{"run":77,"commit":"c7b3f6a","metric":73,"metrics":{"tests_total":73,"milestone_index":4,"loc_core":891,"commit_count_total":79},"status":"keep","description":"T73 blocks secret claims before episodic log writes","timestamp":1778135154384,"segment":0,"confidence":4.0588235294117645,"asi":{"hypothesis":"ADR-0009 requires privacy filtering before the append-only episodic log, so Store::add_claim must reject detected secrets before append_jsonl is called","red_evidence":"add_claim_rejects_secret_before_episodic_log_write failed because Error::Privacy did not exist and add_claim did not call privacy_filter","green_evidence":"cargo test --workspace -q passed; autoresearch.sh parsed tests_green=73 tests_total=73 and checks passed","implementation_notes":"Added Error::Privacy, made PrivacyRejection implement Error, and invoked privacy_filter over subject/predicate/object/source before timestamp/id allocation and append_jsonl; test verifies log.jsonl is not created"}}
{"run":78,"commit":"354b89f","metric":74,"metrics":{"tests_total":74,"milestone_index":4,"loc_core":899,"commit_count_total":80},"status":"keep","description":"T74 rejects GitHub PATs in privacy filter","timestamp":1778135214704,"segment":0,"confidence":4.117647058823529,"asi":{"hypothesis":"ADR-0009 regex catalog should reject GitHub personal access tokens in addition to AWS access keys before memory writes","red_evidence":"privacy_filter_rejects_github_pat failed because PrivacyRejection::GitHubPat did not exist","green_evidence":"cargo test --workspace -q passed; autoresearch.sh parsed tests_green=74 tests_total=74 and checks passed","implementation_notes":"Added PrivacyRejection::GitHubPat and a deterministic ghp_ token prefix/length detector in privacy_filter; no offending content is logged"}}
{"run":79,"commit":"2ad019d","metric":75,"metrics":{"tests_total":75,"milestone_index":4,"loc_core":907,"commit_count_total":81},"status":"keep","description":"T75 rejects fine-grained GitHub PATs","timestamp":1778135251776,"segment":0,"confidence":4.176470588235294,"asi":{"hypothesis":"ADR-0009 specifically calls out fine-grained GitHub PATs, so privacy_filter should distinguish and reject github_pat_ tokens","red_evidence":"privacy_filter_rejects_fine_grained_github_pat failed because PrivacyRejection::GitHubFineGrainedPat did not exist","green_evidence":"cargo test --workspace -q passed; autoresearch.sh parsed tests_green=75 tests_total=75 and checks passed","implementation_notes":"Added PrivacyRejection::GitHubFineGrainedPat and a deterministic github_pat_ prefix/length detector before memory writes"}}
{"run":80,"commit":"17b9fb4","metric":76,"metrics":{"tests_total":76,"milestone_index":4,"loc_core":924,"commit_count_total":82},"status":"keep","description":"T76 rejects JWTs in privacy filter","timestamp":1778135295726,"segment":0,"confidence":4.114285714285714,"asi":{"hypothesis":"ADR-0009 regex catalog should reject JWT-looking bearer tokens before persistence because they often carry credentials or session claims","red_evidence":"privacy_filter_rejects_jwt failed because PrivacyRejection::Jwt did not exist","green_evidence":"cargo test --workspace -q passed; autoresearch.sh parsed tests_green=76 tests_total=76 and checks passed","implementation_notes":"Added PrivacyRejection::Jwt and a deterministic three-segment JWT detector requiring eyJ header and minimum segment lengths; no external regex dependency"}}
{"run":81,"commit":"9ffaaab","metric":77,"metrics":{"tests_total":77,"milestone_index":4,"loc_core":932,"commit_count_total":83},"status":"keep","description":"T77 rejects OpenAI-style API keys","timestamp":1778135350068,"segment":0,"confidence":4.055555555555555,"asi":{"hypothesis":"ADR-0009 calls out OpenAI/Stripe sk- prefixes, so privacy_filter should reject long sk- tokens before claims are persisted","red_evidence":"privacy_filter_rejects_openai_key failed because PrivacyRejection::OpenAiKey did not exist","green_evidence":"cargo test --workspace -q passed; autoresearch.sh parsed tests_green=77 tests_total=77 and checks passed","implementation_notes":"Added PrivacyRejection::OpenAiKey and deterministic sk- prefix/length detection across whitespace or KEY=value boundaries"}}
{"run":82,"commit":"86a6576","metric":78,"metrics":{"tests_total":78,"milestone_index":4,"loc_core":940,"commit_count_total":84},"status":"keep","description":"T78 rejects Anthropic API keys","timestamp":1778135390059,"segment":0,"confidence":4.111111111111111,"asi":{"hypothesis":"ADR-0009 calls out Anthropic sk-ant- prefixes separately, so privacy_filter should reject them before generic sk- handling","red_evidence":"privacy_filter_rejects_anthropic_key failed because PrivacyRejection::AnthropicKey did not exist","green_evidence":"cargo test --workspace -q passed; autoresearch.sh parsed tests_green=78 tests_total=78 and checks passed","implementation_notes":"Added PrivacyRejection::AnthropicKey and sk-ant- prefix/length detection before generic sk- OpenAI-style detection to preserve the specific reason"}}
{"run":83,"commit":"5847004","metric":79,"metrics":{"tests_total":79,"milestone_index":4,"loc_core":948,"commit_count_total":85},"status":"keep","description":"T79 rejects Stripe live secret keys","timestamp":1778135430160,"segment":0,"confidence":4.166666666666667,"asi":{"hypothesis":"ADR-0009 calls out Stripe sk_live_ prefixes, so privacy_filter should reject live Stripe secret keys before persistence","red_evidence":"privacy_filter_rejects_stripe_live_key failed because PrivacyRejection::StripeLiveKey did not exist","green_evidence":"cargo test --workspace -q passed; autoresearch.sh parsed tests_green=79 tests_total=79 and checks passed","implementation_notes":"Added PrivacyRejection::StripeLiveKey and sk_live_ prefix/length detection across whitespace or KEY=value boundaries"}}
{"run":84,"commit":"411babe","metric":80,"metrics":{"tests_total":80,"milestone_index":4,"loc_core":953,"commit_count_total":86},"status":"keep","description":"T80 rejects private key headers","timestamp":1778135469307,"segment":0,"confidence":4.108108108108108,"asi":{"hypothesis":"ADR-0009 says private key blocks must never enter memory, so privacy_filter should reject BEGIN PRIVATE KEY material before writes","red_evidence":"privacy_filter_rejects_private_key_header failed because PrivacyRejection::PrivateKey did not exist","green_evidence":"cargo test --workspace -q passed; autoresearch.sh parsed tests_green=80 tests_total=80 and checks passed","implementation_notes":"Added PrivacyRejection::PrivateKey and a simple BEGIN PRIVATE KEY detector that runs before token scanning; no rejected content is logged"}}
{"run":85,"commit":"79159f5","metric":81,"metrics":{"tests_total":81,"milestone_index":4,"loc_core":978,"commit_count_total":87},"status":"keep","description":"T81 rejects high-entropy tokens","timestamp":1778135532760,"segment":0,"confidence":4.052631578947368,"asi":{"hypothesis":"ADR-0009 high-entropy detector should reject long random-looking tokens even when they lack a known provider prefix","red_evidence":"privacy_filter_rejects_high_entropy_token failed because PrivacyRejection::HighEntropy did not exist","green_evidence":"cargo test --workspace -q passed; autoresearch.sh parsed tests_green=81 tests_total=81 and checks passed","implementation_notes":"Added Shannon entropy scoring for alphanumeric tokens longer than 20 chars with entropy >4.5; moved entropy after provider-specific detectors so specific rejection reasons remain stable"}}
{"run":86,"commit":"bc50f9a","metric":82,"metrics":{"tests_total":82,"milestone_index":4,"loc_core":988,"commit_count_total":88},"status":"keep","description":"T82 rejects secrets directory paths","timestamp":1778135566771,"segment":0,"confidence":4.105263157894737,"asi":{"hypothesis":"ADR-0009 path-based exclusions should reject content sourced from ~/.secrets.d before extraction or memory writes","red_evidence":"privacy_filter_path_rejects_secrets_dir failed because privacy_filter_path and PrivacyRejection::SecretsPath did not exist","green_evidence":"cargo test --workspace -q passed; autoresearch.sh parsed tests_green=82 tests_total=82 and checks passed","implementation_notes":"Added privacy_filter_path accepting AsRef<Path> and rejecting /.secrets.d/ or ~/.secrets.d/ paths with SecretsPath reason; no path content is logged"}}
{"run":87,"commit":"57528f8","metric":83,"metrics":{"tests_total":83,"milestone_index":4,"loc_core":993,"commit_count_total":89},"status":"keep","description":"T83 rejects environment file paths","timestamp":1778135606859,"segment":0,"confidence":4.157894736842105,"asi":{"hypothesis":"ADR-0009 path exclusions include any path containing .env, so privacy_filter_path should reject .env-derived content before extraction","red_evidence":"privacy_filter_path_rejects_env_file failed because PrivacyRejection::EnvPath did not exist","green_evidence":"cargo test --workspace -q passed; autoresearch.sh parsed tests_green=83 tests_total=83 and checks passed","implementation_notes":"Added PrivacyRejection::EnvPath and .env path detection in privacy_filter_path; this is path-only and does not inspect or log file contents"}}
{"run":88,"commit":"e527947","metric":84,"metrics":{"tests_total":84,"milestone_index":4,"loc_core":998,"commit_count_total":90},"status":"keep","description":"T84 rejects memory ignore markers","timestamp":1778135644260,"segment":0,"confidence":4.102564102564102,"asi":{"hypothesis":"ADR-0009 explicit markers should skip extraction entirely, so privacy_filter should reject content lines containing # memory:ignore","red_evidence":"privacy_filter_rejects_memory_ignore_marker failed because PrivacyRejection::MemoryIgnore did not exist","green_evidence":"cargo test --workspace -q passed; autoresearch.sh parsed tests_green=84 tests_total=84 and checks passed","implementation_notes":"Added PrivacyRejection::MemoryIgnore and line-based # memory:ignore detection before any other detector; no marked content is persisted or logged"}}
{"run":89,"commit":"dd98460","metric":85,"metrics":{"tests_total":85,"milestone_index":4,"loc_core":1003,"commit_count_total":91},"status":"keep","description":"T85 rejects HTML memory ignore marker","timestamp":1778135691398,"segment":0,"confidence":4.05,"asi":{"hypothesis":"ADR-0009 says a top-of-file <!-- memory:ignore --> comment skips extraction, so privacy_filter should reject that marker too","red_evidence":"privacy_filter_rejects_top_of_file_html_memory_ignore_marker failed with Ok(()) because only # memory:ignore was detected","green_evidence":"cargo test --workspace -q passed; autoresearch.sh parsed tests_green=85 tests_total=85 and checks passed","implementation_notes":"Extended MemoryIgnore detection to match a trimmed first line equal to <!-- memory:ignore --> while preserving existing line-level # memory:ignore behavior"}}
{"run":90,"commit":"4b7650a","metric":86,"metrics":{"tests_total":86,"milestone_index":4,"loc_core":1008,"commit_count_total":92},"status":"keep","description":"T86 rejects SSH credential paths","timestamp":1778135740556,"segment":0,"confidence":4.1,"asi":{"hypothesis":"ADR-0009 path exclusions include ~/.ssh/**, so privacy_filter_path should reject SSH credential file paths before extraction","red_evidence":"privacy_filter_path_rejects_ssh_dir failed because PrivacyRejection::SshPath did not exist","green_evidence":"cargo test --workspace -q passed; autoresearch.sh parsed tests_green=86 tests_total=86 and checks passed","implementation_notes":"Added PrivacyRejection::SshPath and /.ssh/ path detection in privacy_filter_path; path is rejected without reading or logging contents"}}
{"run":91,"commit":"63d54a4","metric":87,"metrics":{"tests_total":87,"milestone_index":4,"loc_core":1013,"commit_count_total":93},"status":"keep","description":"T87 rejects PEM and key file paths","timestamp":1778135779540,"segment":0,"confidence":4.15,"asi":{"hypothesis":"ADR-0009 path exclusions include *.pem and *.key files, so privacy_filter_path should reject key material paths before extraction","red_evidence":"privacy_filter_path_rejects_pem_file failed because PrivacyRejection::KeyPath did not exist","green_evidence":"cargo test --workspace -q passed; autoresearch.sh parsed tests_green=87 tests_total=87 and checks passed","implementation_notes":"Added PrivacyRejection::KeyPath and suffix detection for .pem and .key paths in privacy_filter_path; no file contents are read or logged"}}
{"run":92,"commit":"1d07665","metric":88,"metrics":{"tests_total":88,"milestone_index":4,"loc_core":1018,"commit_count_total":94},"status":"keep","description":"T88 rejects AWS credentials paths","timestamp":1778135843278,"segment":0,"confidence":4.097560975609756,"asi":{"hypothesis":"ADR-0009 path exclusions specifically include ~/.aws/credentials, so privacy_filter_path should reject that credential source before extraction","red_evidence":"privacy_filter_path_rejects_aws_credentials_file failed because PrivacyRejection::AwsCredentialsPath did not exist","green_evidence":"cargo test --workspace -q passed; autoresearch.sh parsed tests_green=88 tests_total=88 and checks passed","implementation_notes":"Added PrivacyRejection::AwsCredentialsPath and suffix detection for /.aws/credentials in privacy_filter_path; no file contents are read or logged"}}
{"run":93,"commit":"e1c373a","metric":89,"metrics":{"tests_total":89,"milestone_index":4,"loc_core":1023,"commit_count_total":95},"status":"keep","description":"T89 rejects config directory paths","timestamp":1778135882676,"segment":0,"confidence":4.0476190476190474,"asi":{"hypothesis":"ADR-0009 path exclusions include ~/.config/**, so privacy_filter_path should reject config directory sources that often contain credentials","red_evidence":"privacy_filter_path_rejects_config_dir failed because PrivacyRejection::ConfigPath did not exist","green_evidence":"cargo test --workspace -q passed; autoresearch.sh parsed tests_green=89 tests_total=89 and checks passed","implementation_notes":"Added PrivacyRejection::ConfigPath and /.config/ path detection in privacy_filter_path; path is rejected without reading or logging contents"}}
{"run":94,"commit":"58e90f8","metric":90,"metrics":{"tests_total":90,"milestone_index":5,"loc_core":1038,"commit_count_total":96},"status":"keep","description":"T90 starts v0.5 consolidation with duplicate superseding","timestamp":1778135952116,"segment":0,"confidence":4.095238095238095,"asi":{"hypothesis":"v0.5 should begin with deterministic idempotent consolidation that deduplicates identical (subject,predicate,object) claims by superseding later duplicates","red_evidence":"consolidate_supersedes_duplicate_claims failed because Store::consolidate did not exist","green_evidence":"cargo test --workspace -q passed; autoresearch.sh parsed tests_green=90 tests_total=90 milestone_index=5 and checks passed","implementation_notes":"Added Store::consolidate returning the number of rows changed and marking active duplicate triples as SUPERSEDED while keeping the earliest id active; milestone advanced to v0.5"}}
{"run":95,"commit":"fcc8b5b","metric":91,"metrics":{"tests_total":91,"milestone_index":5,"loc_core":1084,"commit_count_total":97},"status":"keep","description":"T91 merges duplicate source refs during consolidation","timestamp":1778136025285,"segment":0,"confidence":4.142857142857143,"asi":{"hypothesis":"Consolidating duplicate claims should preserve provenance by merging duplicate source_refs into the surviving canonical claim before superseding duplicates","red_evidence":"consolidate_merges_duplicate_source_refs_into_survivor failed with survivor source_refs [\"s1\"] instead of [\"s1\",\"s2\"]","green_evidence":"cargo test --workspace -q passed; autoresearch.sh parsed tests_green=91 tests_total=91 and checks passed","implementation_notes":"Added merge_duplicate_source_refs before duplicate superseding; groups identical triples, preserves first-seen source order, deduplicates source refs, and updates the survivor claim"}}
{"run":96,"commit":"d3b75d4","metric":92,"metrics":{"tests_total":92,"milestone_index":5,"loc_core":1098,"commit_count_total":98},"status":"keep","description":"T92 supersedes older conflicting claims","timestamp":1778136081218,"segment":0,"confidence":4.093023255813954,"asi":{"hypothesis":"ADR-0005 contradiction handling should mark an older active claim superseded when a newer claim with the same subject/predicate but different object appears","red_evidence":"consolidate_supersedes_older_conflicting_claim failed with superseded count 0 instead of 1","green_evidence":"cargo test --workspace -q passed; autoresearch.sh parsed tests_green=92 tests_total=92 and checks passed","implementation_notes":"Extended consolidate to add a conflict pass after duplicate superseding; active claims are superseded when a newer claim shares subject/predicate and has a different object"}}
{"run":97,"commit":"8c5a7cf","metric":93,"metrics":{"tests_total":93,"milestone_index":6,"loc_core":1098,"commit_count_total":99},"status":"keep","description":"T93 starts v0.6 prose structured-output parsing","timestamp":1778136166479,"segment":0,"confidence":4.045454545454546,"asi":{"hypothesis":"v0.6 prose extraction should start with offline deterministic parsing of structured LLM output into the same ExtractedFact triples used by code extraction","red_evidence":"parse_prose_facts_reads_structured_llm_output failed because parse_prose_facts did not exist","green_evidence":"cargo test --workspace -q passed; autoresearch.sh parsed tests_green=93 tests_total=93 milestone_index=6 and checks passed","implementation_notes":"Added memory_extractor::prose module, serde/serde_json deps, ExtractedFact Deserialize, parse_prose_facts, and JSON error plumbing; no live LLM/network calls"}}
{"run":98,"commit":"84145e6","metric":94,"metrics":{"tests_total":94,"milestone_index":6,"loc_core":1098,"commit_count_total":100},"status":"keep","description":"T94 rejects empty prose fact subjects","timestamp":1778136243818,"segment":0,"confidence":4.090909090909091,"asi":{"hypothesis":"Structured prose extraction must validate LLM output before memory ingestion, starting by rejecting facts with empty subjects","red_evidence":"parse_prose_facts_rejects_empty_subject failed because parse_prose_facts accepted an empty subject and returned Ok","green_evidence":"cargo test --workspace -q passed; autoresearch.sh parsed tests_green=94 tests_total=94 and checks passed","implementation_notes":"Added Error::InvalidFact and validation in parse_prose_facts that trims subject before accepting parsed ExtractedFact triples; still fully offline"}}
{"run":99,"commit":"8206c0c","metric":95,"metrics":{"tests_total":95,"milestone_index":6,"loc_core":1098,"commit_count_total":101},"status":"keep","description":"T95 rejects empty prose fact predicates","timestamp":1778136296214,"segment":0,"confidence":4.136363636363637,"asi":{"hypothesis":"Structured prose extraction validation should reject empty predicates so LLM output cannot create graph facts without a relationship label","red_evidence":"parse_prose_facts_rejects_empty_predicate failed because parse_prose_facts accepted an empty predicate and returned Ok","green_evidence":"cargo test --workspace -q passed; autoresearch.sh parsed tests_green=95 tests_total=95 and checks passed","implementation_notes":"Extended parse_prose_facts validation to trim and reject empty predicate fields with Error::InvalidFact(\"predicate\")"}}
{"run":100,"commit":"b2943b4","metric":96,"metrics":{"tests_total":96,"milestone_index":6,"loc_core":1098,"commit_count_total":102},"status":"keep","description":"T96 rejects empty prose fact objects","timestamp":1778136338228,"segment":0,"confidence":4.088888888888889,"asi":{"hypothesis":"Structured prose extraction validation should reject empty objects so LLM output cannot create incomplete graph triples","red_evidence":"parse_prose_facts_rejects_empty_object failed because parse_prose_facts accepted an empty object and returned Ok","green_evidence":"cargo test --workspace -q passed; autoresearch.sh parsed tests_green=96 tests_total=96 and checks passed","implementation_notes":"Extended parse_prose_facts validation to trim and reject empty object fields with Error::InvalidFact(\"object\")"}}
{"run":101,"commit":"c8356b3","metric":97,"metrics":{"tests_total":97,"milestone_index":7,"loc_core":1102,"commit_count_total":103},"status":"keep","description":"T97 starts v0.7 ontology entity type table","timestamp":1778136415241,"segment":0,"confidence":4.043478260869565,"asi":{"hypothesis":"v0.7 ontology support should begin with the ADR-0010 entity_types table so entities can carry type hierarchy metadata","red_evidence":"fresh_database_has_entity_types_table failed because Store::open did not apply any migration creating entity_types","green_evidence":"cargo test --workspace -q passed; autoresearch.sh parsed tests_green=97 tests_total=97 milestone_index=7 and checks passed","implementation_notes":"Added migrations/0003_ontology.sql with entity_types(id,name,parent_id) and embedded it in MIGRATIONS; milestone advanced to v0.7"}}
{"run":102,"commit":"3ef3da1","metric":98,"metrics":{"tests_total":98,"milestone_index":7,"loc_core":1102,"commit_count_total":104},"status":"keep","description":"T98 adds ontology predicate type table","timestamp":1778136460803,"segment":0,"confidence":4,"asi":{"hypothesis":"ADR-0010 requires a predicate hierarchy alongside entity types, so the ontology migration should create predicate_types","red_evidence":"fresh_database_has_predicate_types_table failed because predicate_types did not exist after Store::open","green_evidence":"cargo test --workspace -q passed; autoresearch.sh parsed tests_green=98 tests_total=98 and checks passed","implementation_notes":"Extended migrations/0003_ontology.sql with predicate_types(id,name,parent_id) referencing predicate_types(id); no graph DB dependency added"}}
