{"run":206,"commit":"b0c8213","metric":446,"metrics":{"beam_questions":0,"beam_rubric_checks":0,"beam_abstention_pct":0,"beam_contradiction_resolution_pct":0,"beam_event_ordering_pct":0,"beam_information_extraction_pct":0,"beam_instruction_following_pct":0,"beam_knowledge_update_pct":0,"beam_multi_session_reasoning_pct":0,"beam_preference_following_pct":0,"beam_summarization_pct":0,"beam_temporal_reasoning_pct":0,"tests_green":446,"tests_total":446,"milestone_index":9,"loc_core":3910,"commit_count_total":394,"memory_error_rate":0,"unsupported_claim_rate":0,"mean_precision_at_k":1,"mean_recall_at_k":1},"status":"keep","description":"Extract C# struct implements interface facts","timestamp":1778355469943,"segment":26,"confidence":2.402408835814776,"asi":{"hypothesis":"C# struct base lists targeting interfaces declared in the same source should emit Struct implements Interface triples because structs can implement interfaces using the same base-list syntax as classes and records.","red_evidence":"cargo test -q -p aver-extractor extract_csharp_facts_emit_struct_implements_interface_triple failed because extract_csharp_facts did not include Struct:Store implements Interface:IRecallable.","green_evidence":"cargo test --workspace -q passed; ./autoresearch.sh passed with tests_green=446 tests_total=446 and checks green.","implementation_notes":"Extended C# implements extraction to include struct_declaration with Struct subject prefixes while preserving class and record interface implementation facts.","anti_overfit_note":"This is grammar-backed extraction of a standard C# language relationship and does not depend on benchmark labels, expected answers, or scoring-specific shortcuts."}}
{"run":207,"commit":"6d90eeb","metric":447,"metrics":{"beam_questions":0,"beam_rubric_checks":0,"beam_abstention_pct":0,"beam_contradiction_resolution_pct":0,"beam_event_ordering_pct":0,"beam_information_extraction_pct":0,"beam_instruction_following_pct":0,"beam_knowledge_update_pct":0,"beam_multi_session_reasoning_pct":0,"beam_preference_following_pct":0,"beam_summarization_pct":0,"beam_temporal_reasoning_pct":0,"tests_green":447,"tests_total":447,"milestone_index":9,"loc_core":3910,"commit_count_total":395,"memory_error_rate":0,"unsupported_claim_rate":0,"mean_precision_at_k":1,"mean_recall_at_k":1},"status":"keep","description":"Extract Java record implements interface facts","timestamp":1778355590195,"segment":26,"confidence":23.526315789473685,"asi":{"hypothesis":"Java record declarations should emit Record implements Interface triples because records can implement interfaces using the standard Java super_interfaces grammar field.","red_evidence":"cargo test -q -p aver-extractor extract_java_facts_emit_record_implements_triple failed because extract_java_facts did not include Record:Memory implements Interface:Recallable.","green_evidence":"cargo test --workspace -q passed; ./autoresearch.sh passed with tests_green=447 tests_total=447 and checks green.","implementation_notes":"Generalized Java implements extraction from class_declaration to class_declaration and record_declaration, selecting Class or Record subject prefixes.","anti_overfit_note":"This is grammar-backed extraction of a standard Java language relationship and does not depend on benchmark labels, expected answers, or scoring-specific shortcuts."}}
{"run":208,"commit":"6d90eeb","metric":448,"metrics":{"beam_questions":0,"beam_rubric_checks":0,"beam_abstention_pct":0,"beam_contradiction_resolution_pct":0,"beam_event_ordering_pct":0,"beam_information_extraction_pct":0,"beam_instruction_following_pct":0,"beam_knowledge_update_pct":0,"beam_multi_session_reasoning_pct":0,"beam_preference_following_pct":0,"beam_summarization_pct":0,"beam_temporal_reasoning_pct":0,"tests_green":448,"tests_total":448,"milestone_index":9,"loc_core":3910,"commit_count_total":396,"memory_error_rate":0,"unsupported_claim_rate":0,"mean_precision_at_k":1,"mean_recall_at_k":1},"status":"checks_failed","description":"Extract Ruby prepend module facts, but clippy rejected trim before split_whitespace","timestamp":1778355672782,"segment":26,"confidence":24.16216216216216,"asi":{"hypothesis":"Ruby prepend should be treated like a module mixin relationship and emit Class implements Module triples.","failure_evidence":"./autoresearch.sh benchmark passed with tests_green=448 tests_total=448, but autoresearch.checks.sh failed in clippy with trim_split_whitespace at crates/aver-extractor/src/lib.rs:1742.","rollback_reason":"Checks failed, so the change must not be kept until the clippy warning is fixed.","next_action_hint":"Retry the same generic Ruby prepend hypothesis after removing redundant trim_start before split_whitespace in collect_ruby_include_names.","anti_overfit_note":"The attempted extraction is standard Ruby grammar-backed behavior, not benchmark-specific."}}
{"run":209,"commit":"055b404","metric":448,"metrics":{"beam_questions":0,"beam_rubric_checks":0,"beam_abstention_pct":0,"beam_contradiction_resolution_pct":0,"beam_event_ordering_pct":0,"beam_information_extraction_pct":0,"beam_instruction_following_pct":0,"beam_knowledge_update_pct":0,"beam_multi_session_reasoning_pct":0,"beam_preference_following_pct":0,"beam_summarization_pct":0,"beam_temporal_reasoning_pct":0,"tests_green":448,"tests_total":448,"milestone_index":9,"loc_core":3910,"commit_count_total":396,"memory_error_rate":0,"unsupported_claim_rate":0,"mean_precision_at_k":1,"mean_recall_at_k":1},"status":"keep","description":"Extract Ruby prepend module facts","timestamp":1778355730864,"segment":26,"confidence":24.88888888888889,"asi":{"hypothesis":"Ruby prepend is a standard module mixin mechanism and should emit the same Class implements Module relationship as include.","red_evidence":"cargo test -q -p aver-extractor extract_ruby_facts_emit_class_prepends_module_triple failed because extract_ruby_facts did not include Class:Store implements Module:Auditable.","green_evidence":"cargo test --workspace -q passed; ./autoresearch.checks.sh passed; ./autoresearch.sh passed with tests_green=448 tests_total=448 and checks green.","implementation_notes":"Extended Ruby mixin call detection to accept include or prepend using split_whitespace without redundant trimming, satisfying clippy.","anti_overfit_note":"This is grammar-backed extraction of standard Ruby module composition behavior, not benchmark-label tuning."}}
{"run":210,"commit":"db17f54","metric":449,"metrics":{"beam_questions":0,"beam_rubric_checks":0,"beam_abstention_pct":0,"beam_contradiction_resolution_pct":0,"beam_event_ordering_pct":0,"beam_information_extraction_pct":0,"beam_instruction_following_pct":0,"beam_knowledge_update_pct":0,"beam_multi_session_reasoning_pct":0,"beam_preference_following_pct":0,"beam_summarization_pct":0,"beam_temporal_reasoning_pct":0,"tests_green":449,"tests_total":449,"milestone_index":9,"loc_core":3910,"commit_count_total":397,"memory_error_rate":0,"unsupported_claim_rate":0,"mean_precision_at_k":1,"mean_recall_at_k":1},"status":"keep","description":"Extract Ruby extend module facts","timestamp":1778355760581,"segment":26,"confidence":25.65714285714286,"asi":{"hypothesis":"Ruby extend is a standard module composition mechanism and should emit Class implements Module facts for declared modules, complementing include and prepend.","red_evidence":"cargo test -q -p aver-extractor extract_ruby_facts_emit_class_extends_module_triple failed because extract_ruby_facts did not include Class:Store implements Module:Auditable.","green_evidence":"cargo test --workspace -q passed; ./autoresearch.sh passed with tests_green=449 tests_total=449 and checks green.","implementation_notes":"Added extend to the existing Ruby mixin call detector while retaining include and prepend handling.","anti_overfit_note":"This is generic Ruby grammar-backed extraction of module composition behavior, not benchmark-specific tuning."}}
{"run":211,"commit":"82d7b27","metric":450,"metrics":{"beam_questions":0,"beam_rubric_checks":0,"beam_abstention_pct":0,"beam_contradiction_resolution_pct":0,"beam_event_ordering_pct":0,"beam_information_extraction_pct":0,"beam_instruction_following_pct":0,"beam_knowledge_update_pct":0,"beam_multi_session_reasoning_pct":0,"beam_preference_following_pct":0,"beam_summarization_pct":0,"beam_temporal_reasoning_pct":0,"tests_green":450,"tests_total":450,"milestone_index":9,"loc_core":3910,"commit_count_total":398,"memory_error_rate":0,"unsupported_claim_rate":0,"mean_precision_at_k":1,"mean_recall_at_k":1},"status":"keep","description":"Extract Swift struct protocol conformance facts","timestamp":1778355852551,"segment":26,"confidence":26.470588235294116,"asi":{"hypothesis":"Swift struct declarations can conform to protocols using the same inheritance_specifier syntax as classes, so they should emit Struct implements Protocol facts when the protocol is declared in the same source.","red_evidence":"cargo test -q -p aver-extractor extract_swift_facts_emit_struct_implements_protocol_triple failed because extract_swift_facts did not include Struct:Store implements Protocol:Recallable.","green_evidence":"cargo test --workspace -q passed; ./autoresearch.sh passed with tests_green=450 tests_total=450 and checks green.","implementation_notes":"Generalized Swift protocol-conformance extraction from class/actor to class/actor/struct, preserving Class subjects for class and actor declarations and adding Struct subjects for struct declarations.","anti_overfit_note":"This is grammar-backed extraction of a standard Swift type/protocol relationship, not benchmark-specific behavior."}}
{"run":212,"commit":"058002c","metric":451,"metrics":{"beam_questions":0,"beam_rubric_checks":0,"beam_abstention_pct":0,"beam_contradiction_resolution_pct":0,"beam_event_ordering_pct":0,"beam_information_extraction_pct":0,"beam_instruction_following_pct":0,"beam_knowledge_update_pct":0,"beam_multi_session_reasoning_pct":0,"beam_preference_following_pct":0,"beam_summarization_pct":0,"beam_temporal_reasoning_pct":0,"tests_green":451,"tests_total":451,"milestone_index":9,"loc_core":3910,"commit_count_total":399,"memory_error_rate":0,"unsupported_claim_rate":0,"mean_precision_at_k":1,"mean_recall_at_k":1},"status":"keep","description":"Extract Swift enum protocol conformance facts","timestamp":1778355878294,"segment":26,"confidence":26.529411764705884,"asi":{"hypothesis":"Swift enum declarations can conform to protocols using inheritance_specifier, so declared enums should emit Enum implements Protocol facts when the target protocol is declared in the same source.","red_evidence":"cargo test -q -p aver-extractor extract_swift_facts_emit_enum_implements_protocol_triple failed because extract_swift_facts did not include Enum:MemoryKind implements Protocol:Recallable.","green_evidence":"cargo test --workspace -q passed; ./autoresearch.sh passed with tests_green=451 tests_total=451 and checks green.","implementation_notes":"Extended Swift protocol-conformance extraction type-kind mapping to include enum declarations with Enum subject prefixes.","anti_overfit_note":"This is grammar-backed extraction of a standard Swift enum/protocol relationship, not benchmark-specific behavior."}}
{"run":213,"commit":"70ea44e","metric":452,"metrics":{"beam_questions":0,"beam_rubric_checks":0,"beam_abstention_pct":0,"beam_contradiction_resolution_pct":0,"beam_event_ordering_pct":0,"beam_information_extraction_pct":0,"beam_instruction_following_pct":0,"beam_knowledge_update_pct":0,"beam_multi_session_reasoning_pct":0,"beam_preference_following_pct":0,"beam_summarization_pct":0,"beam_temporal_reasoning_pct":0,"tests_green":452,"tests_total":452,"milestone_index":9,"loc_core":3910,"commit_count_total":400,"memory_error_rate":0,"unsupported_claim_rate":0,"mean_precision_at_k":1,"mean_recall_at_k":1},"status":"keep","description":"Extract Kotlin object implements interface facts","timestamp":1778355942221,"segment":26,"confidence":26.58823529411765,"asi":{"hypothesis":"Kotlin object declarations can implement interfaces through delegation_specifier syntax, so declared objects should emit Object implements Interface facts when the interface is declared in the same source.","red_evidence":"cargo test -q -p aver-extractor extract_kotlin_facts_emit_object_implements_interface_triple failed because extract_kotlin_facts did not include Object:Store implements Interface:Recallable.","green_evidence":"cargo test --workspace -q passed; ./autoresearch.sh passed with tests_green=452 tests_total=452 and checks green.","implementation_notes":"Generalized Kotlin implements extraction from class declarations to class and object declarations, using Object subject prefixes for object_declaration nodes.","anti_overfit_note":"This is grammar-backed extraction of a standard Kotlin object/interface relationship, not benchmark-specific behavior."}}
{"run":214,"commit":"fab2273","metric":453,"metrics":{"beam_questions":0,"beam_rubric_checks":0,"beam_abstention_pct":0,"beam_contradiction_resolution_pct":0,"beam_event_ordering_pct":0,"beam_information_extraction_pct":0,"beam_instruction_following_pct":0,"beam_knowledge_update_pct":0,"beam_multi_session_reasoning_pct":0,"beam_preference_following_pct":0,"beam_summarization_pct":0,"beam_temporal_reasoning_pct":0,"tests_green":453,"tests_total":453,"milestone_index":9,"loc_core":3910,"commit_count_total":401,"memory_error_rate":0,"unsupported_claim_rate":0,"mean_precision_at_k":1,"mean_recall_at_k":1},"status":"keep","description":"Extract Kotlin data class implements interface facts","timestamp":1778355979903,"segment":26,"confidence":26.647058823529413,"asi":{"hypothesis":"Kotlin class declarations with modifiers such as data class still implement interfaces through delegation_specifier syntax and should emit Class implements Interface facts.","red_evidence":"cargo test -q -p aver-extractor extract_kotlin_facts_emit_data_class_implements_interface_triple failed because extract_kotlin_facts did not include Class:Store implements Interface:Recallable.","green_evidence":"cargo test --workspace -q passed; ./autoresearch.sh passed with tests_green=453 tests_total=453 and checks green.","implementation_notes":"Changed Kotlin class classification for implements extraction from starts_with('class ') to a split_whitespace keyword check for class, preserving object handling.","anti_overfit_note":"This is grammar-backed support for standard Kotlin modifiers on class declarations, not benchmark-specific behavior."}}
{"run":215,"commit":"09ed0f5","metric":454,"metrics":{"beam_questions":0,"beam_rubric_checks":0,"beam_abstention_pct":0,"beam_contradiction_resolution_pct":0,"beam_event_ordering_pct":0,"beam_information_extraction_pct":0,"beam_instruction_following_pct":0,"beam_knowledge_update_pct":0,"beam_multi_session_reasoning_pct":0,"beam_preference_following_pct":0,"beam_summarization_pct":0,"beam_temporal_reasoning_pct":0,"tests_green":454,"tests_total":454,"milestone_index":9,"loc_core":3910,"commit_count_total":402,"memory_error_rate":0,"unsupported_claim_rate":0,"mean_precision_at_k":1,"mean_recall_at_k":1},"status":"keep","description":"Extract Kotlin data class extends facts","timestamp":1778356018437,"segment":26,"confidence":26.705882352941178,"asi":{"hypothesis":"Kotlin data class declarations can extend a base class through delegation_specifier syntax and should emit Class extends Class facts despite modifiers before the class keyword.","red_evidence":"cargo test -q -p aver-extractor extract_kotlin_facts_emit_data_class_extends_triple failed because extract_kotlin_facts did not include Class:Store extends Class:BaseStore.","green_evidence":"cargo test --workspace -q passed; ./autoresearch.sh passed with tests_green=454 tests_total=454 and checks green.","implementation_notes":"Updated Kotlin extends extraction to classify class/interface declarations by split_whitespace keyword presence rather than trim_start prefixes, covering modified class declarations.","anti_overfit_note":"This is grammar-backed support for standard Kotlin class modifiers in type hierarchy extraction, not benchmark-specific behavior."}}
{"run":216,"commit":"e71ef57","metric":455,"metrics":{"beam_questions":0,"beam_rubric_checks":0,"beam_abstention_pct":0,"beam_contradiction_resolution_pct":0,"beam_event_ordering_pct":0,"beam_information_extraction_pct":0,"beam_instruction_following_pct":0,"beam_knowledge_update_pct":0,"beam_multi_session_reasoning_pct":0,"beam_preference_following_pct":0,"beam_summarization_pct":0,"beam_temporal_reasoning_pct":0,"tests_green":455,"tests_total":455,"milestone_index":9,"loc_core":3910,"commit_count_total":403,"memory_error_rate":0,"unsupported_claim_rate":0,"mean_precision_at_k":1,"mean_recall_at_k":1},"status":"keep","description":"Extract multiple Swift protocol conformance facts","timestamp":1778356131086,"segment":26,"confidence":28.4375,"asi":{"hypothesis":"Swift type declarations can conform to multiple protocols in one inheritance clause, so extractor should emit one implements fact per declared inherited protocol instead of only the first.","red_evidence":"cargo test -q -p aver-extractor extract_swift_facts_emit_multiple_protocol_conformance_triples failed because the Auditable conformance fact was missing while Recallable was present.","green_evidence":"cargo test --workspace -q passed; ./autoresearch.sh passed with tests_green=455 tests_total=455 and checks green.","implementation_notes":"Replaced single inherits_from lookup in Swift protocol-conformance extraction with inheritance_specifier-scoped user_type collection, then filters against protocols declared in the same source.","anti_overfit_note":"This is generic Swift grammar-backed extraction of multiple protocol conformances, not benchmark-specific behavior."}}
{"run":217,"commit":"324b1dd","metric":456,"metrics":{"beam_questions":0,"beam_rubric_checks":0,"beam_abstention_pct":0,"beam_contradiction_resolution_pct":0,"beam_event_ordering_pct":0,"beam_information_extraction_pct":0,"beam_instruction_following_pct":0,"beam_knowledge_update_pct":0,"beam_multi_session_reasoning_pct":0,"beam_preference_following_pct":0,"beam_summarization_pct":0,"beam_temporal_reasoning_pct":0,"tests_green":456,"tests_total":456,"milestone_index":9,"loc_core":3910,"commit_count_total":404,"memory_error_rate":0,"unsupported_claim_rate":0,"mean_precision_at_k":1,"mean_recall_at_k":1},"status":"keep","description":"Extract multiple Kotlin interface conformance facts","timestamp":1778356170153,"segment":26,"confidence":30.4,"asi":{"hypothesis":"Kotlin classes and objects can list multiple delegation specifiers, so implements extraction should emit one Class/Object implements Interface fact per declared interface instead of only the first.","red_evidence":"cargo test -q -p aver-extractor extract_kotlin_facts_emit_multiple_interface_implements_triples failed because the Auditable conformance fact was missing while Recallable was present.","green_evidence":"cargo test --workspace -q passed; ./autoresearch.sh passed with tests_green=456 tests_total=456 and checks green.","implementation_notes":"Added delegation_specifier-scoped Kotlin type-name collection and used it for implements extraction, filtering against interfaces declared in the same source.","anti_overfit_note":"This is generic Kotlin grammar-backed extraction of multiple interface conformances, not benchmark-specific behavior."}}
{"run":218,"commit":"00dfb12","metric":457,"metrics":{"beam_questions":0,"beam_rubric_checks":0,"beam_abstention_pct":0,"beam_contradiction_resolution_pct":0,"beam_event_ordering_pct":0,"beam_information_extraction_pct":0,"beam_instruction_following_pct":0,"beam_knowledge_update_pct":0,"beam_multi_session_reasoning_pct":0,"beam_preference_following_pct":0,"beam_summarization_pct":0,"beam_temporal_reasoning_pct":0,"tests_green":457,"tests_total":457,"milestone_index":9,"loc_core":3910,"commit_count_total":405,"memory_error_rate":0,"unsupported_claim_rate":0,"mean_precision_at_k":1,"mean_recall_at_k":1},"status":"keep","description":"Avoid Go interface extends facts for method parameter types","timestamp":1778356270585,"segment":26,"confidence":30.466666666666665,"asi":{"hypothesis":"Go interface extends facts should come only from embedded type elements, not arbitrary method parameter or return types inside interface methods.","red_evidence":"cargo test -q -p aver-extractor extract_go_facts_do_not_treat_method_parameter_types_as_interface_extends failed because the extractor emitted Interface:Recallable extends Interface:Context from a method parameter type.","green_evidence":"cargo test --workspace -q passed; ./autoresearch.sh passed with tests_green=457 tests_total=457 and checks green.","implementation_notes":"Replaced broad descendant type collection under interface_type with type_elem-scoped collection for Go interface embedding facts, preserving real embedded interface extraction.","anti_overfit_note":"This is a grammar-backed precision guard for Go interface extraction, not benchmark-specific behavior."}}
