{"run":52,"commit":"17c1537","metric":49,"metrics":{"tests_total":49,"milestone_index":2,"loc_core":826,"commit_count_total":54},"status":"keep","description":"T49 deduplicates vector-recalled claims","timestamp":1778133510471,"segment":0,"confidence":4.090909090909091,"asi":{"hypothesis":"vector recall should return each Claim at most once even if multiple chunks from the same claim score highly","red_evidence":"recall_vector_claims_deduplicates_multiple_chunks_for_same_claim failed with len 2 instead of 1 before implementation","green_evidence":"cargo test --workspace -q passed; autoresearch.sh parsed tests_green=49 tests_total=49 and checks passed","implementation_notes":"recall_vector_claims now tracks seen claim_ids with HashSet while preserving first ranked occurrence order"}}
{"run":53,"commit":"c1d0f76","metric":50,"metrics":{"tests_total":50,"milestone_index":2,"loc_core":829,"commit_count_total":55},"status":"keep","description":"T50 fills vector recall top-k with distinct claims","timestamp":1778133579390,"segment":0,"confidence":4.181818181818182,"asi":{"hypothesis":"vector claim recall should satisfy top_k in terms of distinct claims, not raw chunks, when one claim owns multiple highly ranked chunks","red_evidence":"recall_vector_claims_fills_top_k_with_distinct_claims failed with ids [1] vs expected [1,2] before implementation","green_evidence":"cargo test --workspace -q passed; autoresearch.sh parsed tests_green=50 tests_total=50 and checks passed","implementation_notes":"recall_vector_claims now ranks all vector chunks, deduplicates by claim_id in ranked order, and stops after top_k distinct claims"}}
{"run":54,"commit":"2ebc629","metric":51,"metrics":{"tests_total":51,"milestone_index":2,"loc_core":851,"commit_count_total":56},"status":"keep","description":"T51 adds text fallback for hybrid recall","timestamp":1778133683442,"segment":0,"confidence":4.086956521739131,"asi":{"hypothesis":"Hybrid recall should remain useful when the vector index is sparse or empty by filling results from text recall after vector-ranked claims","red_evidence":"recall_hybrid_claims_falls_back_to_text_when_vector_index_empty failed because Store had no recall_hybrid_claims method","green_evidence":"cargo test --workspace -q passed; autoresearch.sh parsed tests_green=51 tests_total=51 and checks passed","implementation_notes":"Added recall_hybrid_claims(query, client, top_k) that returns vector claims first, tracks seen claim_ids, then fills from recall_text without live network calls"}}
{"run":55,"commit":"1ad276d","metric":52,"metrics":{"tests_total":52,"milestone_index":2,"loc_core":855,"commit_count_total":57},"status":"keep","description":"T52 short-circuits zero-result hybrid recall","timestamp":1778133739390,"segment":0,"confidence":4,"asi":{"hypothesis":"hybrid recall with top_k=0 should be a cheap no-op that does not call the embedding client or risk network/HTTP errors","red_evidence":"recall_hybrid_claims_top_k_zero_does_not_embed_query failed because recall_hybrid_claims called client.embed and returned EmbeddingError::Http","green_evidence":"cargo test --workspace -q passed; autoresearch.sh parsed tests_green=52 tests_total=52 and checks passed","implementation_notes":"Added early Ok(Vec::new()) in recall_hybrid_claims when top_k == 0; test uses a local FailingEmbeddingClient to prove no embedding call occurs"}}
{"run":56,"commit":"8c04f5b","metric":53,"metrics":{"tests_total":53,"milestone_index":2,"loc_core":859,"commit_count_total":58},"status":"keep","description":"T53 short-circuits zero-result vector recall","timestamp":1778133803279,"segment":0,"confidence":4.083333333333333,"asi":{"hypothesis":"vector claim recall with top_k=0 should be a cheap no-op that does not call the embedding client, matching hybrid recall behavior","red_evidence":"recall_vector_claims_top_k_zero_does_not_embed_query failed because recall_vector_claims called client.embed and returned EmbeddingError::Http","green_evidence":"cargo test --workspace -q passed; autoresearch.sh parsed tests_green=53 tests_total=53 and checks passed","implementation_notes":"Added early Ok(Vec::new()) in recall_vector_claims when top_k == 0; test uses FailingEmbeddingClient to prove no embedding call occurs"}}
{"run":57,"commit":"5f10483","metric":54,"metrics":{"tests_total":54,"milestone_index":2,"loc_core":863,"commit_count_total":59},"status":"keep","description":"T54 short-circuits zero-result vector chunk recall","timestamp":1778133913617,"segment":0,"confidence":4.166666666666667,"asi":{"hypothesis":"raw vector chunk recall with top_k=0 should be a cheap no-op that does not call the embedding client, matching vector/hybrid claim recall behavior","red_evidence":"recall_vector_chunks_top_k_zero_does_not_embed_query failed because recall_vector_chunks called client.embed and returned EmbeddingError::Http","green_evidence":"cargo test --workspace -q passed; autoresearch.sh parsed tests_green=54 tests_total=54 and checks passed","implementation_notes":"Added early Ok(Vec::new()) in recall_vector_chunks when top_k == 0; test uses FailingEmbeddingClient to prove no embedding call occurs"}}
{"run":58,"commit":"8c04f5b","metric":55,"metrics":{"tests_total":55,"milestone_index":3,"loc_core":863,"commit_count_total":61},"status":"checks_failed","description":"T55 Tree-sitter Rust function extraction passed tests but failed clippy collapsible_if","timestamp":1778134033911,"segment":0,"confidence":4,"asi":{"hypothesis":"start v0.3 with a new memory-extractor crate using tree-sitter-rust to deterministically extract Rust function names","rollback_reason":"cargo clippy -D warnings rejected nested if-let in collect_function_names as collapsible_if","next_action_hint":"reapply memory-extractor crate/test/deps and use combined `if node.kind() == \"function_item\" && let Some(name) = ...`","red_evidence":"extract_rust_functions_finds_function_name failed because memory_extractor::extract_rust_functions did not exist","implementation_notes":"Added workspace member, tree-sitter/tree-sitter-rust/thiserror deps, recursive Tree-sitter traversal, milestone_index advanced to 3; book query suggested confidence tagging for extraction and symbolic memory grounding [ch.69]"}}
{"run":59,"commit":"9d30fc9","metric":55,"metrics":{"tests_total":55,"milestone_index":3,"loc_core":863,"commit_count_total":61},"status":"keep","description":"T55 extracts Rust function names with Tree-sitter","timestamp":1778134107045,"segment":0,"confidence":3.923076923076923,"asi":{"hypothesis":"v0.3 should start with deterministic Tree-sitter Rust extraction that finds function_item names without LLMs or Python","red_evidence":"extract_rust_functions_finds_function_name failed because memory_extractor::extract_rust_functions did not exist","green_evidence":"cargo test --workspace -q passed; autoresearch.sh parsed tests_green=55 tests_total=55 milestone_index=3 and checks passed","implementation_notes":"Added memory-extractor workspace crate with tree-sitter/tree-sitter-rust deps and recursive function_item traversal; used combined if-let to avoid prior clippy collapsible_if; book query grounded extraction as confidence-tagged symbolic memory [ch.69]"}}
{"run":60,"commit":"cedc6ef","metric":56,"metrics":{"tests_total":56,"milestone_index":3,"loc_core":863,"commit_count_total":62},"status":"keep","description":"T56 extracts Rust use imports with Tree-sitter","timestamp":1778134197832,"segment":0,"confidence":4,"asi":{"hypothesis":"v0.3 extractor should collect Rust use declarations deterministically as import facts after function extraction","red_evidence":"extract_rust_imports_finds_use_path failed because memory_extractor::extract_rust_imports did not exist","green_evidence":"cargo test --workspace -q passed; autoresearch.sh parsed tests_green=56 tests_total=56 and checks passed","implementation_notes":"Added extract_rust_imports using Tree-sitter use_declaration traversal, trimming leading `use ` and trailing semicolon; no Python/LLM/network usage"}}
{"run":61,"commit":"75a9130","metric":57,"metrics":{"tests_total":57,"milestone_index":3,"loc_core":863,"commit_count_total":63},"status":"keep","description":"T57 extracts Rust call expressions with Tree-sitter","timestamp":1778134293076,"segment":0,"confidence":4.076923076923077,"asi":{"hypothesis":"v0.3 extractor should identify called Rust functions from call_expression nodes so later memory facts can include function call relationships","red_evidence":"extract_rust_calls_finds_called_function_name failed because memory_extractor::extract_rust_calls did not exist","green_evidence":"cargo test --workspace -q passed; autoresearch.sh parsed tests_green=57 tests_total=57 and checks passed","implementation_notes":"Added extract_rust_calls using Tree-sitter call_expression traversal and function field text; deterministic/offline with no LLM, Python, or network calls"}}
{"run":62,"commit":"4dd11fe","metric":58,"metrics":{"tests_total":58,"milestone_index":3,"loc_core":863,"commit_count_total":64},"status":"keep","description":"T58 extracts Rust struct names with Tree-sitter","timestamp":1778134336053,"segment":0,"confidence":4,"asi":{"hypothesis":"v0.3 extractor should capture Rust type definitions by collecting struct_item names for later File-defines-Type memory facts","red_evidence":"extract_rust_structs_finds_struct_name failed because memory_extractor::extract_rust_structs did not exist","green_evidence":"cargo test --workspace -q passed; autoresearch.sh parsed tests_green=58 tests_total=58 and checks passed","implementation_notes":"Added extract_rust_structs using Tree-sitter struct_item traversal and name field extraction; deterministic/offline and follows existing combined if-let style for clippy"}}
{"run":63,"commit":"875bb8a","metric":59,"metrics":{"tests_total":59,"milestone_index":3,"loc_core":863,"commit_count_total":65},"status":"keep","description":"T59 extracts Rust test function names with Tree-sitter","timestamp":1778134403958,"segment":0,"confidence":3.9285714285714284,"asi":{"hypothesis":"v0.3 function-to-test mapping should start by deterministically identifying #[test] functions from Rust AST siblings","red_evidence":"extract_rust_tests_finds_test_function_name first failed because extract_rust_tests did not exist, then returned [] until attribute_item sibling handling was added","green_evidence":"cargo test --workspace -q passed; autoresearch.sh parsed tests_green=59 tests_total=59 and checks passed","implementation_notes":"Added extract_rust_tests that scans sibling attribute_item nodes followed by function_item names; no ignores, Python, LLM, or network calls"}}
{"run":64,"commit":"85f6f17","metric":60,"metrics":{"tests_total":60,"milestone_index":3,"loc_core":863,"commit_count_total":66},"status":"keep","description":"T60 maps Rust tests to functions by name prefix","timestamp":1778134444875,"segment":0,"confidence":4,"asi":{"hypothesis":"v0.3 can produce an initial deterministic function-to-test mapping by pairing #[test] functions with non-test functions whose names prefix the test name","red_evidence":"map_rust_tests_to_functions_uses_test_name_prefix failed because map_rust_tests_to_functions did not exist","green_evidence":"cargo test --workspace -q passed; autoresearch.sh parsed tests_green=60 tests_total=60 and checks passed","implementation_notes":"Added map_rust_tests_to_functions returning Vec<(test,function)>; filters extracted test functions out of candidate definitions and chooses the longest matching function prefix"}}
{"run":65,"commit":"6d6c209","metric":61,"metrics":{"tests_total":61,"milestone_index":3,"loc_core":863,"commit_count_total":67},"status":"keep","description":"T61 emits Rust file-defines-function facts","timestamp":1778134490440,"segment":0,"confidence":4.071428571428571,"asi":{"hypothesis":"v0.3 extractor should begin emitting explicit triples so AST extraction can feed later memory graph facts rather than only raw name lists","red_evidence":"extract_rust_facts_emits_file_defines_function_triple failed because extract_rust_facts and ExtractedFact did not exist","green_evidence":"cargo test --workspace -q passed; autoresearch.sh parsed tests_green=61 tests_total=61 and checks passed","implementation_notes":"Added ExtractedFact {subject,predicate,object} and extract_rust_facts(path, source) producing File defines Function triples from extracted Rust functions"}}
{"run":66,"commit":"70c5126","metric":62,"metrics":{"tests_total":62,"milestone_index":3,"loc_core":863,"commit_count_total":68},"status":"keep","description":"T62 emits Rust file-imports-module facts","timestamp":1778134527295,"segment":0,"confidence":4,"asi":{"hypothesis":"Rust fact extraction should include import relationships, not just definitions, so v0.3 can represent file dependency edges from Tree-sitter use declarations","red_evidence":"extract_rust_facts_emits_file_imports_module_triple failed with [] because extract_rust_facts only emitted function definition facts","green_evidence":"cargo test --workspace -q passed; autoresearch.sh parsed tests_green=62 tests_total=62 and checks passed","implementation_notes":"Extended extract_rust_facts to append File imports Module triples from extract_rust_imports; deterministic/offline and no ADR changes"}}
{"run":67,"commit":"4bb27a6","metric":63,"metrics":{"tests_total":63,"milestone_index":3,"loc_core":863,"commit_count_total":69},"status":"keep","description":"T63 emits Rust function-call facts","timestamp":1778134603583,"segment":0,"confidence":4.214285714285714,"asi":{"hypothesis":"Rust fact extraction should include intra-code call edges by preserving the caller function context around call_expression nodes","red_evidence":"extract_rust_facts_emits_function_calls_function_triple failed because extract_rust_facts produced only file definition/import facts","green_evidence":"cargo test --workspace -q passed; autoresearch.sh parsed tests_green=63 tests_total=63 and checks passed","implementation_notes":"Added private extraction of Function calls Function triples by walking function_item nodes, collecting nested call_expression function fields, and appending facts"}}
{"run":68,"commit":"2481bc8","metric":64,"metrics":{"tests_total":64,"milestone_index":3,"loc_core":863,"commit_count_total":70},"status":"keep","description":"T64 emits Rust test-to-function facts","timestamp":1778134638060,"segment":0,"confidence":4.137931034482759,"asi":{"hypothesis":"Rust fact extraction should expose the deterministic function-to-test mapping as graph-ready Function tests Function triples","red_evidence":"extract_rust_facts_emits_test_covers_function_triple failed because extract_rust_facts did not include map_rust_tests_to_functions output","green_evidence":"cargo test --workspace -q passed; autoresearch.sh parsed tests_green=64 tests_total=64 and checks passed","implementation_notes":"Extended extract_rust_facts to append Function tests Function triples from map_rust_tests_to_functions; maintains deterministic offline Tree-sitter/name-prefix approach"}}
{"run":69,"commit":"37a6270","metric":65,"metrics":{"tests_total":65,"milestone_index":3,"loc_core":863,"commit_count_total":71},"status":"keep","description":"T65 emits Rust file-defines-struct facts","timestamp":1778134671380,"segment":0,"confidence":4.066666666666666,"asi":{"hypothesis":"Rust fact extraction should expose struct definitions as graph-ready File defines Struct triples alongside function definitions","red_evidence":"extract_rust_facts_emits_file_defines_struct_triple failed with [] because extract_rust_facts did not include extract_rust_structs output","green_evidence":"cargo test --workspace -q passed; autoresearch.sh parsed tests_green=65 tests_total=65 and checks passed","implementation_notes":"Extended extract_rust_facts to append Struct definition facts from extract_rust_structs; kept deterministic Tree-sitter-only implementation"}}
{"run":70,"commit":"77105dc","metric":66,"metrics":{"tests_total":66,"milestone_index":3,"loc_core":863,"commit_count_total":72},"status":"keep","description":"T66 extracts Rust enum names with Tree-sitter","timestamp":1778134729512,"segment":0,"confidence":4.133333333333334,"asi":{"hypothesis":"v0.3 Rust extraction should cover enum type definitions in addition to structs and functions for complete Rust symbol coverage","red_evidence":"extract_rust_enums_finds_enum_name failed because memory_extractor::extract_rust_enums did not exist","green_evidence":"cargo test --workspace -q passed; autoresearch.sh parsed tests_green=66 tests_total=66 and checks passed","implementation_notes":"Added extract_rust_enums and recursive enum_item name-field traversal; deterministic Tree-sitter-only implementation"}}
{"run":71,"commit":"c4bcaae","metric":67,"metrics":{"tests_total":67,"milestone_index":3,"loc_core":863,"commit_count_total":73},"status":"keep","description":"T67 emits Rust file-defines-enum facts","timestamp":1778134783010,"segment":0,"confidence":4.2,"asi":{"hypothesis":"Rust fact extraction should expose enum definitions as graph-ready File defines Enum triples after adding enum extraction","red_evidence":"extract_rust_facts_emits_file_defines_enum_triple failed with [] because extract_rust_facts did not include extract_rust_enums output","green_evidence":"cargo test --workspace -q passed; autoresearch.sh parsed tests_green=67 tests_total=67 and checks passed","implementation_notes":"Extended extract_rust_facts to append Enum definition facts from extract_rust_enums; deterministic Tree-sitter-only"}}
{"run":72,"commit":"e3745e4","metric":68,"metrics":{"tests_total":68,"milestone_index":3,"loc_core":863,"commit_count_total":74},"status":"keep","description":"T68 emits Rust impl method facts","timestamp":1778134838970,"segment":0,"confidence":4.129032258064516,"asi":{"hypothesis":"Rust fact extraction should preserve impl receiver context so methods can be represented as Type defines Function(Type::method) rather than only bare functions","red_evidence":"extract_rust_facts_emits_impl_defines_method_triple failed because extract_rust_facts did not include impl_item method ownership facts","green_evidence":"cargo test --workspace -q passed; autoresearch.sh parsed tests_green=68 tests_total=68 and checks passed","implementation_notes":"Added private impl_item traversal using Tree-sitter type field and nested function names to append Type defines Function Type::method facts"}}
{"run":73,"commit":"d427f92","metric":69,"metrics":{"tests_total":69,"milestone_index":3,"loc_core":863,"commit_count_total":75},"status":"keep","description":"T69 extracts Rust trait names with Tree-sitter","timestamp":1778134894700,"segment":0,"confidence":4.0625,"asi":{"hypothesis":"v0.3 Rust extraction should include trait definitions because they are first-class Rust API symbols alongside structs/enums/functions","red_evidence":"extract_rust_traits_finds_trait_name failed because memory_extractor::extract_rust_traits did not exist","green_evidence":"cargo test --workspace -q passed; autoresearch.sh parsed tests_green=69 tests_total=69 and checks passed","implementation_notes":"Added extract_rust_traits and recursive trait_item name-field traversal using Tree-sitter; deterministic/offline"}}
{"run":74,"commit":"42214fb","metric":70,"metrics":{"tests_total":70,"milestone_index":3,"loc_core":863,"commit_count_total":76},"status":"keep","description":"T70 emits Rust file-defines-trait facts","timestamp":1778134935898,"segment":0,"confidence":4.125,"asi":{"hypothesis":"Rust fact extraction should expose trait definitions as graph-ready File defines Trait triples after adding trait extraction","red_evidence":"extract_rust_facts_emits_file_defines_trait_triple failed because extract_rust_facts did not include extract_rust_traits output","green_evidence":"cargo test --workspace -q passed; autoresearch.sh parsed tests_green=70 tests_total=70 and checks passed","implementation_notes":"Extended extract_rust_facts to append Trait definition facts from extract_rust_traits; deterministic Tree-sitter-only"}}
{"run":75,"commit":"b2550ba","metric":71,"metrics":{"tests_total":71,"milestone_index":3,"loc_core":863,"commit_count_total":77},"status":"keep","description":"T71 emits Rust type-implements-trait facts","timestamp":1778135007446,"segment":0,"confidence":4.1875,"asi":{"hypothesis":"Rust fact extraction should capture trait implementation relationships as the Rust analogue of class extends/implements edges","red_evidence":"extract_rust_facts_emits_type_implements_trait_triple failed because extract_rust_facts did not include impl Trait for Type relationships","green_evidence":"cargo test --workspace -q passed; autoresearch.sh parsed tests_green=71 tests_total=71 and checks passed","implementation_notes":"Added private impl_item traversal that parses impl headers before the body and appends Type implements Trait facts; deterministic local Tree-sitter path"}}
{"run":76,"commit":"31a6955","metric":72,"metrics":{"tests_total":72,"milestone_index":4,"loc_core":886,"commit_count_total":78},"status":"keep","description":"T72 starts v0.4 privacy filter with AWS key rejection","timestamp":1778135078708,"segment":0,"confidence":4.121212121212121,"asi":{"hypothesis":"v0.4 should start with a deterministic pre-write privacy filter that rejects obvious AWS access keys before they can enter memory","red_evidence":"privacy_filter_rejects_aws_access_key failed because privacy_filter and PrivacyRejection did not exist","green_evidence":"cargo test --workspace -q passed; autoresearch.sh parsed tests_green=72 tests_total=72 milestone_index=4 and checks passed","implementation_notes":"Added PrivacyRejection::AwsAccessKey and privacy_filter scanning alphanumeric tokens for AKIA + 16 uppercase/digit characters; milestone advanced to v0.4"}}
