{"run":513,"commit":"789e28f","metric":785,"metrics":{"tests_green":785,"tests_total":785,"milestone_index":9,"loc_core":6951,"commit_count_total":578,"memory_error_rate":0,"unsupported_claim_rate":0,"mean_precision_at_k":1,"mean_recall_at_k":1,"beam_questions":0,"beam_rubric_checks":0,"beam_abstention_pct":0,"beam_contradiction_resolution_pct":0,"beam_event_ordering_pct":0,"beam_information_extraction_pct":0,"beam_instruction_following_pct":0,"beam_knowledge_update_pct":0,"beam_multi_session_reasoning_pct":0,"beam_preference_following_pct":0,"beam_summarization_pct":0,"beam_temporal_reasoning_pct":0},"status":"keep","description":"Reject empty prune marker id arrays","timestamp":1779050477655,"segment":28,"confidence":6.516666666666667,"asi":{"hypothesis":"Observation prune marker pruned_observation_ids arrays should be non-empty because a prune marker with no observations pruned is an unactionable audit record.","red_evidence":"`cargo test -q -p aver-core --test migrations observation_prune_marker_ids_must_not_be_empty` failed because direct SQL accepted an empty array.","green_evidence":"Targeted prune marker nonempty-array test passed; full migrations test passed with 88 tests; `./autoresearch.sh` passed with checks green and metrics tests_green=785 tests_total=785.","implementation_notes":"Added migration `0093_observation_prune_marker_ids_nonempty_checks.sql` with insert/update triggers rejecting valid JSON arrays with length zero.","anti_overfit_note":"This is a general observation pruning audit invariant and does not use benchmark expected outputs or labels."}}
{"run":514,"commit":"35a2b3f","metric":786,"metrics":{"tests_green":786,"tests_total":786,"milestone_index":9,"loc_core":6951,"commit_count_total":579,"memory_error_rate":0,"unsupported_claim_rate":0,"mean_precision_at_k":1,"mean_recall_at_k":1,"beam_questions":0,"beam_rubric_checks":0,"beam_abstention_pct":0,"beam_contradiction_resolution_pct":0,"beam_event_ordering_pct":0,"beam_information_extraction_pct":0,"beam_instruction_following_pct":0,"beam_knowledge_update_pct":0,"beam_multi_session_reasoning_pct":0,"beam_preference_following_pct":0,"beam_summarization_pct":0,"beam_temporal_reasoning_pct":0},"status":"keep","description":"Reject blank prune marker session ids","timestamp":1779050578578,"segment":28,"confidence":6.533333333333333,"asi":{"hypothesis":"Observation prune marker session_id should reject blank strings because markers are session-scoped audit records and blank session identifiers break pruning provenance.","red_evidence":"`cargo test -q -p aver-core --test migrations observation_prune_marker_session_id_must_not_be_blank` failed because direct SQL accepted a whitespace-only session_id.","green_evidence":"Targeted prune marker session-id test passed; full migrations test passed with 89 tests; `./autoresearch.sh` passed with checks green and metrics tests_green=786 tests_total=786.","implementation_notes":"Added migration `0094_observation_prune_marker_session_id_nonblank_checks.sql` with insert/update triggers rejecting trimmed-empty observation_prune_markers.session_id values.","anti_overfit_note":"This is a general observation pruning provenance invariant and does not use benchmark expected outputs or labels."}}
{"run":515,"commit":"f125bd8","metric":787,"metrics":{"tests_green":787,"tests_total":787,"milestone_index":9,"loc_core":6951,"commit_count_total":580,"memory_error_rate":0,"unsupported_claim_rate":0,"mean_precision_at_k":1,"mean_recall_at_k":1,"beam_questions":0,"beam_rubric_checks":0,"beam_abstention_pct":0,"beam_contradiction_resolution_pct":0,"beam_event_ordering_pct":0,"beam_information_extraction_pct":0,"beam_instruction_following_pct":0,"beam_knowledge_update_pct":0,"beam_multi_session_reasoning_pct":0,"beam_preference_following_pct":0,"beam_summarization_pct":0,"beam_temporal_reasoning_pct":0},"status":"keep","description":"Reject blank prune marker ids","timestamp":1779050647832,"segment":28,"confidence":6.4958677685950414,"asi":{"hypothesis":"Observation prune marker ids should reject blank strings because marker primary keys are audit identifiers and blank ids undermine deterministic replay and diagnostics.","red_evidence":"`cargo test -q -p aver-core --test migrations observation_prune_marker_id_must_not_be_blank` failed because direct SQL accepted a whitespace-only id.","green_evidence":"Targeted prune marker id test passed; full migrations test passed with 90 tests; `./autoresearch.sh` passed with checks green and metrics tests_green=787 tests_total=787.","implementation_notes":"Added migration `0095_observation_prune_marker_id_nonblank_checks.sql` with insert/update triggers rejecting trimmed-empty observation_prune_markers.id values.","anti_overfit_note":"This is a general observation pruning audit identity invariant and does not use benchmark expected outputs or labels."}}
{"run":516,"commit":"68e511c","metric":788,"metrics":{"tests_green":788,"tests_total":788,"milestone_index":9,"loc_core":6951,"commit_count_total":581,"memory_error_rate":0,"unsupported_claim_rate":0,"mean_precision_at_k":1,"mean_recall_at_k":1,"beam_questions":0,"beam_rubric_checks":0,"beam_abstention_pct":0,"beam_contradiction_resolution_pct":0,"beam_event_ordering_pct":0,"beam_information_extraction_pct":0,"beam_instruction_following_pct":0,"beam_knowledge_update_pct":0,"beam_multi_session_reasoning_pct":0,"beam_preference_following_pct":0,"beam_summarization_pct":0,"beam_temporal_reasoning_pct":0},"status":"keep","description":"Reject invalid hyperedge source ref elements","timestamp":1779050720265,"segment":28,"confidence":6.459016393442623,"asi":{"hypothesis":"Hyperedge source_refs array elements should be nonblank strings because source references are provenance identifiers and mixed/blank values are not auditable.","red_evidence":"`cargo test -q -p aver-core --test migrations hyperedge_source_refs_elements_must_be_nonblank_strings` failed because direct SQL accepted a whitespace-only source ref element.","green_evidence":"Targeted hyperedge source-ref element test passed; full migrations test passed with 91 tests; `./autoresearch.sh` passed with checks green and metrics tests_green=788 tests_total=788.","implementation_notes":"Added migration `0096_hyperedge_source_refs_elements_nonblank_checks.sql` with insert/update triggers using json_each to reject non-text or trimmed-empty source_refs elements.","anti_overfit_note":"This is a general hyperedge provenance invariant and does not use benchmark expected outputs or labels."}}
{"run":517,"commit":"415b4ba","metric":789,"metrics":{"tests_green":789,"tests_total":789,"milestone_index":9,"loc_core":6951,"commit_count_total":582,"memory_error_rate":0,"unsupported_claim_rate":0,"mean_precision_at_k":1,"mean_recall_at_k":1,"beam_questions":0,"beam_rubric_checks":0,"beam_abstention_pct":0,"beam_contradiction_resolution_pct":0,"beam_event_ordering_pct":0,"beam_information_extraction_pct":0,"beam_instruction_following_pct":0,"beam_knowledge_update_pct":0,"beam_multi_session_reasoning_pct":0,"beam_preference_following_pct":0,"beam_summarization_pct":0,"beam_temporal_reasoning_pct":0},"status":"keep","description":"Reject invalid prune marker id elements","timestamp":1779050797800,"segment":28,"confidence":6.475409836065574,"asi":{"hypothesis":"Observation prune marker pruned_observation_ids elements should be nonblank strings because prune markers identify concrete observations and mixed/blank values are not replayable.","red_evidence":"`cargo test -q -p aver-core --test migrations observation_prune_marker_ids_elements_must_be_nonblank_strings` failed because direct SQL accepted a whitespace-only observation id element.","green_evidence":"Targeted prune marker id element test passed; full migrations test passed with 92 tests; `./autoresearch.sh` passed with checks green and metrics tests_green=789 tests_total=789.","implementation_notes":"Added migration `0097_observation_prune_marker_ids_elements_nonblank_checks.sql` with insert/update triggers using json_each to reject non-text or trimmed-empty pruned_observation_ids elements.","anti_overfit_note":"This is a general observation pruning replayability invariant and does not use benchmark expected outputs or labels."}}
{"run":518,"commit":"5362e11","metric":790,"metrics":{"tests_green":790,"tests_total":790,"milestone_index":9,"loc_core":6951,"commit_count_total":583,"memory_error_rate":0,"unsupported_claim_rate":0,"mean_precision_at_k":1,"mean_recall_at_k":1,"beam_questions":0,"beam_rubric_checks":0,"beam_abstention_pct":0,"beam_contradiction_resolution_pct":0,"beam_event_ordering_pct":0,"beam_information_extraction_pct":0,"beam_instruction_following_pct":0,"beam_knowledge_update_pct":0,"beam_multi_session_reasoning_pct":0,"beam_preference_following_pct":0,"beam_summarization_pct":0,"beam_temporal_reasoning_pct":0},"status":"keep","description":"Reject duplicate hyperedge source refs","timestamp":1779050877484,"segment":28,"confidence":6.491803278688525,"asi":{"hypothesis":"Hyperedge source_refs should not contain duplicate provenance identifiers because duplicates inflate audit evidence without adding source diversity.","red_evidence":"`cargo test -q -p aver-core --test migrations hyperedge_source_refs_must_not_contain_duplicates` failed because direct SQL accepted duplicate source refs.","green_evidence":"Targeted hyperedge duplicate source-ref test passed; full migrations test passed with 93 tests; `./autoresearch.sh` passed with checks green and metrics tests_green=790 tests_total=790.","implementation_notes":"Added migration `0098_hyperedge_source_refs_unique_checks.sql` with insert/update triggers comparing json_each text element count to count(distinct value).","anti_overfit_note":"This is a general hyperedge provenance normalization invariant and does not use benchmark expected outputs or labels."}}
{"run":519,"commit":"29afbd8","metric":791,"metrics":{"tests_green":791,"tests_total":791,"milestone_index":9,"loc_core":6951,"commit_count_total":584,"memory_error_rate":0,"unsupported_claim_rate":0,"mean_precision_at_k":1,"mean_recall_at_k":1,"beam_questions":0,"beam_rubric_checks":0,"beam_abstention_pct":0,"beam_contradiction_resolution_pct":0,"beam_event_ordering_pct":0,"beam_information_extraction_pct":0,"beam_instruction_following_pct":0,"beam_knowledge_update_pct":0,"beam_multi_session_reasoning_pct":0,"beam_preference_following_pct":0,"beam_summarization_pct":0,"beam_temporal_reasoning_pct":0},"status":"keep","description":"Reject duplicate prune marker ids","timestamp":1779050955813,"segment":28,"confidence":6.508196721311475,"asi":{"hypothesis":"Observation prune marker pruned_observation_ids should not contain duplicate observation identifiers because duplicates inflate prune evidence and complicate replay semantics.","red_evidence":"`cargo test -q -p aver-core --test migrations observation_prune_marker_ids_must_not_contain_duplicates` failed because direct SQL accepted duplicate observation ids.","green_evidence":"Targeted prune marker duplicate-id test passed; full migrations test passed with 94 tests; `./autoresearch.sh` passed with checks green and metrics tests_green=791 tests_total=791.","implementation_notes":"Added migration `0099_observation_prune_marker_ids_unique_checks.sql` with insert/update triggers comparing json_each text element count to count(distinct value).","anti_overfit_note":"This is a general observation pruning replay normalization invariant and does not use benchmark expected outputs or labels."}}
{"run":520,"commit":"93a9194","metric":792,"metrics":{"tests_green":792,"tests_total":792,"milestone_index":9,"loc_core":6951,"commit_count_total":585,"memory_error_rate":0,"unsupported_claim_rate":0,"mean_precision_at_k":1,"mean_recall_at_k":1,"beam_questions":0,"beam_rubric_checks":0,"beam_abstention_pct":0,"beam_contradiction_resolution_pct":0,"beam_event_ordering_pct":0,"beam_information_extraction_pct":0,"beam_instruction_following_pct":0,"beam_knowledge_update_pct":0,"beam_multi_session_reasoning_pct":0,"beam_preference_following_pct":0,"beam_summarization_pct":0,"beam_temporal_reasoning_pct":0},"status":"keep","description":"Reject duplicate hyperedge participants","timestamp":1779051055460,"segment":28,"confidence":6.524590163934426,"asi":{"hypothesis":"Hyperedge participants should not duplicate the same role/entity tuple within one hyperedge because duplicate graph endpoints add no semantic information and complicate traversal semantics.","red_evidence":"`cargo test -q -p aver-core --test migrations hyperedge_participants_must_not_duplicate_role_entity` failed because direct SQL accepted two identical participant rows.","green_evidence":"Targeted duplicate participant test passed; full migrations test passed with 95 tests; `./autoresearch.sh` passed with checks green and metrics tests_green=792 tests_total=792.","implementation_notes":"Added migration `0100_hyperedge_participants_unique_role_entity.sql` with a unique index and insert/update triggers that emit a precise invariant error before duplicate role/entity rows persist.","anti_overfit_note":"This is a general hyperedge graph normalization invariant and does not use benchmark expected outputs or labels."}}
{"run":521,"commit":"93a9194","metric":453,"metrics":{"tests_green":453,"tests_total":454,"milestone_index":9,"loc_core":6951,"commit_count_total":586,"memory_error_rate":0,"unsupported_claim_rate":0,"mean_precision_at_k":1,"mean_recall_at_k":1,"beam_questions":0,"beam_rubric_checks":0,"beam_abstention_pct":0,"beam_contradiction_resolution_pct":0,"beam_event_ordering_pct":0,"beam_information_extraction_pct":0,"beam_instruction_following_pct":0,"beam_knowledge_update_pct":0,"beam_multi_session_reasoning_pct":0,"beam_preference_following_pct":0,"beam_summarization_pct":0,"beam_temporal_reasoning_pct":0},"status":"crash","description":"Hyperedge predicate ontology trigger broke older migration replay","timestamp":1779051145041,"segment":28,"confidence":6.524590163934426,"asi":{"hypothesis":"Hyperedge predicates should be backed by predicate ontology rows or aliases.","rollback_reason":"`./autoresearch.sh` failed in vector_index migration replay: `hyperedges_predicate_ontology_insert` referenced `predicate_alias`, which does not exist in the older schema state used by `migration_backfills_existing_vector_chunks_rows`.","next_action_hint":"Reapply hyperedge predicate ontology test with a migration trigger that only references tables guaranteed to exist at that migration point, or guard alias support via predicate_types only until predicate_alias is available in replay fixtures.","red_evidence":"Targeted migrations test passed on a fresh DB, but workspace benchmark failed in `crates/aver-core/tests/vector_index.rs` during migration replay.","anti_overfit_note":"The invariant is still general, but migration compatibility across historical schemas must be preserved."}}
{"run":522,"commit":"1210b75","metric":793,"metrics":{"tests_green":793,"tests_total":793,"milestone_index":9,"loc_core":6951,"commit_count_total":586,"memory_error_rate":0,"unsupported_claim_rate":0,"mean_precision_at_k":1,"mean_recall_at_k":1,"beam_questions":0,"beam_rubric_checks":0,"beam_abstention_pct":0,"beam_contradiction_resolution_pct":0,"beam_event_ordering_pct":0,"beam_information_extraction_pct":0,"beam_instruction_following_pct":0,"beam_knowledge_update_pct":0,"beam_multi_session_reasoning_pct":0,"beam_preference_following_pct":0,"beam_summarization_pct":0,"beam_temporal_reasoning_pct":0},"status":"keep","description":"Reject unknown hyperedge predicates","timestamp":1779051234797,"segment":28,"confidence":6.540983606557377,"asi":{"hypothesis":"Hyperedge predicates should reference canonical predicate_types so n-ary graph relationships use the same controlled vocabulary as durable claims without depending on later alias tables during migration replay.","red_evidence":"`cargo test -q -p aver-core --test migrations hyperedge_predicate_must_exist_in_predicate_types` failed because direct SQL accepted an unknown predicate.","green_evidence":"Targeted hyperedge predicate type test passed; full migrations test passed with 96 tests; vector_index migration replay test passed; `./autoresearch.sh` passed with checks green and metrics tests_green=793 tests_total=793.","implementation_notes":"Added migration `0101_hyperedge_predicate_type_checks.sql` with insert/update triggers checking predicate_types only, avoiding the previous failed attempt that referenced predicate_alias in historical migration replay contexts.","anti_overfit_note":"This is a general hyperedge ontology consistency invariant and does not use benchmark expected outputs or labels."}}
{"run":523,"commit":"d561f3a","metric":794,"metrics":{"tests_green":794,"tests_total":794,"milestone_index":9,"loc_core":6951,"commit_count_total":587,"memory_error_rate":0,"unsupported_claim_rate":0,"mean_precision_at_k":1,"mean_recall_at_k":1,"beam_questions":0,"beam_rubric_checks":0,"beam_abstention_pct":0,"beam_contradiction_resolution_pct":0,"beam_event_ordering_pct":0,"beam_information_extraction_pct":0,"beam_instruction_following_pct":0,"beam_knowledge_update_pct":0,"beam_multi_session_reasoning_pct":0,"beam_preference_following_pct":0,"beam_summarization_pct":0,"beam_temporal_reasoning_pct":0},"status":"keep","description":"Reject duplicate claim source refs","timestamp":1779051340695,"segment":28,"confidence":6.504065040650406,"asi":{"hypothesis":"Durable claim source_refs should not contain duplicate provenance identifiers because duplicates inflate support without improving audit evidence.","red_evidence":"`cargo test -q -p aver-core --test migrations claims_source_refs_must_not_contain_duplicates` failed because direct SQL accepted duplicate source_refs elements.","green_evidence":"Targeted claim duplicate source-ref test passed; full migrations test passed with 97 tests; `./autoresearch.sh` passed with checks green and metrics tests_green=794 tests_total=794.","implementation_notes":"Added migration `0102_claim_source_refs_unique_checks.sql` with insert/update triggers comparing json_each text element count to count(distinct value).","anti_overfit_note":"This is a general durable claim provenance normalization invariant and does not use benchmark expected outputs or labels."}}
{"run":524,"commit":"8927f33","metric":795,"metrics":{"tests_green":795,"tests_total":795,"milestone_index":9,"loc_core":6951,"commit_count_total":588,"memory_error_rate":0,"unsupported_claim_rate":0,"mean_precision_at_k":1,"mean_recall_at_k":1,"beam_questions":0,"beam_rubric_checks":0,"beam_abstention_pct":0,"beam_contradiction_resolution_pct":0,"beam_event_ordering_pct":0,"beam_information_extraction_pct":0,"beam_instruction_following_pct":0,"beam_knowledge_update_pct":0,"beam_multi_session_reasoning_pct":0,"beam_preference_following_pct":0,"beam_summarization_pct":0,"beam_temporal_reasoning_pct":0},"status":"keep","description":"Reject duplicate observation source event ids","timestamp":1779051436918,"segment":28,"confidence":6.467741935483871,"asi":{"hypothesis":"Observation source_event_ids should not contain duplicates because repeated event ids inflate provenance without adding independent support.","red_evidence":"`cargo test -q -p aver-core --test migrations observations_source_event_ids_must_not_contain_duplicates` failed because direct SQL accepted duplicate event ids.","green_evidence":"Targeted observation duplicate source-event test passed; full migrations test passed with 98 tests; `./autoresearch.sh` passed with checks green and metrics tests_green=795 tests_total=795.","implementation_notes":"Added migration `0103_observation_source_event_ids_unique_checks.sql` with insert/update triggers comparing json_each integer element count to count(distinct value).","anti_overfit_note":"This is a general observation provenance normalization invariant and does not use benchmark expected outputs or labels."}}
{"run":525,"commit":"e751197","metric":796,"metrics":{"tests_green":796,"tests_total":796,"milestone_index":9,"loc_core":6951,"commit_count_total":589,"memory_error_rate":0,"unsupported_claim_rate":0,"mean_precision_at_k":1,"mean_recall_at_k":1,"beam_questions":0,"beam_rubric_checks":0,"beam_abstention_pct":0,"beam_contradiction_resolution_pct":0,"beam_event_ordering_pct":0,"beam_information_extraction_pct":0,"beam_instruction_following_pct":0,"beam_knowledge_update_pct":0,"beam_multi_session_reasoning_pct":0,"beam_preference_following_pct":0,"beam_summarization_pct":0,"beam_temporal_reasoning_pct":0},"status":"keep","description":"Reject non-positive candidate event links","timestamp":1779051549330,"segment":28,"confidence":6.483870967741935,"asi":{"hypothesis":"Candidate claim event_id links should reject non-positive values before foreign-key handling so malformed staged-claim provenance gets precise diagnostics.","red_evidence":"`cargo test -q -p aver-core --test migrations candidate_claim_event_id_must_be_positive` failed because event_id=0 produced a generic foreign-key error.","green_evidence":"Targeted candidate event-id test passed; full migrations test passed with 99 tests; `./autoresearch.sh` passed with checks green and metrics tests_green=796 tests_total=796.","implementation_notes":"Added migration `0104_candidate_claim_event_id_positive_checks.sql` with insert/update triggers rejecting candidate_claims.event_id <= 0.","anti_overfit_note":"This is a general staged-claim provenance link invariant and does not use benchmark expected outputs or labels."}}
