{"run":169,"commit":"0797eff","metric":182,"metrics":{"tests_total":182,"milestone_index":9,"loc_core":1797,"commit_count_total":193,"memory_error_rate":0,"unsupported_claim_rate":0,"mean_precision_at_k":1,"mean_recall_at_k":1},"status":"keep","description":"add offline-tested BEAM100K evaluator harness CLI","timestamp":1778206863790,"segment":23,"confidence":4.5,"asi":{"hypothesis":"Aver eval should be able to load BEAM100K-style datasets and expose prompt/judge parsing helpers offline while the live Ollama runner stays behind an explicit CLI path","red_evidence":"BEAM harness tests initially did not exist and adding a second binary made autoresearch.sh fail because cargo run could not choose the default binary","green_evidence":"after adding default-run=aver-eval, autoresearch.sh passed with tests_green=182, tests_total=182, memory_error_rate=0, and checks green","anti_overfit_note":"unit tests cover generic dataset deserialization, rubric extraction, judge score parsing, and prompt assembly without network calls or fixture-specific answer logic"}}
{"type":"config","name":"Optimize Aver BEAM100K local Ollama score","metricName":"beam_score_pct","metricUnit":"","bestDirection":"higher"}
{"run":169,"commit":"0797eff","metric":0,"metrics":{},"status":"crash","description":"attempted custom BEAM baseline command while autoresearch.sh gate requires script entrypoint","timestamp":1778206900001,"segment":24,"confidence":null,"asi":{"hypothesis":"Run full BEAM100K baseline directly and parse mean_score as beam_score_pct","rollback_reason":"run_experiment refused custom command because autoresearch.sh exists and must be the experiment entrypoint","next_action_hint":"teach autoresearch.sh a BEAM target mode, then run AVER_AUTORESEARCH_TARGET=beam ./autoresearch.sh"}}
{"run":170,"commit":"47c6d71","metric":183,"metrics":{"tests_total":183,"milestone_index":9,"loc_core":1797,"commit_count_total":194,"memory_error_rate":0,"unsupported_claim_rate":0,"mean_precision_at_k":1,"mean_recall_at_k":1},"status":"keep","description":"extract enum variant definition triples","timestamp":1778207008029,"segment":23,"confidence":4.75,"asi":{"hypothesis":"Tree-sitter code graph extraction should represent enum variants as first-class symbols so MemoryError::ParseFailed style facts can be linked independently of the enum type","red_evidence":"extract_rust_facts_emits_enum_defines_variant_triple failed because enum_item extraction only emitted Enum:MemoryError and no Variant facts","green_evidence":"autoresearch.sh passed with tests_green=183, tests_total=183, memory_error_rate=0, and checks green","anti_overfit_note":"implementation generically walks enum_variant nodes under any enum_item and emits Enum:<name> defines Variant:<name>::<variant>, not fixture-specific MemoryError logic"}}
{"run":171,"commit":"58410f0","metric":184,"metrics":{"tests_total":184,"milestone_index":9,"loc_core":1797,"commit_count_total":195,"memory_error_rate":0,"unsupported_claim_rate":0,"mean_precision_at_k":1,"mean_recall_at_k":1},"status":"keep","description":"extract module-qualified enum variant triples","timestamp":1778207062805,"segment":23,"confidence":4.444444444444445,"asi":{"hypothesis":"Tree-sitter code graph extraction should preserve module context for enum variants so errors::MemoryError::ParseFailed is linked to the module-qualified enum rather than only the unqualified enum","red_evidence":"extract_rust_facts_emits_module_qualified_enum_variant_triple failed because module enum extraction emitted Enum:errors::MemoryError but no Variant:errors::MemoryError::ParseFailed fact","green_evidence":"autoresearch.sh passed with tests_green=184, tests_total=184, memory_error_rate=0, and checks green","anti_overfit_note":"implementation reuses generic enum_variant traversal under any module-scoped enum_item and qualifies with the current module path; no fixture-specific matching"}}
{"run":170,"commit":"0797eff","metric":0,"metrics":{},"status":"crash","description":"full BEAM baseline crashed on privacy filter high-entropy dataset content","timestamp":1778207875427,"segment":24,"confidence":null,"asi":{"hypothesis":"Run full BEAM100K through the new beam_score_pct autoresearch target using Ollama embeddings and gemma4 judge","rollback_reason":"conversation 3 contains high-entropy token-like content and Store::add_claim correctly rejected it via the privacy filter","next_action_hint":"add a generic privacy-preserving BEAM ingestion sanitizer that redacts high-entropy/API-key-like tokens before storing and embedding, without weakening Store privacy behavior","failure_detail":"Error: privacy filter rejected content: HighEntropy during BEAM conv 3 ingestion"}}
{"run":171,"commit":"3985876","metric":42.150333016175075,"metrics":{"beam_questions":400,"beam_rubric_checks":1051,"beam_abstention_pct":82.5,"beam_contradiction_resolution_pct":34.6875,"beam_event_ordering_pct":42.95774647887324,"beam_information_extraction_pct":38.58695652173913,"beam_instruction_following_pct":32.20338983050847,"beam_knowledge_update_pct":52.38095238095239,"beam_multi_session_reasoning_pct":32.67326732673268,"beam_preference_following_pct":64.1891891891892,"beam_summarization_pct":35.8974358974359,"beam_temporal_reasoning_pct":48},"status":"keep","description":"establish full BEAM100K autoresearch baseline with privacy-preserving ingestion","timestamp":1778214366482,"segment":24,"confidence":null,"asi":{"hypothesis":"Full BEAM100K can run as the new autoresearch target if the experiment entrypoint emits beam_score_pct and ingestion redacts secret-like high-entropy tokens before Store writes","red_evidence":"previous full run crashed at conversation 3 because privacy_filter correctly rejected high-entropy dataset content; added a failing unit test for secret-like token redaction before ingestion","green_evidence":"full run passed: 400 questions, 1051 rubric checks, beam_score_pct=42.150333016175075, and checks passed","anti_overfit_note":"redaction is generic privacy handling for high-entropy/API-key-like tokens and does not inspect BEAM labels, rubrics, questions, or answers; no scoring/judge shortcuts were added"}}
{"type":"config","name":"Optimize Aver BEAM100K local Ollama score without answer leakage","metricName":"beam_score_pct","metricUnit":"","bestDirection":"higher"}
{"run":172,"commit":"1769d89","metric":42.72121788772598,"metrics":{"beam_questions":400,"beam_rubric_checks":1051,"beam_abstention_pct":78.75,"beam_contradiction_resolution_pct":39.375,"beam_event_ordering_pct":40.61032863849765,"beam_information_extraction_pct":38.58695652173913,"beam_instruction_following_pct":32.20338983050847,"beam_knowledge_update_pct":53.57142857142857,"beam_multi_session_reasoning_pct":37.62376237623762,"beam_preference_following_pct":68.24324324324324,"beam_summarization_pct":32.30769230769231,"beam_temporal_reasoning_pct":52.666666666666664},"status":"keep","description":"remove BEAM reference-answer leakage from answer prompt","timestamp":1778217972885,"segment":25,"confidence":null,"asi":{"hypothesis":"Removing the BEAM reference answer from the answer-generation prompt prevents ground-truth leakage while preserving a valid full-dataset beam_score_pct baseline","red_evidence":"beam_answer_prompt_contains_question_and_context_without_reference_answer_leakage failed because answer_prompt included a synthetic ground-truth-only answer string","green_evidence":"full BEAM100K run without reference-answer leakage passed: 400 questions, 1051 rubric checks, beam_score_pct=42.72121788772598, checks green","anti_overfit_note":"the prompt now only includes question and retrieved memory context; reference answers remain available solely to the separate LLM judge rubric path, not answer generation"}}
{"run":173,"commit":"640a3d4","metric":44.814462416745954,"metrics":{"beam_questions":400,"beam_rubric_checks":1051,"beam_abstention_pct":83.75,"beam_contradiction_resolution_pct":57.49999999999999,"beam_event_ordering_pct":47.88732394366197,"beam_information_extraction_pct":36.95652173913043,"beam_instruction_following_pct":38.983050847457626,"beam_knowledge_update_pct":14.285714285714285,"beam_multi_session_reasoning_pct":40.099009900990104,"beam_preference_following_pct":75.67567567567568,"beam_summarization_pct":27.94871794871795,"beam_temporal_reasoning_pct":39.33333333333333},"status":"keep","description":"make BEAM answer prompt direct grounded and conflict-aware","timestamp":1778221479857,"segment":25,"confidence":null,"asi":{"hypothesis":"A generic answer prompt that asks for direct, grounded answers, no meta-commentary, and explicit conflict reporting should improve BEAM performance without using labels or reference answers","red_evidence":"beam_answer_prompt_instructs_direct_grounded_answers failed because the prompt lacked directness, anti-meta, and conflict-aware instructions","green_evidence":"full BEAM100K score improved from 42.72121788772598 to 44.814462416745954 with checks green","tradeoffs":"large gains in contradiction_resolution, event_ordering, instruction_following, preference_following, abstention; knowledge_update and temporal_reasoning declined, suggesting retrieval/currentness needs separate generic work","anti_overfit_note":"prompt changes are broad answer-quality instructions independent of BEAM rubrics, labels, or expected answers"}}
{"type":"config","name":"Complete Aver documented memory-layer surfaces without benchmark overfitting","metricName":"tests_green","metricUnit":"","bestDirection":"higher"}
{"run":176,"commit":"d4ad317","metric":193,"metrics":{"tests_total":193,"milestone_index":9,"loc_core":2031,"commit_count_total":202,"memory_error_rate":0,"unsupported_claim_rate":0,"mean_precision_at_k":1,"mean_recall_at_k":1},"status":"checks_failed","description":"complete documented memory-layer API surfaces but clippy found needless question mark","timestamp":1778223412224,"segment":26,"confidence":null,"asi":{"hypothesis":"Implementing generic ADR-0008 five-tool API, graph expansion, contradiction records, confidence decay, adaptive retrieval classification, and local community detection should raise deterministic tests without touching benchmarks or reference answers","red_evidence":"Added failing tests for graph expansion, contradictions, contradictions migration, ADR-0008 tool lifecycle, adaptive HybridRAG query classification, community detection, and confidence decay; each failed for missing APIs before implementation","green_evidence":"cargo test --workspace --locked passed with 193 tests before checks","rollback_reason":"autoresearch.checks.sh failed because clippy reported needless_question_mark in Store::contradict return path","next_action_hint":"Remove the unneeded Ok(...?) around get_contradiction, rerun autoresearch.sh/checks, and keep if tests_green remains 193 with checks green","anti_overfit_note":"Changes are generic memory-layer capabilities grounded in ADRs, the book's graph/HybridRAG guidance, Karta's contradiction/consolidation patterns, and MuninnDB's entity graph/retrieval mode ideas; no BEAM labels, rubrics, reference answers, or scoring shortcuts were used"}}
{"run":177,"commit":"7cd3e13","metric":193,"metrics":{"tests_total":193,"milestone_index":9,"loc_core":2031,"commit_count_total":202,"memory_error_rate":0,"unsupported_claim_rate":0,"mean_precision_at_k":1,"mean_recall_at_k":1},"status":"keep","description":"complete ADR-0008 graph tools and documented memory-layer surfaces","timestamp":1778223714351,"segment":26,"confidence":null,"asi":{"hypothesis":"Generic memory-layer capabilities from the README partial list can be completed with deterministic tests: ADR-0008 tool surface, graph expansion, contradiction records, confidence decay, adaptive HybridRAG weights, and local community detection","red_evidence":"Before implementation, targeted tests failed because Store::expand, Store::contradict, Store::list_contradictions, Store::decay_contradicted_confidence, Store::detect_communities, HybridWeights::for_query, the contradictions migration, and ADR-0008 server tools did not exist","green_evidence":"./autoresearch.sh passed with tests_green=193, tests_total=193, memory_error_rate=0, and autoresearch.checks.sh green","sources":"Book guidance: append-only triples, consolidation, graph traversal and HybridRAG [ch.147-148]; Karta references: contradiction/consolidation/confidence/temporal memory operations; MuninnDB references: entity graph traversal, retrieval modes/weights, confidence and decay concepts","anti_overfit_note":"No BEAM labels, rubrics, reference answers, or benchmark-specific branches were used; changes are generic APIs and data-model behavior covered by deterministic unit tests"}}
{"run":178,"commit":"d55a1be","metric":194,"metrics":{"tests_total":194,"milestone_index":9,"loc_core":2049,"commit_count_total":203,"memory_error_rate":0,"unsupported_claim_rate":0,"mean_precision_at_k":1,"mean_recall_at_k":1},"status":"keep","description":"report merged superseded and decayed consolidation counts","timestamp":1778223907704,"segment":26,"confidence":null,"asi":{"hypothesis":"Consolidation should return an auditable report with separate merged, superseded, and decayed counts so ADR-0008 memory.consolidate exposes meaningful lifecycle effects rather than a single ambiguous row count","red_evidence":"consolidate_report_counts_merged_superseded_and_decayed_claims initially failed because Store had no consolidate_report method","green_evidence":"./autoresearch.sh passed with tests_green=194, tests_total=194, memory_error_rate=0, and autoresearch.checks.sh green","source_grounding":"The Memory Layer emphasizes append-only graph triples consolidated into persistent memory [ch.147-148]; the report makes those consolidation effects observable without deleting history","anti_overfit_note":"The change is a generic core API and server tool improvement for auditable consolidation; it does not inspect or branch on benchmark datasets, labels, rubrics, reference answers, or BEAM ability names"}}
{"run":179,"commit":"66a94ad","metric":195,"metrics":{"tests_total":195,"milestone_index":9,"loc_core":2053,"commit_count_total":204,"memory_error_rate":0,"unsupported_claim_rate":0,"mean_precision_at_k":1,"mean_recall_at_k":1},"status":"keep","description":"skip superseded claims in vector recall","timestamp":1778223980868,"segment":26,"confidence":4,"asi":{"hypothesis":"Vector recall should preserve the same active-memory semantics as text recall by skipping claims that consolidation has superseded, preventing stale vector chunks from resurrecting invalidated facts","red_evidence":"vector_claim_recall_skips_superseded_claims failed because recall_vector_claims returned both a superseded stale claim and the active current claim","green_evidence":"./autoresearch.sh passed with tests_green=195, tests_total=195, memory_error_rate=0, and autoresearch.checks.sh green","source_grounding":"The Memory Layer frames the graph as ground truth while LLM/vector layers support retrieval [ch.147-148]; active claim status should therefore gate vector-returned claims","anti_overfit_note":"The change is a status-consistency rule for all vector recall results; it does not depend on benchmark datasets, BEAM labels, rubrics, reference answers, or fixture-specific strings"}}
{"run":180,"commit":"4299912","metric":196,"metrics":{"tests_total":196,"milestone_index":9,"loc_core":2053,"commit_count_total":205,"memory_error_rate":0,"unsupported_claim_rate":0,"mean_precision_at_k":1,"mean_recall_at_k":1},"status":"keep","description":"validate explicit recall alpha overrides","timestamp":1778224053854,"segment":26,"confidence":3,"asi":{"hypothesis":"The ADR-0008 recall surface should enforce the same 0..1 alpha validation as core HybridRAG weights instead of accepting invalid agent-supplied overrides","red_evidence":"recall_tool_rejects_alpha_outside_unit_interval failed because AverTools::recall accepted alpha=1.5 and returned an empty successful RecallView","green_evidence":"./autoresearch.sh passed with tests_green=196, tests_total=196, memory_error_rate=0, and autoresearch.checks.sh green","anti_overfit_note":"The change validates a generic public API parameter and is unrelated to benchmark data, BEAM labels, rubrics, reference answers, or ability categories"}}
{"run":181,"commit":"c62ea6d","metric":197,"metrics":{"tests_total":197,"milestone_index":9,"loc_core":2053,"commit_count_total":206,"memory_error_rate":0,"unsupported_claim_rate":0,"mean_precision_at_k":1,"mean_recall_at_k":1},"status":"keep","description":"validate add-triple confidence overrides","timestamp":1778224124731,"segment":26,"confidence":2.6666666666666665,"asi":{"hypothesis":"The ADR-0008 add_triple surface should reject out-of-range confidence values instead of silently clamping or ignoring invalid write parameters","red_evidence":"add_triple_rejects_confidence_outside_unit_interval failed because AverTools::add_triple accepted confidence=-0.1 and appended a claim","green_evidence":"./autoresearch.sh passed with tests_green=197, tests_total=197, memory_error_rate=0, and autoresearch.checks.sh green","anti_overfit_note":"The change is a generic API validation guard on agent writes; it does not depend on benchmark data, BEAM labels, rubrics, reference answers, or fixture-specific strings"}}
{"run":182,"commit":"c62ea6d","metric":198,"metrics":{"tests_total":198,"milestone_index":9,"loc_core":2089,"commit_count_total":207,"memory_error_rate":0,"unsupported_claim_rate":0,"mean_precision_at_k":1,"mean_recall_at_k":1},"status":"checks_failed","description":"persist add-triple confidence overrides but clippy flagged too many arguments","timestamp":1778224297461,"segment":26,"confidence":2,"asi":{"hypothesis":"Valid ADR-0008 add_triple confidence overrides should be persisted into claims and audit log entries instead of validated but ignored","red_evidence":"add_triple_persists_valid_confidence_override failed because a confidence=0.4 add_triple was recalled with default confidence 0.95","green_evidence":"cargo test --workspace --locked passed with tests_green=198 before checks","rollback_reason":"autoresearch.checks.sh failed because clippy flagged add_claim_from_agent_with_confidence as too_many_arguments","next_action_hint":"Replace the internal many-argument helper with a small NewClaimWrite struct or otherwise reduce the argument count, then rerun autoresearch.sh/checks","anti_overfit_note":"The change is a generic API correctness improvement for persisted confidence; it does not use benchmark data, labels, rubrics, reference answers, or BEAM ability categories"}}
{"run":183,"commit":"c7d4764","metric":198,"metrics":{"tests_total":198,"milestone_index":9,"loc_core":2103,"commit_count_total":207,"memory_error_rate":0,"unsupported_claim_rate":0,"mean_precision_at_k":1,"mean_recall_at_k":1},"status":"keep","description":"persist add-triple confidence overrides","timestamp":1778224410382,"segment":26,"confidence":2.5,"asi":{"hypothesis":"Valid ADR-0008 add_triple confidence overrides should be stored in the claim row and audit log rather than validated but ignored","red_evidence":"add_triple_persists_valid_confidence_override failed because a confidence=0.4 add_triple was recalled with default confidence 0.95","green_evidence":"./autoresearch.sh passed with tests_green=198, tests_total=198, memory_error_rate=0, and autoresearch.checks.sh green after replacing the clippy-failing helper with an internal ClaimWrite struct","anti_overfit_note":"The change is generic API correctness for all agent writes; it does not depend on benchmark data, BEAM labels, rubrics, reference answers, or ability categories"}}
{"run":184,"commit":"2e582d0","metric":199,"metrics":{"tests_total":199,"milestone_index":9,"loc_core":2103,"commit_count_total":208,"memory_error_rate":0,"unsupported_claim_rate":0,"mean_precision_at_k":1,"mean_recall_at_k":1},"status":"keep","description":"validate graph expansion hop bounds","timestamp":1778224469676,"segment":26,"confidence":3,"asi":{"hypothesis":"The ADR-0008 expand surface should reject invalid hop counts instead of silently clamping zero to one, making agent graph traversal parameters explicit and auditable","red_evidence":"expand_tool_rejects_zero_hops failed because AverTools::expand accepted hops=0 and returned an empty one-node GraphView","green_evidence":"./autoresearch.sh passed with tests_green=199, tests_total=199, memory_error_rate=0, and autoresearch.checks.sh green","anti_overfit_note":"The change validates a generic graph traversal API parameter; it does not depend on benchmark data, BEAM labels, rubrics, reference answers, or fixture-specific strings"}}
{"run":185,"commit":"c8219fd","metric":200,"metrics":{"tests_total":200,"milestone_index":9,"loc_core":2103,"commit_count_total":209,"memory_error_rate":0,"unsupported_claim_rate":0,"mean_precision_at_k":1,"mean_recall_at_k":1},"status":"keep","description":"validate recall hop bounds","timestamp":1778224498389,"segment":26,"confidence":3.5,"asi":{"hypothesis":"The ADR-0008 recall surface should reject invalid hop counts just like expand so graph-context controls are consistent across retrieval tools","red_evidence":"recall_tool_rejects_zero_hops failed because AverTools::recall accepted hops=0 and returned a successful empty RecallView","green_evidence":"./autoresearch.sh passed with tests_green=200, tests_total=200, memory_error_rate=0, and autoresearch.checks.sh green","anti_overfit_note":"The change validates a generic recall parameter; it does not depend on benchmark data, BEAM labels, rubrics, reference answers, or ability categories"}}
