{"run":103,"commit":"12ce3b9","metric":99,"metrics":{"tests_total":99,"milestone_index":7,"loc_core":1102,"commit_count_total":105},"status":"keep","description":"T99 adds entity type closure table","timestamp":1778136517523,"segment":0,"confidence":3.9583333333333335,"asi":{"hypothesis":"ADR-0010 materialized closure requires entity_type_closure so is_a queries can avoid walking parent chains at retrieval time","red_evidence":"fresh_database_has_entity_type_closure_table failed because entity_type_closure did not exist after Store::open","green_evidence":"cargo test --workspace -q passed; autoresearch.sh parsed tests_green=99 tests_total=99 and checks passed","implementation_notes":"Extended ontology migration with entity_type_closure(child_id,ancestor_id) and composite primary key referencing entity_types"}}
{"run":104,"commit":"022c084","metric":100,"metrics":{"tests_total":100,"milestone_index":7,"loc_core":1102,"commit_count_total":106},"status":"keep","description":"T100 adds predicate closure table","timestamp":1778136568719,"segment":0,"confidence":4,"asi":{"hypothesis":"ADR-0010 materialized closure also requires predicate_closure so predicate.implies queries can avoid walking parent chains","red_evidence":"fresh_database_has_predicate_closure_table failed because predicate_closure did not exist after Store::open","green_evidence":"cargo test --workspace -q passed; autoresearch.sh parsed tests_green=100 tests_total=100 and checks passed","implementation_notes":"Extended ontology migration with predicate_closure(child_id,ancestor_id) and composite primary key referencing predicate_types"}}
{"run":105,"commit":"a48129f","metric":101,"metrics":{"tests_total":101,"milestone_index":8,"loc_core":1102,"commit_count_total":107},"status":"keep","description":"T101 starts v0.8 eval harness descriptor","timestamp":1778136612792,"segment":0,"confidence":4.041666666666667,"asi":{"hypothesis":"v0.8 evaluation support should begin with a versioned MemoryAgentBench descriptor that tests can validate before adding benchmark runners","red_evidence":"eval_harness_declares_memory_agent_bench failed because eval/memory_agent_bench.json did not exist","green_evidence":"cargo test --workspace -q passed; autoresearch.sh parsed tests_green=101 tests_total=101 milestone_index=8 and checks passed","implementation_notes":"Added eval/memory_agent_bench.json with name, primary_metric, and version plus a memory-core test that parses and validates it; milestone advanced to v0.8"}}
{"run":106,"commit":"a0352ff","metric":102,"metrics":{"tests_total":102,"milestone_index":9,"loc_core":1102,"commit_count_total":108},"status":"keep","description":"T102 reaches v0.9 with shared-mode marker","timestamp":1778136662779,"segment":0,"confidence":4,"asi":{"hypothesis":"v0.9 shared-mode planning should be explicitly marked in workspace metadata so the roadmap can detect shared-mode readiness without adding an actual graph database dependency","red_evidence":"workspace_declares_shared_mode_feature failed because root Cargo.toml did not contain shared_mode","green_evidence":"cargo test --workspace -q passed; autoresearch.sh parsed tests_green=102 tests_total=102 milestone_index=9 and checks passed","implementation_notes":"Added [workspace.metadata.memory] shared_mode = \"planned\" and a memory-core test that validates the marker; no Postgres/Memgraph dependency or external service added"}}
{"run":107,"commit":"a0352ff","metric":102,"metrics":{"tests_total":102,"milestone_index":9,"loc_core":1102,"commit_count_total":109},"status":"discard","description":"terminal no-op after v0.9 reached","timestamp":1778136711684,"segment":0,"confidence":3.92,"asi":{"hypothesis":"Roadmap already reached v0.9, so per autoresearch.md the correct next cycle is a no-op verification emitting unchanged metrics rather than adding benchmark-gaming tests","rollback_reason":"No code changes were made and primary metric did not increase; terminal state is already achieved","next_action_hint":"Stop autonomous TDD additions unless the supervisor changes the optimization target or roadmap; future invocations should remain no-op verifications","green_evidence":"autoresearch.sh passed with checks green; parsed tests_green=102 tests_total=102 milestone_index=9"}}
{"run":108,"commit":"a0352ff","metric":102,"metrics":{"tests_total":102,"milestone_index":9,"loc_core":1102,"commit_count_total":109},"status":"discard","description":"terminal no-op after v0.9 reached","timestamp":1778136743778,"segment":0,"confidence":3.92,"asi":{"hypothesis":"Roadmap remains at terminal v0.9, so the non-cheating next action is only to verify unchanged green metrics rather than adding tests beyond the requested roadmap","rollback_reason":"No code changes were made and primary metric did not increase; terminal state is already achieved","next_action_hint":"Do not continue adding roadmap tests unless autoresearch.md or the optimization target changes; future invocations should remain no-op verifications","green_evidence":"autoresearch.sh passed with checks green; parsed tests_green=102 tests_total=102 milestone_index=9"}}
{"run":109,"commit":"a0352ff","metric":102,"metrics":{"tests_total":102,"milestone_index":9,"loc_core":1102,"commit_count_total":109},"status":"discard","description":"terminal no-op after v0.9 reached","timestamp":1778136780217,"segment":0,"confidence":3.92,"asi":{"hypothesis":"Roadmap remains complete at milestone_index=9; per termination rules, the next most promising non-cheating action is verifying green state without adding tests","rollback_reason":"No code changes were made and primary metric did not increase; v0.9 terminal state is already achieved","next_action_hint":"Do not add more tests or features under the current objective; only resume implementation if autoresearch.md or the optimization target changes","green_evidence":"autoresearch.sh passed with checks green; parsed tests_green=102 tests_total=102 milestone_index=9"}}
{"run":110,"commit":"a0352ff","metric":102,"metrics":{"tests_total":102,"milestone_index":9,"loc_core":1102,"commit_count_total":109},"status":"discard","description":"terminal no-op after v0.9 reached","timestamp":1778136816628,"segment":0,"confidence":3.843137254901961,"asi":{"hypothesis":"Roadmap remains complete at milestone_index=9; per autoresearch termination rules, the only non-cheating continuation is verifying unchanged green state","rollback_reason":"No code changes were made and primary metric did not increase; v0.9 terminal state is already achieved","next_action_hint":"Do not add tests/features under the current objective; only resume implementation if autoresearch.md or the optimization target changes","green_evidence":"autoresearch.sh passed with checks green; parsed tests_green=102 tests_total=102 milestone_index=9"}}
{"run":111,"commit":"a0352ff","metric":102,"metrics":{"tests_total":102,"milestone_index":9,"loc_core":1102,"commit_count_total":109},"status":"discard","description":"terminal no-op after v0.9 reached","timestamp":1778136847347,"segment":0,"confidence":3.769230769230769,"asi":{"hypothesis":"Roadmap remains complete at milestone_index=9; per autoresearch termination rules, the only non-cheating continuation is verifying unchanged green state","rollback_reason":"No code changes were made and primary metric did not increase; v0.9 terminal state is already achieved","next_action_hint":"Do not add tests/features under the current objective; only resume implementation if autoresearch.md or the optimization target changes","green_evidence":"autoresearch.sh passed with checks green; parsed tests_green=102 tests_total=102 milestone_index=9"}}
{"run":112,"commit":"a0352ff","metric":102,"metrics":{"tests_total":102,"milestone_index":9,"loc_core":1102,"commit_count_total":109},"status":"discard","description":"terminal no-op after v0.9 reached","timestamp":1778136877992,"segment":0,"confidence":3.69811320754717,"asi":{"hypothesis":"Roadmap remains complete at milestone_index=9; per autoresearch termination rules, the only non-cheating continuation is verifying unchanged green state","rollback_reason":"No code changes were made and primary metric did not increase; v0.9 terminal state is already achieved","next_action_hint":"Do not add tests/features under the current objective; only resume implementation if autoresearch.md or the optimization target changes","green_evidence":"autoresearch.sh passed with checks green; parsed tests_green=102 tests_total=102 milestone_index=9"}}
{"run":113,"commit":"a0352ff","metric":102,"metrics":{"tests_total":102,"milestone_index":9,"loc_core":1102,"commit_count_total":109},"status":"discard","description":"terminal no-op after v0.9 reached","timestamp":1778136911755,"segment":0,"confidence":3.6296296296296298,"asi":{"hypothesis":"Roadmap remains complete at milestone_index=9; per autoresearch termination rules, the only non-cheating continuation is verifying unchanged green state","rollback_reason":"No code changes were made and primary metric did not increase; v0.9 terminal state is already achieved","next_action_hint":"Do not add tests/features under the current objective; only resume implementation if autoresearch.md or the optimization target changes","green_evidence":"autoresearch.sh passed with checks green; parsed tests_green=102 tests_total=102 milestone_index=9"}}
{"run":114,"commit":"a0352ff","metric":102,"metrics":{"tests_total":102,"milestone_index":9,"loc_core":1102,"commit_count_total":109},"status":"discard","description":"terminal no-op after v0.9 reached","timestamp":1778136946949,"segment":0,"confidence":3.6296296296296298,"asi":{"hypothesis":"Roadmap remains complete at milestone_index=9; per autoresearch termination rules, the only non-cheating continuation is verifying unchanged green state","rollback_reason":"No code changes were made and primary metric did not increase; v0.9 terminal state is already achieved","next_action_hint":"Do not add tests/features under the current objective; only resume implementation if autoresearch.md or the optimization target changes","green_evidence":"autoresearch.sh passed with checks green; parsed tests_green=102 tests_total=102 milestone_index=9"}}
{"run":115,"commit":"a0352ff","metric":102,"metrics":{"tests_total":102,"milestone_index":9,"loc_core":1102,"commit_count_total":109},"status":"discard","description":"terminal no-op after v0.9 reached","timestamp":1778156791866,"segment":0,"confidence":3.6296296296296298,"asi":{"hypothesis":"Roadmap remains complete at milestone_index=9; per autoresearch termination rules, the only non-cheating continuation is verifying unchanged green state","rollback_reason":"No code changes were made and primary metric did not increase; v0.9 terminal state is already achieved","next_action_hint":"Do not add tests/features under the current objective; only resume implementation if autoresearch.md or the optimization target changes","green_evidence":"autoresearch.sh passed with checks green; parsed tests_green=102 tests_total=102 milestone_index=9"}}
{"type":"config","name":"Optimize Aver noisy recall precision without sacrificing recall","metricName":"unsupported_claim_rate","metricUnit":"","bestDirection":"lower"}
{"run":116,"commit":"79a5a0d","metric":0,"metrics":{"tests_green":140,"tests_total":140,"milestone_index":9,"loc_core":1667,"commit_count_total":150},"status":"crash","description":"benchmark metric extraction failed in autoresearch.sh Python one-liner","timestamp":1778182562179,"segment":1,"confidence":null,"asi":{"hypothesis":"switch autoresearch primary metric to noisy recall unsupported_claim_rate baseline","rollback_reason":"autoresearch.sh emitted a Python f-string SyntaxError while extracting JSON metrics, so primary unsupported_claim_rate was not parsed","next_action_hint":"reapply benchmark metric extraction using a here-doc or python script that avoids shell-escaped f-strings","error_detail":"SyntaxError in python3 -c metric extraction; tests and checks otherwise passed"}}
{"run":117,"commit":"6acc20b","metric":0.5,"metrics":{"tests_green":140,"tests_total":140,"milestone_index":9,"loc_core":1667,"commit_count_total":150,"mean_precision_at_k":0.5666666666666667,"mean_recall_at_k":1},"status":"keep","description":"establish noisy recall unsupported-claim baseline","timestamp":1778182593912,"segment":1,"confidence":null,"asi":{"hypothesis":"make autoresearch.sh measure the conflict_and_noise fixture unsupported_claim_rate as the primary optimization target","baseline_note":"previous crash logged metric=0 only because metric extraction failed; this is the first valid unsupported_claim_rate baseline","benchmark_fixture":"eval/fixtures/conflict_and_noise.json","guardrail":"do not overfit by hard-coding fixture answers; optimize general retrieval ranking or evaluation semantics only"}}
{"run":118,"commit":"8b96d06","metric":0.45454545454545453,"metrics":{"tests_green":141,"tests_total":141,"milestone_index":9,"loc_core":1686,"commit_count_total":151,"mean_precision_at_k":0.6333333333333333,"mean_recall_at_k":1},"status":"keep","description":"rank recall with exact-token weighting to reduce weak compound-token noise","timestamp":1778182648343,"segment":1,"confidence":null,"asi":{"hypothesis":"we can reduce unsupported noisy recall by treating full token matches as stronger than subtoken matches and filtering weak compound-only matches","red_evidence":"recall_text_filters_weak_compound_token_distractors failed with old_language returned for query 'Aver language'","green_evidence":"conflict_and_noise unsupported_claim_rate improved from 0.5 to 0.454545 while mean_recall_at_k stayed 1.0","generalization_note":"not hard-coded to fixture answers; applies field/token scoring generally and preserves subtoken-only single-term recall such as stripe vs stripe_sdk"}}
{"run":119,"commit":"8b96d06","metric":0,"metrics":{"tests_green":104,"tests_total":105,"milestone_index":9,"loc_core":1697,"commit_count_total":152,"mean_precision_at_k":0,"mean_recall_at_k":0},"status":"crash","description":"strict coverage filter made noisy fixture test expectation stale","timestamp":1778182711295,"segment":1,"confidence":null,"asi":{"hypothesis":"filter broad two-token distractors when a stronger multi-token match exists","rollback_reason":"workspace failed because conflict_and_noise_fixture_exercises_distractor_retrieval still asserted unsupported_claim_rate > 0.0 even after the intended precision improvement reached 0.0","next_action_hint":"reapply scoring change and update the eval test to assert bounded metrics plus recall preservation rather than requiring noise remains","failure_detail":"cargo test failed in aver-eval runner after benchmark unsupported_claim_rate became 0.0"}}
{"run":120,"commit":"6ef8382","metric":0,"metrics":{"tests_green":142,"tests_total":142,"milestone_index":9,"loc_core":1697,"commit_count_total":152,"mean_precision_at_k":1,"mean_recall_at_k":1},"status":"keep","description":"filter broad distractors when stronger multi-token matches exist","timestamp":1778182740250,"segment":1,"confidence":null,"asi":{"hypothesis":"when a query has a strong two-token match and no name-anchor expansion is needed, weaker one-token matches are likely broad distractors and should be filtered","red_evidence":"recall_text_prefers_claims_covering_multiple_query_tokens failed before the filter because 'Rust user' also returned project-language and user-name single-token matches","green_evidence":"conflict_and_noise unsupported_claim_rate improved from 0.454545 to 0.0; mean_precision_at_k and mean_recall_at_k are both 1.0","guardrail":"heuristic is schema-general: keep weaker subject-cluster matches only when a strongest predicate=name claim anchors the entity, preserving 'Aver project' multi-claim recall"}}
{"type":"config","name":"Optimize Aver noisy recall precision across multiple fixtures","metricName":"unsupported_claim_rate","metricUnit":"","bestDirection":"lower"}
{"run":121,"commit":"2394d5b","metric":0,"metrics":{"tests_green":142,"tests_total":142,"milestone_index":9,"loc_core":1697,"commit_count_total":153,"mean_precision_at_k":1,"mean_recall_at_k":1},"status":"keep","description":"baseline after broadening noisy recall experiment target","timestamp":1778182778835,"segment":2,"confidence":null,"asi":{"hypothesis":"establish the current unsupported_claim_rate baseline after resetting the experiment target for multi-fixture noisy recall work","baseline_note":"current conflict_and_noise fixture is saturated at unsupported_claim_rate=0, so subsequent cycles should broaden benchmark coverage rather than tune against this fixture","next_action_hint":"add a multi-fixture eval runner/aggregate metric or a harder fixture before further retrieval changes","guardrail":"avoid fixture-specific scoring changes now that the current benchmark is saturated"}}
{"type":"config","name":"Optimize Aver noisy recall precision across aggregate fixtures","metricName":"unsupported_claim_rate","metricUnit":"","bestDirection":"lower"}
{"run":122,"commit":"2394d5b","metric":0.13333333333333333,"metrics":{"tests_green":143,"tests_total":143,"milestone_index":9,"loc_core":1697,"commit_count_total":154,"mean_precision_at_k":0.9259259259259259,"mean_recall_at_k":1},"status":"checks_failed","description":"aggregate fixture benchmark failed formatting check","timestamp":1778182837470,"segment":3,"confidence":null,"asi":{"hypothesis":"broaden benchmark workload by aggregating basic, conflict/noise, and ambiguous single-token fixtures","rollback_reason":"cargo fmt --check required wrapping the multi-fixture usage error in aver-eval main","next_action_hint":"run cargo fmt, then rerun aggregate benchmark; code behavior and metrics were otherwise valid","benchmark_metric":"unsupported_claim_rate=0.13333333333333333 on aggregate fixtures"}}
{"run":123,"commit":"e0e266d","metric":0.13333333333333333,"metrics":{"tests_green":143,"tests_total":143,"milestone_index":9,"loc_core":1697,"commit_count_total":154,"mean_precision_at_k":0.9259259259259259,"mean_recall_at_k":1},"status":"keep","description":"broaden noisy recall benchmark with aggregate fixtures","timestamp":1778182878572,"segment":3,"confidence":null,"asi":{"hypothesis":"avoid overfitting the saturated conflict_and_noise fixture by measuring an aggregate of basic, conflict/noise, and ambiguous single-token recall fixtures","baseline_note":"this is the first checks-passing run for the aggregate fixture workload; previous equal metric failed formatting checks and was not committed","benchmark_metric":"aggregate unsupported_claim_rate=0.13333333333333333","next_action_hint":"optimize ambiguous single-token precision without reducing recall on the aggregate"}}
{"run":124,"commit":"e0e266d","metric":0,"metrics":{"tests_green":100,"tests_total":101,"milestone_index":9,"loc_core":1700,"commit_count_total":155,"mean_precision_at_k":0,"mean_recall_at_k":0},"status":"crash","description":"single-token cap made aggregate CLI test expectation stale","timestamp":1778182917433,"segment":3,"confidence":null,"asi":{"hypothesis":"cap ambiguous single-token recall to the best ranked match to reduce broad one-word noise","rollback_reason":"workspace failed because aver_eval_binary_aggregates_multiple_fixtures still asserted aggregate unsupported_claim_rate > 0.0 after the intended improvement drove it to zero","next_action_hint":"reapply single-token cap and update aggregate CLI test to require bounded unsupported rate rather than persistent noise","failure_detail":"cargo test failed in aver-eval cli test"}}
{"run":125,"commit":"4b6e5a7","metric":0,"metrics":{"tests_green":144,"tests_total":144,"milestone_index":9,"loc_core":1700,"commit_count_total":155,"mean_precision_at_k":1,"mean_recall_at_k":1},"status":"keep","description":"cap ambiguous single-token recall to best match","timestamp":1778182954074,"segment":3,"confidence":null,"asi":{"hypothesis":"single-token queries are highly ambiguous, so returning only the best ranked match should reduce broad noise while preserving exact-match recall in the aggregate fixtures","red_evidence":"recall_text_caps_ambiguous_single_token_queries_to_best_match failed because 'Rust' returned three exact matches","green_evidence":"aggregate unsupported_claim_rate improved from 0.13333333333333333 to 0.0 with mean_recall_at_k still 1.0","generalization_risk":"may reduce recall for genuinely multi-answer single-token queries; future fixtures should include such cases if broad single-token recall is desired"}}
{"type":"config","name":"Optimize Aver aggregate memory error without overfitting precision","metricName":"memory_error_rate","metricUnit":"","bestDirection":"lower"}
{"run":126,"commit":"8bb9737","metric":0.16666666666666663,"metrics":{"tests_green":144,"tests_total":144,"milestone_index":9,"loc_core":1700,"commit_count_total":156,"unsupported_claim_rate":0,"mean_precision_at_k":1,"mean_recall_at_k":0.8333333333333334},"status":"keep","description":"broaden aggregate benchmark with multi-answer single-token fixture","timestamp":1778183028312,"segment":4,"confidence":null,"asi":{"hypothesis":"avoid overfitting the single-token precision cap by adding a fixture where one-token queries legitimately have multiple relevant answers and measuring memory_error_rate = unsupported_claim_rate + (1 - mean_recall_at_k)","baseline_note":"new aggregate workload exposes recall loss from the previous single-token cap while preserving unsupported_claim_rate=0","benchmark_fixture_added":"eval/fixtures/single_token_multi_answer.json","next_action_hint":"improve single-token recall for multi-answer cases without reopening unsupported noise on ambiguous_single_token"}}
