{"run":207,"commit":"0740080","metric":222,"metrics":{"tests_total":222,"milestone_index":9,"loc_core":2166,"commit_count_total":231,"memory_error_rate":0,"unsupported_claim_rate":0,"mean_precision_at_k":1,"mean_recall_at_k":1},"status":"keep","description":"validate embedded vector values","timestamp":1778226666041,"segment":26,"confidence":3.625,"asi":{"hypothesis":"Embedded vector chunk writes should reject empty embedding arrays so persisted vector rows always contain usable nearest-neighbor data","red_evidence":"add_vector_chunk_with_embedding_rejects_empty_embedding failed because Store::add_vector_chunk_with_embedding accepted an empty vector and inserted chunk id 1","green_evidence":"./autoresearch.sh passed with tests_green=222, tests_total=222, memory_error_rate=0, and autoresearch.checks.sh green","anti_overfit_note":"The change is a generic vector projection integrity invariant; it does not depend on benchmark data, BEAM labels, rubrics, reference answers, or fixture-specific scoring shortcuts"}}
{"run":208,"commit":"392c613","metric":223,"metrics":{"tests_total":223,"milestone_index":9,"loc_core":2166,"commit_count_total":232,"memory_error_rate":0,"unsupported_claim_rate":0,"mean_precision_at_k":1,"mean_recall_at_k":1},"status":"keep","description":"reject non-finite embedding values","timestamp":1778226693288,"segment":26,"confidence":3.75,"asi":{"hypothesis":"Embedded vector chunk writes should reject NaN or infinite embedding components so vector retrieval math stays deterministic and serializable","red_evidence":"add_vector_chunk_with_embedding_rejects_non_finite_embedding_values failed because Store::add_vector_chunk_with_embedding accepted a vector containing f32::NAN and inserted chunk id 1","green_evidence":"./autoresearch.sh passed with tests_green=223, tests_total=223, memory_error_rate=0, and autoresearch.checks.sh green","anti_overfit_note":"The change is a generic vector numeric-integrity invariant; it does not depend on benchmark data, BEAM labels, rubrics, reference answers, or fixture-specific scoring shortcuts"}}
{"run":209,"commit":"4ad9fcf","metric":224,"metrics":{"tests_total":224,"milestone_index":9,"loc_core":2171,"commit_count_total":233,"memory_error_rate":0,"unsupported_claim_rate":0,"mean_precision_at_k":1,"mean_recall_at_k":1},"status":"keep","description":"require existing candidate rejection targets","timestamp":1778226760835,"segment":26,"confidence":3.6470588235294117,"asi":{"hypothesis":"Rejecting a candidate claim should fail honestly when the candidate id does not exist instead of silently updating zero rows","red_evidence":"reject_candidate_claim_requires_existing_candidate failed because Store::reject_candidate_claim returned Ok(()) for missing candidate id 42","green_evidence":"./autoresearch.sh passed with tests_green=224, tests_total=224, memory_error_rate=0, and autoresearch.checks.sh green","anti_overfit_note":"The change is a generic staged-memory lifecycle integrity check; it does not depend on benchmark data, BEAM labels, rubrics, reference answers, or fixture-specific scoring shortcuts"}}
{"run":210,"commit":"df2cd24","metric":225,"metrics":{"tests_total":225,"milestone_index":9,"loc_core":2182,"commit_count_total":234,"memory_error_rate":0,"unsupported_claim_rate":0,"mean_precision_at_k":1,"mean_recall_at_k":1},"status":"keep","description":"validate candidate rejection reasons","timestamp":1778226808696,"segment":26,"confidence":3.5555555555555554,"asi":{"hypothesis":"Rejecting a staged candidate should require a non-empty rejection reason so audit metadata remains explainable","red_evidence":"reject_candidate_claim_rejects_empty_reason failed because Store::reject_candidate_claim accepted a whitespace-only reason and marked the candidate rejected","green_evidence":"./autoresearch.sh passed with tests_green=225, tests_total=225, memory_error_rate=0, and autoresearch.checks.sh green","anti_overfit_note":"The change is a generic staged-memory auditability invariant; it does not depend on benchmark data, BEAM labels, rubrics, reference answers, or fixture-specific scoring shortcuts"}}
{"run":211,"commit":"a54ed84","metric":226,"metrics":{"tests_total":226,"milestone_index":9,"loc_core":2190,"commit_count_total":235,"memory_error_rate":0,"unsupported_claim_rate":0,"mean_precision_at_k":1,"mean_recall_at_k":1},"status":"keep","description":"prevent promoting rejected candidates","timestamp":1778226848325,"segment":26,"confidence":3.6666666666666665,"asi":{"hypothesis":"Candidate promotion should honor lifecycle state and reject candidates already marked REJECTED instead of later turning them into durable claims","red_evidence":"promote_candidate_claim_rejects_rejected_candidate failed because Store::promote_candidate_claim promoted a candidate after it had been rejected","green_evidence":"./autoresearch.sh passed with tests_green=226, tests_total=226, memory_error_rate=0, and autoresearch.checks.sh green","anti_overfit_note":"The change is a generic staged-memory lifecycle invariant; it does not depend on benchmark data, BEAM labels, rubrics, reference answers, or fixture-specific scoring shortcuts"}}
{"run":212,"commit":"8d0d910","metric":227,"metrics":{"tests_total":227,"milestone_index":9,"loc_core":2203,"commit_count_total":236,"memory_error_rate":0,"unsupported_claim_rate":0,"mean_precision_at_k":1,"mean_recall_at_k":1},"status":"keep","description":"prevent rejecting promoted candidates","timestamp":1778226896904,"segment":26,"confidence":3.7777777777777777,"asi":{"hypothesis":"Candidate rejection should honor lifecycle state and fail for candidates already promoted into durable claims","red_evidence":"reject_candidate_claim_rejects_promoted_candidate failed because Store::reject_candidate_claim marked an already promoted candidate as REJECTED","green_evidence":"./autoresearch.sh passed with tests_green=227, tests_total=227, memory_error_rate=0, and autoresearch.checks.sh green","anti_overfit_note":"The change is a generic staged-memory lifecycle integrity check; it does not depend on benchmark data, BEAM labels, rubrics, reference answers, or fixture-specific scoring shortcuts"}}
{"run":213,"commit":"f891e92","metric":228,"metrics":{"tests_total":228,"milestone_index":9,"loc_core":2208,"commit_count_total":237,"memory_error_rate":0,"unsupported_claim_rate":0,"mean_precision_at_k":1,"mean_recall_at_k":1},"status":"keep","description":"validate core extraction thresholds","timestamp":1778226928012,"segment":26,"confidence":3.6842105263157894,"asi":{"hypothesis":"Core extraction-trigger checks should reject zero event thresholds instead of silently returning false, matching public API validation","red_evidence":"should_extract_memories_rejects_zero_threshold failed because Store::should_extract_memories returned Ok(false) for event_threshold=0","green_evidence":"./autoresearch.sh passed with tests_green=228, tests_total=228, memory_error_rate=0, and autoresearch.checks.sh green","anti_overfit_note":"The change is a generic extraction orchestration input-validation invariant; it does not depend on benchmark data, BEAM labels, rubrics, reference answers, or fixture-specific scoring shortcuts"}}
{"run":214,"commit":"8d310f2","metric":229,"metrics":{"tests_total":229,"milestone_index":9,"loc_core":2210,"commit_count_total":238,"memory_error_rate":0,"unsupported_claim_rate":0,"mean_precision_at_k":1,"mean_recall_at_k":1},"status":"keep","description":"validate core text recall queries","timestamp":1778226967215,"segment":26,"confidence":3.6,"asi":{"hypothesis":"Core text recall should reject blank queries instead of silently returning an empty result, making misuse visible to callers","red_evidence":"recall_text_rejects_empty_queries failed because Store::recall_text returned Ok([]) for a whitespace-only query","green_evidence":"./autoresearch.sh passed with tests_green=229, tests_total=229, memory_error_rate=0, and autoresearch.checks.sh green","anti_overfit_note":"The change is a generic recall API input-validation invariant; it does not depend on benchmark data, BEAM labels, rubrics, reference answers, or fixture-specific scoring shortcuts"}}
{"run":215,"commit":"8d310f2","metric":135,"metrics":{"tests_total":136,"milestone_index":9,"loc_core":2212,"commit_count_total":239,"memory_error_rate":0,"unsupported_claim_rate":0,"mean_precision_at_k":0,"mean_recall_at_k":0},"status":"crash","description":"tried to reject zero vector recall top-k but existing API defines short-circuit","timestamp":1778227013186,"segment":26,"confidence":3.6,"asi":{"hypothesis":"Core vector recall should reject top_k=0 like public server recall limits","red_evidence":"recall_vector_chunks_rejects_zero_top_k failed because Store::recall_vector_chunks returned Ok([]) for top_k=0","rollback_reason":"Existing deterministic tests intentionally require top_k=0 to short-circuit before embedding for recall_vector_chunks, recall_vector_claims, and recall_hybrid_claims; changing this invariant broke recall_vector_chunks_top_k_zero_does_not_embed_query","next_action_hint":"Keep the zero-top-k short-circuit invariant in core vector recall; pursue a different generic invariant such as blank vector query validation or missing claim handling","anti_overfit_note":"The attempted change was generic API validation and did not use benchmark data, BEAM labels, rubrics, reference answers, or fixture-specific scoring shortcuts"}}
{"run":216,"commit":"4147b30","metric":230,"metrics":{"tests_total":230,"milestone_index":9,"loc_core":2219,"commit_count_total":239,"memory_error_rate":0,"unsupported_claim_rate":0,"mean_precision_at_k":1,"mean_recall_at_k":1},"status":"keep","description":"validate vector recall queries","timestamp":1778227047113,"segment":26,"confidence":3.7,"asi":{"hypothesis":"Vector recall should reject blank queries before embedding while preserving the documented top_k=0 short-circuit behavior","red_evidence":"recall_vector_chunks_rejects_empty_query failed because Store::recall_vector_chunks embedded a whitespace-only query and returned Ok([])","green_evidence":"./autoresearch.sh passed with tests_green=230, tests_total=230, memory_error_rate=0, and autoresearch.checks.sh green","anti_overfit_note":"The change is a generic vector recall API input-validation invariant; it does not depend on benchmark data, BEAM labels, rubrics, reference answers, or fixture-specific scoring shortcuts","prior_dead_end_addressed":"Unlike the discarded zero-top-k experiment, this preserves existing top_k=0 short-circuit tests and only validates non-empty queries when embedding would be attempted"}}
{"run":217,"commit":"3258099","metric":231,"metrics":{"tests_total":231,"milestone_index":9,"loc_core":2220,"commit_count_total":240,"memory_error_rate":0,"unsupported_claim_rate":0,"mean_precision_at_k":1,"mean_recall_at_k":1},"status":"keep","description":"validate vector ranking query embeddings","timestamp":1778227073310,"segment":26,"confidence":3.619047619047619,"asi":{"hypothesis":"Direct vector ranking should reject empty query embedding arrays so callers cannot rank against unusable vectors","red_evidence":"rank_vector_chunks_by_embedding_rejects_empty_query_embedding failed because Store::rank_vector_chunks_by_embedding returned Ok([]) for an empty query vector","green_evidence":"./autoresearch.sh passed with tests_green=231, tests_total=231, memory_error_rate=0, and autoresearch.checks.sh green","anti_overfit_note":"The change is a generic vector retrieval numeric-integrity invariant; it does not depend on benchmark data, BEAM labels, rubrics, reference answers, or fixture-specific scoring shortcuts"}}
{"run":218,"commit":"f138387","metric":232,"metrics":{"tests_total":232,"milestone_index":9,"loc_core":2234,"commit_count_total":241,"memory_error_rate":0,"unsupported_claim_rate":0,"mean_precision_at_k":1,"mean_recall_at_k":1},"status":"keep","description":"validate candidate status filters","timestamp":1778227105940,"segment":26,"confidence":3.5454545454545454,"asi":{"hypothesis":"Candidate listing should reject unknown status filters instead of silently returning an empty list that hides caller mistakes","red_evidence":"list_candidate_claims_rejects_unknown_status_filter failed because Store::list_candidate_claims(None, Some(\"UNKNOWN\")) returned Ok([])","green_evidence":"./autoresearch.sh passed with tests_green=232, tests_total=232, memory_error_rate=0, and autoresearch.checks.sh green","anti_overfit_note":"The change is a generic staged-memory API input-validation invariant; it does not depend on benchmark data, BEAM labels, rubrics, reference answers, or fixture-specific scoring shortcuts"}}
{"run":219,"commit":"5b88d7d","metric":233,"metrics":{"tests_total":233,"milestone_index":9,"loc_core":2235,"commit_count_total":242,"memory_error_rate":0,"unsupported_claim_rate":0,"mean_precision_at_k":1,"mean_recall_at_k":1},"status":"keep","description":"validate event session filters","timestamp":1778227146109,"segment":26,"confidence":3.6363636363636362,"asi":{"hypothesis":"Core event listing should reject blank session filters instead of silently returning an empty list that hides caller mistakes","red_evidence":"list_events_for_session_rejects_empty_session_id failed because Store::list_events_for_session(\" \") returned Ok([])","green_evidence":"./autoresearch.sh passed with tests_green=233, tests_total=233, memory_error_rate=0, and autoresearch.checks.sh green","anti_overfit_note":"The change is a generic episodic-memory API input-validation invariant; it does not depend on benchmark data, BEAM labels, rubrics, reference answers, or fixture-specific scoring shortcuts"}}
{"run":220,"commit":"73ec3f5","metric":234,"metrics":{"tests_total":234,"milestone_index":9,"loc_core":2236,"commit_count_total":243,"memory_error_rate":0,"unsupported_claim_rate":0,"mean_precision_at_k":1,"mean_recall_at_k":1},"status":"keep","description":"validate extraction session ids","timestamp":1778227190785,"segment":26,"confidence":3.727272727272727,"asi":{"hypothesis":"Core extraction-trigger checks should reject blank session ids before querying episodic events, matching event-write and event-listing validation","red_evidence":"should_extract_memories_rejects_empty_session_id failed because Store::should_extract_memories(\" \", 1) returned Ok(false)","green_evidence":"./autoresearch.sh passed with tests_green=234, tests_total=234, memory_error_rate=0, and autoresearch.checks.sh green","anti_overfit_note":"The change is a generic episodic extraction input-validation invariant; it does not depend on benchmark data, BEAM labels, rubrics, reference answers, or fixture-specific scoring shortcuts"}}
{"run":221,"commit":"704fecc","metric":235,"metrics":{"tests_total":235,"milestone_index":9,"loc_core":2239,"commit_count_total":244,"memory_error_rate":0,"unsupported_claim_rate":0,"mean_precision_at_k":1,"mean_recall_at_k":1},"status":"keep","description":"validate candidate session filters","timestamp":1778227230875,"segment":26,"confidence":3.652173913043478,"asi":{"hypothesis":"Candidate listing should reject blank session filters instead of silently returning an empty list that hides caller mistakes","red_evidence":"list_candidate_claims_rejects_empty_session_filter failed because Store::list_candidate_claims(Some(\" \"), None) returned Ok([])","green_evidence":"./autoresearch.sh passed with tests_green=235, tests_total=235, memory_error_rate=0, and autoresearch.checks.sh green","anti_overfit_note":"The change is a generic staged-memory API input-validation invariant; it does not depend on benchmark data, BEAM labels, rubrics, reference answers, or fixture-specific scoring shortcuts"}}
{"run":222,"commit":"768336d","metric":236,"metrics":{"tests_total":236,"milestone_index":9,"loc_core":2250,"commit_count_total":245,"memory_error_rate":0,"unsupported_claim_rate":0,"mean_precision_at_k":1,"mean_recall_at_k":1},"status":"keep","description":"validate contradiction reasons","timestamp":1778227272965,"segment":26,"confidence":3.5833333333333335,"asi":{"hypothesis":"Contradiction records should require a non-empty reason so audit history explains why a claim was contradicted","red_evidence":"contradict_rejects_empty_reason failed because Store::contradict accepted a whitespace-only reason and persisted a ContradictionRecord","green_evidence":"./autoresearch.sh passed with tests_green=236, tests_total=236, memory_error_rate=0, and autoresearch.checks.sh green","anti_overfit_note":"The change is a generic contradiction-audit integrity invariant; it does not depend on benchmark data, BEAM labels, rubrics, reference answers, or fixture-specific scoring shortcuts"}}
{"run":223,"commit":"69a0d30","metric":237,"metrics":{"tests_total":237,"milestone_index":9,"loc_core":2259,"commit_count_total":246,"memory_error_rate":0,"unsupported_claim_rate":0,"mean_precision_at_k":1,"mean_recall_at_k":1},"status":"keep","description":"require existing claim for contradiction listing","timestamp":1778227340611,"segment":26,"confidence":3.6666666666666665,"asi":{"hypothesis":"Contradiction listing should fail honestly for missing claim ids instead of returning an empty list indistinguishable from no contradictions","red_evidence":"list_contradictions_requires_existing_claim failed because Store::list_contradictions(42) returned Ok([]) for a missing claim","green_evidence":"./autoresearch.sh passed with tests_green=237, tests_total=237, memory_error_rate=0, and autoresearch.checks.sh green","anti_overfit_note":"The change is a generic contradiction API integrity check; it does not depend on benchmark data, BEAM labels, rubrics, reference answers, or fixture-specific scoring shortcuts"}}
{"run":224,"commit":"0fdf9ef","metric":238,"metrics":{"tests_total":238,"milestone_index":9,"loc_core":2264,"commit_count_total":247,"memory_error_rate":0,"unsupported_claim_rate":0,"mean_precision_at_k":1,"mean_recall_at_k":1},"status":"keep","description":"validate graph expansion entities","timestamp":1778227415780,"segment":26,"confidence":3.75,"asi":{"hypothesis":"Core graph expansion should reject blank entity roots instead of returning an empty graph indistinguishable from a real isolated entity","red_evidence":"expand_rejects_empty_entity failed because Store::expand(\" \", 1, None) returned an empty GraphExpansion","green_evidence":"./autoresearch.sh passed with tests_green=238, tests_total=238, memory_error_rate=0, and autoresearch.checks.sh green","anti_overfit_note":"The change is a generic graph traversal input-validation invariant; it does not depend on benchmark data, BEAM labels, rubrics, reference answers, or fixture-specific scoring shortcuts"}}
{"run":225,"commit":"49addac","metric":239,"metrics":{"tests_total":239,"milestone_index":9,"loc_core":2263,"commit_count_total":248,"memory_error_rate":0,"unsupported_claim_rate":0,"mean_precision_at_k":1,"mean_recall_at_k":1},"status":"keep","description":"validate graph expansion hop counts","timestamp":1778227453206,"segment":26,"confidence":3.68,"asi":{"hypothesis":"Core graph expansion should reject zero hop counts, matching the public expand tool's validation and avoiding silent empty graph responses for invalid traversal requests","red_evidence":"expand_rejects_zero_hops failed because Store::expand(\"PaymentGateway\", 0, None) returned an empty GraphExpansion","green_evidence":"./autoresearch.sh passed with tests_green=239, tests_total=239, memory_error_rate=0, and autoresearch.checks.sh green","anti_overfit_note":"The change is a generic graph traversal input-validation invariant; it does not depend on benchmark data, BEAM labels, rubrics, reference answers, or fixture-specific scoring shortcuts"}}
{"run":226,"commit":"0e980e4","metric":240,"metrics":{"tests_total":240,"milestone_index":9,"loc_core":2271,"commit_count_total":249,"memory_error_rate":0,"unsupported_claim_rate":0,"mean_precision_at_k":1,"mean_recall_at_k":1},"status":"keep","description":"validate graph predicate filters","timestamp":1778227492719,"segment":26,"confidence":3.6153846153846154,"asi":{"hypothesis":"Graph expansion should reject an explicitly empty predicate filter because it is an invalid traversal constraint, not a meaningful request for all predicates","red_evidence":"expand_rejects_empty_predicate_filter failed because Store::expand(\"PaymentGateway\", 1, Some(&[])) returned a graph with only the root node","green_evidence":"./autoresearch.sh passed with tests_green=240, tests_total=240, memory_error_rate=0, and autoresearch.checks.sh green","anti_overfit_note":"The change is a generic graph traversal input-validation invariant; it does not depend on benchmark data, BEAM labels, rubrics, reference answers, or fixture-specific scoring shortcuts"}}
{"run":227,"commit":"0d83ca9","metric":241,"metrics":{"tests_total":241,"milestone_index":9,"loc_core":2271,"commit_count_total":250,"memory_error_rate":0,"unsupported_claim_rate":0,"mean_precision_at_k":1,"mean_recall_at_k":1},"status":"keep","description":"validate graph predicate filter items","timestamp":1778227524054,"segment":26,"confidence":3.6923076923076925,"asi":{"hypothesis":"Graph expansion predicate filters should reject blank predicate entries, not treat them as filters that silently match nothing","red_evidence":"expand_rejects_blank_predicate_filter_item failed because Store::expand(\"PaymentGateway\", 1, Some(&[\" \"])) returned a root-only graph","green_evidence":"./autoresearch.sh passed with tests_green=241, tests_total=241, memory_error_rate=0, and autoresearch.checks.sh green","anti_overfit_note":"The change is a generic graph traversal input-validation invariant; it does not depend on benchmark data, BEAM labels, rubrics, reference answers, or fixture-specific scoring shortcuts"}}
