{"run":127,"commit":"6178d98","metric":0.1,"metrics":{"tests_green":145,"tests_total":145,"milestone_index":9,"loc_core":1697,"commit_count_total":157,"unsupported_claim_rate":0.1,"mean_precision_at_k":0.9444444444444444,"mean_recall_at_k":1},"status":"keep","description":"preserve multi-answer single-token recall instead of hard-capping","timestamp":1778183070089,"segment":4,"confidence":null,"asi":{"hypothesis":"removing the single-token hard cap should improve balanced memory_error_rate because false negatives on legitimate multi-answer single-token queries are worse than modest unsupported noise","red_evidence":"recall_text_preserves_multi_answer_single_token_matches failed under the cap, returning only one Rust claim instead of three","green_evidence":"memory_error_rate improved from 0.16666666666666663 to 0.1; mean_recall_at_k recovered to 1.0 while unsupported_claim_rate rose to 0.1","anti_overfit_note":"updated the earlier cap test to deterministic ranking rather than deletion; the broader workload now includes both ambiguous single-answer and multi-answer single-token cases"}}
{"type":"config","name":"Optimize Aver aggregate memory error on non-contradictory fixtures","metricName":"memory_error_rate","metricUnit":"","bestDirection":"lower"}
{"run":128,"commit":"b69b936","metric":0,"metrics":{"tests_green":146,"tests_total":146,"milestone_index":9,"loc_core":1697,"commit_count_total":158,"unsupported_claim_rate":0,"mean_precision_at_k":1,"mean_recall_at_k":1},"status":"keep","description":"remove contradictory single-token fixture labeling","timestamp":1778183131147,"segment":5,"confidence":null,"asi":{"hypothesis":"the prior ambiguous_single_token fixture was under-specified because the query 'Rust' could not distinguish one relevant claim from multiple exact Rust claims; scoping it to 'project Rust' makes the workload non-contradictory","red_evidence":"ambiguous_single_answer_fixture_scopes_rust_query failed while the fixture still used query 'Rust' with only one relevant Rust claim","green_evidence":"aggregate memory_error_rate is 0.0 with unsupported_claim_rate=0 and mean_recall_at_k=1.0 on the non-contradictory workload","anti_overfit_note":"this changes the benchmark to remove an impossible intent label rather than hard-coding retrieval for fixture answers"}}
{"type":"config","name":"Optimize Aver aggregate memory error with natural query noise","metricName":"memory_error_rate","metricUnit":"","bestDirection":"lower"}
{"run":129,"commit":"f1a98df","metric":0,"metrics":{"tests_green":147,"tests_total":147,"milestone_index":9,"loc_core":1706,"commit_count_total":159,"unsupported_claim_rate":0,"mean_precision_at_k":1,"mean_recall_at_k":1},"status":"keep","description":"add natural query fixture with plural token normalization","timestamp":1778183201974,"segment":6,"confidence":null,"asi":{"hypothesis":"natural user queries often contain plural entity words; normalizing simple plural suffixes should improve scoped retrieval without LLMs or fixture-specific matching","red_evidence":"recall_text_singularizes_plural_query_tokens failed because 'projects using Rust' returned both project-language and user-likes Rust before normalization","green_evidence":"natural_query_noise joins the aggregate with memory_error_rate=0, unsupported_claim_rate=0, and recall=1","anti_overfit_note":"the rule is a generic conservative token normalizer for ASCII plural suffixes, not a special case for Rust or project claims"}}
{"type":"config","name":"Optimize Aver aggregate memory error with identifier tokenization","metricName":"memory_error_rate","metricUnit":"","bestDirection":"lower"}
{"run":130,"commit":"dfc569d","metric":0,"metrics":{"tests_green":148,"tests_total":148,"milestone_index":9,"loc_core":1723,"commit_count_total":160,"unsupported_claim_rate":0,"mean_precision_at_k":1,"mean_recall_at_k":1},"status":"keep","description":"add camel-case identifier recall fixture","timestamp":1778183309057,"segment":7,"confidence":null,"asi":{"hypothesis":"agent memory often stores code/eval identifiers in CamelCase, so recall should split identifier words and tighten high-confidence thresholds to avoid broad topic distractors","red_evidence":"recall_text_splits_camel_case_claim_tokens failed because spaced query 'memory agent bench benchmark' ranked the broad memory_recall topic above MemoryAgentBench","green_evidence":"camel_case_memory_terms joins aggregate with memory_error_rate=0 and all existing fixtures stay green","anti_overfit_note":"camel-case token splitting and max-score thresholding are generic identifier-recall rules, not fixture-specific answer matching"}}
{"type":"config","name":"Optimize Aver aggregate memory error with abstention semantics","metricName":"memory_error_rate","metricUnit":"","bestDirection":"lower"}
{"run":131,"commit":"dfc569d","metric":0,"metrics":{"tests_green":149,"tests_total":149,"milestone_index":9,"loc_core":1723,"commit_count_total":161,"unsupported_claim_rate":0,"mean_precision_at_k":1,"mean_recall_at_k":1},"status":"checks_failed","description":"abstention semantics failed formatting check","timestamp":1778183383943,"segment":8,"confidence":null,"asi":{"hypothesis":"zero-relevant queries with no retrieved claims should score as correct abstention instead of false recall failure","rollback_reason":"cargo fmt --check required multiline formatting in aver-eval recall/precision abstention branches","next_action_hint":"run cargo fmt and reapply abstention fixture plus scoring semantics","benchmark_metric":"memory_error_rate=0 with abstention fixture before formatting failure"}}
{"run":132,"commit":"7a8a95b","metric":0,"metrics":{"tests_green":149,"tests_total":149,"milestone_index":9,"loc_core":1723,"commit_count_total":161,"unsupported_claim_rate":0,"mean_precision_at_k":1,"mean_recall_at_k":1},"status":"keep","description":"score empty no-relevant retrieval as correct abstention","timestamp":1778183430031,"segment":8,"confidence":null,"asi":{"hypothesis":"zero-relevant queries with no retrieved claims should be scored as correct abstention so the benchmark can test no-answer behavior without penalizing recall","red_evidence":"no_relevant_empty_retrieval_scores_perfect_abstention failed because empty no-relevant queries scored recall=0 and precision=0","green_evidence":"abstention fixture joins aggregate with memory_error_rate=0 and all checks pass","anti_overfit_note":"this changes evaluation semantics for a standard abstention case rather than altering retrieval behavior for specific fixture answers"}}
{"type":"config","name":"Optimize Aver aggregate memory error with role predicate morphology","metricName":"memory_error_rate","metricUnit":"","bestDirection":"lower"}
{"run":133,"commit":"7a8a95b","metric":0,"metrics":{"tests_green":150,"tests_total":150,"milestone_index":9,"loc_core":1730,"commit_count_total":162,"unsupported_claim_rate":0,"mean_precision_at_k":1,"mean_recall_at_k":1},"status":"checks_failed","description":"role predicate morphology failed clippy duplicate branch","timestamp":1778183559502,"segment":9,"confidence":null,"asi":{"hypothesis":"normalize role predicate forms such as attendee/attends and raise threshold for medium-confidence matches to suppress broad same-subject facts","rollback_reason":"clippy rejected identical max_score>=4 and max_score>=3 threshold branches","next_action_hint":"combine the threshold branches into one max_score>=3 case, rerun checks","benchmark_metric":"memory_error_rate=0 before clippy failure"}}
{"run":134,"commit":"6c84f4a","metric":0,"metrics":{"tests_green":150,"tests_total":150,"milestone_index":9,"loc_core":1728,"commit_count_total":162,"unsupported_claim_rate":0,"mean_precision_at_k":1,"mean_recall_at_k":1},"status":"keep","description":"match role predicates from natural verb queries","timestamp":1778183627611,"segment":9,"confidence":null,"asi":{"hypothesis":"natural queries often use verbs while memory predicates use role nouns, so normalizing -ee role suffixes and tightening medium score thresholds should suppress broad same-subject distractors","red_evidence":"recall_text_matches_attendee_role_from_attends_query failed because 'who attends meetings' returned both meeting attendee and meeting topic","green_evidence":"predicate_role_morphology joins aggregate with memory_error_rate=0 and all checks pass","anti_overfit_note":"the threshold change is score-based and the suffix rule is a small deterministic morphological normalizer; no fixture answer hard-coding"}}
{"type":"config","name":"Optimize Aver aggregate memory error with acronym expansion","metricName":"memory_error_rate","metricUnit":"","bestDirection":"lower"}
{"run":135,"commit":"0b4df5c","metric":0,"metrics":{"tests_green":151,"tests_total":151,"milestone_index":9,"loc_core":1742,"commit_count_total":163,"unsupported_claim_rate":0,"mean_precision_at_k":1,"mean_recall_at_k":1},"status":"keep","description":"add acronym expansion recall fixture","timestamp":1778183738026,"segment":10,"confidence":null,"asi":{"hypothesis":"expanded natural terms such as 'model context protocol' should recall acronym memories like MCP by adding a generic acronym query token for 3+ token queries","red_evidence":"recall_text_matches_acronym_claim_from_expanded_query failed because the expanded query matched only broad protocol subject facts and did not specifically match MCP","green_evidence":"acronym_expansion joins aggregate with memory_error_rate=0, unsupported_claim_rate=0, precision=1, recall=1","anti_overfit_note":"acronym token generation is generic across multi-word queries; no MCP-specific matching or fixture answer hard-coding"}}
{"type":"config","name":"Optimize Aver aggregate memory error with CamelCase acronym queries","metricName":"memory_error_rate","metricUnit":"","bestDirection":"lower"}
{"run":136,"commit":"99f7372","metric":0,"metrics":{"tests_green":152,"tests_total":152,"milestone_index":9,"loc_core":1753,"commit_count_total":164,"unsupported_claim_rate":0,"mean_precision_at_k":1,"mean_recall_at_k":1},"status":"keep","description":"match CamelCase identifiers from acronym queries","timestamp":1778183810681,"segment":11,"confidence":null,"asi":{"hypothesis":"acronym queries such as 'MAB benchmark' should recall CamelCase identifiers by preserving all-uppercase query tokens and adding acronym tokens for CamelCase claim parts","red_evidence":"recall_text_matches_camel_case_identifier_from_acronym_query failed because MAB did not match MemoryAgentBench and broad benchmark topic was returned","green_evidence":"camel_case_acronym_query joins aggregate with memory_error_rate=0 and checks pass","anti_overfit_note":"the implementation is generic identifier tokenization: all-uppercase acronyms remain whole and CamelCase parts emit their initialism"}}
{"type":"config","name":"Optimize Aver aggregate memory error with versioned acronym identifiers","metricName":"memory_error_rate","metricUnit":"","bestDirection":"lower"}
{"run":137,"commit":"99f7372","metric":0,"metrics":{"tests_green":153,"tests_total":153,"milestone_index":9,"loc_core":1763,"commit_count_total":165,"unsupported_claim_rate":0,"mean_precision_at_k":1,"mean_recall_at_k":1},"status":"checks_failed","description":"versioned acronym identifiers failed clippy collapsible-if","timestamp":1778183906164,"segment":12,"confidence":null,"asi":{"hypothesis":"versioned acronym identifiers like MCP2 should be tokenized into acronym plus numeric suffix so query 'MCP 2' can distinguish MCP1 from MCP2","rollback_reason":"clippy rejected nested digit-split if in camel_case_parts as collapsible_if","next_action_hint":"reapply versioned acronym fixture and collapse nested if with let-chain","benchmark_metric":"memory_error_rate=0 before clippy failure"}}
{"run":138,"commit":"2d6ce69","metric":0,"metrics":{"tests_green":153,"tests_total":153,"milestone_index":9,"loc_core":1763,"commit_count_total":165,"unsupported_claim_rate":0,"mean_precision_at_k":1,"mean_recall_at_k":1},"status":"keep","description":"distinguish versioned acronym identifiers","timestamp":1778183953595,"segment":12,"confidence":null,"asi":{"hypothesis":"versioned acronym identifiers like MCP2 should tokenize into full token, acronym prefix, and numeric suffix so query 'MCP 2' distinguishes MCP2 from MCP1","red_evidence":"recall_text_matches_versioned_acronym_identifier failed because MCP1 and MCP2 both matched the shared MCP prefix","green_evidence":"versioned_acronym_identifier joins aggregate with memory_error_rate=0 and checks pass","anti_overfit_note":"the digit-suffix split applies to any all-uppercase/digit identifier, not MCP-specific fixture matching"}}
{"type":"config","name":"Optimize Aver aggregate memory error with versioned CamelCase identifiers","metricName":"memory_error_rate","metricUnit":"","bestDirection":"lower"}
{"run":139,"commit":"59fdefc","metric":0,"metrics":{"tests_green":154,"tests_total":154,"milestone_index":9,"loc_core":1772,"commit_count_total":166,"unsupported_claim_rate":0,"mean_precision_at_k":1,"mean_recall_at_k":1},"status":"keep","description":"distinguish versioned CamelCase identifiers","timestamp":1778184024950,"segment":13,"confidence":null,"asi":{"hypothesis":"CamelCase identifier parts may carry numeric suffixes, so tokenizing part-level digit suffixes should distinguish MemoryAgent2 from MemoryAgent1 for natural query 'memory agent 2'","red_evidence":"recall_text_matches_versioned_camel_case_identifier failed because MemoryAgent1 and MemoryAgent2 tied on shared memory/agent tokens","green_evidence":"versioned_camel_case_identifier joins aggregate with memory_error_rate=0 and checks pass","anti_overfit_note":"digit suffix splitting applies to any CamelCase part, not a MemoryAgent-specific rule"}}
{"type":"config","name":"Optimize Aver aggregate memory error with mixed-case numeric identifiers","metricName":"memory_error_rate","metricUnit":"","bestDirection":"lower"}
{"run":140,"commit":"81d76fe","metric":0,"metrics":{"tests_green":155,"tests_total":155,"milestone_index":9,"loc_core":1772,"commit_count_total":167,"unsupported_claim_rate":0,"mean_precision_at_k":1,"mean_recall_at_k":1},"status":"keep","description":"broaden aggregate with mixed-case numeric identifier fixture","timestamp":1778184115045,"segment":14,"confidence":null,"asi":{"hypothesis":"mixed-case identifiers with numeric suffixes such as OAuth2 should be covered by the aggregate benchmark to guard against regressions in natural spaced queries like 'OAuth 2 server'","red_evidence":"new test was expected to expose a gap, but existing scoring already ranked OAuth2 above generic version 2 because numeric and server tokens supplied enough signal","green_evidence":"mixed_case_numeric_identifier joins aggregate with memory_error_rate=0 and checks pass","anti_overfit_note":"this is benchmark broadening only; no retrieval implementation was changed because existing generic tokenization already handled the case"}}
{"type":"config","name":"Optimize Aver aggregate memory error with mixed-case prefix identifiers","metricName":"memory_error_rate","metricUnit":"","bestDirection":"lower"}
{"run":141,"commit":"6ae4655","metric":0,"metrics":{"tests_green":156,"tests_total":156,"milestone_index":9,"loc_core":1772,"commit_count_total":168,"unsupported_claim_rate":0,"mean_precision_at_k":1,"mean_recall_at_k":1},"status":"keep","description":"broaden aggregate with mixed-case prefix identifier fixture","timestamp":1778184180761,"segment":15,"confidence":null,"asi":{"hypothesis":"mixed-case numeric identifiers such as OAuth2 should also be covered when users omit the numeric suffix, e.g. 'OAuth server'","red_evidence":"new test was expected to expose a gap, but existing token scoring already ranked OAuth2 above generic server version facts","green_evidence":"mixed_case_prefix_identifier joins aggregate with memory_error_rate=0 and checks pass","anti_overfit_note":"benchmark broadening only; no implementation change was needed because existing generic tokenization handled the case"}}
{"type":"config","name":"Optimize Aver aggregate benchmark observability","metricName":"memory_error_rate","metricUnit":"","bestDirection":"lower"}
{"run":142,"commit":"7ad4e8d","metric":0,"metrics":{"tests_green":156,"tests_total":156,"milestone_index":9,"loc_core":1772,"commit_count_total":169,"unsupported_claim_rate":0,"mean_precision_at_k":1,"mean_recall_at_k":1},"status":"keep","description":"report query count in aggregate benchmark output","timestamp":1778184241318,"segment":16,"confidence":null,"asi":{"hypothesis":"aggregate benchmark output should expose total query_count so future workload broadening is visible and fixture-level weighting effects are easier to audit","red_evidence":"aver_eval_binary_aggregates_multiple_fixtures failed because aggregate JSON had no query_count field","green_evidence":"aggregate benchmark remains memory_error_rate=0 and now reports query_count","anti_overfit_note":"benchmark observability only; no retrieval behavior or fixture answers changed"}}
{"type":"config","name":"Optimize Aver aggregate benchmark query weighting","metricName":"memory_error_rate","metricUnit":"","bestDirection":"lower"}
{"run":143,"commit":"5d05eed","metric":0,"metrics":{"tests_green":157,"tests_total":157,"milestone_index":9,"loc_core":1772,"commit_count_total":170,"unsupported_claim_rate":0,"mean_precision_at_k":1,"mean_recall_at_k":1},"status":"keep","description":"weight aggregate benchmark metrics by query count","timestamp":1778184333729,"segment":17,"confidence":null,"asi":{"hypothesis":"aggregate metrics should be weighted by query count so small fixtures do not dominate larger workloads as benchmark coverage grows","red_evidence":"aggregate_metrics_weights_means_by_query_count failed because no aggregate_metrics API existed and CLI aggregation averaged by fixture count","green_evidence":"aggregate memory_error_rate remains 0 while benchmark output now has a reusable query-weighted aggregate implementation","anti_overfit_note":"benchmark math improvement only; retrieval and fixture answers were unchanged"}}
{"run":144,"commit":"bd28604","metric":0,"metrics":{"tests_green":158,"tests_total":158,"milestone_index":9,"loc_core":1772,"commit_count_total":171,"unsupported_claim_rate":0,"mean_precision_at_k":1,"mean_recall_at_k":1},"status":"keep","description":"weight aggregate unsupported rate by retrieved claims","timestamp":1778184418586,"segment":17,"confidence":null,"asi":{"hypothesis":"aggregate unsupported_claim_rate should be a retrieved-item error rate, weighted by total retrieved claims rather than fixture or query count","red_evidence":"aggregate_metrics_weights_unsupported_rate_by_retrieved_claims failed because aggregate_metrics returned fixture/query-weighted unsupported rate instead of 1/11","green_evidence":"aggregate benchmark remains memory_error_rate=0 while unsupported aggregation now uses total retrieved and non-relevant counts","anti_overfit_note":"benchmark metric correctness only; retrieval behavior and fixture labels unchanged"}}
{"type":"config","name":"Optimize Aver aggregate memory error with -ies plural morphology","metricName":"memory_error_rate","metricUnit":"","bestDirection":"lower"}
{"run":145,"commit":"bd28604","metric":0,"metrics":{"tests_green":111,"tests_total":112,"milestone_index":9,"loc_core":1774,"commit_count_total":172,"unsupported_claim_rate":0,"mean_precision_at_k":0,"mean_recall_at_k":0},"status":"crash","description":"ies plural fixture made aggregate query-count test stale","timestamp":1778184531247,"segment":18,"confidence":null,"asi":{"hypothesis":"normalize -ies plurals such as companies to company to reduce object-only distractor ties in natural queries","rollback_reason":"workspace failed because aver_eval_binary_aggregates_multiple_fixtures expected query_count=21 after adding one query fixture, but aggregate now reports 22","next_action_hint":"reapply -ies fixture and normalizer; update aggregate CLI query_count expectation to 22","failure_detail":"cargo test failed in aver-eval cli test, not retrieval logic"}}
{"run":146,"commit":"fd2edab","metric":0,"metrics":{"tests_green":159,"tests_total":159,"milestone_index":9,"loc_core":1774,"commit_count_total":172,"unsupported_claim_rate":0,"mean_precision_at_k":1,"mean_recall_at_k":1},"status":"keep","description":"normalize -ies plurals in natural recall queries","timestamp":1778184593325,"segment":18,"confidence":null,"asi":{"hypothesis":"natural plural words ending in -ies should normalize to singular -y, so scoped queries like 'companies named Acme' beat object-only distractors","red_evidence":"recall_text_singularizes_ies_plural_query_tokens failed because 'companies' normalized to 'companie' and both company/name/Acme and user/employer/Acme tied on Acme only","green_evidence":"ies_plural_morphology joins aggregate with memory_error_rate=0 and checks pass","anti_overfit_note":"generic suffix normalization only; no company or Acme special-casing"}}
{"type":"config","name":"Optimize Aver aggregate memory error with compact multi-digit versions","metricName":"memory_error_rate","metricUnit":"","bestDirection":"lower"}
