{"run":437,"commit":"e9994ee","metric":531,"metrics":{"tests_green":531,"tests_total":531,"milestone_index":9,"loc_core":5081,"commit_count_total":468,"memory_error_rate":0,"unsupported_claim_rate":0,"mean_precision_at_k":1,"mean_recall_at_k":1,"beam_questions":0,"beam_rubric_checks":0,"beam_abstention_pct":0,"beam_contradiction_resolution_pct":0,"beam_event_ordering_pct":0,"beam_information_extraction_pct":0,"beam_instruction_following_pct":0,"beam_knowledge_update_pct":0,"beam_multi_session_reasoning_pct":0,"beam_preference_following_pct":0,"beam_summarization_pct":0,"beam_temporal_reasoning_pct":0},"status":"keep","description":"Reject unauditable claims with empty source_refs","timestamp":1778420606959,"segment":28,"confidence":4.724137931034483,"asi":{"hypothesis":"Claim source_refs arrays should reject empty arrays at the schema layer because Store::add_claim always records at least one provenance source and claim loading/audit expects support refs.","red_evidence":"`cargo test -q -p aver-core --test migrations claims_source_refs_must_not_be_empty` failed because direct SQL accepted `source_refs = []`.","green_evidence":"Targeted test passed; stale raw-SQL trigger fixtures were updated to use nonempty valid source_refs; `./autoresearch.sh` passed with checks green and metrics tests_green=531 tests_total=531.","implementation_notes":"Added migration `0019_claim_source_refs_nonempty_checks.sql` with insert/update triggers rejecting empty JSON arrays for claims.source_refs; registered it in embedded migrations. Updated confidence, ontology, and vector-index raw-SQL fixtures to isolate their target invariants with valid nonempty source_refs.","anti_overfit_note":"This enforces a general auditability invariant and only adjusts tests to avoid invalid fixture data under the stricter schema."}}
{"run":438,"commit":"12d5fdb","metric":532,"metrics":{"tests_green":532,"tests_total":532,"milestone_index":9,"loc_core":5085,"commit_count_total":469,"memory_error_rate":0,"unsupported_claim_rate":0,"mean_precision_at_k":1,"mean_recall_at_k":1,"beam_questions":0,"beam_rubric_checks":0,"beam_abstention_pct":0,"beam_contradiction_resolution_pct":0,"beam_event_ordering_pct":0,"beam_information_extraction_pct":0,"beam_instruction_following_pct":0,"beam_knowledge_update_pct":0,"beam_multi_session_reasoning_pct":0,"beam_preference_following_pct":0,"beam_summarization_pct":0,"beam_temporal_reasoning_pct":0},"status":"keep","description":"Reject blank claim source_refs elements","timestamp":1778420654546,"segment":28,"confidence":4.758620689655173,"asi":{"hypothesis":"Claim source_refs text elements should reject blank strings just like Store::add_claim rejects blank claim sources, preserving meaningful provenance under direct SQL writes.","red_evidence":"`cargo test -q -p aver-core --test migrations claims_source_refs_text_elements_must_not_be_blank` failed because direct SQL accepted `[\"test\", \"   \"]`.","green_evidence":"Targeted test passed; full migrations test passed; `./autoresearch.sh` passed with checks green and metrics tests_green=532 tests_total=532.","implementation_notes":"Added migration `0020_claim_source_refs_nonblank_checks.sql` with insert/update triggers using json_each to reject text source_refs whose trimmed value is empty; registered it in embedded migrations.","anti_overfit_note":"This mirrors existing write-path validation and enforces a generic provenance-quality invariant, not benchmark-specific behavior."}}
{"run":439,"commit":"a5d4e18","metric":533,"metrics":{"tests_green":533,"tests_total":533,"milestone_index":9,"loc_core":5089,"commit_count_total":470,"memory_error_rate":0,"unsupported_claim_rate":0,"mean_precision_at_k":1,"mean_recall_at_k":1,"beam_questions":0,"beam_rubric_checks":0,"beam_abstention_pct":0,"beam_contradiction_resolution_pct":0,"beam_event_ordering_pct":0,"beam_information_extraction_pct":0,"beam_instruction_following_pct":0,"beam_knowledge_update_pct":0,"beam_multi_session_reasoning_pct":0,"beam_preference_following_pct":0,"beam_summarization_pct":0,"beam_temporal_reasoning_pct":0},"status":"keep","description":"Reject non-positive observation source event ids","timestamp":1778420697979,"segment":28,"confidence":4.793103448275862,"asi":{"hypothesis":"Observation source_event_ids should reject non-positive integers because they cite episodic_events row ids and Store::record_observation verifies real positive event ids.","red_evidence":"`cargo test -q -p aver-core --test migrations observations_source_event_ids_must_be_positive` failed because direct SQL accepted `source_event_ids = [0]`.","green_evidence":"Targeted test passed; full migrations test passed; `./autoresearch.sh` passed with checks green and metrics tests_green=533 tests_total=533.","implementation_notes":"Added migration `0021_observation_source_event_ids_positive_checks.sql` with insert/update triggers using json_each over valid arrays to reject integer elements <= 0; registered it in embedded migrations.","anti_overfit_note":"This enforces a general provenance-reference sanity check for observations and is independent of benchmark fixtures."}}
{"run":440,"commit":"3764950","metric":534,"metrics":{"tests_green":534,"tests_total":534,"milestone_index":9,"loc_core":5093,"commit_count_total":471,"memory_error_rate":0,"unsupported_claim_rate":0,"mean_precision_at_k":1,"mean_recall_at_k":1,"beam_questions":0,"beam_rubric_checks":0,"beam_abstention_pct":0,"beam_contradiction_resolution_pct":0,"beam_event_ordering_pct":0,"beam_information_extraction_pct":0,"beam_instruction_following_pct":0,"beam_knowledge_update_pct":0,"beam_multi_session_reasoning_pct":0,"beam_preference_following_pct":0,"beam_summarization_pct":0,"beam_temporal_reasoning_pct":0},"status":"keep","description":"Reject empty persisted embedding vectors","timestamp":1778420753099,"segment":28,"confidence":4.827586206896552,"asi":{"hypothesis":"Persisted vector_chunks.embedding_json should reject empty arrays because write-path embedding validation already rejects empty vectors and empty embeddings are unusable for cosine/KNN recall.","red_evidence":"`cargo test -q -p aver-core --test migrations vector_chunk_embedding_json_must_not_be_empty_array` failed because direct SQL accepted `embedding_json = []`.","green_evidence":"Targeted test passed; full migrations test passed; `./autoresearch.sh` passed with checks green and metrics tests_green=534 tests_total=534.","implementation_notes":"Added migration `0022_vector_embedding_nonempty_checks.sql` with insert/update triggers rejecting empty JSON arrays when embedding_json is non-null; registered it in embedded migrations.","anti_overfit_note":"This mirrors existing generic vector write validation and is not tied to benchmark expected answers or scoring."}}
{"run":441,"commit":"2c653fd","metric":535,"metrics":{"tests_green":535,"tests_total":535,"milestone_index":9,"loc_core":5097,"commit_count_total":472,"memory_error_rate":0,"unsupported_claim_rate":0,"mean_precision_at_k":1,"mean_recall_at_k":1,"beam_questions":0,"beam_rubric_checks":0,"beam_abstention_pct":0,"beam_contradiction_resolution_pct":0,"beam_event_ordering_pct":0,"beam_information_extraction_pct":0,"beam_instruction_following_pct":0,"beam_knowledge_update_pct":0,"beam_multi_session_reasoning_pct":0,"beam_preference_following_pct":0,"beam_summarization_pct":0,"beam_temporal_reasoning_pct":0},"status":"keep","description":"Reject blank vector chunk text in schema","timestamp":1778420840818,"segment":28,"confidence":4.779661016949152,"asi":{"hypothesis":"Vector chunk text should reject blank strings at the schema layer because Store::add_vector_chunk validates non-blank recallable chunk content and blank chunks are useless for retrieval.","red_evidence":"`cargo test -q -p aver-core --test migrations vector_chunk_text_must_not_be_blank` failed because direct SQL accepted `text = '   '`.","green_evidence":"Targeted test passed; full migrations test passed; `./autoresearch.sh` passed with checks green and metrics tests_green=535 tests_total=535.","implementation_notes":"Added migration `0023_vector_chunk_text_nonblank_checks.sql` with insert/update triggers rejecting vector_chunks rows whose trimmed text is empty; registered it in embedded migrations.","anti_overfit_note":"This mirrors existing generic vector chunk write-path validation and is unrelated to benchmark expected answers or scoring."}}
{"run":442,"commit":"6052dc9","metric":536,"metrics":{"tests_green":536,"tests_total":536,"milestone_index":9,"loc_core":5101,"commit_count_total":473,"memory_error_rate":0,"unsupported_claim_rate":0,"mean_precision_at_k":1,"mean_recall_at_k":1,"beam_questions":0,"beam_rubric_checks":0,"beam_abstention_pct":0,"beam_contradiction_resolution_pct":0,"beam_event_ordering_pct":0,"beam_information_extraction_pct":0,"beam_instruction_following_pct":0,"beam_knowledge_update_pct":0,"beam_multi_session_reasoning_pct":0,"beam_preference_following_pct":0,"beam_summarization_pct":0,"beam_temporal_reasoning_pct":0},"status":"keep","description":"Reject blank vector embedding model names","timestamp":1778420891599,"segment":28,"confidence":4.733333333333333,"asi":{"hypothesis":"Vector chunk embedding_model should reject blank names at the schema layer because write-path validation already requires model identity for replay/debuggability.","red_evidence":"`cargo test -q -p aver-core --test migrations vector_chunk_embedding_model_must_not_be_blank` failed because direct SQL accepted `embedding_model = '   '`.","green_evidence":"Targeted test passed; full migrations test passed; `./autoresearch.sh` passed with checks green and metrics tests_green=536 tests_total=536.","implementation_notes":"Added migration `0024_vector_chunk_embedding_model_nonblank_checks.sql` with insert/update triggers rejecting vector_chunks rows whose trimmed embedding_model is empty; registered it in embedded migrations.","anti_overfit_note":"This mirrors existing generic vector write-path validation and protects metadata replay, not benchmark scoring."}}
{"run":443,"commit":"34a01ae","metric":537,"metrics":{"tests_green":537,"tests_total":537,"milestone_index":9,"loc_core":5105,"commit_count_total":474,"memory_error_rate":0,"unsupported_claim_rate":0,"mean_precision_at_k":1,"mean_recall_at_k":1,"beam_questions":0,"beam_rubric_checks":0,"beam_abstention_pct":0,"beam_contradiction_resolution_pct":0,"beam_event_ordering_pct":0,"beam_information_extraction_pct":0,"beam_instruction_following_pct":0,"beam_knowledge_update_pct":0,"beam_multi_session_reasoning_pct":0,"beam_preference_following_pct":0,"beam_summarization_pct":0,"beam_temporal_reasoning_pct":0},"status":"keep","description":"Reject blank episodic event session ids","timestamp":1778420973992,"segment":28,"confidence":4.688524590163935,"asi":{"hypothesis":"Episodic event session_id should reject blank strings at the schema layer because Store::record_event already validates meaningful session grouping before logging.","red_evidence":"`cargo test -q -p aver-core --test migrations episodic_event_session_id_must_not_be_blank` failed because direct SQL accepted `session_id = '   '`.","green_evidence":"Targeted test passed; full migrations test passed; `./autoresearch.sh` passed with checks green and metrics tests_green=537 tests_total=537.","implementation_notes":"Added migration `0025_episodic_event_session_nonblank_checks.sql` with insert/update triggers rejecting episodic_events rows whose trimmed session_id is empty; registered it in embedded migrations.","anti_overfit_note":"This mirrors existing event write-path validation and protects session-based recall/audit generally, not benchmark scoring."}}
{"run":444,"commit":"094e10c","metric":538,"metrics":{"tests_green":538,"tests_total":538,"milestone_index":9,"loc_core":5109,"commit_count_total":475,"memory_error_rate":0,"unsupported_claim_rate":0,"mean_precision_at_k":1,"mean_recall_at_k":1,"beam_questions":0,"beam_rubric_checks":0,"beam_abstention_pct":0,"beam_contradiction_resolution_pct":0,"beam_event_ordering_pct":0,"beam_information_extraction_pct":0,"beam_instruction_following_pct":0,"beam_knowledge_update_pct":0,"beam_multi_session_reasoning_pct":0,"beam_preference_following_pct":0,"beam_summarization_pct":0,"beam_temporal_reasoning_pct":0},"status":"keep","description":"Reject blank episodic event kinds","timestamp":1778421019578,"segment":28,"confidence":4.645161290322581,"asi":{"hypothesis":"Episodic event kind should reject blank strings at the schema layer because Store::record_event already validates the event classifier before logging.","red_evidence":"`cargo test -q -p aver-core --test migrations episodic_event_kind_must_not_be_blank` failed because direct SQL accepted `kind = '   '`.","green_evidence":"Targeted test passed; full migrations test passed; `./autoresearch.sh` passed with checks green and metrics tests_green=538 tests_total=538.","implementation_notes":"Added migration `0026_episodic_event_kind_nonblank_checks.sql` with insert/update triggers rejecting episodic_events rows whose trimmed kind is empty; registered it in embedded migrations.","anti_overfit_note":"This mirrors existing event write-path validation and protects typed event-stream extraction generally, not benchmark scoring."}}
{"run":445,"commit":"a8c7c70","metric":539,"metrics":{"tests_green":539,"tests_total":539,"milestone_index":9,"loc_core":5113,"commit_count_total":476,"memory_error_rate":0,"unsupported_claim_rate":0,"mean_precision_at_k":1,"mean_recall_at_k":1,"beam_questions":0,"beam_rubric_checks":0,"beam_abstention_pct":0,"beam_contradiction_resolution_pct":0,"beam_event_ordering_pct":0,"beam_information_extraction_pct":0,"beam_instruction_following_pct":0,"beam_knowledge_update_pct":0,"beam_multi_session_reasoning_pct":0,"beam_preference_following_pct":0,"beam_summarization_pct":0,"beam_temporal_reasoning_pct":0},"status":"keep","description":"Reject blank episodic event sources","timestamp":1778421063677,"segment":28,"confidence":4.603174603174603,"asi":{"hypothesis":"Episodic event source should reject blank strings at the schema layer because Store::record_event already validates source labels before audit logging.","red_evidence":"`cargo test -q -p aver-core --test migrations episodic_event_source_must_not_be_blank` failed because direct SQL accepted `source = '   '`.","green_evidence":"Targeted test passed; full migrations test passed; `./autoresearch.sh` passed with checks green and metrics tests_green=539 tests_total=539.","implementation_notes":"Added migration `0027_episodic_event_source_nonblank_checks.sql` with insert/update triggers rejecting episodic_events rows whose trimmed source is empty; registered it in embedded migrations.","anti_overfit_note":"This mirrors existing event write-path validation and protects provenance auditability generally, not benchmark scoring."}}
{"run":446,"commit":"49e2388","metric":540,"metrics":{"tests_green":540,"tests_total":540,"milestone_index":9,"loc_core":5117,"commit_count_total":477,"memory_error_rate":0,"unsupported_claim_rate":0,"mean_precision_at_k":1,"mean_recall_at_k":1,"beam_questions":0,"beam_rubric_checks":0,"beam_abstention_pct":0,"beam_contradiction_resolution_pct":0,"beam_event_ordering_pct":0,"beam_information_extraction_pct":0,"beam_instruction_following_pct":0,"beam_knowledge_update_pct":0,"beam_multi_session_reasoning_pct":0,"beam_preference_following_pct":0,"beam_summarization_pct":0,"beam_temporal_reasoning_pct":0},"status":"keep","description":"Reject blank episodic event agent ids","timestamp":1778421127472,"segment":28,"confidence":4.5625,"asi":{"hypothesis":"Episodic event agent_id should reject blank strings at the schema layer because Store::record_event_from_agent validates actor identity before logging.","red_evidence":"`cargo test -q -p aver-core --test migrations episodic_event_agent_id_must_not_be_blank` failed because direct SQL accepted `agent_id = '   '`.","green_evidence":"Targeted test passed; full migrations test passed; `./autoresearch.sh` passed with checks green and metrics tests_green=540 tests_total=540.","implementation_notes":"Added migration `0028_episodic_event_agent_id_nonblank_checks.sql` with insert/update triggers rejecting episodic_events rows whose trimmed agent_id is empty; registered it in embedded migrations.","anti_overfit_note":"This mirrors existing event write-path validation and protects actor provenance generally, not benchmark scoring."}}
{"run":447,"commit":"3020e7f","metric":541,"metrics":{"tests_green":541,"tests_total":541,"milestone_index":9,"loc_core":5121,"commit_count_total":478,"memory_error_rate":0,"unsupported_claim_rate":0,"mean_precision_at_k":1,"mean_recall_at_k":1,"beam_questions":0,"beam_rubric_checks":0,"beam_abstention_pct":0,"beam_contradiction_resolution_pct":0,"beam_event_ordering_pct":0,"beam_information_extraction_pct":0,"beam_instruction_following_pct":0,"beam_knowledge_update_pct":0,"beam_multi_session_reasoning_pct":0,"beam_preference_following_pct":0,"beam_summarization_pct":0,"beam_temporal_reasoning_pct":0},"status":"keep","description":"Reject invalid episodic event agent id characters","timestamp":1778421189120,"segment":28,"confidence":4.59375,"asi":{"hypothesis":"Episodic event agent_id should enforce the same portable identifier character set as Store::record_event_from_agent, preventing direct SQL rows from breaking per-agent audit-log assumptions.","red_evidence":"`cargo test -q -p aver-core --test migrations episodic_event_agent_id_allows_only_portable_identifier_chars` failed because direct SQL accepted `agent_id = 'bad id!'`.","green_evidence":"Targeted test passed; full migrations test passed after guarding the charset trigger so blank ids keep the clearer nonblank error; `./autoresearch.sh` passed with checks green and metrics tests_green=541 tests_total=541.","implementation_notes":"Added migration `0029_episodic_event_agent_id_charset_checks.sql` with insert/update triggers using SQLite GLOB to reject characters outside ASCII alphanumeric, underscore, and hyphen; registered it in embedded migrations.","anti_overfit_note":"This mirrors existing generic agent-id validation for audit-path safety and is independent of benchmark fixtures or scoring."}}
{"run":448,"commit":"7fc9221","metric":542,"metrics":{"tests_green":542,"tests_total":542,"milestone_index":9,"loc_core":5125,"commit_count_total":479,"memory_error_rate":0,"unsupported_claim_rate":0,"mean_precision_at_k":1,"mean_recall_at_k":1,"beam_questions":0,"beam_rubric_checks":0,"beam_abstention_pct":0,"beam_contradiction_resolution_pct":0,"beam_event_ordering_pct":0,"beam_information_extraction_pct":0,"beam_instruction_following_pct":0,"beam_knowledge_update_pct":0,"beam_multi_session_reasoning_pct":0,"beam_preference_following_pct":0,"beam_summarization_pct":0,"beam_temporal_reasoning_pct":0},"status":"keep","description":"Reject blank claim agent ids","timestamp":1778421250154,"segment":28,"confidence":4.625,"asi":{"hypothesis":"Claim agent_id should reject blank strings at the schema layer because Store::add_claim validates agent identity before persisting durable memory provenance.","red_evidence":"`cargo test -q -p aver-core --test migrations claims_agent_id_must_not_be_blank` failed because direct SQL accepted `agent_id = '   '`.","green_evidence":"Targeted test passed; full migrations test passed; `./autoresearch.sh` passed with checks green and metrics tests_green=542 tests_total=542.","implementation_notes":"Added migration `0030_claim_agent_id_nonblank_checks.sql` with insert/update triggers rejecting claims rows whose trimmed agent_id is empty; registered it in embedded migrations.","anti_overfit_note":"This mirrors existing write-path provenance validation and protects durable claim auditability generally, not benchmark scoring."}}
{"run":449,"commit":"129e179","metric":543,"metrics":{"tests_green":543,"tests_total":543,"milestone_index":9,"loc_core":5129,"commit_count_total":480,"memory_error_rate":0,"unsupported_claim_rate":0,"mean_precision_at_k":1,"mean_recall_at_k":1,"beam_questions":0,"beam_rubric_checks":0,"beam_abstention_pct":0,"beam_contradiction_resolution_pct":0,"beam_event_ordering_pct":0,"beam_information_extraction_pct":0,"beam_instruction_following_pct":0,"beam_knowledge_update_pct":0,"beam_multi_session_reasoning_pct":0,"beam_preference_following_pct":0,"beam_summarization_pct":0,"beam_temporal_reasoning_pct":0},"status":"keep","description":"Reject invalid claim agent id characters","timestamp":1778421318806,"segment":28,"confidence":4.584615384615384,"asi":{"hypothesis":"Claim agent_id should enforce the same portable identifier character set as Store::add_claim, preventing direct SQL rows from breaking provenance and per-agent audit assumptions.","red_evidence":"`cargo test -q -p aver-core --test migrations claims_agent_id_allows_only_portable_identifier_chars` failed because direct SQL accepted `agent_id = 'bad id!'`.","green_evidence":"Targeted test passed; full migrations test passed; `./autoresearch.sh` passed with checks green and metrics tests_green=543 tests_total=543.","implementation_notes":"Added migration `0031_claim_agent_id_charset_checks.sql` with insert/update triggers using SQLite GLOB to reject characters outside ASCII alphanumeric, underscore, and hyphen; registered it in embedded migrations.","anti_overfit_note":"This mirrors existing generic claim write-path validation for audit safety and is independent of benchmark fixtures or scoring."}}
