{"run":526,"commit":"a92b243","metric":797,"metrics":{"tests_green":797,"tests_total":797,"milestone_index":9,"loc_core":6951,"commit_count_total":590,"memory_error_rate":0,"unsupported_claim_rate":0,"mean_precision_at_k":1,"mean_recall_at_k":1,"beam_questions":0,"beam_rubric_checks":0,"beam_abstention_pct":0,"beam_contradiction_resolution_pct":0,"beam_event_ordering_pct":0,"beam_information_extraction_pct":0,"beam_instruction_following_pct":0,"beam_knowledge_update_pct":0,"beam_multi_session_reasoning_pct":0,"beam_preference_following_pct":0,"beam_summarization_pct":0,"beam_temporal_reasoning_pct":0},"status":"keep","description":"Reject non-positive contradiction claim links","timestamp":1779051628132,"segment":28,"confidence":6.5,"asi":{"hypothesis":"Contradiction claim_id links should reject non-positive values before foreign-key handling so contradiction audit records get precise diagnostics.","red_evidence":"`cargo test -q -p aver-core --test migrations contradiction_claim_id_must_be_positive` failed because claim_id=0 produced a generic foreign-key error.","green_evidence":"Targeted contradiction claim-id test passed; full migrations test passed with 100 tests; `./autoresearch.sh` passed with checks green and metrics tests_green=797 tests_total=797.","implementation_notes":"Added migration `0105_contradiction_claim_id_positive_checks.sql` with insert/update triggers rejecting contradictions.claim_id <= 0.","anti_overfit_note":"This is a general contradiction provenance link invariant and does not use benchmark expected outputs or labels."}}
{"run":527,"commit":"4181d39","metric":798,"metrics":{"tests_green":798,"tests_total":798,"milestone_index":9,"loc_core":6951,"commit_count_total":591,"memory_error_rate":0,"unsupported_claim_rate":0,"mean_precision_at_k":1,"mean_recall_at_k":1,"beam_questions":0,"beam_rubric_checks":0,"beam_abstention_pct":0,"beam_contradiction_resolution_pct":0,"beam_event_ordering_pct":0,"beam_information_extraction_pct":0,"beam_instruction_following_pct":0,"beam_knowledge_update_pct":0,"beam_multi_session_reasoning_pct":0,"beam_preference_following_pct":0,"beam_summarization_pct":0,"beam_temporal_reasoning_pct":0},"status":"keep","description":"Reject non-positive contradiction replacements","timestamp":1779051706002,"segment":28,"confidence":6.464,"asi":{"hypothesis":"Contradiction new_claim_id should reject non-positive values when set so replacement-claim links get precise diagnostics before foreign-key handling.","red_evidence":"`cargo test -q -p aver-core --test migrations contradiction_new_claim_id_must_be_positive_when_set` failed because new_claim_id=0 produced a generic foreign-key error.","green_evidence":"Targeted contradiction replacement-id test passed; full migrations test passed with 101 tests; `./autoresearch.sh` passed with checks green and metrics tests_green=798 tests_total=798.","implementation_notes":"Added migration `0106_contradiction_new_claim_id_positive_checks.sql` with insert/update triggers rejecting non-null contradictions.new_claim_id <= 0.","anti_overfit_note":"This is a general contradiction replacement-link invariant and does not use benchmark expected outputs or labels."}}
{"run":528,"commit":"a33bc77","metric":799,"metrics":{"tests_green":799,"tests_total":799,"milestone_index":9,"loc_core":6951,"commit_count_total":592,"memory_error_rate":0,"unsupported_claim_rate":0,"mean_precision_at_k":1,"mean_recall_at_k":1,"beam_questions":0,"beam_rubric_checks":0,"beam_abstention_pct":0,"beam_contradiction_resolution_pct":0,"beam_event_ordering_pct":0,"beam_information_extraction_pct":0,"beam_instruction_following_pct":0,"beam_knowledge_update_pct":0,"beam_multi_session_reasoning_pct":0,"beam_preference_following_pct":0,"beam_summarization_pct":0,"beam_temporal_reasoning_pct":0},"status":"keep","description":"Reject non-positive entity type parents","timestamp":1779051835886,"segment":28,"confidence":6.428571428571429,"asi":{"hypothesis":"Entity type parent_id should reject non-positive values when set so ontology hierarchy links get precise diagnostics before foreign-key handling.","red_evidence":"`cargo test -q -p aver-core --test migrations entity_type_parent_must_be_positive_when_set` failed because parent_id=0 produced a generic foreign-key error.","green_evidence":"Targeted entity type parent-id test passed; full migrations test passed with 102 tests; `./autoresearch.sh` passed with checks green and metrics tests_green=799 tests_total=799.","implementation_notes":"Added migration `0107_entity_type_parent_id_positive_checks.sql` with insert/update triggers rejecting non-null entity_types.parent_id <= 0.","anti_overfit_note":"This is a general ontology hierarchy link invariant and does not use benchmark expected outputs or labels."}}
{"run":529,"commit":"b8aca72","metric":800,"metrics":{"tests_green":800,"tests_total":800,"milestone_index":9,"loc_core":6951,"commit_count_total":593,"memory_error_rate":0,"unsupported_claim_rate":0,"mean_precision_at_k":1,"mean_recall_at_k":1,"beam_questions":0,"beam_rubric_checks":0,"beam_abstention_pct":0,"beam_contradiction_resolution_pct":0,"beam_event_ordering_pct":0,"beam_information_extraction_pct":0,"beam_instruction_following_pct":0,"beam_knowledge_update_pct":0,"beam_multi_session_reasoning_pct":0,"beam_preference_following_pct":0,"beam_summarization_pct":0,"beam_temporal_reasoning_pct":0},"status":"keep","description":"Reject non-positive predicate type parents","timestamp":1779051950031,"segment":28,"confidence":6.444444444444445,"asi":{"hypothesis":"Predicate type parent_id should reject non-positive values when set so predicate ontology hierarchy links get precise diagnostics before foreign-key handling.","red_evidence":"`cargo test -q -p aver-core --test migrations predicate_type_parent_must_be_positive_when_set` failed because parent_id=0 produced a generic foreign-key error.","green_evidence":"Targeted predicate type parent-id test passed; full migrations test passed with 103 tests; `./autoresearch.sh` passed with checks green and metrics tests_green=800 tests_total=800.","implementation_notes":"Added migration `0108_predicate_type_parent_id_positive_checks.sql` with insert/update triggers rejecting non-null predicate_types.parent_id <= 0.","anti_overfit_note":"This is a general predicate ontology hierarchy link invariant and does not use benchmark expected outputs or labels."}}
{"run":530,"commit":"18c083a","metric":801,"metrics":{"tests_green":801,"tests_total":801,"milestone_index":9,"loc_core":6951,"commit_count_total":594,"memory_error_rate":0,"unsupported_claim_rate":0,"mean_precision_at_k":1,"mean_recall_at_k":1,"beam_questions":0,"beam_rubric_checks":0,"beam_abstention_pct":0,"beam_contradiction_resolution_pct":0,"beam_event_ordering_pct":0,"beam_information_extraction_pct":0,"beam_instruction_following_pct":0,"beam_knowledge_update_pct":0,"beam_multi_session_reasoning_pct":0,"beam_preference_following_pct":0,"beam_summarization_pct":0,"beam_temporal_reasoning_pct":0},"status":"keep","description":"Reject non-positive predicate alias links","timestamp":1779052075871,"segment":28,"confidence":6.4603174603174605,"asi":{"hypothesis":"Predicate alias predicate_id links should reject non-positive values so alias ontology links get precise diagnostics before foreign-key handling.","red_evidence":"`cargo test -q -p aver-core --test migrations predicate_alias_predicate_id_must_be_positive` failed because predicate_id=0 produced a generic foreign-key error.","green_evidence":"Targeted predicate alias predicate-id test passed; full migrations test passed with 104 tests; `./autoresearch.sh` passed with checks green and metrics tests_green=801 tests_total=801.","implementation_notes":"Added migration `0109_predicate_alias_predicate_id_positive_checks.sql` with insert/update triggers rejecting predicate_alias.predicate_id <= 0.","anti_overfit_note":"This is a general predicate alias ontology link invariant and does not use benchmark expected outputs or labels."}}
{"run":531,"commit":"c488a66","metric":802,"metrics":{"tests_green":802,"tests_total":802,"milestone_index":9,"loc_core":6951,"commit_count_total":595,"memory_error_rate":0,"unsupported_claim_rate":0,"mean_precision_at_k":1,"mean_recall_at_k":1,"beam_questions":0,"beam_rubric_checks":0,"beam_abstention_pct":0,"beam_contradiction_resolution_pct":0,"beam_event_ordering_pct":0,"beam_information_extraction_pct":0,"beam_instruction_following_pct":0,"beam_knowledge_update_pct":0,"beam_multi_session_reasoning_pct":0,"beam_preference_following_pct":0,"beam_summarization_pct":0,"beam_temporal_reasoning_pct":0},"status":"keep","description":"Reject non-positive entity type links","timestamp":1779052190316,"segment":28,"confidence":6.425196850393701,"asi":{"hypothesis":"Entity type_id links should reject non-positive values so entity ontology assignments get precise diagnostics before foreign-key handling.","red_evidence":"`cargo test -q -p aver-core --test migrations entity_type_id_must_be_positive` failed because type_id=0 produced a generic foreign-key error.","green_evidence":"Targeted entity type-id test passed; full migrations test passed with 105 tests; `./autoresearch.sh` passed with checks green and metrics tests_green=802 tests_total=802.","implementation_notes":"Added migration `0110_entity_type_id_positive_checks.sql` with insert/update triggers rejecting entities.type_id <= 0.","anti_overfit_note":"This is a general entity ontology assignment invariant and does not use benchmark expected outputs or labels."}}
{"run":532,"commit":"ce60b47","metric":803,"metrics":{"tests_green":803,"tests_total":803,"milestone_index":9,"loc_core":6951,"commit_count_total":596,"memory_error_rate":0,"unsupported_claim_rate":0,"mean_precision_at_k":1,"mean_recall_at_k":1,"beam_questions":0,"beam_rubric_checks":0,"beam_abstention_pct":0,"beam_contradiction_resolution_pct":0,"beam_event_ordering_pct":0,"beam_information_extraction_pct":0,"beam_instruction_following_pct":0,"beam_knowledge_update_pct":0,"beam_multi_session_reasoning_pct":0,"beam_preference_following_pct":0,"beam_summarization_pct":0,"beam_temporal_reasoning_pct":0},"status":"keep","description":"Reject non-positive vector chunk claim links","timestamp":1779052288618,"segment":28,"confidence":6.390625,"asi":{"hypothesis":"Vector chunk claim_id links should reject non-positive values so embedding/provenance rows get precise diagnostics before foreign-key handling.","red_evidence":"`cargo test -q -p aver-core --test migrations vector_chunk_claim_id_must_be_positive` failed because claim_id=0 produced a generic foreign-key error.","green_evidence":"Targeted vector chunk claim-id test passed; full migrations test passed with 106 tests; `./autoresearch.sh` passed with checks green and metrics tests_green=803 tests_total=803.","implementation_notes":"Added migration `0111_vector_chunk_claim_id_positive_checks.sql` with insert/update triggers rejecting vector_chunks.claim_id <= 0.","anti_overfit_note":"This is a general vector chunk claim-link invariant and does not use benchmark expected outputs or labels."}}
{"run":533,"commit":"04f29cb","metric":804,"metrics":{"tests_green":804,"tests_total":804,"milestone_index":9,"loc_core":6951,"commit_count_total":597,"memory_error_rate":0,"unsupported_claim_rate":0,"mean_precision_at_k":1,"mean_recall_at_k":1,"beam_questions":0,"beam_rubric_checks":0,"beam_abstention_pct":0,"beam_contradiction_resolution_pct":0,"beam_event_ordering_pct":0,"beam_information_extraction_pct":0,"beam_instruction_following_pct":0,"beam_knowledge_update_pct":0,"beam_multi_session_reasoning_pct":0,"beam_preference_following_pct":0,"beam_summarization_pct":0,"beam_temporal_reasoning_pct":0},"status":"keep","description":"Reject non-positive candidate promotion links","timestamp":1779052420556,"segment":28,"confidence":6.40625,"asi":{"hypothesis":"Candidate claim promoted_claim_id links should reject non-positive values when set so promotion provenance gets precise diagnostics before foreign-key handling.","red_evidence":"`cargo test -q -p aver-core --test migrations candidate_claim_promoted_claim_id_must_be_positive_when_set` failed because promoted_claim_id=0 produced a generic foreign-key error.","green_evidence":"Targeted candidate promotion-id test passed; full migrations test passed with 107 tests; `./autoresearch.sh` passed with checks green and metrics tests_green=804 tests_total=804.","implementation_notes":"Added migration `0112_candidate_claim_promoted_claim_id_positive_checks.sql` with insert/update triggers rejecting non-null candidate_claims.promoted_claim_id <= 0.","anti_overfit_note":"This is a general candidate promotion link invariant and does not use benchmark expected outputs or labels."}}
{"run":534,"commit":"1767448","metric":805,"metrics":{"tests_green":805,"tests_total":805,"milestone_index":9,"loc_core":6951,"commit_count_total":598,"memory_error_rate":0,"unsupported_claim_rate":0,"mean_precision_at_k":1,"mean_recall_at_k":1,"beam_questions":0,"beam_rubric_checks":0,"beam_abstention_pct":0,"beam_contradiction_resolution_pct":0,"beam_event_ordering_pct":0,"beam_information_extraction_pct":0,"beam_instruction_following_pct":0,"beam_knowledge_update_pct":0,"beam_multi_session_reasoning_pct":0,"beam_preference_following_pct":0,"beam_summarization_pct":0,"beam_temporal_reasoning_pct":0},"status":"keep","description":"Reject non-positive entity closure children","timestamp":1779052512717,"segment":28,"confidence":6.421875,"asi":{"hypothesis":"Entity type closure child_id links should reject non-positive values so ontology transitive-closure rows get precise diagnostics before foreign-key handling.","red_evidence":"`cargo test -q -p aver-core --test migrations entity_type_closure_child_id_must_be_positive` failed because child_id=0 produced a generic foreign-key error.","green_evidence":"Targeted entity closure child-id test passed; full migrations test passed with 108 tests; `./autoresearch.sh` passed with checks green and metrics tests_green=805 tests_total=805.","implementation_notes":"Added migration `0113_entity_type_closure_child_id_positive_checks.sql` with insert/update triggers rejecting entity_type_closure.child_id <= 0.","anti_overfit_note":"This is a general ontology closure integrity invariant and does not use benchmark expected outputs or labels."}}
{"run":535,"commit":"100c510","metric":806,"metrics":{"tests_green":806,"tests_total":806,"milestone_index":9,"loc_core":6951,"commit_count_total":599,"memory_error_rate":0,"unsupported_claim_rate":0,"mean_precision_at_k":1,"mean_recall_at_k":1,"beam_questions":0,"beam_rubric_checks":0,"beam_abstention_pct":0,"beam_contradiction_resolution_pct":0,"beam_event_ordering_pct":0,"beam_information_extraction_pct":0,"beam_instruction_following_pct":0,"beam_knowledge_update_pct":0,"beam_multi_session_reasoning_pct":0,"beam_preference_following_pct":0,"beam_summarization_pct":0,"beam_temporal_reasoning_pct":0},"status":"keep","description":"Reject non-positive entity closure ancestors","timestamp":1779052616437,"segment":28,"confidence":6.387596899224806,"asi":{"hypothesis":"Entity type closure ancestor_id links should reject non-positive values so ontology transitive-closure rows get precise diagnostics before foreign-key handling.","red_evidence":"`cargo test -q -p aver-core --test migrations entity_type_closure_ancestor_id_must_be_positive` failed because ancestor_id=0 produced a generic foreign-key error.","green_evidence":"Targeted entity closure ancestor-id test passed; full migrations test passed with 109 tests; `./autoresearch.sh` passed with checks green and metrics tests_green=806 tests_total=806.","implementation_notes":"Added migration `0114_entity_type_closure_ancestor_id_positive_checks.sql` with insert/update triggers rejecting entity_type_closure.ancestor_id <= 0.","anti_overfit_note":"This is a general ontology closure integrity invariant and does not use benchmark expected outputs or labels."}}
{"run":536,"commit":"74552c9","metric":807,"metrics":{"tests_green":807,"tests_total":807,"milestone_index":9,"loc_core":6951,"commit_count_total":600,"memory_error_rate":0,"unsupported_claim_rate":0,"mean_precision_at_k":1,"mean_recall_at_k":1,"beam_questions":0,"beam_rubric_checks":0,"beam_abstention_pct":0,"beam_contradiction_resolution_pct":0,"beam_event_ordering_pct":0,"beam_information_extraction_pct":0,"beam_instruction_following_pct":0,"beam_knowledge_update_pct":0,"beam_multi_session_reasoning_pct":0,"beam_preference_following_pct":0,"beam_summarization_pct":0,"beam_temporal_reasoning_pct":0},"status":"keep","description":"Reject non-positive predicate closure children","timestamp":1779052727528,"segment":28,"confidence":6.3538461538461535,"asi":{"hypothesis":"Predicate closure child_id links should reject non-positive values so predicate ontology transitive-closure rows get precise diagnostics before foreign-key handling.","red_evidence":"`cargo test -q -p aver-core --test migrations predicate_closure_child_id_must_be_positive` failed for the intended reason after using the seeded `uses` predicate type: child_id=0 produced a generic foreign-key error.","green_evidence":"Targeted predicate closure child-id test passed; full migrations test passed with 110 tests; `./autoresearch.sh` passed with checks green and metrics tests_green=807 tests_total=807.","implementation_notes":"Added migration `0115_predicate_closure_child_id_positive_checks.sql` with insert/update triggers rejecting predicate_closure.child_id <= 0.","anti_overfit_note":"This is a general predicate ontology closure integrity invariant and does not use benchmark expected outputs or labels."}}
{"run":537,"commit":"74fbeab","metric":808,"metrics":{"tests_green":808,"tests_total":808,"milestone_index":9,"loc_core":6951,"commit_count_total":601,"memory_error_rate":0,"unsupported_claim_rate":0,"mean_precision_at_k":1,"mean_recall_at_k":1,"beam_questions":0,"beam_rubric_checks":0,"beam_abstention_pct":0,"beam_contradiction_resolution_pct":0,"beam_event_ordering_pct":0,"beam_information_extraction_pct":0,"beam_instruction_following_pct":0,"beam_knowledge_update_pct":0,"beam_multi_session_reasoning_pct":0,"beam_preference_following_pct":0,"beam_summarization_pct":0,"beam_temporal_reasoning_pct":0},"status":"keep","description":"Reject non-positive predicate closure ancestors","timestamp":1779052824413,"segment":28,"confidence":6.369230769230769,"asi":{"hypothesis":"Predicate closure ancestor_id links should reject non-positive values so predicate ontology transitive-closure rows get precise diagnostics before foreign-key handling.","red_evidence":"`cargo test -q -p aver-core --test migrations predicate_closure_ancestor_id_must_be_positive` failed because ancestor_id=0 produced a generic foreign-key error.","green_evidence":"Targeted predicate closure ancestor-id test passed; full migrations test passed with 111 tests; `./autoresearch.sh` passed with checks green and metrics tests_green=808 tests_total=808.","implementation_notes":"Added migration `0116_predicate_closure_ancestor_id_positive_checks.sql` with insert/update triggers rejecting predicate_closure.ancestor_id <= 0.","anti_overfit_note":"This is a general predicate ontology closure integrity invariant and does not use benchmark expected outputs or labels."}}
{"run":538,"commit":"5547e6f","metric":809,"metrics":{"tests_green":809,"tests_total":809,"milestone_index":9,"loc_core":6951,"commit_count_total":602,"memory_error_rate":0,"unsupported_claim_rate":0,"mean_precision_at_k":1,"mean_recall_at_k":1,"beam_questions":0,"beam_rubric_checks":0,"beam_abstention_pct":0,"beam_contradiction_resolution_pct":0,"beam_event_ordering_pct":0,"beam_information_extraction_pct":0,"beam_instruction_following_pct":0,"beam_knowledge_update_pct":0,"beam_multi_session_reasoning_pct":0,"beam_preference_following_pct":0,"beam_summarization_pct":0,"beam_temporal_reasoning_pct":0},"status":"keep","description":"Reject blank predicate alias notes","timestamp":1779052989417,"segment":28,"confidence":6.384615384615385,"asi":{"hypothesis":"Predicate alias notes are optional, but when present they should be nonblank so alias provenance remains meaningful and auditable.","red_evidence":"`cargo test -q -p aver-core --test migrations predicate_alias_note_must_not_be_blank_when_set` failed because direct SQL accepted a whitespace-only note.","green_evidence":"Targeted predicate alias note test passed; full migrations test passed with 112 tests; `./autoresearch.sh` passed with checks green and metrics tests_green=809 tests_total=809.","implementation_notes":"Added migration `0117_predicate_alias_note_nonblank_checks.sql` with insert/update triggers rejecting non-null trimmed-empty predicate_alias.note values.","anti_overfit_note":"This is a general predicate alias auditability invariant and does not use benchmark expected outputs or labels."}}
