{"run":475,"commit":"86e78cf","metric":568,"metrics":{"tests_green":568,"tests_total":568,"milestone_index":9,"loc_core":5229,"commit_count_total":505,"memory_error_rate":0,"unsupported_claim_rate":0,"mean_precision_at_k":1,"mean_recall_at_k":1,"beam_questions":0,"beam_rubric_checks":0,"beam_abstention_pct":0,"beam_contradiction_resolution_pct":0,"beam_event_ordering_pct":0,"beam_information_extraction_pct":0,"beam_instruction_following_pct":0,"beam_knowledge_update_pct":0,"beam_multi_session_reasoning_pct":0,"beam_preference_following_pct":0,"beam_summarization_pct":0,"beam_temporal_reasoning_pct":0},"status":"keep","description":"Reject blank predicate aliases","timestamp":1778423151146,"segment":28,"confidence":3.8666666666666667,"asi":{"hypothesis":"Predicate aliases should reject blank strings at the schema layer because alias rows are accepted by claim ontology enforcement and blank aliases would undermine predicate validation.","red_evidence":"`cargo test -q -p aver-core --test migrations predicate_alias_must_not_be_blank` failed because direct SQL accepted `predicate_alias.alias = '   '`.","green_evidence":"Targeted test passed; full migrations test passed; `./autoresearch.sh` passed with checks green and metrics tests_green=568 tests_total=568.","implementation_notes":"Added migration `0056_predicate_alias_nonblank_checks.sql` with insert/update triggers rejecting predicate_alias rows whose trimmed alias is empty; registered it in embedded migrations.","anti_overfit_note":"This is a general ontology alias consistency invariant and does not use benchmark expected outputs or labels."}}
{"run":476,"commit":"7bc82cf","metric":569,"metrics":{"tests_green":569,"tests_total":569,"milestone_index":9,"loc_core":5233,"commit_count_total":506,"memory_error_rate":0,"unsupported_claim_rate":0,"mean_precision_at_k":1,"mean_recall_at_k":1,"beam_questions":0,"beam_rubric_checks":0,"beam_abstention_pct":0,"beam_contradiction_resolution_pct":0,"beam_event_ordering_pct":0,"beam_information_extraction_pct":0,"beam_instruction_following_pct":0,"beam_knowledge_update_pct":0,"beam_multi_session_reasoning_pct":0,"beam_preference_following_pct":0,"beam_summarization_pct":0,"beam_temporal_reasoning_pct":0},"status":"keep","description":"Reject non-positive predicate alias timestamps","timestamp":1778423236269,"segment":28,"confidence":3.8043478260869565,"asi":{"hypothesis":"Predicate alias created_at values should be positive at the schema layer because aliases are ontology audit records and should not carry sentinel zero timestamps.","red_evidence":"`cargo test -q -p aver-core --test migrations predicate_alias_created_at_must_be_positive` failed because direct SQL accepted `created_at = 0`.","green_evidence":"Targeted test passed; full migrations test passed; `./autoresearch.sh` passed with checks green and metrics tests_green=569 tests_total=569.","implementation_notes":"Added migration `0057_predicate_alias_created_at_positive_checks.sql` with insert/update triggers rejecting predicate_alias rows whose created_at is <= 0; registered it in embedded migrations.","anti_overfit_note":"This is a general ontology alias audit chronology invariant and does not use benchmark expected outputs or labels."}}
{"run":477,"commit":"c2b22c3","metric":570,"metrics":{"tests_green":570,"tests_total":570,"milestone_index":9,"loc_core":5237,"commit_count_total":507,"memory_error_rate":0,"unsupported_claim_rate":0,"mean_precision_at_k":1,"mean_recall_at_k":1,"beam_questions":0,"beam_rubric_checks":0,"beam_abstention_pct":0,"beam_contradiction_resolution_pct":0,"beam_event_ordering_pct":0,"beam_information_extraction_pct":0,"beam_instruction_following_pct":0,"beam_knowledge_update_pct":0,"beam_multi_session_reasoning_pct":0,"beam_preference_following_pct":0,"beam_summarization_pct":0,"beam_temporal_reasoning_pct":0},"status":"keep","description":"Reject blank ontology extension predicates","timestamp":1778423306019,"segment":28,"confidence":3.6666666666666665,"asi":{"hypothesis":"Ontology extension log predicates should reject blank strings at the schema layer because extension audit records must name the vocabulary term being added.","red_evidence":"`cargo test -q -p aver-core --test migrations ontology_extension_predicate_must_not_be_blank` failed because direct SQL accepted `predicate = '   '`.","green_evidence":"Targeted test passed; full migrations test passed; `./autoresearch.sh` passed with checks green and metrics tests_green=570 tests_total=570.","implementation_notes":"Added migration `0058_ontology_extension_predicate_nonblank_checks.sql` with insert/update triggers rejecting ontology_extension_log rows whose trimmed predicate is empty; registered it in embedded migrations.","anti_overfit_note":"This is a general ontology extension auditability invariant and does not use benchmark expected outputs or labels."}}
{"run":478,"commit":"e1b57ac","metric":571,"metrics":{"tests_green":571,"tests_total":571,"milestone_index":9,"loc_core":5241,"commit_count_total":508,"memory_error_rate":0,"unsupported_claim_rate":0,"mean_precision_at_k":1,"mean_recall_at_k":1,"beam_questions":0,"beam_rubric_checks":0,"beam_abstention_pct":0,"beam_contradiction_resolution_pct":0,"beam_event_ordering_pct":0,"beam_information_extraction_pct":0,"beam_instruction_following_pct":0,"beam_knowledge_update_pct":0,"beam_multi_session_reasoning_pct":0,"beam_preference_following_pct":0,"beam_summarization_pct":0,"beam_temporal_reasoning_pct":0},"status":"keep","description":"Reject blank ontology extension parents","timestamp":1778423379197,"segment":28,"confidence":3.54,"asi":{"hypothesis":"Ontology extension log parents should reject blank strings at the schema layer because extension audit records must explain where a user-asserted predicate was seated in the ontology.","red_evidence":"`cargo test -q -p aver-core --test migrations ontology_extension_parent_must_not_be_blank` failed because direct SQL accepted `parent = '   '`.","green_evidence":"Targeted test passed; full migrations test passed; `./autoresearch.sh` passed with checks green and metrics tests_green=571 tests_total=571.","implementation_notes":"Added migration `0059_ontology_extension_parent_nonblank_checks.sql` with insert/update triggers rejecting ontology_extension_log rows whose trimmed parent is empty; registered it in embedded migrations.","anti_overfit_note":"This is a general ontology extension auditability invariant and does not use benchmark expected outputs or labels."}}
{"run":479,"commit":"efca6c4","metric":572,"metrics":{"tests_green":572,"tests_total":572,"milestone_index":9,"loc_core":5245,"commit_count_total":509,"memory_error_rate":0,"unsupported_claim_rate":0,"mean_precision_at_k":1,"mean_recall_at_k":1,"beam_questions":0,"beam_rubric_checks":0,"beam_abstention_pct":0,"beam_contradiction_resolution_pct":0,"beam_event_ordering_pct":0,"beam_information_extraction_pct":0,"beam_instruction_following_pct":0,"beam_knowledge_update_pct":0,"beam_multi_session_reasoning_pct":0,"beam_preference_following_pct":0,"beam_summarization_pct":0,"beam_temporal_reasoning_pct":0},"status":"keep","description":"Reject blank ontology extension agent ids","timestamp":1778423495379,"segment":28,"confidence":3.4901960784313726,"asi":{"hypothesis":"Ontology extension log agent_id should reject blank strings at the schema layer because vocabulary extension audit records must remain attributable to an agent.","red_evidence":"`cargo test -q -p aver-core --test migrations ontology_extension_agent_id_must_not_be_blank` failed because direct SQL accepted `agent_id = '   '`.","green_evidence":"Targeted test passed; full migrations test passed; `./autoresearch.sh` passed with checks green and metrics tests_green=572 tests_total=572.","implementation_notes":"Added migration `0060_ontology_extension_agent_id_nonblank_checks.sql` with insert/update triggers rejecting ontology_extension_log rows whose trimmed agent_id is empty; registered it in embedded migrations.","anti_overfit_note":"This is a general ontology extension provenance invariant and does not use benchmark expected outputs or labels."}}
{"run":480,"commit":"26ddee6","metric":573,"metrics":{"tests_green":573,"tests_total":573,"milestone_index":9,"loc_core":5249,"commit_count_total":510,"memory_error_rate":0,"unsupported_claim_rate":0,"mean_precision_at_k":1,"mean_recall_at_k":1,"beam_questions":0,"beam_rubric_checks":0,"beam_abstention_pct":0,"beam_contradiction_resolution_pct":0,"beam_event_ordering_pct":0,"beam_information_extraction_pct":0,"beam_instruction_following_pct":0,"beam_knowledge_update_pct":0,"beam_multi_session_reasoning_pct":0,"beam_preference_following_pct":0,"beam_summarization_pct":0,"beam_temporal_reasoning_pct":0},"status":"keep","description":"Reject invalid ontology extension agent id characters","timestamp":1778423553606,"segment":28,"confidence":3.4423076923076925,"asi":{"hypothesis":"Ontology extension log agent_id should enforce the same portable identifier character set as Store agent IDs, preserving attributable and machine-parseable ontology audit records.","red_evidence":"`cargo test -q -p aver-core --test migrations ontology_extension_agent_id_allows_only_portable_identifier_chars` failed because direct SQL accepted `agent_id = 'bad id!'`.","green_evidence":"Targeted test passed; full migrations test passed; `./autoresearch.sh` passed with checks green and metrics tests_green=573 tests_total=573.","implementation_notes":"Added migration `0061_ontology_extension_agent_id_charset_checks.sql` with insert/update triggers rejecting ontology_extension_log agent_id values containing characters outside ASCII alphanumeric, underscore, and hyphen; registered it in embedded migrations.","anti_overfit_note":"This is a general ontology extension provenance invariant and does not use benchmark expected outputs or labels."}}
{"run":481,"commit":"26ddee6","metric":197,"metrics":{"tests_green":197,"tests_total":198,"milestone_index":9,"loc_core":5253,"commit_count_total":511,"memory_error_rate":0,"unsupported_claim_rate":0,"mean_precision_at_k":0,"mean_recall_at_k":0,"beam_questions":0,"beam_rubric_checks":0,"beam_abstention_pct":0,"beam_contradiction_resolution_pct":0,"beam_event_ordering_pct":0,"beam_information_extraction_pct":0,"beam_instruction_following_pct":0,"beam_knowledge_update_pct":0,"beam_multi_session_reasoning_pct":0,"beam_preference_following_pct":0,"beam_summarization_pct":0,"beam_temporal_reasoning_pct":0},"status":"crash","description":"Crash while enforcing ontology extension positive timestamps due replay fixture","timestamp":1778423628302,"segment":28,"confidence":3.4423076923076925,"asi":{"hypothesis":"Ontology extension created_at should reject non-positive sentinel timestamps at the schema layer.","rollback_reason":"Full workspace failed in `crates/aver-core/tests/operational_policy.rs` because `replay_walks_rotated_logs_in_numeric_order` replays an ontology extension fixture with `created_at = 0`, so the new positive timestamp trigger rejected replay before the test's intended ordering assertion.","next_action_hint":"Retry the invariant after updating the stale replay fixture in operational_policy.rs to use a positive created_at such as 1 while keeping the new migration test's invalid timestamp at 0.","red_evidence":"Targeted `ontology_extension_created_at_must_be_positive` failed because direct SQL accepted `created_at = 0`; after adding the trigger, `./autoresearch.sh` failed with `ontology_extension_log.created_at must be positive`.","anti_overfit_note":"The failure is fixture interaction between schema invariants, not benchmark-specific behavior."}}
{"run":482,"commit":"e4729a1","metric":574,"metrics":{"tests_green":574,"tests_total":574,"milestone_index":9,"loc_core":5253,"commit_count_total":511,"memory_error_rate":0,"unsupported_claim_rate":0,"mean_precision_at_k":1,"mean_recall_at_k":1,"beam_questions":0,"beam_rubric_checks":0,"beam_abstention_pct":0,"beam_contradiction_resolution_pct":0,"beam_event_ordering_pct":0,"beam_information_extraction_pct":0,"beam_instruction_following_pct":0,"beam_knowledge_update_pct":0,"beam_multi_session_reasoning_pct":0,"beam_preference_following_pct":0,"beam_summarization_pct":0,"beam_temporal_reasoning_pct":0},"status":"keep","description":"Reject non-positive ontology extension timestamps","timestamp":1778423699180,"segment":28,"confidence":3.3962264150943398,"asi":{"hypothesis":"Ontology extension created_at values should be positive at the schema layer because extension audit records should not carry sentinel zero timestamps.","red_evidence":"`cargo test -q -p aver-core --test migrations ontology_extension_created_at_must_be_positive` failed because direct SQL accepted `created_at = 0`. An earlier full-run crash exposed a stale replay fixture using log `ts = 0`.","green_evidence":"Targeted positive timestamp test passed; targeted operational_policy replay fixture passed after updating replay log timestamps; full migrations test passed; `./autoresearch.sh` passed with checks green and metrics tests_green=574 tests_total=574.","implementation_notes":"Added migration `0062_ontology_extension_created_at_positive_checks.sql` with insert/update triggers rejecting ontology_extension_log rows whose created_at is <= 0; registered it in embedded migrations. Updated the rotated-log replay fixture to use positive log timestamps so replay-created ontology extension audit rows satisfy the invariant.","anti_overfit_note":"This is a general ontology extension audit chronology invariant and does not use benchmark expected outputs or labels."}}
{"run":483,"commit":"6faca15","metric":575,"metrics":{"tests_green":575,"tests_total":575,"milestone_index":9,"loc_core":5257,"commit_count_total":512,"memory_error_rate":0,"unsupported_claim_rate":0,"mean_precision_at_k":1,"mean_recall_at_k":1,"beam_questions":0,"beam_rubric_checks":0,"beam_abstention_pct":0,"beam_contradiction_resolution_pct":0,"beam_event_ordering_pct":0,"beam_information_extraction_pct":0,"beam_instruction_following_pct":0,"beam_knowledge_update_pct":0,"beam_multi_session_reasoning_pct":0,"beam_preference_following_pct":0,"beam_summarization_pct":0,"beam_temporal_reasoning_pct":0},"status":"keep","description":"Require existing parents for ontology extensions","timestamp":1778423828176,"segment":28,"confidence":3.3518518518518516,"asi":{"hypothesis":"Ontology extension log parent values should reference existing predicate_types so extension audit rows always identify a real ontology seating point.","red_evidence":"`cargo test -q -p aver-core --test migrations ontology_extension_parent_must_exist` failed because direct SQL accepted `parent = 'missing_parent'`.","green_evidence":"Targeted missing-parent test passed; blank-parent test still produces the clearer nonblank error after trigger guard; full migrations test passed; `./autoresearch.sh` passed with checks green and metrics tests_green=575 tests_total=575.","implementation_notes":"Added migration `0063_ontology_extension_parent_exists_checks.sql` with insert/update triggers rejecting ontology_extension_log rows whose nonblank parent is absent from predicate_types; registered it in embedded migrations.","anti_overfit_note":"This is a general ontology extension consistency invariant and does not use benchmark expected outputs or labels."}}
{"run":484,"commit":"43c8613","metric":576,"metrics":{"tests_green":576,"tests_total":576,"milestone_index":9,"loc_core":5261,"commit_count_total":513,"memory_error_rate":0,"unsupported_claim_rate":0,"mean_precision_at_k":1,"mean_recall_at_k":1,"beam_questions":0,"beam_rubric_checks":0,"beam_abstention_pct":0,"beam_contradiction_resolution_pct":0,"beam_event_ordering_pct":0,"beam_information_extraction_pct":0,"beam_instruction_following_pct":0,"beam_knowledge_update_pct":0,"beam_multi_session_reasoning_pct":0,"beam_preference_following_pct":0,"beam_summarization_pct":0,"beam_temporal_reasoning_pct":0},"status":"keep","description":"Reject self-parented entity types","timestamp":1778423911408,"segment":28,"confidence":3.3703703703703702,"asi":{"hypothesis":"Entity type parent_id should not equal id at the schema layer because self-loop hierarchy edges make ontology closure semantics ambiguous.","red_evidence":"`cargo test -q -p aver-core --test migrations entity_type_parent_must_not_self_reference` failed because direct SQL accepted `id = parent_id = 9999`.","green_evidence":"Targeted test passed; full migrations test passed; `./autoresearch.sh` passed with checks green and metrics tests_green=576 tests_total=576.","implementation_notes":"Added migration `0064_entity_type_parent_distinct_checks.sql` with insert/update triggers rejecting entity_types rows whose non-null parent_id equals id; registered it in embedded migrations.","anti_overfit_note":"This is a general ontology hierarchy consistency invariant and does not use benchmark expected outputs or labels."}}
{"run":485,"commit":"054009f","metric":577,"metrics":{"tests_green":577,"tests_total":577,"milestone_index":9,"loc_core":5265,"commit_count_total":514,"memory_error_rate":0,"unsupported_claim_rate":0,"mean_precision_at_k":1,"mean_recall_at_k":1,"beam_questions":0,"beam_rubric_checks":0,"beam_abstention_pct":0,"beam_contradiction_resolution_pct":0,"beam_event_ordering_pct":0,"beam_information_extraction_pct":0,"beam_instruction_following_pct":0,"beam_knowledge_update_pct":0,"beam_multi_session_reasoning_pct":0,"beam_preference_following_pct":0,"beam_summarization_pct":0,"beam_temporal_reasoning_pct":0},"status":"keep","description":"Reject self-parented predicate types","timestamp":1778424012454,"segment":28,"confidence":3.3577981651376145,"asi":{"hypothesis":"Predicate type parent_id should not equal id at the schema layer because self-loop hierarchy edges make ontology closure and predicate inheritance semantics ambiguous.","red_evidence":"`cargo test -q -p aver-core --test migrations predicate_type_parent_must_not_self_reference` failed because direct SQL accepted `id = parent_id = 9999`.","green_evidence":"Targeted test passed; full migrations test passed; `./autoresearch.sh` passed with checks green and metrics tests_green=577 tests_total=577.","implementation_notes":"Added migration `0065_predicate_type_parent_distinct_checks.sql` with insert/update triggers rejecting predicate_types rows whose non-null parent_id equals id; registered it in embedded migrations.","anti_overfit_note":"This is a general ontology hierarchy consistency invariant and does not use benchmark expected outputs or labels."}}
{"run":486,"commit":"5a17af5","metric":578,"metrics":{"tests_green":578,"tests_total":578,"milestone_index":9,"loc_core":5269,"commit_count_total":515,"memory_error_rate":0,"unsupported_claim_rate":0,"mean_precision_at_k":1,"mean_recall_at_k":1,"beam_questions":0,"beam_rubric_checks":0,"beam_abstention_pct":0,"beam_contradiction_resolution_pct":0,"beam_event_ordering_pct":0,"beam_information_extraction_pct":0,"beam_instruction_following_pct":0,"beam_knowledge_update_pct":0,"beam_multi_session_reasoning_pct":0,"beam_preference_following_pct":0,"beam_summarization_pct":0,"beam_temporal_reasoning_pct":0},"status":"keep","description":"Reject blank projected entity names","timestamp":1778424124457,"segment":28,"confidence":3.3454545454545452,"asi":{"hypothesis":"Projected entity names should reject blank strings at the schema layer because entities are derived from claim subjects/objects and graph classification/expansion requires meaningful identifiers.","red_evidence":"`cargo test -q -p aver-core --test migrations entity_name_must_not_be_blank` failed because direct SQL accepted `entities.name = '   '`.","green_evidence":"Targeted test passed; full migrations test passed; `./autoresearch.sh` passed with checks green and metrics tests_green=578 tests_total=578.","implementation_notes":"Added migration `0066_entity_name_nonblank_checks.sql` with insert/update triggers rejecting entities rows whose trimmed name is empty; registered it in embedded migrations.","anti_overfit_note":"This is a general graph entity consistency invariant and does not use benchmark expected outputs or labels."}}
{"run":487,"commit":"885b0f1","metric":579,"metrics":{"tests_green":579,"tests_total":579,"milestone_index":9,"loc_core":5273,"commit_count_total":516,"memory_error_rate":0,"unsupported_claim_rate":0,"mean_precision_at_k":1,"mean_recall_at_k":1,"beam_questions":0,"beam_rubric_checks":0,"beam_abstention_pct":0,"beam_contradiction_resolution_pct":0,"beam_event_ordering_pct":0,"beam_information_extraction_pct":0,"beam_instruction_following_pct":0,"beam_knowledge_update_pct":0,"beam_multi_session_reasoning_pct":0,"beam_preference_following_pct":0,"beam_summarization_pct":0,"beam_temporal_reasoning_pct":0},"status":"keep","description":"Reject non-positive entity creation timestamps","timestamp":1778424196488,"segment":28,"confidence":3.3636363636363638,"asi":{"hypothesis":"Projected entity created_at values should be positive at the schema layer because Store/replay creates entities with real Unix timestamps and graph audit chronology should not contain sentinel zero values.","red_evidence":"`cargo test -q -p aver-core --test migrations entity_created_at_must_be_positive` failed because direct SQL accepted `created_at = 0`.","green_evidence":"Targeted test passed; full migrations test passed; `./autoresearch.sh` passed with checks green and metrics tests_green=579 tests_total=579.","implementation_notes":"Added migration `0067_entity_created_at_positive_checks.sql` with insert/update triggers rejecting entities rows whose created_at is <= 0; registered it in embedded migrations.","anti_overfit_note":"This is a general graph entity audit chronology invariant and does not use benchmark expected outputs or labels."}}
