{"run":232,"commit":"fc2ed7a","metric":471,"metrics":{"beam_questions":0,"beam_rubric_checks":0,"beam_abstention_pct":0,"beam_contradiction_resolution_pct":0,"beam_event_ordering_pct":0,"beam_information_extraction_pct":0,"beam_instruction_following_pct":0,"beam_knowledge_update_pct":0,"beam_multi_session_reasoning_pct":0,"beam_preference_following_pct":0,"beam_summarization_pct":0,"beam_temporal_reasoning_pct":0,"tests_green":471,"tests_total":471,"milestone_index":9,"loc_core":3910,"commit_count_total":419,"memory_error_rate":0,"unsupported_claim_rate":0,"mean_precision_at_k":1,"mean_recall_at_k":1},"status":"keep","description":"Avoid Ruby scoped mixin false top-level module facts","timestamp":1778357315499,"segment":26,"confidence":31.4,"asi":{"hypothesis":"Ruby mixin extraction should treat scoped constants such as Memory::Recallable as one scoped module reference, not as separate top-level Memory and Recallable module implementations.","red_evidence":"cargo test -q -p aver-extractor extract_ruby_facts_do_not_split_scoped_mixin_references_into_top_level_modules failed because the extractor emitted Class:Store implements Module:Memory from include Memory::Recallable.","green_evidence":"cargo fmt --all passed; targeted Ruby scoped mixin and existing include tests passed; cargo test --workspace -q passed; ./autoresearch.sh passed with tests_green=471 tests_total=471 and checks green.","implementation_notes":"Changed Ruby mixin argument collection to record scope_resolution text as a single name and stop recursion before collecting its child constants, while preserving direct constant include/prepend/extend behavior.","anti_overfit_note":"This is a grammar-backed precision guard for standard Ruby scoped constants and does not depend on benchmark labels, expected answers, or scoring-specific shortcuts."}}
{"run":233,"commit":"7ef361b","metric":472,"metrics":{"beam_questions":0,"beam_rubric_checks":0,"beam_abstention_pct":0,"beam_contradiction_resolution_pct":0,"beam_event_ordering_pct":0,"beam_information_extraction_pct":0,"beam_instruction_following_pct":0,"beam_knowledge_update_pct":0,"beam_multi_session_reasoning_pct":0,"beam_preference_following_pct":0,"beam_summarization_pct":0,"beam_temporal_reasoning_pct":0,"tests_green":472,"tests_total":472,"milestone_index":9,"loc_core":3910,"commit_count_total":420,"memory_error_rate":0,"unsupported_claim_rate":0,"mean_precision_at_k":1,"mean_recall_at_k":1},"status":"keep","description":"Avoid Ruby scoped superclass false top-level class facts","timestamp":1778357369101,"segment":26,"confidence":31.466666666666665,"asi":{"hypothesis":"Ruby class inheritance extraction should treat scoped constants such as Memory::BaseStore as one superclass reference, not as a top-level Memory superclass.","red_evidence":"cargo test -q -p aver-extractor extract_ruby_facts_do_not_split_scoped_superclass_references_into_top_level_classes failed because the extractor emitted Class:Store extends Class:Memory from class Store < Memory::BaseStore.","green_evidence":"cargo fmt --all passed; targeted scoped-superclass and existing Ruby extends tests passed; cargo test --workspace -q passed; ./autoresearch.sh passed with tests_green=472 tests_total=472 and checks green.","implementation_notes":"Changed Ruby superclass extraction to prefer scope_resolution nodes before plain constant descendants, preserving unscoped superclass extraction while avoiding false top-level class facts.","anti_overfit_note":"This is a grammar-backed precision guard for standard Ruby scoped constant inheritance and does not depend on benchmark labels, expected answers, or scoring-specific shortcuts."}}
{"run":234,"commit":"90ed849","metric":473,"metrics":{"beam_questions":0,"beam_rubric_checks":0,"beam_abstention_pct":0,"beam_contradiction_resolution_pct":0,"beam_event_ordering_pct":0,"beam_information_extraction_pct":0,"beam_instruction_following_pct":0,"beam_knowledge_update_pct":0,"beam_multi_session_reasoning_pct":0,"beam_preference_following_pct":0,"beam_summarization_pct":0,"beam_temporal_reasoning_pct":0,"tests_green":473,"tests_total":473,"milestone_index":9,"loc_core":3910,"commit_count_total":421,"memory_error_rate":0,"unsupported_claim_rate":0,"mean_precision_at_k":1,"mean_recall_at_k":1},"status":"keep","description":"Avoid PHP qualified superclass false top-level class facts","timestamp":1778357421503,"segment":26,"confidence":30.516129032258064,"asi":{"hypothesis":"PHP class inheritance extraction should treat qualified names such as Memory\\BaseStore as one superclass reference, not as a top-level Memory superclass.","red_evidence":"cargo test -q -p aver-extractor extract_php_facts_do_not_split_qualified_superclass_references_into_top_level_classes failed because the extractor emitted Class:Store extends Class:Memory from class Store extends Memory\\BaseStore.","green_evidence":"cargo fmt --all passed; targeted PHP qualified-superclass test passed; cargo test --workspace -q passed; ./autoresearch.sh passed with tests_green=473 tests_total=473 and checks green.","implementation_notes":"Changed PHP class extends extraction to prefer qualified_name nodes before plain name descendants, preserving unqualified superclass extraction while avoiding false top-level class facts.","anti_overfit_note":"This is a grammar-backed precision guard for standard PHP qualified names and does not depend on benchmark labels, expected answers, or scoring-specific shortcuts."}}
{"run":235,"commit":"08727bc","metric":474,"metrics":{"beam_questions":0,"beam_rubric_checks":0,"beam_abstention_pct":0,"beam_contradiction_resolution_pct":0,"beam_event_ordering_pct":0,"beam_information_extraction_pct":0,"beam_instruction_following_pct":0,"beam_knowledge_update_pct":0,"beam_multi_session_reasoning_pct":0,"beam_preference_following_pct":0,"beam_summarization_pct":0,"beam_temporal_reasoning_pct":0,"tests_green":474,"tests_total":474,"milestone_index":9,"loc_core":3910,"commit_count_total":422,"memory_error_rate":0,"unsupported_claim_rate":0,"mean_precision_at_k":1,"mean_recall_at_k":1},"status":"keep","description":"Avoid PHP qualified interface false top-level implements facts","timestamp":1778357463264,"segment":26,"confidence":29.625,"asi":{"hypothesis":"PHP class implements extraction should treat qualified names such as Memory\\Recallable as one interface reference, not as a top-level Memory interface implementation.","red_evidence":"cargo test -q -p aver-extractor extract_php_facts_do_not_split_qualified_interface_references_into_top_level_interfaces failed because the extractor emitted Class:Store implements Interface:Memory from class Store implements Memory\\Recallable.","green_evidence":"cargo fmt --all passed; targeted PHP qualified-interface test and existing PHP implements/interface-extends tests passed; cargo test --workspace -q passed; ./autoresearch.sh passed with tests_green=474 tests_total=474 and checks green.","implementation_notes":"Added PHP reference-name collection that records qualified_name as an atomic reference before recursing into child name nodes, and used it for class implements extraction.","anti_overfit_note":"This is a grammar-backed precision guard for standard PHP qualified names and does not depend on benchmark labels, expected answers, or scoring-specific shortcuts."}}
{"run":236,"commit":"3cfcfed","metric":475,"metrics":{"beam_questions":0,"beam_rubric_checks":0,"beam_abstention_pct":0,"beam_contradiction_resolution_pct":0,"beam_event_ordering_pct":0,"beam_information_extraction_pct":0,"beam_instruction_following_pct":0,"beam_knowledge_update_pct":0,"beam_multi_session_reasoning_pct":0,"beam_preference_following_pct":0,"beam_summarization_pct":0,"beam_temporal_reasoning_pct":0,"tests_green":475,"tests_total":475,"milestone_index":9,"loc_core":3910,"commit_count_total":423,"memory_error_rate":0,"unsupported_claim_rate":0,"mean_precision_at_k":1,"mean_recall_at_k":1},"status":"keep","description":"Avoid PHP qualified trait false top-level uses facts","timestamp":1778357498872,"segment":26,"confidence":29.6875,"asi":{"hypothesis":"PHP trait use extraction should treat qualified names such as Memory\\RecordsMemory as one trait reference, not as a top-level Memory trait use.","red_evidence":"cargo test -q -p aver-extractor extract_php_facts_do_not_split_qualified_trait_references_into_top_level_traits failed because the extractor emitted Class:Store uses Trait:Memory from use Memory\\RecordsMemory.","green_evidence":"cargo fmt --all passed; targeted PHP qualified-trait test and existing PHP trait-use test passed; cargo test --workspace -q passed; ./autoresearch.sh passed with tests_green=475 tests_total=475 and checks green.","implementation_notes":"Reused the PHP reference-name collector for class-body trait use declarations so qualified_name is recorded atomically before child name traversal.","anti_overfit_note":"This is a grammar-backed precision guard for standard PHP qualified names in trait use syntax and does not depend on benchmark labels, expected answers, or scoring-specific shortcuts."}}
{"run":237,"commit":"035f0cb","metric":476,"metrics":{"beam_questions":0,"beam_rubric_checks":0,"beam_abstention_pct":0,"beam_contradiction_resolution_pct":0,"beam_event_ordering_pct":0,"beam_information_extraction_pct":0,"beam_instruction_following_pct":0,"beam_knowledge_update_pct":0,"beam_multi_session_reasoning_pct":0,"beam_preference_following_pct":0,"beam_summarization_pct":0,"beam_temporal_reasoning_pct":0,"tests_green":476,"tests_total":476,"milestone_index":9,"loc_core":3910,"commit_count_total":424,"memory_error_rate":0,"unsupported_claim_rate":0,"mean_precision_at_k":1,"mean_recall_at_k":1},"status":"keep","description":"Avoid PHP qualified interface extends false top-level facts","timestamp":1778357543409,"segment":26,"confidence":29.75,"asi":{"hypothesis":"PHP interface inheritance extraction should treat qualified names such as Memory\\BaseRecallable as one base interface reference, not as a top-level Memory interface extension.","red_evidence":"cargo test -q -p aver-extractor extract_php_facts_do_not_split_qualified_interface_extends_into_top_level_interfaces failed because the extractor emitted Interface:Recallable extends Interface:Memory from extends Memory\\BaseRecallable.","green_evidence":"cargo fmt --all passed; targeted PHP qualified-interface-extends test and existing multiple interface extends test passed; cargo test --workspace -q passed; ./autoresearch.sh passed with tests_green=476 tests_total=476 and checks green.","implementation_notes":"Reused the PHP reference-name collector for interface base_clause traversal so qualified_name is recorded atomically before child name nodes.","anti_overfit_note":"This is a grammar-backed precision guard for standard PHP qualified names in interface inheritance syntax and does not depend on benchmark labels, expected answers, or scoring-specific shortcuts."}}
{"run":406,"commit":"cf3f1dd","metric":477,"metrics":{"beam_questions":0,"beam_rubric_checks":0,"beam_abstention_pct":0,"beam_contradiction_resolution_pct":0,"beam_event_ordering_pct":0,"beam_information_extraction_pct":0,"beam_instruction_following_pct":0,"beam_knowledge_update_pct":0,"beam_multi_session_reasoning_pct":0,"beam_preference_following_pct":0,"beam_summarization_pct":0,"beam_temporal_reasoning_pct":0,"tests_green":477,"tests_total":477,"milestone_index":9,"loc_core":3910,"commit_count_total":425,"memory_error_rate":0,"unsupported_claim_rate":0,"mean_precision_at_k":1,"mean_recall_at_k":1},"status":"keep","description":"Avoid false JS extends split on scoped class references","timestamp":1778358500679,"segment":28,"confidence":3.772727272727273,"asi":{"hypothesis":"JavaScript and TypeScript class inheritance should preserve scoped names like Memory.BaseStore as a single base-class name instead of splitting into top-level Memory.","implementation_notes":"Added a single-name collector for heritage clauses and reused it for JS and TS class extends. Added JS regression test asserting `Class:Store` extends `Class:Memory.BaseStore` and does not emit `Class:Memory`.","anti_overfit_note":"Grammar-backed name-composition behavior for scoped JavaScript/TypeScript heritage references, not benchmark-specific scoring behavior.","next_action_hint":"Keep this helper in place and add a companion TypeScript scoped-extends regression if any future parser variant parses dotted inheritance differently."}}
{"run":407,"commit":"6f77a50","metric":478,"metrics":{"beam_questions":0,"beam_rubric_checks":0,"beam_abstention_pct":0,"beam_contradiction_resolution_pct":0,"beam_event_ordering_pct":0,"beam_information_extraction_pct":0,"beam_instruction_following_pct":0,"beam_knowledge_update_pct":0,"beam_multi_session_reasoning_pct":0,"beam_preference_following_pct":0,"beam_summarization_pct":0,"beam_temporal_reasoning_pct":0,"tests_green":478,"tests_total":478,"milestone_index":9,"loc_core":3910,"commit_count_total":426,"memory_error_rate":0,"unsupported_claim_rate":0,"mean_precision_at_k":1,"mean_recall_at_k":1},"status":"keep","description":"Add TypeScript regression for scoped class extends names","timestamp":1778358548479,"segment":28,"confidence":3.8181818181818183,"asi":{"hypothesis":"TypeScript class inheritance should preserve scoped names (`Memory.BaseStore`) as a single base-class reference rather than splitting into top-level `Memory` facts.","red_evidence":"No TypeScript companion test existed for scoped extends; behavior was only validated indirectly by JavaScript tests.","green_evidence":"Targeted TypeScript regression now passes while preserving existing generic/extends extraction behavior and the full workspace reaches tests_green=478.","implementation_notes":"Added one TS regression test (`extract_typescript_facts_do_not_split_scoped_extends_reference_into_top_level_class`) asserting only `Class:Memory.BaseStore` is emitted and `Class:Memory` is not.","anti_overfit_note":"Parser-grammar precision guard for scoped inheritance names in TypeScript syntax; no benchmark-specific heuristics.","next_action_hint":"Audit scoped inheritance for other declaration forms (e.g., interfaces or type aliases) only if failures appear, to avoid overfitting to current fixtures."}}
{"run":408,"commit":"0f2bc43","metric":479,"metrics":{"tests_green":479,"tests_total":479,"milestone_index":9,"loc_core":3910,"commit_count_total":427,"memory_error_rate":0,"unsupported_claim_rate":0,"mean_precision_at_k":1,"mean_recall_at_k":1,"beam_questions":0,"beam_rubric_checks":0,"beam_abstention_pct":0,"beam_contradiction_resolution_pct":0,"beam_event_ordering_pct":0,"beam_information_extraction_pct":0,"beam_instruction_following_pct":0,"beam_knowledge_update_pct":0,"beam_multi_session_reasoning_pct":0,"beam_preference_following_pct":0,"beam_summarization_pct":0,"beam_temporal_reasoning_pct":0},"status":"keep","description":"Add TypeScript interface scoped-extends precision regression","timestamp":1778358607113,"segment":28,"confidence":3.8636363636363638,"asi":{"hypothesis":"TypeScript interface inheritance should preserve scoped base names (`interface Store extends Memory.BaseStore`) as one reference instead of emitting top-level split facts.","red_evidence":"No dedicated interface-scoped-extends regression existed; this case was only indirectly exercised by class-scoped coverage.","green_evidence":"Targeted interface regression passes with existing collector behavior; workspace now has tests_green=479 and checks pass.","implementation_notes":"Added one regression test asserting `Interface:Store extends Interface:Memory.BaseStore` and absence of `Interface:Memory` for scoped interface extends syntax. No code change was required because interface extraction already handled this shape.","next_action_hint":"Look for a true regression gap by probing other TS declaration forms (type aliases or mapped types) where scoped references are still parsed as split identifiers."}}
{"run":409,"commit":"bb1dae6","metric":480,"metrics":{"tests_green":480,"tests_total":480,"milestone_index":9,"loc_core":3910,"commit_count_total":428,"memory_error_rate":0,"unsupported_claim_rate":0,"mean_precision_at_k":1,"mean_recall_at_k":1,"beam_questions":0,"beam_rubric_checks":0,"beam_abstention_pct":0,"beam_contradiction_resolution_pct":0,"beam_event_ordering_pct":0,"beam_information_extraction_pct":0,"beam_instruction_following_pct":0,"beam_knowledge_update_pct":0,"beam_multi_session_reasoning_pct":0,"beam_preference_following_pct":0,"beam_summarization_pct":0,"beam_temporal_reasoning_pct":0},"status":"keep","description":"Add TypeScript interface-implements scoped-name regression","timestamp":1778358663914,"segment":28,"confidence":3.8222222222222224,"asi":{"hypothesis":"TypeScript class implements should treat scoped interface names like `Memory.Recallable` as a single interface fact rather than splitting into top-level `Memory` references.","red_evidence":"No TypeScript class-implements scoped-name regression existed; dotted namespace/interface forms were only indirectly covered through class extends tests.","green_evidence":"Added regression test asserting `Class:Store implements Interface:Memory.Recallable` and absence of `Interface:Memory`; workspace green with tests_green=480.","implementation_notes":"Only test addition in `multilang.rs`; existing `collect_typescript_implements_names` already handles scoped interface names for `implements` clauses with this grammar shape.","next_action_hint":"If false positives appear on dotted/namespace interface declarations for other TS constructs (e.g., utility types), add targeted tests before broad extractor changes."}}
{"run":410,"commit":"1a7424d","metric":482,"metrics":{"tests_green":482,"tests_total":482,"milestone_index":9,"loc_core":3910,"commit_count_total":429,"memory_error_rate":0,"unsupported_claim_rate":0,"mean_precision_at_k":1,"mean_recall_at_k":1,"beam_questions":0,"beam_rubric_checks":0,"beam_abstention_pct":0,"beam_contradiction_resolution_pct":0,"beam_event_ordering_pct":0,"beam_information_extraction_pct":0,"beam_instruction_following_pct":0,"beam_knowledge_update_pct":0,"beam_multi_session_reasoning_pct":0,"beam_preference_following_pct":0,"beam_summarization_pct":0,"beam_temporal_reasoning_pct":0},"status":"keep","description":"Add TypeScript multi-dot interface-implements scoped regression coverage","timestamp":1778358787939,"segment":28,"confidence":3.8260869565217392,"asi":{"hypothesis":"TypeScript class implements with nested namespace/interface paths such as `Acme.Memory.Recallable` should remain atomic and not emit top-level split names, including when generic type arguments are present.","red_evidence":"No regression currently guarded multi-segment dotted implements names beyond single-segment `Memory.Recallable`; this is a likely splitter failure mode.","green_evidence":"Added two targeted tests for single and multi-dot namespace paths, plus generic-path variant; workspace remains green (`tests_green=482`) after adding them.","implementation_notes":"Only test additions in `crates/aver-extractor/tests/multilang.rs` (no production changes required; existing collector already handles these shapes).","next_action_hint":"If failures emerge for utility/qualified type constructs, add focused tests before changing collection logic."}}
{"run":411,"commit":"8b5f817","metric":484,"metrics":{"tests_green":484,"tests_total":484,"milestone_index":9,"loc_core":3910,"commit_count_total":430,"memory_error_rate":0,"unsupported_claim_rate":0,"mean_precision_at_k":1,"mean_recall_at_k":1,"beam_questions":0,"beam_rubric_checks":0,"beam_abstention_pct":0,"beam_contradiction_resolution_pct":0,"beam_event_ordering_pct":0,"beam_information_extraction_pct":0,"beam_instruction_following_pct":0,"beam_knowledge_update_pct":0,"beam_multi_session_reasoning_pct":0,"beam_preference_following_pct":0,"beam_summarization_pct":0,"beam_temporal_reasoning_pct":0},"status":"keep","description":"Expand Rust grouped use-declaration imports","timestamp":1778358879146,"segment":28,"confidence":3.9130434782608696,"asi":{"hypothesis":"Rust `use` declarations with brace groups (`use std::{fs, path}`) should be expanded into atomic module imports for deterministic downstream facts, not kept as raw brace syntax.","red_evidence":"`extract_rust_imports` previously emitted `std::{fs, path}` for grouped imports, losing module-level granularity needed by triple extraction and consistency with single-path imports.","green_evidence":"Added regression test and implemented parser expansion in `collect_imports`, producing `std::fs` and `std::path`; rerunning focused and full tests and `./autoresearch.sh` passes.","implementation_notes":"Only changed Rust import normalization path; used minimal textual parsing for brace groups in `collect_imports` with comma splitting and alias stripping.","next_action_hint":"Add a follow-up regression for nested/renamed grouped imports and alias semantics (`use std::{self as s, path as p}`) only if needed."}}
