{"run":412,"commit":"0cbbd04","metric":485,"metrics":{"tests_green":485,"tests_total":485,"milestone_index":9,"loc_core":3910,"commit_count_total":431,"memory_error_rate":0,"unsupported_claim_rate":0,"mean_precision_at_k":1,"mean_recall_at_k":1,"beam_questions":0,"beam_rubric_checks":0,"beam_abstention_pct":0,"beam_contradiction_resolution_pct":0,"beam_event_ordering_pct":0,"beam_information_extraction_pct":0,"beam_instruction_following_pct":0,"beam_knowledge_update_pct":0,"beam_multi_session_reasoning_pct":0,"beam_preference_following_pct":0,"beam_summarization_pct":0,"beam_temporal_reasoning_pct":0},"status":"keep","description":"Expand nested Rust grouped import grammar handling","timestamp":1778358942421,"segment":28,"confidence":3.9565217391304346,"asi":{"hypothesis":"Rust nested grouped imports like `use std::{fs::{self as stds, read_to_string}, path::Path};` should expand to atomic module paths for deterministic extraction, including nested group entries and alias-only entries.","red_evidence":"Nested groups were previously flattened to `std::fs::{self ...}`-style strings, so import facts missed atomic module-level import triples for nested members.","green_evidence":"Added recursion-based grouped-import expansion with alias stripping and a focused Rust regression test; `extract_rust_imports_expands_nested_brace_grouped_imports` and full `rust` tests now pass.","implementation_notes":"Extended existing text-level `expand_rust_use_declaration` path with recursive `expand_rust_use_items` that handles nested braces and alias stripping without over-broad changes.","next_action_hint":"Add dedicated tests for glob (`::*`) and root re-exports only if production usage requires them; avoid broad normalization until failing cases appear."}}
{"run":413,"commit":"e5306cb","metric":486,"metrics":{"tests_green":486,"tests_total":486,"milestone_index":9,"loc_core":3910,"commit_count_total":432,"memory_error_rate":0,"unsupported_claim_rate":0,"mean_precision_at_k":1,"mean_recall_at_k":1,"beam_questions":0,"beam_rubric_checks":0,"beam_abstention_pct":0,"beam_contradiction_resolution_pct":0,"beam_event_ordering_pct":0,"beam_information_extraction_pct":0,"beam_instruction_following_pct":0,"beam_knowledge_update_pct":0,"beam_multi_session_reasoning_pct":0,"beam_preference_following_pct":0,"beam_summarization_pct":0,"beam_temporal_reasoning_pct":0},"status":"keep","description":"Normalize Rust top-level import alias and visibility prefixes","timestamp":1778359006799,"segment":28,"confidence":3.9148936170212765,"asi":{"hypothesis":"Rust `pub use` and top-level `as` aliases should not leak visibility/alias syntax into collected import module names used by extractor downstream facts.","red_evidence":"`extract_rust_imports` returned `pub use ...` and `... as ...` tokens verbatim, causing downstream `extract_rust_facts` import triples to carry non-module text.","green_evidence":"Added regression `extract_rust_imports_normalizes_aliasing_and_visibility_prefix` and minimal normalization in `expand_rust_use_declaration`; both alias-only and pub-import cases now normalize to canonical module paths.","implementation_notes":"Implemented visibility/alias stripping only in the simple declaration path before grouped-brace expansion, with existing nested- brace expansion logic unchanged.","next_action_hint":"Consider adding tests for additional `pub` forms (e.g., `pub(crate)`/`pub(super)`) only if AST extraction for real crates demonstrates need; avoid broader heuristics."}}
{"run":414,"commit":"3cff0ba","metric":487,"metrics":{"tests_green":487,"tests_total":487,"milestone_index":9,"loc_core":3910,"commit_count_total":434,"memory_error_rate":0,"unsupported_claim_rate":0,"mean_precision_at_k":1,"mean_recall_at_k":1,"beam_questions":0,"beam_rubric_checks":0,"beam_abstention_pct":0,"beam_contradiction_resolution_pct":0,"beam_event_ordering_pct":0,"beam_information_extraction_pct":0,"beam_instruction_following_pct":0,"beam_knowledge_update_pct":0,"beam_multi_session_reasoning_pct":0,"beam_preference_following_pct":0,"beam_summarization_pct":0,"beam_temporal_reasoning_pct":0},"status":"keep","description":"Normalize pub-scoped Rust import declarations","timestamp":1778359060300,"segment":28,"confidence":3.875,"asi":{"hypothesis":"Rust `pub(crate)`/`pub(super)`/`pub(in ...)` import declarations should normalize to canonical module paths just like `pub use`, so downstream import facts are stable and deterministic.","red_evidence":"Current parser left parenthesized pub visibility forms intact (`pub(crate) use ...`, `pub(super) use ...`), producing non-canonical import strings and potentially noisy or missing downstream import facts.","green_evidence":"Added a focused Rust test for pub-visibility modifiers and updated `expand_rust_use_declaration` to strip visibility forms before alias stripping + brace expansion.","implementation_notes":"Kept the existing grouped-brace recursion unchanged and added only lightweight, declaration-prefix normalization for visibility patterns, preserving behavior for already supported `pub use` and `use` forms.","next_action_hint":"Consider adding one regression for `pub(in path)` with nested braces only if real-source smoke tests surface another visibility-related mismatch; otherwise stop to avoid overfitting."}}
{"run":415,"commit":"a43d0b4","metric":488,"metrics":{"tests_green":488,"tests_total":488,"milestone_index":9,"loc_core":3910,"commit_count_total":436,"memory_error_rate":0,"unsupported_claim_rate":0,"mean_precision_at_k":1,"mean_recall_at_k":1,"beam_questions":0,"beam_rubric_checks":0,"beam_abstention_pct":0,"beam_contradiction_resolution_pct":0,"beam_event_ordering_pct":0,"beam_information_extraction_pct":0,"beam_instruction_following_pct":0,"beam_knowledge_update_pct":0,"beam_multi_session_reasoning_pct":0,"beam_preference_following_pct":0,"beam_summarization_pct":0,"beam_temporal_reasoning_pct":0},"status":"keep","description":"Expand root-grouped Rust import declarations","timestamp":1778359110196,"segment":28,"confidence":3.9166666666666665,"asi":{"hypothesis":"Rust root-level grouped imports (`use { ... }`) should be expanded recursively into atomic module paths to avoid carrying brace-group syntax into extractor import facts.","red_evidence":"`extract_rust_imports` previously treated `use {std::{fs}, crate::memory::{self as memory}};` as a single opaque token, dropping deterministic import expansion for valid declaration forms.","green_evidence":"Added focused regression `extract_rust_imports_expands_root_grouped_imports` and recursive handling in `expand_rust_use_declaration` for root braces, then expanded nested groups through existing helper logic.","implementation_notes":"Handled root-brace groups before nested `::{...}` processing by splitting on top-level commas and reusing `expand_rust_use_declaration` recursively; existing behavior for direct and pub/visibility imports remains unchanged.","next_action_hint":"Monitor for remaining unhandled Rust declaration shapes (e.g., mixed grouped imports with aliases and re-exports); add narrowly-scoped tests only if concrete failures appear in real parsing traces."}}
{"run":416,"commit":"6a173c8","metric":489,"metrics":{"tests_green":489,"tests_total":489,"milestone_index":9,"loc_core":3910,"commit_count_total":438,"memory_error_rate":0,"unsupported_claim_rate":0,"mean_precision_at_k":1,"mean_recall_at_k":1,"beam_questions":0,"beam_rubric_checks":0,"beam_abstention_pct":0,"beam_contradiction_resolution_pct":0,"beam_event_ordering_pct":0,"beam_information_extraction_pct":0,"beam_instruction_following_pct":0,"beam_knowledge_update_pct":0,"beam_multi_session_reasoning_pct":0,"beam_preference_following_pct":0,"beam_summarization_pct":0,"beam_temporal_reasoning_pct":0},"status":"keep","description":"Deduplicate Rust import extraction output","timestamp":1778359152439,"segment":28,"confidence":3.9583333333333335,"asi":{"hypothesis":"Duplicate `use` declarations currently emit duplicate module import modules, creating redundant fact edges; normalizing imports to unique values yields deterministic downstream imports.","red_evidence":"`extract_rust_imports` returned duplicates for repeated import forms like `use std::fs;` + `use std::fs;` and also for equivalent alias/group duplicates.","green_evidence":"Added `extract_rust_imports_deduplicates_duplicates` regression and dedup logic in `extract_rust_imports` while preserving first-seen order.","implementation_notes":"Deduping happens after tree traversal so all syntax-normalization paths remain unchanged and behavior is centralized in one place.","next_action_hint":"If needed, extend dedupe to canonical sort-ordering across all collector outputs (not just imports), only if downstream consumers rely on strict ordering."}}
{"run":417,"commit":"9025ec7","metric":490,"metrics":{"tests_green":490,"tests_total":490,"milestone_index":9,"loc_core":3910,"commit_count_total":440,"memory_error_rate":0,"unsupported_claim_rate":0,"mean_precision_at_k":1,"mean_recall_at_k":1,"beam_questions":0,"beam_rubric_checks":0,"beam_abstention_pct":0,"beam_contradiction_resolution_pct":0,"beam_event_ordering_pct":0,"beam_information_extraction_pct":0,"beam_instruction_following_pct":0,"beam_knowledge_update_pct":0,"beam_multi_session_reasoning_pct":0,"beam_preference_following_pct":0,"beam_summarization_pct":0,"beam_temporal_reasoning_pct":0},"status":"keep","description":"Normalize Rust glob import declarations","timestamp":1778359193824,"segment":28,"confidence":3.9183673469387754,"asi":{"hypothesis":"Rust glob imports (`use ...::*`) should be normalized to base module paths so import facts remain canonical and avoid propagating wildcard syntax downstream.","red_evidence":"`extract_rust_imports` emitted `std::collections::*` for wildcard imports, creating non-canonical module terms and inconsistent import edges compared to other normalized forms.","green_evidence":"Added regression `extract_rust_imports_normalizes_glob_import` and stripped trailing `::*` during declaration normalization in `expand_rust_use_declaration`; full rust test suite and `./autoresearch.sh` passed.","implementation_notes":"Normalization is applied after existing `as` alias stripping and before emission; this keeps behavior for grouped/visibility/alias forms unchanged while canonicalizing only glob imports.","next_action_hint":"Add the same wildcard normalization for any nested `expand_rust_use_items` emission paths only if parser traces reveal cases like `use crate::events::{Sub::*}` that should emit non-wildcard paths."}}
{"run":418,"commit":"18fa2a5","metric":491,"metrics":{"tests_green":491,"tests_total":491,"milestone_index":9,"loc_core":3910,"commit_count_total":442,"memory_error_rate":0,"unsupported_claim_rate":0,"mean_precision_at_k":1,"mean_recall_at_k":1,"beam_questions":0,"beam_rubric_checks":0,"beam_abstention_pct":0,"beam_contradiction_resolution_pct":0,"beam_event_ordering_pct":0,"beam_information_extraction_pct":0,"beam_instruction_following_pct":0,"beam_knowledge_update_pct":0,"beam_multi_session_reasoning_pct":0,"beam_preference_following_pct":0,"beam_summarization_pct":0,"beam_temporal_reasoning_pct":0},"status":"keep","description":"Normalize nested Rust glob imports in use-item expansion","timestamp":1778359246134,"segment":28,"confidence":3.88,"asi":{"hypothesis":"Nested wildcard import arms (e.g., `use crate::events::{Sub::*}`) should normalize to deterministic non-wildcard module paths, otherwise downstream import facts can retain `::*` syntax and become inconsistent with top-level glob normalization.","red_evidence":"After top-level glob canonicalization, wildcard forms nested inside brace groups still emitted `:: *`-suffixed entries (e.g., `crate::events::self as events`, `crate::store::self as store`, `std::fs::self as stds`).","green_evidence":"Added regression `extract_rust_imports_normalizes_nested_glob_import` and applied wildcard trimming in `expand_rust_use_items` while preserving existing alias/self handling, then validated existing nested/grouped import tests plus full rust extractor suite.","implementation_notes":"Normalization is now applied to post-alias item arms before final emission in nested expansion, with explicit handling for `self` and standalone `*` to avoid emitting wildcard tokens in any path.","next_action_hint":"Revisit if real parser traces reveal other unresolved wildcard contexts (e.g., mixed nested aliases with re-exports) before adding broad wildcard semantics."}}
{"run":419,"commit":"af680a2","metric":494,"metrics":{"beam_questions":0,"beam_rubric_checks":0,"beam_abstention_pct":0,"beam_contradiction_resolution_pct":0,"beam_event_ordering_pct":0,"beam_information_extraction_pct":0,"beam_instruction_following_pct":0,"beam_knowledge_update_pct":0,"beam_multi_session_reasoning_pct":0,"beam_preference_following_pct":0,"beam_summarization_pct":0,"beam_temporal_reasoning_pct":0,"tests_green":494,"tests_total":494,"milestone_index":9,"loc_core":3910,"commit_count_total":444,"memory_error_rate":0,"unsupported_claim_rate":0,"mean_precision_at_k":1,"mean_recall_at_k":1},"status":"keep","description":"Add Bayesian-style retrieval tuner for BEAM autoresearch","timestamp":1778366624516,"segment":28,"confidence":4,"asi":{"hypothesis":"Retrieval quality can be improved without test overfitting by exposing top_k plus HybridRAG alpha as tunable BEAM/autoresearch parameters and adding a Bayesian-style tuner that proposes the next held-out live run from prior observations.","red_evidence":"cargo test -q -p aver-eval bayesian_tuner_prefers_promising_untried_retrieval_neighborhood failed because aver_eval::tuning did not exist; cargo test -q -p aver-eval beam_retrieval_weights_accept_explicit_alpha_for_tuning failed because BEAM retrieval alpha override did not exist.","green_evidence":"cargo fmt --all passed; targeted tuning and BEAM alpha tests passed; cargo test --workspace -q passed; sample aver-tune-retrieval CLI produced BEAM_TOP_K/BEAM_RETRIEVAL_ALPHA env suggestions; ./autoresearch.sh passed with tests_green=494 tests_total=494 and checks green.","implementation_notes":"Added aver_eval::tuning with deterministic RBF-surrogate/UCB suggestion over top_k and alpha, a new aver-tune-retrieval CLI for JSONL observations, --retrieval-alpha support in aver-beam100k, BEAM_RETRIEVAL_ALPHA forwarding in autoresearch.sh, and README usage notes warning to keep a held-out validation split.","anti_overfit_note":"The tuner consumes only prior run metrics and parameter values; it does not inspect BEAM labels/reference answers or alter answer generation, and README explicitly warns against tuning on the final benchmark labels."}}
{"run":420,"commit":"db7a47a","metric":495,"metrics":{"beam_questions":0,"beam_rubric_checks":0,"beam_abstention_pct":0,"beam_contradiction_resolution_pct":0,"beam_event_ordering_pct":0,"beam_information_extraction_pct":0,"beam_instruction_following_pct":0,"beam_knowledge_update_pct":0,"beam_multi_session_reasoning_pct":0,"beam_preference_following_pct":0,"beam_summarization_pct":0,"beam_temporal_reasoning_pct":0,"tests_green":495,"tests_total":495,"milestone_index":9,"loc_core":3910,"commit_count_total":445,"memory_error_rate":0,"unsupported_claim_rate":0,"mean_precision_at_k":1,"mean_recall_at_k":1},"status":"keep","description":"Normalize Rust absolute import paths","timestamp":1778366693616,"segment":28,"confidence":4.04,"asi":{"hypothesis":"Rust absolute-path imports such as use ::std::fs should normalize to the same canonical dependency path as use std::fs, preventing duplicate import facts for equivalent syntax.","red_evidence":"cargo test -q -p aver-extractor extract_rust_imports_normalizes_leading_absolute_path_colons failed because extract_rust_imports returned ::std::fs instead of std::fs.","green_evidence":"cargo fmt --all passed; targeted absolute-path import test and existing nested grouped import test passed; cargo test --workspace -q passed; ./autoresearch.sh passed with tests_green=495 tests_total=495 and checks green.","implementation_notes":"Stripped a leading :: during Rust use declaration normalization for both direct declarations and grouped-item arms after alias/glob normalization.","anti_overfit_note":"This is a grammar-backed canonicalization for standard Rust absolute use paths and does not depend on benchmark labels, expected answers, or scoring-specific shortcuts."}}
{"run":421,"commit":"be1525b","metric":496,"metrics":{"beam_questions":0,"beam_rubric_checks":0,"beam_abstention_pct":0,"beam_contradiction_resolution_pct":0,"beam_event_ordering_pct":0,"beam_information_extraction_pct":0,"beam_instruction_following_pct":0,"beam_knowledge_update_pct":0,"beam_multi_session_reasoning_pct":0,"beam_preference_following_pct":0,"beam_summarization_pct":0,"beam_temporal_reasoning_pct":0,"tests_green":496,"tests_total":496,"milestone_index":9,"loc_core":3910,"commit_count_total":446,"memory_error_rate":0,"unsupported_claim_rate":0,"mean_precision_at_k":1,"mean_recall_at_k":1},"status":"keep","description":"Normalize grouped Rust absolute import prefixes","timestamp":1778366735229,"segment":28,"confidence":4,"asi":{"hypothesis":"Rust grouped absolute imports such as use ::std::{fs, path} should normalize their shared prefix to the same canonical paths as non-absolute grouped imports.","red_evidence":"cargo test -q -p aver-extractor extract_rust_imports_normalizes_grouped_absolute_path_prefixes failed because extract_rust_imports returned ::std::fs and ::std::path instead of std::fs and std::path.","green_evidence":"cargo fmt --all passed; targeted grouped absolute-prefix, direct absolute-path, and nested grouped import tests passed; cargo test --workspace -q passed; ./autoresearch.sh passed with tests_green=496 tests_total=496 and checks green.","implementation_notes":"Stripped a leading :: from Rust use grouped prefixes before expanding grouped items, and normalized nested grouped prefixes during recursive use-item expansion.","anti_overfit_note":"This is a grammar-backed canonicalization for standard Rust absolute grouped use paths and does not depend on benchmark labels, expected answers, or scoring-specific shortcuts."}}
{"run":422,"commit":"82915cd","metric":497,"metrics":{"beam_questions":0,"beam_rubric_checks":0,"beam_abstention_pct":0,"beam_contradiction_resolution_pct":0,"beam_event_ordering_pct":0,"beam_information_extraction_pct":0,"beam_instruction_following_pct":0,"beam_knowledge_update_pct":0,"beam_multi_session_reasoning_pct":0,"beam_preference_following_pct":0,"beam_summarization_pct":0,"beam_temporal_reasoning_pct":0,"tests_green":497,"tests_total":497,"milestone_index":9,"loc_core":3910,"commit_count_total":447,"memory_error_rate":0,"unsupported_claim_rate":0,"mean_precision_at_k":1,"mean_recall_at_k":1},"status":"keep","description":"Normalize Rust raw identifier import segments","timestamp":1778366790435,"segment":28,"confidence":3.9615384615384617,"asi":{"hypothesis":"Rust raw identifier import segments such as r#type should normalize to their canonical identifier text so equivalent dependency paths do not produce distinct import facts.","red_evidence":"cargo test -q -p aver-extractor extract_rust_imports_normalizes_raw_identifier_segments failed because extract_rust_imports returned crate::r#type::Store instead of crate::type::Store.","green_evidence":"cargo fmt --all passed; targeted raw-identifier import test and grouped absolute-prefix test passed; cargo test --workspace -q passed; ./autoresearch.sh passed with tests_green=497 tests_total=497 and checks green.","implementation_notes":"Added Rust import path normalization that strips r# from each ::-separated path segment before emitting direct, self, glob, or grouped import entries.","anti_overfit_note":"This is a grammar-backed canonicalization for standard Rust raw identifiers in use paths and does not depend on benchmark labels, expected answers, or scoring-specific shortcuts."}}
{"run":423,"commit":"fd9fe26","metric":498,"metrics":{"beam_questions":0,"beam_rubric_checks":0,"beam_abstention_pct":0,"beam_contradiction_resolution_pct":0,"beam_event_ordering_pct":0,"beam_information_extraction_pct":0,"beam_instruction_following_pct":0,"beam_knowledge_update_pct":0,"beam_multi_session_reasoning_pct":0,"beam_preference_following_pct":0,"beam_summarization_pct":0,"beam_temporal_reasoning_pct":0,"tests_green":498,"tests_total":498,"milestone_index":9,"loc_core":3910,"commit_count_total":448,"memory_error_rate":0,"unsupported_claim_rate":0,"mean_precision_at_k":1,"mean_recall_at_k":1},"status":"keep","description":"Normalize Rust raw identifier function names","timestamp":1778366899946,"segment":28,"confidence":4,"asi":{"hypothesis":"Rust raw identifier function names such as fn r#type should normalize to their canonical identifier text so definition facts match ordinary call and reference names.","red_evidence":"cargo test -q -p aver-extractor extract_rust_functions_normalizes_raw_identifier_names failed because extract_rust_functions returned r#type instead of type.","green_evidence":"cargo fmt --all passed; targeted raw-identifier function and import tests passed; cargo test --workspace -q passed; ./autoresearch.sh passed with tests_green=498 tests_total=498 and checks green.","implementation_notes":"Added Rust identifier normalization for function_item name extraction by stripping a leading r# before emitting the function name.","anti_overfit_note":"This is a grammar-backed canonicalization for standard Rust raw identifiers in function definitions and does not depend on benchmark labels, expected answers, or scoring-specific shortcuts."}}
