{"run":463,"commit":"f270a24","metric":319,"metrics":{"tests_green":319,"tests_total":320,"milestone_index":9,"loc_core":5185,"commit_count_total":494,"memory_error_rate":0,"unsupported_claim_rate":0,"mean_precision_at_k":0,"mean_recall_at_k":0,"beam_questions":0,"beam_rubric_checks":0,"beam_abstention_pct":0,"beam_contradiction_resolution_pct":0,"beam_event_ordering_pct":0,"beam_information_extraction_pct":0,"beam_instruction_following_pct":0,"beam_knowledge_update_pct":0,"beam_multi_session_reasoning_pct":0,"beam_preference_following_pct":0,"beam_summarization_pct":0,"beam_temporal_reasoning_pct":0},"status":"crash","description":"Crash while enforcing vector chunk positive timestamps due stale vector_index fixture","timestamp":1778422282864,"segment":28,"confidence":4.378378378378378,"asi":{"hypothesis":"Vector chunk created_at should reject non-positive sentinel timestamps at the schema layer.","rollback_reason":"Full workspace failed in `crates/aver-core/tests/vector_index.rs` because `migration_backfills_existing_vector_chunks_rows` uses a direct-SQL vector_chunks fixture with `created_at = 0`, so the new positive timestamp trigger masked the intended vector-index backfill assertion.","next_action_hint":"Retry the invariant after updating stale direct-SQL vector_chunks fixtures (especially vector_index.rs) to use a positive created_at such as 1 while keeping the new migration test's invalid timestamp at 0.","red_evidence":"Targeted `vector_chunk_created_at_must_be_positive` initially failed because direct SQL accepted `created_at = 0`; after adding the trigger, `./autoresearch.sh` failed with `vector_chunks.created_at must be positive` in `migration_backfills_existing_vector_chunks_rows`.","anti_overfit_note":"The failure is fixture interaction between schema invariants, not benchmark-specific behavior."}}
{"run":464,"commit":"af026c6","metric":557,"metrics":{"tests_green":557,"tests_total":557,"milestone_index":9,"loc_core":5185,"commit_count_total":494,"memory_error_rate":0,"unsupported_claim_rate":0,"mean_precision_at_k":1,"mean_recall_at_k":1,"beam_questions":0,"beam_rubric_checks":0,"beam_abstention_pct":0,"beam_contradiction_resolution_pct":0,"beam_event_ordering_pct":0,"beam_information_extraction_pct":0,"beam_instruction_following_pct":0,"beam_knowledge_update_pct":0,"beam_multi_session_reasoning_pct":0,"beam_preference_following_pct":0,"beam_summarization_pct":0,"beam_temporal_reasoning_pct":0},"status":"keep","description":"Reject non-positive vector chunk timestamps","timestamp":1778422341009,"segment":28,"confidence":4.405405405405405,"asi":{"hypothesis":"Vector chunk created_at values should be positive at the schema layer because Store writes real Unix timestamps and chunk chronology should not contain sentinel zero values.","red_evidence":"`cargo test -q -p aver-core --test migrations vector_chunk_created_at_must_be_positive` failed because direct SQL accepted `created_at = 0`. An earlier full-run crash exposed a stale vector_index direct-SQL fixture with `created_at = 0`.","green_evidence":"Targeted positive timestamp test passed; targeted vector_index backfill fixture passed after updating fixture timestamps; full migrations test passed; `./autoresearch.sh` passed with checks green and metrics tests_green=557 tests_total=557.","implementation_notes":"Added migration `0045_vector_chunk_created_at_positive_checks.sql` with insert/update triggers rejecting vector_chunks rows whose created_at is <= 0; registered it in embedded migrations. Updated direct-SQL vector chunk fixtures to use positive timestamps except the new invalid timestamp test.","anti_overfit_note":"This is a general vector chunk chronology/audit invariant and does not use benchmark expected outputs or labels."}}
{"run":465,"commit":"dc1bafd","metric":558,"metrics":{"tests_green":558,"tests_total":558,"milestone_index":9,"loc_core":5189,"commit_count_total":495,"memory_error_rate":0,"unsupported_claim_rate":0,"mean_precision_at_k":1,"mean_recall_at_k":1,"beam_questions":0,"beam_rubric_checks":0,"beam_abstention_pct":0,"beam_contradiction_resolution_pct":0,"beam_event_ordering_pct":0,"beam_information_extraction_pct":0,"beam_instruction_following_pct":0,"beam_knowledge_update_pct":0,"beam_multi_session_reasoning_pct":0,"beam_preference_following_pct":0,"beam_summarization_pct":0,"beam_temporal_reasoning_pct":0},"status":"keep","description":"Reject non-positive observation timestamps","timestamp":1778422437375,"segment":28,"confidence":4.373333333333333,"asi":{"hypothesis":"Observation timestamps should be positive at the schema layer because Store records real Unix timestamps and observation chronology should not contain sentinel zero values.","red_evidence":"`cargo test -q -p aver-core --test migrations observations_timestamp_must_be_positive` failed because direct SQL accepted `ts = 0`.","green_evidence":"Targeted test passed; full migrations test passed; `./autoresearch.sh` passed with checks green and metrics tests_green=558 tests_total=558.","implementation_notes":"Added migration `0046_observation_ts_positive_checks.sql` with insert/update triggers rejecting observations rows whose ts is <= 0; registered it in embedded migrations. Updated direct-SQL observation invariant fixtures to use positive timestamps except the new invalid timestamp test.","anti_overfit_note":"This is a general observation chronology/audit invariant and does not use benchmark expected outputs or labels."}}
{"run":466,"commit":"c79377b","metric":559,"metrics":{"tests_green":559,"tests_total":559,"milestone_index":9,"loc_core":5193,"commit_count_total":496,"memory_error_rate":0,"unsupported_claim_rate":0,"mean_precision_at_k":1,"mean_recall_at_k":1,"beam_questions":0,"beam_rubric_checks":0,"beam_abstention_pct":0,"beam_contradiction_resolution_pct":0,"beam_event_ordering_pct":0,"beam_information_extraction_pct":0,"beam_instruction_following_pct":0,"beam_knowledge_update_pct":0,"beam_multi_session_reasoning_pct":0,"beam_preference_following_pct":0,"beam_summarization_pct":0,"beam_temporal_reasoning_pct":0},"status":"keep","description":"Reject promoted claim links on rejected candidates","timestamp":1778422504301,"segment":28,"confidence":4.342105263157895,"asi":{"hypothesis":"Rejected candidate claims should not retain promoted_claim_id at the schema layer because rejection and promotion are mutually exclusive Store workflow states.","red_evidence":"`cargo test -q -p aver-core --test migrations rejected_candidate_claims_must_not_reference_promoted_claim` failed because direct SQL accepted status REJECTED with a non-null promoted_claim_id.","green_evidence":"Targeted test passed; full migrations test passed; `./autoresearch.sh` passed with checks green and metrics tests_green=559 tests_total=559.","implementation_notes":"Added migration `0047_candidate_rejection_promotion_exclusion.sql` with insert/update triggers rejecting candidate_claims rows whose status is REJECTED while promoted_claim_id is non-null; registered it in embedded migrations.","anti_overfit_note":"This is a general staged-claim workflow consistency invariant and does not use benchmark expected outputs or labels."}}
{"run":467,"commit":"99e0783","metric":560,"metrics":{"tests_green":560,"tests_total":560,"milestone_index":9,"loc_core":5197,"commit_count_total":497,"memory_error_rate":0,"unsupported_claim_rate":0,"mean_precision_at_k":1,"mean_recall_at_k":1,"beam_questions":0,"beam_rubric_checks":0,"beam_abstention_pct":0,"beam_contradiction_resolution_pct":0,"beam_event_ordering_pct":0,"beam_information_extraction_pct":0,"beam_instruction_following_pct":0,"beam_knowledge_update_pct":0,"beam_multi_session_reasoning_pct":0,"beam_preference_following_pct":0,"beam_summarization_pct":0,"beam_temporal_reasoning_pct":0},"status":"keep","description":"Reject rejection reasons on promoted candidates","timestamp":1778422567319,"segment":28,"confidence":4.368421052631579,"asi":{"hypothesis":"Promoted candidate claims should not retain rejection_reason at the schema layer because promotion and rejection are mutually exclusive Store workflow states.","red_evidence":"`cargo test -q -p aver-core --test migrations promoted_candidate_claims_must_not_have_rejection_reason` failed because direct SQL accepted status PROMOTED with a non-null rejection_reason.","green_evidence":"Targeted test passed; full migrations test passed; `./autoresearch.sh` passed with checks green and metrics tests_green=560 tests_total=560.","implementation_notes":"Added migration `0048_candidate_promotion_rejection_exclusion.sql` with insert/update triggers rejecting candidate_claims rows whose status is PROMOTED while rejection_reason is non-null; registered it in embedded migrations.","anti_overfit_note":"This is a general staged-claim workflow consistency invariant and does not use benchmark expected outputs or labels."}}
{"run":468,"commit":"f946370","metric":561,"metrics":{"tests_green":561,"tests_total":561,"milestone_index":9,"loc_core":5201,"commit_count_total":498,"memory_error_rate":0,"unsupported_claim_rate":0,"mean_precision_at_k":1,"mean_recall_at_k":1,"beam_questions":0,"beam_rubric_checks":0,"beam_abstention_pct":0,"beam_contradiction_resolution_pct":0,"beam_event_ordering_pct":0,"beam_information_extraction_pct":0,"beam_instruction_following_pct":0,"beam_knowledge_update_pct":0,"beam_multi_session_reasoning_pct":0,"beam_preference_following_pct":0,"beam_summarization_pct":0,"beam_temporal_reasoning_pct":0},"status":"keep","description":"Reject rejection reasons on pending candidates","timestamp":1778422653532,"segment":28,"confidence":4.394736842105263,"asi":{"hypothesis":"Pending candidate claims should not retain rejection_reason at the schema layer because pending rows represent unreviewed staged memory and Store::propose_candidate_claim creates them without rejection metadata.","red_evidence":"`cargo test -q -p aver-core --test migrations pending_candidate_claims_must_not_have_rejection_reason` failed because direct SQL accepted status PENDING with a non-null rejection_reason.","green_evidence":"Targeted test passed; full migrations test passed; `./autoresearch.sh` passed with checks green and metrics tests_green=561 tests_total=561.","implementation_notes":"Added migration `0049_candidate_pending_rejection_exclusion.sql` with insert/update triggers rejecting candidate_claims rows whose status is PENDING while rejection_reason is non-null; registered it in embedded migrations.","anti_overfit_note":"This is a general staged-claim workflow consistency invariant and does not use benchmark expected outputs or labels."}}
{"run":469,"commit":"f0a91e8","metric":562,"metrics":{"tests_green":562,"tests_total":562,"milestone_index":9,"loc_core":5205,"commit_count_total":499,"memory_error_rate":0,"unsupported_claim_rate":0,"mean_precision_at_k":1,"mean_recall_at_k":1,"beam_questions":0,"beam_rubric_checks":0,"beam_abstention_pct":0,"beam_contradiction_resolution_pct":0,"beam_event_ordering_pct":0,"beam_information_extraction_pct":0,"beam_instruction_following_pct":0,"beam_knowledge_update_pct":0,"beam_multi_session_reasoning_pct":0,"beam_preference_following_pct":0,"beam_summarization_pct":0,"beam_temporal_reasoning_pct":0},"status":"keep","description":"Reject promoted claim links on pending candidates","timestamp":1778422720226,"segment":28,"confidence":4.3076923076923075,"asi":{"hypothesis":"Pending candidate claims should not retain promoted_claim_id at the schema layer because pending rows represent unreviewed staged memory and Store::propose_candidate_claim creates them without durable claim links.","red_evidence":"`cargo test -q -p aver-core --test migrations pending_candidate_claims_must_not_reference_promoted_claim` failed because direct SQL accepted status PENDING with a non-null promoted_claim_id.","green_evidence":"Targeted test passed; full migrations test passed; `./autoresearch.sh` passed with checks green and metrics tests_green=562 tests_total=562.","implementation_notes":"Added migration `0050_candidate_pending_promotion_exclusion.sql` with insert/update triggers rejecting candidate_claims rows whose status is PENDING while promoted_claim_id is non-null; registered it in embedded migrations.","anti_overfit_note":"This is a general staged-claim workflow consistency invariant and does not use benchmark expected outputs or labels."}}
{"run":470,"commit":"beb7729","metric":563,"metrics":{"tests_green":563,"tests_total":563,"milestone_index":9,"loc_core":5209,"commit_count_total":500,"memory_error_rate":0,"unsupported_claim_rate":0,"mean_precision_at_k":1,"mean_recall_at_k":1,"beam_questions":0,"beam_rubric_checks":0,"beam_abstention_pct":0,"beam_contradiction_resolution_pct":0,"beam_event_ordering_pct":0,"beam_information_extraction_pct":0,"beam_instruction_following_pct":0,"beam_knowledge_update_pct":0,"beam_multi_session_reasoning_pct":0,"beam_preference_following_pct":0,"beam_summarization_pct":0,"beam_temporal_reasoning_pct":0},"status":"keep","description":"Reject blank contradiction reasons","timestamp":1778422778064,"segment":28,"confidence":4.225,"asi":{"hypothesis":"Contradiction reasons should reject blank strings at the schema layer because Store::contradict validates rationale text and contradiction records are audit evidence.","red_evidence":"`cargo test -q -p aver-core --test migrations contradiction_reason_must_not_be_blank` failed because direct SQL accepted `reason = '   '`.","green_evidence":"Targeted test passed; full migrations test passed; `./autoresearch.sh` passed with checks green and metrics tests_green=563 tests_total=563.","implementation_notes":"Added migration `0051_contradiction_reason_nonblank_checks.sql` with insert/update triggers rejecting contradictions rows whose trimmed reason is empty; registered it in embedded migrations.","anti_overfit_note":"This is a general auditability invariant for contradiction records and does not use benchmark expected outputs or labels."}}
{"run":471,"commit":"d7f7788","metric":564,"metrics":{"tests_green":564,"tests_total":564,"milestone_index":9,"loc_core":5213,"commit_count_total":501,"memory_error_rate":0,"unsupported_claim_rate":0,"mean_precision_at_k":1,"mean_recall_at_k":1,"beam_questions":0,"beam_rubric_checks":0,"beam_abstention_pct":0,"beam_contradiction_resolution_pct":0,"beam_event_ordering_pct":0,"beam_information_extraction_pct":0,"beam_instruction_following_pct":0,"beam_knowledge_update_pct":0,"beam_multi_session_reasoning_pct":0,"beam_preference_following_pct":0,"beam_summarization_pct":0,"beam_temporal_reasoning_pct":0},"status":"keep","description":"Reject non-positive contradiction timestamps","timestamp":1778422890895,"segment":28,"confidence":4.146341463414634,"asi":{"hypothesis":"Contradiction created_at values should be positive at the schema layer because Store writes real Unix timestamps and contradiction audit chronology should not contain sentinel zero values.","red_evidence":"`cargo test -q -p aver-core --test migrations contradiction_created_at_must_be_positive` failed because direct SQL accepted `created_at = 0`.","green_evidence":"Targeted test passed; full migrations test passed; `./autoresearch.sh` passed with checks green and metrics tests_green=564 tests_total=564.","implementation_notes":"Added migration `0052_contradiction_created_at_positive_checks.sql` with insert/update triggers rejecting contradictions rows whose created_at is <= 0; registered it in embedded migrations.","anti_overfit_note":"This is a general contradiction audit chronology invariant and does not use benchmark expected outputs or labels."}}
{"run":472,"commit":"70ef131","metric":565,"metrics":{"tests_green":565,"tests_total":565,"milestone_index":9,"loc_core":5217,"commit_count_total":502,"memory_error_rate":0,"unsupported_claim_rate":0,"mean_precision_at_k":1,"mean_recall_at_k":1,"beam_questions":0,"beam_rubric_checks":0,"beam_abstention_pct":0,"beam_contradiction_resolution_pct":0,"beam_event_ordering_pct":0,"beam_information_extraction_pct":0,"beam_instruction_following_pct":0,"beam_knowledge_update_pct":0,"beam_multi_session_reasoning_pct":0,"beam_preference_following_pct":0,"beam_summarization_pct":0,"beam_temporal_reasoning_pct":0},"status":"keep","description":"Reject self-referential contradiction replacements","timestamp":1778422960479,"segment":28,"confidence":4.071428571428571,"asi":{"hypothesis":"Contradiction new_claim_id should not equal claim_id at the schema layer because a replacement/new claim must be distinct from the contradicted claim to provide meaningful audit evidence.","red_evidence":"`cargo test -q -p aver-core --test migrations contradiction_new_claim_must_not_equal_claim` failed because direct SQL accepted new_claim_id equal to claim_id.","green_evidence":"Targeted test passed; full migrations test passed; `./autoresearch.sh` passed with checks green and metrics tests_green=565 tests_total=565.","implementation_notes":"Added migration `0053_contradiction_new_claim_distinct_checks.sql` with insert/update triggers rejecting contradictions rows whose non-null new_claim_id equals claim_id; registered it in embedded migrations.","anti_overfit_note":"This is a general contradiction graph consistency invariant and does not use benchmark expected outputs or labels."}}
{"run":473,"commit":"98ec3a9","metric":566,"metrics":{"tests_green":566,"tests_total":566,"milestone_index":9,"loc_core":5221,"commit_count_total":503,"memory_error_rate":0,"unsupported_claim_rate":0,"mean_precision_at_k":1,"mean_recall_at_k":1,"beam_questions":0,"beam_rubric_checks":0,"beam_abstention_pct":0,"beam_contradiction_resolution_pct":0,"beam_event_ordering_pct":0,"beam_information_extraction_pct":0,"beam_instruction_following_pct":0,"beam_knowledge_update_pct":0,"beam_multi_session_reasoning_pct":0,"beam_preference_following_pct":0,"beam_summarization_pct":0,"beam_temporal_reasoning_pct":0},"status":"keep","description":"Reject blank entity type names","timestamp":1778423034153,"segment":28,"confidence":4,"asi":{"hypothesis":"Ontology entity type names should reject blank strings at the schema layer because type closure/classification logic requires meaningful vocabulary identifiers.","red_evidence":"`cargo test -q -p aver-core --test migrations entity_type_name_must_not_be_blank` failed because direct SQL accepted `entity_types.name = '   '`.","green_evidence":"Targeted test passed; full migrations test passed; `./autoresearch.sh` passed with checks green and metrics tests_green=566 tests_total=566.","implementation_notes":"Added migration `0054_entity_type_name_nonblank_checks.sql` with insert/update triggers rejecting entity_types rows whose trimmed name is empty; registered it in embedded migrations.","anti_overfit_note":"This is a general ontology vocabulary consistency invariant and does not use benchmark expected outputs or labels."}}
{"run":474,"commit":"593ed51","metric":567,"metrics":{"tests_green":567,"tests_total":567,"milestone_index":9,"loc_core":5225,"commit_count_total":504,"memory_error_rate":0,"unsupported_claim_rate":0,"mean_precision_at_k":1,"mean_recall_at_k":1,"beam_questions":0,"beam_rubric_checks":0,"beam_abstention_pct":0,"beam_contradiction_resolution_pct":0,"beam_event_ordering_pct":0,"beam_information_extraction_pct":0,"beam_instruction_following_pct":0,"beam_knowledge_update_pct":0,"beam_multi_session_reasoning_pct":0,"beam_preference_following_pct":0,"beam_summarization_pct":0,"beam_temporal_reasoning_pct":0},"status":"keep","description":"Reject blank predicate type names","timestamp":1778423093641,"segment":28,"confidence":3.9318181818181817,"asi":{"hypothesis":"Ontology predicate type names should reject blank strings at the schema layer because claim predicate validation requires meaningful vocabulary identifiers.","red_evidence":"`cargo test -q -p aver-core --test migrations predicate_type_name_must_not_be_blank` failed because direct SQL accepted `predicate_types.name = '   '`.","green_evidence":"Targeted test passed; full migrations test passed; `./autoresearch.sh` passed with checks green and metrics tests_green=567 tests_total=567.","implementation_notes":"Added migration `0055_predicate_type_name_nonblank_checks.sql` with insert/update triggers rejecting predicate_types rows whose trimmed name is empty; registered it in embedded migrations.","anti_overfit_note":"This is a general ontology vocabulary consistency invariant and does not use benchmark expected outputs or labels."}}
