{"run":345,"commit":"098bbb6","metric":421,"metrics":{"tests_total":421,"milestone_index":9,"loc_core":3910,"commit_count_total":369,"memory_error_rate":0,"unsupported_claim_rate":0,"mean_precision_at_k":1,"mean_recall_at_k":1},"status":"keep","description":"Extract Java class implements facts","timestamp":1778353740893,"segment":28,"confidence":4.153846153846154,"asi":{"hypothesis":"Java class declarations should emit implements facts for implemented interfaces because class-interface relationships are deterministic AST relationships and complement class extends extraction without using benchmark-specific signals.","red_evidence":"cargo test -q -p aver-extractor extract_java_facts_emit_class_implements_triple failed because extract_java_facts did not include a Class:Store implements Interface:Recallable triple.","green_evidence":"cargo test --workspace -q passed; ./autoresearch.sh passed with tests_green=421 tests_total=421 and checks green.","implementation_notes":"Added Java super_interfaces scanning from class_declaration interfaces field and emitted implements triples for descendant interface identifiers.","anti_overfit_note":"This is grammar-backed extraction of a standard Java type relationship and does not depend on benchmark labels, expected answers, or scoring-specific shortcuts."}}
{"run":346,"commit":"c7d20b8","metric":422,"metrics":{"tests_total":422,"milestone_index":9,"loc_core":3910,"commit_count_total":370,"memory_error_rate":0,"unsupported_claim_rate":0,"mean_precision_at_k":1,"mean_recall_at_k":1},"status":"keep","description":"Extract JavaScript class inheritance facts","timestamp":1778353795150,"segment":28,"confidence":4,"asi":{"hypothesis":"JavaScript class declarations should emit extends facts because ES class heritage is a deterministic AST relationship and should match TypeScript/common class extraction behavior.","red_evidence":"cargo test -q -p aver-extractor extract_javascript_facts_emit_class_extends_triple failed because extract_javascript_facts did not include a Class:Store extends Class:BaseStore triple.","green_evidence":"cargo test --workspace -q passed; ./autoresearch.sh passed with tests_green=422 tests_total=422 and checks green.","implementation_notes":"Added JavaScript class_declaration class_heritage scanning via Tree-sitter and extended extract_javascript_facts with extends triples.","anti_overfit_note":"This is grammar-backed extraction of a standard JavaScript inheritance relationship and does not depend on benchmark labels, expected answers, or scoring-specific shortcuts."}}
{"run":347,"commit":"c7d20b8","metric":0,"metrics":{"tests_total":0,"milestone_index":9,"loc_core":3910,"commit_count_total":371,"memory_error_rate":0,"unsupported_claim_rate":0,"mean_precision_at_k":0,"mean_recall_at_k":0},"status":"crash","description":"TypeScript interface extends experiment blocked by duplicate BEAM tests","timestamp":1778353895546,"segment":28,"confidence":4,"asi":{"hypothesis":"TypeScript interface declarations should emit Interface extends Interface triples via Tree-sitter extends_type_clause extraction.","red_evidence":"cargo test -q -p aver-extractor extract_typescript_facts_emit_interface_extends_triple failed because extract_typescript_facts did not include Interface:Recallable extends Interface:BaseRecallable.","rollback_reason":"./autoresearch.sh failed before measuring the extractor change because crates/aver-eval/tests/beam.rs had duplicate beam_answer_prompt_* tests from an unrelated prior failed prompt experiment reappear in the working tree.","next_action_hint":"First restore crates/aver-eval/tests/beam.rs to HEAD or otherwise remove the unrelated duplicate BEAM test block, then reapply the TypeScript interface-extends TDD step with the same grammar-backed test.","anti_overfit_note":"The attempted extractor change was grammar-backed and generic; the crash was unrelated to benchmark labels or expected answers."}}
{"run":348,"commit":"c288651","metric":423,"metrics":{"tests_total":423,"milestone_index":9,"loc_core":3910,"commit_count_total":371,"memory_error_rate":0,"unsupported_claim_rate":0,"mean_precision_at_k":1,"mean_recall_at_k":1},"status":"keep","description":"Extract TypeScript interface inheritance facts","timestamp":1778353939209,"segment":28,"confidence":4.142857142857143,"asi":{"hypothesis":"TypeScript interface declarations should emit Interface extends Interface triples via Tree-sitter extends_type_clause extraction because interface inheritance is a deterministic type relationship.","red_evidence":"cargo test -q -p aver-extractor extract_typescript_facts_emit_interface_extends_triple failed because extract_typescript_facts did not include Interface:Recallable extends Interface:BaseRecallable.","green_evidence":"cargo test --workspace -q passed; ./autoresearch.sh passed with tests_green=423 tests_total=423 and checks green.","implementation_notes":"Replaced the narrow TypeScript source-line class extends scanner with Tree-sitter-backed class_heritage and extends_type_clause scanning, preserving class extends behavior and adding interface extends facts.","anti_overfit_note":"This is grammar-backed extraction of a standard TypeScript inheritance relationship and does not depend on benchmark labels, expected answers, or scoring-specific shortcuts."}}
{"run":349,"commit":"9665b2d","metric":424,"metrics":{"tests_total":424,"milestone_index":9,"loc_core":3910,"commit_count_total":372,"memory_error_rate":0,"unsupported_claim_rate":0,"mean_precision_at_k":1,"mean_recall_at_k":1},"status":"keep","description":"Extract PHP class inheritance facts","timestamp":1778353981211,"segment":28,"confidence":4.285714285714286,"asi":{"hypothesis":"PHP class declarations should emit extends facts because base_clause relationships are deterministic AST relationships and align PHP extraction with other class-based languages.","red_evidence":"cargo test -q -p aver-extractor extract_php_facts_emit_class_extends_triple failed because extract_php_facts did not include Class:Store extends Class:BaseStore.","green_evidence":"cargo test --workspace -q passed; ./autoresearch.sh passed with tests_green=424 tests_total=424 and checks green.","implementation_notes":"Added PHP class_declaration base_clause scanning via Tree-sitter and extended extract_php_facts with class extends triples.","anti_overfit_note":"This is grammar-backed extraction of a standard PHP inheritance relationship and does not depend on benchmark labels, expected answers, or scoring-specific shortcuts."}}
{"run":350,"commit":"d9f0bde","metric":425,"metrics":{"tests_total":425,"milestone_index":9,"loc_core":3910,"commit_count_total":373,"memory_error_rate":0,"unsupported_claim_rate":0,"mean_precision_at_k":1,"mean_recall_at_k":1},"status":"keep","description":"Extract Ruby class inheritance facts","timestamp":1778354017347,"segment":28,"confidence":4.133333333333334,"asi":{"hypothesis":"Ruby class declarations should emit extends facts because superclass fields are deterministic Tree-sitter AST relationships and align Ruby extraction with other class-based languages.","red_evidence":"cargo test -q -p aver-extractor extract_ruby_facts_emit_class_extends_triple failed because extract_ruby_facts did not include Class:Store extends Class:BaseStore.","green_evidence":"cargo test --workspace -q passed; ./autoresearch.sh passed with tests_green=425 tests_total=425 and checks green.","implementation_notes":"Added Ruby class superclass scanning via Tree-sitter and extended extract_ruby_facts with class extends triples.","anti_overfit_note":"This is grammar-backed extraction of a standard Ruby inheritance relationship and does not depend on benchmark labels, expected answers, or scoring-specific shortcuts."}}
{"run":193,"commit":"d9f0bde","metric":0,"metrics":{"beam_questions":0,"beam_rubric_checks":0,"beam_abstention_pct":0,"beam_contradiction_resolution_pct":0,"beam_event_ordering_pct":0,"beam_information_extraction_pct":0,"beam_instruction_following_pct":0,"beam_knowledge_update_pct":0,"beam_multi_session_reasoning_pct":0,"beam_preference_following_pct":0,"beam_summarization_pct":0,"beam_temporal_reasoning_pct":0,"tests_green":342,"tests_total":343,"milestone_index":9,"loc_core":3910,"commit_count_total":374},"status":"crash","description":"PHP interface extends step blocked by unrelated Kotlin class extends red test","timestamp":1778354061503,"segment":26,"confidence":127.70000000000105,"asi":{"hypothesis":"PHP interface declarations should emit Interface extends Interface triples via Tree-sitter base-clause extraction.","rollback_reason":"./autoresearch.sh failed because a separate Kotlin class-extends test is currently red, so this PHP step could not be measured cleanly.","error_detail":"extract_kotlin_facts_emit_class_extends_triple failed: extract_kotlin_facts did not contain Class:Store extends Class:BaseStore.","next_action_hint":"Address the active Kotlin class-extends TDD step first or restore unrelated dirty tests before rerunning the PHP interface-extends experiment.","anti_overfit_note":"The attempted PHP extractor change is grammar-backed and generic; no benchmark labels or expected-answer shortcuts are involved."}}
{"run":351,"commit":"d9f0bde","metric":342,"metrics":{"tests_total":343,"milestone_index":9,"loc_core":3910,"commit_count_total":374,"memory_error_rate":0,"unsupported_claim_rate":0,"mean_precision_at_k":0,"mean_recall_at_k":0},"status":"crash","description":"Kotlin class/interface inheritance experiment left Kotlin interface extends red","timestamp":1778354136956,"segment":28,"confidence":3.875,"asi":{"hypothesis":"Kotlin class declarations with delegation_specifier should emit class extends triples.","red_evidence":"cargo test -q -p aver-extractor extract_kotlin_facts_emit_class_extends_triple initially failed because extract_kotlin_facts lacked Class:Store extends Class:BaseStore.","rollback_reason":"./autoresearch.sh found an additional red uncommitted test, extract_kotlin_facts_emit_interface_extends_triple, expecting Interface:Recallable extends Interface:BaseRecallable; the implementation only handled class delegation and left that interface relationship red.","next_action_hint":"Reapply Kotlin inheritance as a single coherent TDD step that supports both class and interface delegation_specifier relationships, then rerun workspace tests before autoresearch.","anti_overfit_note":"The attempted changes were grammar-backed Kotlin AST extraction and did not use benchmark labels or expected answers."}}
{"run":352,"commit":"03878ea","metric":427,"metrics":{"tests_total":427,"milestone_index":9,"loc_core":3910,"commit_count_total":374,"memory_error_rate":0,"unsupported_claim_rate":0,"mean_precision_at_k":1,"mean_recall_at_k":1},"status":"keep","description":"Extract Kotlin and PHP interface inheritance facts","timestamp":1778354200938,"segment":28,"confidence":4.125,"asi":{"hypothesis":"Kotlin delegation specifiers and PHP interface base clauses should emit inheritance facts because both are deterministic AST relationships not covered by prior definition-only extraction.","red_evidence":"cargo test -q -p aver-extractor extract_kotlin_facts_emit_delegation_extends_triples failed because Kotlin class/interface inheritance triples were absent; workspace also exposed a red PHP interface extends test expecting Interface:Recallable extends Interface:BaseRecallable.","green_evidence":"cargo test --workspace -q passed; ./autoresearch.sh passed with tests_green=427 tests_total=427 and checks green.","implementation_notes":"Added Kotlin class/interface delegation_specifier extends facts and extended PHP base_clause handling to interface_declaration as well as class_declaration.","anti_overfit_note":"This is grammar-backed extraction of standard language inheritance relationships and does not depend on benchmark labels, expected answers, or scoring-specific shortcuts."}}
{"run":353,"commit":"b073856","metric":428,"metrics":{"tests_total":428,"milestone_index":9,"loc_core":3910,"commit_count_total":375,"memory_error_rate":0,"unsupported_claim_rate":0,"mean_precision_at_k":1,"mean_recall_at_k":1},"status":"keep","description":"Lock C# interface inheritance facts","timestamp":1778354260861,"segment":28,"confidence":4.25,"asi":{"hypothesis":"C# interface declarations should have an explicit regression test for Interface extends Interface facts because base_list extraction already supports this deterministic relationship and it is part of common type hierarchy extraction.","red_evidence":"A persisted uncommitted test for extract_csharp_facts_emit_interface_extends_triple was present after compaction; targeted cargo test passed against existing C# base_list extraction, so this cycle locks the behavior rather than adding new production code.","green_evidence":"cargo test --workspace -q passed; ./autoresearch.sh passed with tests_green=428 tests_total=428 and checks green.","implementation_notes":"Added a deterministic C# interface inheritance regression test asserting Interface:Recallable extends Interface:BaseRecallable from interface Recallable : BaseRecallable {}.","anti_overfit_note":"This is grammar-backed coverage of a standard C# interface inheritance relationship and does not depend on benchmark labels, expected answers, or scoring-specific shortcuts."}}
{"run":194,"commit":"dd704c1","metric":428,"metrics":{"beam_questions":0,"beam_rubric_checks":0,"beam_abstention_pct":0,"beam_contradiction_resolution_pct":0,"beam_event_ordering_pct":0,"beam_information_extraction_pct":0,"beam_instruction_following_pct":0,"beam_knowledge_update_pct":0,"beam_multi_session_reasoning_pct":0,"beam_preference_following_pct":0,"beam_summarization_pct":0,"beam_temporal_reasoning_pct":0,"tests_green":428,"tests_total":428,"milestone_index":9,"loc_core":3910,"commit_count_total":375,"memory_error_rate":0,"unsupported_claim_rate":0,"mean_precision_at_k":1,"mean_recall_at_k":1},"status":"keep","description":"Extract C# interface inheritance facts","timestamp":1778354266456,"segment":26,"confidence":856.8152380952348,"asi":{"hypothesis":"C# interface declarations should emit Interface extends Interface triples because interface inheritance is a standard deterministic AST relationship and complements existing class inheritance extraction.","red_evidence":"cargo test -q -p aver-extractor extract_csharp_facts_emit_interface_extends_triple failed because extract_csharp_facts did not include Interface:Recallable extends Interface:BaseRecallable.","green_evidence":"cargo test --workspace -q passed; ./autoresearch.sh passed with tests_green=428 tests_total=428 and checks green.","implementation_notes":"Generalized C# base_list extraction from class_declaration only to class_declaration and interface_declaration, using Class/Interface fact prefixes accordingly.","anti_overfit_note":"This is grammar-backed extraction of a standard C# language relationship and does not depend on benchmark labels, expected answers, or scoring-specific shortcuts."}}
{"run":195,"commit":"9c3f995","metric":430,"metrics":{"beam_questions":0,"beam_rubric_checks":0,"beam_abstention_pct":0,"beam_contradiction_resolution_pct":0,"beam_event_ordering_pct":0,"beam_information_extraction_pct":0,"beam_instruction_following_pct":0,"beam_knowledge_update_pct":0,"beam_multi_session_reasoning_pct":0,"beam_preference_following_pct":0,"beam_summarization_pct":0,"beam_temporal_reasoning_pct":0,"tests_green":430,"tests_total":430,"milestone_index":9,"loc_core":3910,"commit_count_total":377,"memory_error_rate":0,"unsupported_claim_rate":0,"mean_precision_at_k":1,"mean_recall_at_k":1},"status":"keep","description":"Extract Swift protocol inheritance facts","timestamp":1778354348585,"segment":26,"confidence":821.6909090908969,"asi":{"hypothesis":"Swift protocol declarations should emit Protocol extends Protocol triples because protocol inheritance is a standard deterministic AST relationship and complements class/actor inheritance extraction.","red_evidence":"cargo test -q -p aver-extractor extract_swift_facts_emit_protocol_extends_triple failed because extract_swift_facts did not include Protocol:Recallable extends Protocol:BaseRecallable.","green_evidence":"cargo test --workspace -q passed; ./autoresearch.sh passed with tests_green=430 tests_total=430 and checks green.","implementation_notes":"Generalized Swift inheritance extraction to emit Class extends Class for class/actor declarations and Protocol extends Protocol for protocol_declaration inheritance specifiers.","anti_overfit_note":"This is grammar-backed extraction of a standard Swift language relationship and does not depend on benchmark labels, expected answers, or scoring-specific shortcuts."}}
{"run":196,"commit":"ef89fa4","metric":431,"metrics":{"beam_questions":0,"beam_rubric_checks":0,"beam_abstention_pct":0,"beam_contradiction_resolution_pct":0,"beam_event_ordering_pct":0,"beam_information_extraction_pct":0,"beam_instruction_following_pct":0,"beam_knowledge_update_pct":0,"beam_multi_session_reasoning_pct":0,"beam_preference_following_pct":0,"beam_summarization_pct":0,"beam_temporal_reasoning_pct":0,"tests_green":431,"tests_total":431,"milestone_index":9,"loc_core":3910,"commit_count_total":378,"memory_error_rate":0,"unsupported_claim_rate":0,"mean_precision_at_k":1,"mean_recall_at_k":1},"status":"keep","description":"Extract Go interface embedding inheritance facts","timestamp":1778354435240,"segment":26,"confidence":647.1157142857106,"asi":{"hypothesis":"Go interface declarations should emit Interface extends Interface triples for embedded interfaces because embedding is Go's deterministic interface inheritance relationship.","red_evidence":"cargo test -q -p aver-extractor extract_go_facts_emit_interface_extends_triple failed because extract_go_facts did not include Interface:Recallable extends Interface:BaseRecallable.","green_evidence":"cargo test --workspace -q passed; ./autoresearch.sh passed with tests_green=431 tests_total=431 and checks green.","implementation_notes":"Added Go interface_type scanning under type_spec and emitted extends triples for embedded type_identifier/qualified_type descendants.","anti_overfit_note":"This is grammar-backed extraction of a standard Go language relationship and does not depend on benchmark labels, expected answers, or scoring-specific shortcuts."}}
{"run":197,"commit":"37f8aa8","metric":432,"metrics":{"beam_questions":0,"beam_rubric_checks":0,"beam_abstention_pct":0,"beam_contradiction_resolution_pct":0,"beam_event_ordering_pct":0,"beam_information_extraction_pct":0,"beam_instruction_following_pct":0,"beam_knowledge_update_pct":0,"beam_multi_session_reasoning_pct":0,"beam_preference_following_pct":0,"beam_summarization_pct":0,"beam_temporal_reasoning_pct":0,"tests_green":432,"tests_total":432,"milestone_index":9,"loc_core":3910,"commit_count_total":379,"memory_error_rate":0,"unsupported_claim_rate":0,"mean_precision_at_k":1,"mean_recall_at_k":1},"status":"keep","description":"Extract C# record inheritance facts","timestamp":1778354542772,"segment":26,"confidence":605.3759999999959,"asi":{"hypothesis":"C# record declarations should emit Record extends Record triples because records use base lists for deterministic type hierarchy relationships just like classes and interfaces.","red_evidence":"cargo test -q -p aver-extractor extract_csharp_facts_emit_record_extends_triple failed because extract_csharp_facts did not include Record:User extends Record:BaseUser.","green_evidence":"cargo test --workspace -q passed; ./autoresearch.sh passed with tests_green=432 tests_total=432 and checks green.","implementation_notes":"Extended C# base_list extraction to include record_declaration with Record fact prefixes, preserving existing class/interface extends extraction.","anti_overfit_note":"This is grammar-backed extraction of a standard C# language relationship and does not depend on benchmark labels, expected answers, or scoring-specific shortcuts."}}
{"run":354,"commit":"22198ec","metric":433,"metrics":{"tests_total":433,"milestone_index":9,"loc_core":3910,"commit_count_total":380,"memory_error_rate":0,"unsupported_claim_rate":0,"mean_precision_at_k":1,"mean_recall_at_k":1},"status":"keep","description":"Extract C++ struct inheritance facts","timestamp":1778354583614,"segment":28,"confidence":4.588235294117647,"asi":{"hypothesis":"C++ struct inheritance should emit Struct extends Struct triples because struct_specifier uses the same base_class_clause relationship as classes but represents a distinct public type kind.","red_evidence":"The persisted uncommitted test extract_cpp_facts_emit_struct_extends_triple captured that previous C++ inheritance extraction emitted only Class-prefixed triples for class_specifier/struct_specifier; the new assertion requires Struct:Store extends Struct:BaseStore.","green_evidence":"cargo test -q -p aver-extractor extract_cpp_facts_emit_struct_extends_triple passed; cargo test --workspace -q passed; ./autoresearch.sh passed with tests_green=433 tests_total=433 and checks green.","implementation_notes":"Generalized the C++ base_class_clause collector to choose Class or Struct prefixes based on class_specifier versus struct_specifier while preserving class inheritance behavior.","anti_overfit_note":"This is grammar-backed extraction of a standard C++ language relationship and does not depend on benchmark labels, expected answers, or scoring-specific shortcuts."}}
