{"run":228,"commit":"33f20f7","metric":242,"metrics":{"tests_total":242,"milestone_index":9,"loc_core":2277,"commit_count_total":251,"memory_error_rate":0,"unsupported_claim_rate":0,"mean_precision_at_k":1,"mean_recall_at_k":1},"status":"keep","description":"require existing claims for contradiction records","timestamp":1778227573999,"segment":26,"confidence":3.769230769230769,"asi":{"hypothesis":"Recording a contradiction should report a domain-specific missing-claim error when the target claim id does not exist, rather than leaking a raw SQLite no-row error","red_evidence":"contradict_requires_existing_claim failed because Store::contradict(42, ...) errored without mentioning claim context","green_evidence":"./autoresearch.sh passed with tests_green=242, tests_total=242, memory_error_rate=0, and autoresearch.checks.sh green","anti_overfit_note":"The change is a generic contradiction API error-honesty invariant; it does not depend on benchmark data, BEAM labels, rubrics, reference answers, or fixture-specific scoring shortcuts"}}
{"run":229,"commit":"cf6902a","metric":243,"metrics":{"tests_total":243,"milestone_index":9,"loc_core":2288,"commit_count_total":252,"memory_error_rate":0,"unsupported_claim_rate":0,"mean_precision_at_k":1,"mean_recall_at_k":1},"status":"keep","description":"require existing claims for vector chunks","timestamp":1778227614354,"segment":26,"confidence":3.7037037037037037,"asi":{"hypothesis":"Vector chunk writes should require an existing claim id and return a domain-specific missing-claim error instead of leaking storage-layer errors","red_evidence":"add_vector_chunk_requires_existing_claim failed because Store::add_vector_chunk(42, ...) errored without a claim-context message","green_evidence":"./autoresearch.sh passed with tests_green=243, tests_total=243, memory_error_rate=0, and autoresearch.checks.sh green","anti_overfit_note":"The change is a generic vector projection referential-integrity invariant; it does not depend on benchmark data, BEAM labels, rubrics, reference answers, or fixture-specific scoring shortcuts"}}
{"run":230,"commit":"9552ed5","metric":244,"metrics":{"tests_total":244,"milestone_index":9,"loc_core":2289,"commit_count_total":253,"memory_error_rate":0,"unsupported_claim_rate":0,"mean_precision_at_k":1,"mean_recall_at_k":1},"status":"keep","description":"require existing claims for embedded vector chunks","timestamp":1778227647626,"segment":26,"confidence":3.642857142857143,"asi":{"hypothesis":"Embedded vector chunk writes should enforce the same existing-claim invariant as metadata-only vector chunk writes","red_evidence":"add_vector_chunk_with_embedding_requires_existing_claim failed because Store::add_vector_chunk_with_embedding(42, ...) errored without a claim-context message","green_evidence":"./autoresearch.sh passed with tests_green=244, tests_total=244, memory_error_rate=0, and autoresearch.checks.sh green","anti_overfit_note":"The change is a generic vector projection referential-integrity invariant shared by embedded and non-embedded paths; it does not depend on benchmark data, BEAM labels, rubrics, reference answers, or fixture-specific scoring shortcuts"}}
{"run":231,"commit":"10fcc55","metric":245,"metrics":{"tests_total":245,"milestone_index":9,"loc_core":2290,"commit_count_total":254,"memory_error_rate":0,"unsupported_claim_rate":0,"mean_precision_at_k":1,"mean_recall_at_k":1},"status":"keep","description":"require existing claims for vector chunk listing","timestamp":1778227696154,"segment":26,"confidence":3.7142857142857144,"asi":{"hypothesis":"Listing vector chunks for a claim should require that the claim exists, so callers can distinguish a missing claim id from an existing claim with no chunks","red_evidence":"list_vector_chunks_for_claim_requires_existing_claim failed because Store::list_vector_chunks_for_claim(42) returned an empty list","green_evidence":"./autoresearch.sh passed with tests_green=245, tests_total=245, memory_error_rate=0, and autoresearch.checks.sh green","anti_overfit_note":"The change is a generic vector projection API integrity invariant; it does not depend on benchmark data, BEAM labels, rubrics, reference answers, or fixture-specific scoring shortcuts"}}
{"run":232,"commit":"dad7b26","metric":246,"metrics":{"tests_total":246,"milestone_index":9,"loc_core":2295,"commit_count_total":255,"memory_error_rate":0,"unsupported_claim_rate":0,"mean_precision_at_k":1,"mean_recall_at_k":1},"status":"keep","description":"report missing vector chunk ids","timestamp":1778227739095,"segment":26,"confidence":3.7857142857142856,"asi":{"hypothesis":"Fetching a vector chunk by id should report a domain-specific missing-vector-chunk error instead of leaking a raw SQLite no-row error","red_evidence":"get_vector_chunk_requires_existing_chunk failed because Store::get_vector_chunk(42) errored without vector chunk context","green_evidence":"./autoresearch.sh passed with tests_green=246, tests_total=246, memory_error_rate=0, and autoresearch.checks.sh green","anti_overfit_note":"The change is a generic vector projection API error-honesty invariant; it does not depend on benchmark data, BEAM labels, rubrics, reference answers, or fixture-specific scoring shortcuts"}}
{"run":233,"commit":"3854b46","metric":247,"metrics":{"tests_total":247,"milestone_index":9,"loc_core":2306,"commit_count_total":256,"memory_error_rate":0,"unsupported_claim_rate":0,"mean_precision_at_k":1,"mean_recall_at_k":1},"status":"keep","description":"validate direct vector ranking limits","timestamp":1778227797634,"segment":26,"confidence":3.7241379310344827,"asi":{"hypothesis":"The low-level vector ranking API should reject zero top_k limits, while the higher-level recall API can preserve its existing zero-top-k no-embed short-circuit","red_evidence":"rank_vector_chunks_by_embedding_rejects_zero_top_k failed because direct ranking returned an empty list for top_k=0","green_evidence":"./autoresearch.sh passed with tests_green=247, tests_total=247, memory_error_rate=0, and autoresearch.checks.sh green","anti_overfit_note":"The change is a generic direct vector retrieval API input-validation invariant and explicitly preserves the existing high-level recall short-circuit behavior; it does not depend on benchmark data, BEAM labels, rubrics, reference answers, or fixture-specific scoring shortcuts"}}
{"run":234,"commit":"76fe204","metric":248,"metrics":{"tests_total":248,"milestone_index":9,"loc_core":2307,"commit_count_total":257,"memory_error_rate":0,"unsupported_claim_rate":0,"mean_precision_at_k":1,"mean_recall_at_k":1},"status":"keep","description":"require existing claims for claim-text vector chunks","timestamp":1778227830523,"segment":26,"confidence":3.6666666666666665,"asi":{"hypothesis":"The convenience path that derives vector text from a claim should report the same domain-specific missing-claim error as direct vector chunk writes","red_evidence":"add_vector_chunk_for_claim_requires_existing_claim failed because Store::add_vector_chunk_for_claim(42, ...) errored without claim context","green_evidence":"./autoresearch.sh passed with tests_green=248, tests_total=248, memory_error_rate=0, and autoresearch.checks.sh green","anti_overfit_note":"The change is a generic vector projection referential-integrity invariant for a convenience API; it does not depend on benchmark data, BEAM labels, rubrics, reference answers, or fixture-specific scoring shortcuts"}}
{"run":235,"commit":"083e923","metric":249,"metrics":{"tests_total":249,"milestone_index":9,"loc_core":2308,"commit_count_total":258,"memory_error_rate":0,"unsupported_claim_rate":0,"mean_precision_at_k":1,"mean_recall_at_k":1},"status":"keep","description":"require existing claims for embedded claim-text vectors","timestamp":1778227904444,"segment":26,"confidence":3.7333333333333334,"asi":{"hypothesis":"The convenience path that embeds canonical claim text should report the same domain-specific missing-claim error as other vector chunk write paths before invoking embedding","red_evidence":"add_embedded_vector_chunk_for_claim_requires_existing_claim failed because Store::add_embedded_vector_chunk_for_claim(42, ...) errored without claim context","green_evidence":"./autoresearch.sh passed with tests_green=249, tests_total=249, memory_error_rate=0, and autoresearch.checks.sh green","anti_overfit_note":"The change is a generic vector projection referential-integrity invariant for a convenience API; it does not depend on benchmark data, BEAM labels, rubrics, reference answers, or fixture-specific scoring shortcuts"}}
{"run":236,"commit":"45e339a","metric":250,"metrics":{"tests_total":250,"milestone_index":9,"loc_core":2316,"commit_count_total":259,"memory_error_rate":0,"unsupported_claim_rate":0,"mean_precision_at_k":1,"mean_recall_at_k":1},"status":"keep","description":"report missing event ids","timestamp":1778228025853,"segment":26,"confidence":3.8,"asi":{"hypothesis":"Fetching an episodic event by id should report a domain-specific missing-event error instead of leaking a raw SQLite no-row error","red_evidence":"get_event_requires_existing_event failed because Store::get_event(42) errored without event context","green_evidence":"./autoresearch.sh passed with tests_green=250, tests_total=250, memory_error_rate=0, and autoresearch.checks.sh green","anti_overfit_note":"The change is a generic episodic-memory API error-honesty invariant; it does not depend on benchmark data, BEAM labels, rubrics, reference answers, or fixture-specific scoring shortcuts"}}
{"run":237,"commit":"d2b6669","metric":251,"metrics":{"tests_total":251,"milestone_index":9,"loc_core":2321,"commit_count_total":260,"memory_error_rate":0,"unsupported_claim_rate":0,"mean_precision_at_k":1,"mean_recall_at_k":1},"status":"keep","description":"report missing candidate claim ids","timestamp":1778228073741,"segment":26,"confidence":3.7419354838709675,"asi":{"hypothesis":"Fetching a candidate claim by id should report a domain-specific missing-candidate error instead of leaking a raw SQLite no-row error","red_evidence":"get_candidate_claim_requires_existing_candidate failed because Store::get_candidate_claim(42) errored without candidate context","green_evidence":"./autoresearch.sh passed with tests_green=251, tests_total=251, memory_error_rate=0, and autoresearch.checks.sh green","anti_overfit_note":"The change is a generic staged-memory API error-honesty invariant; it does not depend on benchmark data, BEAM labels, rubrics, reference answers, or fixture-specific scoring shortcuts"}}
{"run":238,"commit":"9b7a411","metric":252,"metrics":{"tests_total":252,"milestone_index":9,"loc_core":2327,"commit_count_total":261,"memory_error_rate":0,"unsupported_claim_rate":0,"mean_precision_at_k":1,"mean_recall_at_k":1},"status":"keep","description":"report missing claim ids","timestamp":1778228130981,"segment":26,"confidence":3.6875,"asi":{"hypothesis":"Fetching a durable claim by id should report a domain-specific missing-claim error instead of leaking a raw SQLite no-row error","red_evidence":"get_claim_requires_existing_claim failed because Store::get_claim(42) errored without claim context","green_evidence":"./autoresearch.sh passed with tests_green=252, tests_total=252, memory_error_rate=0, and autoresearch.checks.sh green","anti_overfit_note":"The change is a generic durable-claim API error-honesty invariant; it does not depend on benchmark data, BEAM labels, rubrics, reference answers, or fixture-specific scoring shortcuts"}}
{"run":239,"commit":"8efc0dc","metric":253,"metrics":{"tests_total":253,"milestone_index":9,"loc_core":2328,"commit_count_total":262,"memory_error_rate":0,"unsupported_claim_rate":0,"mean_precision_at_k":1,"mean_recall_at_k":1},"status":"keep","description":"validate claim sources before logging","timestamp":1778228209817,"segment":26,"confidence":3.75,"asi":{"hypothesis":"Core claim writes should require non-empty source labels before append-only logging so provenance remains auditable","red_evidence":"add_claim_rejects_empty_source_before_log_write failed because Store::add_claim accepted a blank source and wrote claim id 1","green_evidence":"./autoresearch.sh passed with tests_green=253, tests_total=253, memory_error_rate=0, and autoresearch.checks.sh green","anti_overfit_note":"The change is a generic claim provenance integrity invariant enforced before log-first writes; it does not depend on benchmark data, BEAM labels, rubrics, reference answers, or fixture-specific scoring shortcuts"}}
{"run":240,"commit":"d6d980b","metric":254,"metrics":{"tests_total":254,"milestone_index":9,"loc_core":2329,"commit_count_total":263,"memory_error_rate":0,"unsupported_claim_rate":0,"mean_precision_at_k":1,"mean_recall_at_k":1},"status":"keep","description":"validate event sources before logging","timestamp":1778228260936,"segment":26,"confidence":3.8125,"asi":{"hypothesis":"Core episodic event writes should require non-empty source labels before append-only event logging so event provenance remains auditable","red_evidence":"record_event_rejects_empty_source_before_log_write failed because Store::record_event accepted a blank source and wrote event id 1","green_evidence":"./autoresearch.sh passed with tests_green=254, tests_total=254, memory_error_rate=0, and autoresearch.checks.sh green","anti_overfit_note":"The change is a generic episodic provenance integrity invariant enforced before event-log writes; it does not depend on benchmark data, BEAM labels, rubrics, reference answers, or fixture-specific scoring shortcuts"}}
{"run":241,"commit":"7f0fd0a","metric":255,"metrics":{"tests_total":255,"milestone_index":9,"loc_core":2329,"commit_count_total":264,"memory_error_rate":0,"unsupported_claim_rate":0,"mean_precision_at_k":1,"mean_recall_at_k":1},"status":"keep","description":"reject relative env privacy paths","timestamp":1778228327222,"segment":26,"confidence":3.757575757575758,"asi":{"hypothesis":"The privacy path filter should reject relative .env file paths, not only paths containing '/.env', to avoid false negatives for common project-local secrets","red_evidence":"privacy_filter_path_rejects_relative_env_file failed because privacy_filter_path(\".env\") returned Ok(())","green_evidence":"./autoresearch.sh passed with tests_green=255, tests_total=255, memory_error_rate=0, and autoresearch.checks.sh green","anti_overfit_note":"The change strengthens a generic privacy guardrail for local path filtering; it does not depend on benchmark data, BEAM labels, rubrics, reference answers, or fixture-specific scoring shortcuts"}}
{"run":242,"commit":"f172146","metric":256,"metrics":{"tests_total":256,"milestone_index":9,"loc_core":2329,"commit_count_total":265,"memory_error_rate":0,"unsupported_claim_rate":0,"mean_precision_at_k":1,"mean_recall_at_k":1},"status":"keep","description":"reject relative ssh privacy paths","timestamp":1778228390054,"segment":26,"confidence":3.7058823529411766,"asi":{"hypothesis":"The privacy path filter should reject relative .ssh paths, not only absolute paths containing '/.ssh/', to avoid false negatives for project-local SSH material","red_evidence":"privacy_filter_path_rejects_relative_ssh_dir failed because privacy_filter_path(\".ssh/id_rsa\") returned Ok(())","green_evidence":"./autoresearch.sh passed with tests_green=256, tests_total=256, memory_error_rate=0, and autoresearch.checks.sh green","anti_overfit_note":"The change strengthens a generic privacy guardrail for local path filtering; it does not depend on benchmark data, BEAM labels, rubrics, reference answers, or fixture-specific scoring shortcuts"}}
{"run":243,"commit":"591519e","metric":257,"metrics":{"tests_total":257,"milestone_index":9,"loc_core":2329,"commit_count_total":266,"memory_error_rate":0,"unsupported_claim_rate":0,"mean_precision_at_k":1,"mean_recall_at_k":1},"status":"keep","description":"reject relative aws credentials privacy paths","timestamp":1778228445139,"segment":26,"confidence":3.764705882352941,"asi":{"hypothesis":"The privacy path filter should reject relative .aws/credentials paths, not only absolute paths ending in '/.aws/credentials', to avoid false negatives for project-local cloud credentials","red_evidence":"privacy_filter_path_rejects_relative_aws_credentials_file failed because privacy_filter_path(\".aws/credentials\") returned Ok(())","green_evidence":"./autoresearch.sh passed with tests_green=257, tests_total=257, memory_error_rate=0, and autoresearch.checks.sh green","anti_overfit_note":"The change strengthens a generic privacy guardrail for local path filtering; it does not depend on benchmark data, BEAM labels, rubrics, reference answers, or fixture-specific scoring shortcuts"}}
{"run":244,"commit":"eca68bb","metric":258,"metrics":{"tests_total":258,"milestone_index":9,"loc_core":2329,"commit_count_total":267,"memory_error_rate":0,"unsupported_claim_rate":0,"mean_precision_at_k":1,"mean_recall_at_k":1},"status":"keep","description":"reject relative config privacy paths","timestamp":1778228526792,"segment":26,"confidence":3.823529411764706,"asi":{"hypothesis":"The privacy path filter should reject relative .config paths, not only absolute paths containing '/.config/', to avoid false negatives for project-local sensitive configuration","red_evidence":"privacy_filter_path_rejects_relative_config_dir failed because privacy_filter_path(\".config/aver/secrets.toml\") returned Ok(())","green_evidence":"./autoresearch.sh passed with tests_green=258, tests_total=258, memory_error_rate=0, and autoresearch.checks.sh green","anti_overfit_note":"The change strengthens a generic privacy guardrail for local path filtering; it does not depend on benchmark data, BEAM labels, rubrics, reference answers, or fixture-specific scoring shortcuts"}}
{"run":245,"commit":"0096584","metric":259,"metrics":{"tests_total":259,"milestone_index":9,"loc_core":2332,"commit_count_total":268,"memory_error_rate":0,"unsupported_claim_rate":0,"mean_precision_at_k":1,"mean_recall_at_k":1},"status":"keep","description":"reject relative secrets privacy paths","timestamp":1778228588424,"segment":26,"confidence":3.7714285714285714,"asi":{"hypothesis":"The privacy path filter should reject relative .secrets.d paths, not only home-relative or absolute paths, to avoid false negatives for project-local secret directories","red_evidence":"privacy_filter_path_rejects_relative_secrets_dir failed because privacy_filter_path(\".secrets.d/token\") returned Ok(())","green_evidence":"./autoresearch.sh passed with tests_green=259, tests_total=259, memory_error_rate=0, and autoresearch.checks.sh green","anti_overfit_note":"The change strengthens a generic privacy guardrail for local path filtering; it does not depend on benchmark data, BEAM labels, rubrics, reference answers, or fixture-specific scoring shortcuts"}}
{"run":246,"commit":"9ec658a","metric":260,"metrics":{"tests_total":260,"milestone_index":9,"loc_core":2332,"commit_count_total":269,"memory_error_rate":0,"unsupported_claim_rate":0,"mean_precision_at_k":1,"mean_recall_at_k":1},"status":"keep","description":"reject envrc privacy paths","timestamp":1778228666621,"segment":26,"confidence":3.7222222222222223,"asi":{"hypothesis":"The privacy path filter should reject .envrc files alongside .env files because they commonly carry local environment secrets","red_evidence":"privacy_filter_path_rejects_envrc_file failed because privacy_filter_path(\".envrc\") returned Ok(())","green_evidence":"./autoresearch.sh passed with tests_green=260, tests_total=260, memory_error_rate=0, and autoresearch.checks.sh green","anti_overfit_note":"The change strengthens a generic privacy guardrail for local environment-file filtering; it does not depend on benchmark data, BEAM labels, rubrics, reference answers, or fixture-specific scoring shortcuts"}}
{"run":247,"commit":"92b6613","metric":261,"metrics":{"tests_total":261,"milestone_index":9,"loc_core":2332,"commit_count_total":270,"memory_error_rate":0,"unsupported_claim_rate":0,"mean_precision_at_k":1,"mean_recall_at_k":1},"status":"keep","description":"reject OpenSSH private keys","timestamp":1778228733336,"segment":26,"confidence":3.7777777777777777,"asi":{"hypothesis":"The privacy content filter should reject OpenSSH private-key headers in addition to generic private-key headers","red_evidence":"privacy_filter_rejects_openssh_private_key_header failed because a split synthetic OpenSSH private-key header returned Ok(())","green_evidence":"./autoresearch.sh passed with tests_green=261, tests_total=261, memory_error_rate=0, and autoresearch.checks.sh green","anti_overfit_note":"The change strengthens a generic privacy guardrail for secret material detection; it does not depend on benchmark data, BEAM labels, rubrics, reference answers, or fixture-specific scoring shortcuts"}}
{"run":248,"commit":"7d3c504","metric":262,"metrics":{"tests_total":262,"milestone_index":9,"loc_core":2335,"commit_count_total":271,"memory_error_rate":0,"unsupported_claim_rate":0,"mean_precision_at_k":1,"mean_recall_at_k":1},"status":"keep","description":"reject RSA private keys","timestamp":1778228801471,"segment":26,"confidence":3.8333333333333335,"asi":{"hypothesis":"The privacy content filter should reject RSA private-key headers in addition to generic and OpenSSH private-key headers","red_evidence":"privacy_filter_rejects_rsa_private_key_header failed because a split synthetic RSA private-key header returned Ok(())","green_evidence":"./autoresearch.sh passed with tests_green=262, tests_total=262, memory_error_rate=0, and autoresearch.checks.sh green","anti_overfit_note":"The change strengthens a generic privacy guardrail for secret material detection; it does not depend on benchmark data, BEAM labels, rubrics, reference answers, or fixture-specific scoring shortcuts"}}
