{"run":186,"commit":"e2484b1","metric":201,"metrics":{"tests_total":201,"milestone_index":9,"loc_core":2103,"commit_count_total":210,"memory_error_rate":0,"unsupported_claim_rate":0,"mean_precision_at_k":1,"mean_recall_at_k":1},"status":"keep","description":"validate recall top-k bounds","timestamp":1778224545159,"segment":26,"confidence":4,"asi":{"hypothesis":"The ADR-0008 recall surface should reject invalid top_k values instead of silently clamping zero to one, keeping retrieval budgets explicit for agents","red_evidence":"recall_tool_rejects_zero_top_k failed because AverTools::recall accepted top_k=0 and returned a successful empty RecallView","green_evidence":"./autoresearch.sh passed with tests_green=201, tests_total=201, memory_error_rate=0, and autoresearch.checks.sh green","anti_overfit_note":"The change validates a generic recall result-limit parameter; it does not depend on benchmark data, BEAM labels, rubrics, reference answers, or ability categories"}}
{"run":187,"commit":"46d9a38","metric":202,"metrics":{"tests_total":202,"milestone_index":9,"loc_core":2103,"commit_count_total":211,"memory_error_rate":0,"unsupported_claim_rate":0,"mean_precision_at_k":1,"mean_recall_at_k":1},"status":"keep","description":"return graph context from recall","timestamp":1778224613134,"segment":26,"confidence":3.6,"asi":{"hypothesis":"ADR-0008 recall should return a subgraph as well as triples, so entity queries should include bounded graph context from the same expansion machinery used by expand","red_evidence":"recall_tool_returns_graph_context_for_entity_query failed because RecallView.subgraph was always empty despite a PaymentGateway depends_on StripeSDK claim","green_evidence":"./autoresearch.sh passed with tests_green=202, tests_total=202, memory_error_rate=0, and autoresearch.checks.sh green","anti_overfit_note":"The change implements generic entity graph context for recall using Store::expand over the query string; it does not use benchmark data, BEAM labels, rubrics, reference answers, or fixture-specific scoring shortcuts"}}
{"run":188,"commit":"a1d3e5e","metric":203,"metrics":{"tests_total":203,"milestone_index":9,"loc_core":2103,"commit_count_total":212,"memory_error_rate":0,"unsupported_claim_rate":0,"mean_precision_at_k":1,"mean_recall_at_k":1},"status":"keep","description":"expand recall graph from retrieved claim subject","timestamp":1778224652450,"segment":26,"confidence":3.3333333333333335,"asi":{"hypothesis":"When a recall query is a natural-language phrase rather than an exact entity id, recall should still provide graph context by expanding from the top recalled claim subject","red_evidence":"recall_tool_expands_graph_from_recalled_claim_subject_when_query_is_phrase failed because RecallView.subgraph remained empty for 'what depends on PaymentGateway' despite a recalled PaymentGateway triple","green_evidence":"./autoresearch.sh passed with tests_green=203, tests_total=203, memory_error_rate=0, and autoresearch.checks.sh green","anti_overfit_note":"The fallback is generic retrieval-to-graph expansion based on the top recalled claim subject; it does not use benchmark data, BEAM labels, rubrics, reference answers, or fixture-specific scoring shortcuts"}}
{"run":189,"commit":"b179ac9","metric":204,"metrics":{"tests_total":204,"milestone_index":9,"loc_core":2103,"commit_count_total":213,"memory_error_rate":0,"unsupported_claim_rate":0,"mean_precision_at_k":1,"mean_recall_at_k":1},"status":"keep","description":"report recall confidence floor","timestamp":1778224709757,"segment":26,"confidence":3.6666666666666665,"asi":{"hypothesis":"ADR-0008 recall's confidence_floor should reflect the minimum confidence among returned triples rather than always reporting 0.0","red_evidence":"recall_tool_reports_confidence_floor_for_returned_triples failed because a single returned triple with confidence 0.4 still produced confidence_floor=0.0","green_evidence":"./autoresearch.sh passed with tests_green=204, tests_total=204, memory_error_rate=0, and autoresearch.checks.sh green","anti_overfit_note":"The change computes a generic response metadata field from returned claims; it does not depend on benchmark data, BEAM labels, rubrics, reference answers, or fixture-specific scoring shortcuts"}}
{"run":190,"commit":"459ff4e","metric":205,"metrics":{"tests_total":205,"milestone_index":9,"loc_core":2103,"commit_count_total":214,"memory_error_rate":0,"unsupported_claim_rate":0,"mean_precision_at_k":1,"mean_recall_at_k":1},"status":"keep","description":"include recall subgraph in confidence floor","timestamp":1778224767143,"segment":26,"confidence":4,"asi":{"hypothesis":"Recall confidence_floor should cover the whole returned memory slice, including graph-context edges, not only the top_k direct triples","red_evidence":"recall_tool_confidence_floor_includes_subgraph_edges failed because direct triples had floor 0.95 while a returned subgraph edge had confidence 0.4","green_evidence":"./autoresearch.sh passed with tests_green=205, tests_total=205, memory_error_rate=0, and autoresearch.checks.sh green","anti_overfit_note":"The change computes response metadata from returned graph data generally; it does not depend on benchmark data, BEAM labels, rubrics, reference answers, or fixture-specific scoring shortcuts"}}
{"run":191,"commit":"98f67d3","metric":206,"metrics":{"tests_total":206,"milestone_index":9,"loc_core":2103,"commit_count_total":215,"memory_error_rate":0,"unsupported_claim_rate":0,"mean_precision_at_k":1,"mean_recall_at_k":1},"status":"keep","description":"reject unsupported consolidation scopes","timestamp":1778224838310,"segment":26,"confidence":3.7142857142857144,"asi":{"hypothesis":"Until scoped consolidation is implemented, the ADR-0008 consolidate tool should reject unsupported scope values instead of silently running global consolidation","red_evidence":"consolidate_tool_rejects_unsupported_scope failed because consolidate(scope='session:abc') returned a successful zero-count global-looking report","green_evidence":"./autoresearch.sh passed with tests_green=206, tests_total=206, memory_error_rate=0, and autoresearch.checks.sh green","anti_overfit_note":"The change is generic public API honesty for unimplemented scoped consolidation; it does not depend on benchmark data, BEAM labels, rubrics, reference answers, or fixture-specific scoring shortcuts"}}
{"run":192,"commit":"78f10c2","metric":207,"metrics":{"tests_total":207,"milestone_index":9,"loc_core":2103,"commit_count_total":216,"memory_error_rate":0,"unsupported_claim_rate":0,"mean_precision_at_k":1,"mean_recall_at_k":1},"status":"keep","description":"validate extraction trigger threshold","timestamp":1778224896788,"segment":26,"confidence":3.5,"asi":{"hypothesis":"The should_extract_memories operational MCP tool should reject a zero event_threshold instead of treating an invalid trigger budget as a normal request","red_evidence":"should_extract_memories_rejects_zero_event_threshold failed because event_threshold=0 returned ShouldExtractMemoriesView { should_extract: false }","green_evidence":"./autoresearch.sh passed with tests_green=207, tests_total=207, memory_error_rate=0, and autoresearch.checks.sh green","anti_overfit_note":"The change validates a generic extraction-trigger API parameter; it does not depend on benchmark data, BEAM labels, rubrics, reference answers, or fixture-specific scoring shortcuts"}}
{"run":193,"commit":"c6cec00","metric":208,"metrics":{"tests_total":208,"milestone_index":9,"loc_core":2103,"commit_count_total":217,"memory_error_rate":0,"unsupported_claim_rate":0,"mean_precision_at_k":1,"mean_recall_at_k":1},"status":"keep","description":"validate event session ids","timestamp":1778224955314,"segment":26,"confidence":3.75,"asi":{"hypothesis":"The record_event operational MCP tool should reject empty session ids so episodic events remain partitionable and auditable","red_evidence":"record_event_tool_rejects_empty_session_id failed because an empty session_id was accepted and persisted as an EventView","green_evidence":"./autoresearch.sh passed with tests_green=208, tests_total=208, memory_error_rate=0, and autoresearch.checks.sh green","anti_overfit_note":"The change validates generic episodic event metadata; it does not depend on benchmark data, BEAM labels, rubrics, reference answers, or fixture-specific scoring shortcuts"}}
{"run":194,"commit":"1b51161","metric":209,"metrics":{"tests_total":209,"milestone_index":9,"loc_core":2103,"commit_count_total":218,"memory_error_rate":0,"unsupported_claim_rate":0,"mean_precision_at_k":1,"mean_recall_at_k":1},"status":"keep","description":"validate event kinds","timestamp":1778225076834,"segment":26,"confidence":4,"asi":{"hypothesis":"The record_event operational MCP tool should reject blank event kinds so episodic logs remain typed and auditable","red_evidence":"record_event_tool_rejects_empty_kind failed because a blank kind was accepted and persisted as an EventView","green_evidence":"./autoresearch.sh passed with tests_green=209, tests_total=209, memory_error_rate=0, and autoresearch.checks.sh green","anti_overfit_note":"The change validates generic episodic event metadata; it does not depend on benchmark data, BEAM labels, rubrics, reference answers, or fixture-specific scoring shortcuts"}}
{"run":195,"commit":"4c7c914","metric":210,"metrics":{"tests_total":210,"milestone_index":9,"loc_core":2103,"commit_count_total":219,"memory_error_rate":0,"unsupported_claim_rate":0,"mean_precision_at_k":1,"mean_recall_at_k":1},"status":"keep","description":"validate add-triple subjects","timestamp":1778225159891,"segment":26,"confidence":3.7777777777777777,"asi":{"hypothesis":"The ADR-0008 add_triple tool should reject blank subjects so durable graph claims remain traversable and auditable","red_evidence":"add_triple_rejects_empty_subject failed because a whitespace-only subject was accepted and appended as a durable triple","green_evidence":"./autoresearch.sh passed with tests_green=210, tests_total=210, memory_error_rate=0, and autoresearch.checks.sh green","anti_overfit_note":"The change validates generic write-side graph data shape; it does not depend on benchmark data, BEAM labels, rubrics, reference answers, or fixture-specific scoring shortcuts"}}
{"run":196,"commit":"f263275","metric":211,"metrics":{"tests_total":211,"milestone_index":9,"loc_core":2103,"commit_count_total":220,"memory_error_rate":0,"unsupported_claim_rate":0,"mean_precision_at_k":1,"mean_recall_at_k":1},"status":"keep","description":"validate add-triple predicates","timestamp":1778225237954,"segment":26,"confidence":3.6,"asi":{"hypothesis":"The ADR-0008 add_triple tool should reject blank predicates so durable graph claims have meaningful relationship labels","red_evidence":"add_triple_rejects_empty_predicate failed because a whitespace-only predicate was accepted and appended as a durable triple","green_evidence":"./autoresearch.sh passed with tests_green=211, tests_total=211, memory_error_rate=0, and autoresearch.checks.sh green","anti_overfit_note":"The change validates generic write-side graph data shape; it does not depend on benchmark data, BEAM labels, rubrics, reference answers, or fixture-specific scoring shortcuts"}}
{"run":197,"commit":"b8f957f","metric":212,"metrics":{"tests_total":212,"milestone_index":9,"loc_core":2103,"commit_count_total":221,"memory_error_rate":0,"unsupported_claim_rate":0,"mean_precision_at_k":1,"mean_recall_at_k":1},"status":"keep","description":"validate add-triple objects","timestamp":1778225272515,"segment":26,"confidence":3.8,"asi":{"hypothesis":"The ADR-0008 add_triple tool should reject blank objects so durable graph claims have traversable endpoints","red_evidence":"add_triple_rejects_empty_object failed because a whitespace-only object was accepted and appended as a durable triple","green_evidence":"./autoresearch.sh passed with tests_green=212, tests_total=212, memory_error_rate=0, and autoresearch.checks.sh green","anti_overfit_note":"The change validates generic write-side graph data shape; it does not depend on benchmark data, BEAM labels, rubrics, reference answers, or fixture-specific scoring shortcuts"}}
{"run":198,"commit":"10c4a7e","metric":213,"metrics":{"tests_total":213,"milestone_index":9,"loc_core":2103,"commit_count_total":222,"memory_error_rate":0,"unsupported_claim_rate":0,"mean_precision_at_k":1,"mean_recall_at_k":1},"status":"keep","description":"validate remember-claim subjects","timestamp":1778225319958,"segment":26,"confidence":4,"asi":{"hypothesis":"The legacy remember_claim MCP tool should enforce the same non-empty subject invariant as add_triple so both write paths preserve traversable graph endpoints","red_evidence":"remember_claim_rejects_empty_subject failed because a whitespace-only subject was accepted and persisted as an active claim","green_evidence":"./autoresearch.sh passed with tests_green=213, tests_total=213, memory_error_rate=0, and autoresearch.checks.sh green","anti_overfit_note":"The change validates generic write-side graph data shape on an existing public API; it does not depend on benchmark data, BEAM labels, rubrics, reference answers, or fixture-specific scoring shortcuts"}}
{"run":199,"commit":"51da563","metric":214,"metrics":{"tests_total":214,"milestone_index":9,"loc_core":2103,"commit_count_total":223,"memory_error_rate":0,"unsupported_claim_rate":0,"mean_precision_at_k":1,"mean_recall_at_k":1},"status":"keep","description":"validate remember-claim predicates","timestamp":1778225395423,"segment":26,"confidence":3.8181818181818183,"asi":{"hypothesis":"The legacy remember_claim MCP tool should reject blank predicates so both write surfaces preserve meaningful relationship labels","red_evidence":"remember_claim_rejects_empty_predicate failed because a whitespace-only predicate was accepted and persisted as an active claim","green_evidence":"./autoresearch.sh passed with tests_green=214, tests_total=214, memory_error_rate=0, and autoresearch.checks.sh green","anti_overfit_note":"The change validates generic write-side graph data shape on an existing public API; it does not depend on benchmark data, BEAM labels, rubrics, reference answers, or fixture-specific scoring shortcuts"}}
{"run":200,"commit":"394ae5c","metric":215,"metrics":{"tests_total":215,"milestone_index":9,"loc_core":2103,"commit_count_total":224,"memory_error_rate":0,"unsupported_claim_rate":0,"mean_precision_at_k":1,"mean_recall_at_k":1},"status":"keep","description":"validate remember-claim objects","timestamp":1778225466259,"segment":26,"confidence":3.6666666666666665,"asi":{"hypothesis":"The legacy remember_claim MCP tool should reject blank objects so both write surfaces preserve traversable graph endpoints","red_evidence":"remember_claim_rejects_empty_object failed because a whitespace-only object was accepted and persisted as an active claim","green_evidence":"./autoresearch.sh passed with tests_green=215, tests_total=215, memory_error_rate=0, and autoresearch.checks.sh green","anti_overfit_note":"The change validates generic write-side graph data shape on an existing public API; it does not depend on benchmark data, BEAM labels, rubrics, reference answers, or fixture-specific scoring shortcuts"}}
{"run":201,"commit":"e7ef500","metric":216,"metrics":{"tests_total":216,"milestone_index":9,"loc_core":2116,"commit_count_total":225,"memory_error_rate":0,"unsupported_claim_rate":0,"mean_precision_at_k":1,"mean_recall_at_k":1},"status":"keep","description":"validate core claim subjects before logging","timestamp":1778225610937,"segment":26,"confidence":3.8333333333333335,"asi":{"hypothesis":"The core Store write path should enforce non-empty claim fields before privacy filtering and append-only logging, not rely only on server-side API validation","red_evidence":"add_claim_rejects_empty_subject_before_log_write failed because Store::add_claim accepted a whitespace-only subject and returned claim id 1","green_evidence":"./autoresearch.sh passed with tests_green=216, tests_total=216, memory_error_rate=0, and autoresearch.checks.sh green","anti_overfit_note":"The change is a generic core data-integrity invariant for all claim writers; it does not depend on benchmark data, BEAM labels, rubrics, reference answers, or fixture-specific scoring shortcuts"}}
{"run":202,"commit":"d0d11fd","metric":217,"metrics":{"tests_total":217,"milestone_index":9,"loc_core":2128,"commit_count_total":226,"memory_error_rate":0,"unsupported_claim_rate":0,"mean_precision_at_k":1,"mean_recall_at_k":1},"status":"keep","description":"validate core event session ids before logging","timestamp":1778225734371,"segment":26,"confidence":4,"asi":{"hypothesis":"The core Store event path should reject blank session ids before append-only event logging, not rely only on server-side validation","red_evidence":"record_event_rejects_empty_session_id_before_log_write failed because Store::record_event accepted a whitespace-only session_id and returned event id 1","green_evidence":"./autoresearch.sh passed with tests_green=217, tests_total=217, memory_error_rate=0, and autoresearch.checks.sh green","anti_overfit_note":"The change is a generic core episodic-log integrity invariant for all event writers; it does not depend on benchmark data, BEAM labels, rubrics, reference answers, or fixture-specific scoring shortcuts"}}
{"run":203,"commit":"15877c7","metric":218,"metrics":{"tests_total":218,"milestone_index":9,"loc_core":2131,"commit_count_total":227,"memory_error_rate":0,"unsupported_claim_rate":0,"mean_precision_at_k":1,"mean_recall_at_k":1},"status":"keep","description":"validate candidate claim subjects","timestamp":1778225817577,"segment":26,"confidence":3.8461538461538463,"asi":{"hypothesis":"Candidate claims should enforce the same non-empty subject invariant as durable claims before staging extracted memory","red_evidence":"propose_candidate_claim_rejects_empty_subject failed because a whitespace-only candidate subject was accepted and staged","green_evidence":"./autoresearch.sh passed with tests_green=218, tests_total=218, memory_error_rate=0, and autoresearch.checks.sh green","anti_overfit_note":"The change is a generic staged-claim data-integrity invariant for extractor and MCP candidate flows; it does not depend on benchmark data, BEAM labels, rubrics, reference answers, or fixture-specific scoring shortcuts"}}
{"run":204,"commit":"5e10575","metric":219,"metrics":{"tests_total":219,"milestone_index":9,"loc_core":2142,"commit_count_total":228,"memory_error_rate":0,"unsupported_claim_rate":0,"mean_precision_at_k":1,"mean_recall_at_k":1},"status":"keep","description":"validate vector chunk text","timestamp":1778225964351,"segment":26,"confidence":3.7142857142857144,"asi":{"hypothesis":"Vector chunk rows should reject blank text so the vector projection cannot accumulate empty, unembeddable retrieval units","red_evidence":"add_vector_chunk_rejects_empty_text failed because Store::add_vector_chunk accepted whitespace-only text and inserted chunk id 1","green_evidence":"./autoresearch.sh passed with tests_green=219, tests_total=219, memory_error_rate=0, and autoresearch.checks.sh green","anti_overfit_note":"The change is a generic vector-store data-integrity invariant; it does not depend on benchmark data, BEAM labels, rubrics, reference answers, or fixture-specific scoring shortcuts"}}
{"run":205,"commit":"3ac3532","metric":220,"metrics":{"tests_total":220,"milestone_index":9,"loc_core":2153,"commit_count_total":229,"memory_error_rate":0,"unsupported_claim_rate":0,"mean_precision_at_k":1,"mean_recall_at_k":1},"status":"keep","description":"validate vector embedding models","timestamp":1778226584068,"segment":26,"confidence":3.6,"asi":{"hypothesis":"Vector chunk rows should reject blank embedding model identifiers so stored embeddings remain attributable to a concrete model/projection","red_evidence":"add_vector_chunk_rejects_empty_embedding_model failed because Store::add_vector_chunk accepted a whitespace-only embedding_model and inserted chunk id 1","green_evidence":"./autoresearch.sh passed with tests_green=220, tests_total=220, memory_error_rate=0, and autoresearch.checks.sh green","anti_overfit_note":"The change is a generic vector metadata integrity invariant; it does not depend on benchmark data, BEAM labels, rubrics, reference answers, or fixture-specific scoring shortcuts"}}
{"run":206,"commit":"76773b2","metric":221,"metrics":{"tests_total":221,"milestone_index":9,"loc_core":2155,"commit_count_total":230,"memory_error_rate":0,"unsupported_claim_rate":0,"mean_precision_at_k":1,"mean_recall_at_k":1},"status":"keep","description":"validate embedded vector chunk text","timestamp":1778226620407,"segment":26,"confidence":3.5,"asi":{"hypothesis":"Embedded vector chunk writes should enforce the same non-empty text invariant as metadata-only vector chunk writes","red_evidence":"add_vector_chunk_with_embedding_rejects_empty_text failed because Store::add_vector_chunk_with_embedding accepted whitespace-only text and inserted chunk id 1","green_evidence":"./autoresearch.sh passed with tests_green=221, tests_total=221, memory_error_rate=0, and autoresearch.checks.sh green","anti_overfit_note":"The change is a generic vector projection integrity invariant shared by embedded and non-embedded paths; it does not depend on benchmark data, BEAM labels, rubrics, reference answers, or fixture-specific scoring shortcuts"}}
