{"run":500,"commit":"e2b1d73","metric":64,"metrics":{"tests_green":64,"tests_total":65,"milestone_index":9,"loc_core":5006,"commit_count_total":527,"memory_error_rate":0,"unsupported_claim_rate":0,"mean_precision_at_k":1,"mean_recall_at_k":1,"beam_questions":0,"beam_rubric_checks":0,"beam_abstention_pct":0,"beam_contradiction_resolution_pct":0,"beam_event_ordering_pct":0,"beam_information_extraction_pct":0,"beam_instruction_following_pct":0,"beam_knowledge_update_pct":0,"beam_multi_session_reasoning_pct":0,"beam_preference_following_pct":0,"beam_summarization_pct":0,"beam_temporal_reasoning_pct":0},"status":"crash","description":"Claim write timestamp trigger masked confidence fixture","timestamp":1778426519881,"segment":28,"confidence":3.3620689655172415,"asi":{"hypothesis":"Durable claim write_ts values should be positive at the schema layer because log-first projections should not retain zero audit timestamps.","red_evidence":"`cargo test -q -p aver-core --test migrations claims_write_ts_must_be_positive` failed because direct SQL accepted `write_ts = 0`.","rollback_reason":"Full `./autoresearch.sh` failed in `migration_0009_rejects_out_of_range_confidence_and_invalid_status` because two raw-SQL confidence fixtures omit write_ts, so the new write_ts trigger masked the intended confidence trigger assertion.","next_action_hint":"Reapply the write_ts positivity test and migration, but first update `crates/aver-core/tests/claims.rs` confidence fixtures to include `write_ts = 1` along with positive created_at/last_seen_at before rerunning autoresearch.","anti_overfit_note":"This is a general log-first audit timestamp invariant and does not use benchmark expected outputs or labels."}}
{"run":501,"commit":"5f82982","metric":590,"metrics":{"tests_green":590,"tests_total":590,"milestone_index":9,"loc_core":5006,"commit_count_total":527,"memory_error_rate":0,"unsupported_claim_rate":0,"mean_precision_at_k":1,"mean_recall_at_k":1,"beam_questions":0,"beam_rubric_checks":0,"beam_abstention_pct":0,"beam_contradiction_resolution_pct":0,"beam_event_ordering_pct":0,"beam_information_extraction_pct":0,"beam_instruction_following_pct":0,"beam_knowledge_update_pct":0,"beam_multi_session_reasoning_pct":0,"beam_preference_following_pct":0,"beam_summarization_pct":0,"beam_temporal_reasoning_pct":0},"status":"keep","description":"Reject non-positive durable claim write timestamps","timestamp":1778426587802,"segment":28,"confidence":3.3793103448275863,"asi":{"hypothesis":"Durable claim write_ts values should be positive at the schema layer because log-first projections should not retain zero audit timestamps.","red_evidence":"`cargo test -q -p aver-core --test migrations claims_write_ts_must_be_positive` failed because direct SQL accepted `write_ts = 0`.","green_evidence":"Targeted write_ts test passed; confidence-trigger fixture regression test passed; full migrations test passed; `./autoresearch.sh` passed with checks green and metrics tests_green=590 tests_total=590.","implementation_notes":"Added migration `0078_claim_write_ts_positive_checks.sql` with insert/update triggers rejecting claims rows whose write_ts is <= 0. Updated raw confidence-trigger fixtures to provide `write_ts = 1` so the new timestamp invariant does not mask their intended confidence assertions.","anti_overfit_note":"This is a general log-first audit timestamp invariant and does not use benchmark expected outputs or labels."}}
{"run":502,"commit":"50a635b","metric":591,"metrics":{"tests_green":591,"tests_total":591,"milestone_index":9,"loc_core":5006,"commit_count_total":528,"memory_error_rate":0,"unsupported_claim_rate":0,"mean_precision_at_k":1,"mean_recall_at_k":1,"beam_questions":0,"beam_rubric_checks":0,"beam_abstention_pct":0,"beam_contradiction_resolution_pct":0,"beam_event_ordering_pct":0,"beam_information_extraction_pct":0,"beam_instruction_following_pct":0,"beam_knowledge_update_pct":0,"beam_multi_session_reasoning_pct":0,"beam_preference_following_pct":0,"beam_summarization_pct":0,"beam_temporal_reasoning_pct":0},"status":"keep","description":"Reject non-positive claim verification timestamps","timestamp":1778426666623,"segment":28,"confidence":3.396551724137931,"asi":{"hypothesis":"Durable claim last_verified_at is optional, but when set it should be positive because Store uses real timestamps for policy scoring and audit chronology.","red_evidence":"`cargo test -q -p aver-core --test migrations claims_last_verified_at_must_be_positive_when_set` failed because direct SQL accepted `last_verified_at = 0`.","green_evidence":"Targeted last_verified_at test passed; full migrations test passed with 77 tests; `./autoresearch.sh` passed with checks green and metrics tests_green=591 tests_total=591.","implementation_notes":"Added migration `0079_claim_last_verified_at_positive_checks.sql` with insert/update triggers rejecting claims rows whose non-null last_verified_at is <= 0 while preserving NULL as a valid optional value.","anti_overfit_note":"This is a general durable claim verification timestamp invariant and does not use benchmark expected outputs or labels."}}
{"run":503,"commit":"72cfba5","metric":592,"metrics":{"tests_green":592,"tests_total":592,"milestone_index":9,"loc_core":5006,"commit_count_total":529,"memory_error_rate":0,"unsupported_claim_rate":0,"mean_precision_at_k":1,"mean_recall_at_k":1,"beam_questions":0,"beam_rubric_checks":0,"beam_abstention_pct":0,"beam_contradiction_resolution_pct":0,"beam_event_ordering_pct":0,"beam_information_extraction_pct":0,"beam_instruction_following_pct":0,"beam_knowledge_update_pct":0,"beam_multi_session_reasoning_pct":0,"beam_preference_following_pct":0,"beam_summarization_pct":0,"beam_temporal_reasoning_pct":0},"status":"keep","description":"Reject claim verification before creation","timestamp":1778426754226,"segment":28,"confidence":3.413793103448276,"asi":{"hypothesis":"When durable claim last_verified_at is set, it should not precede created_at because verification cannot logically happen before the claim exists.","red_evidence":"`cargo test -q -p aver-core --test migrations claims_last_verified_at_must_not_precede_created_at_when_set` failed because direct SQL accepted `last_verified_at < created_at`.","green_evidence":"Targeted verification chronology test passed; full migrations test passed with 78 tests; `./autoresearch.sh` passed with checks green and metrics tests_green=592 tests_total=592.","implementation_notes":"Added migration `0080_claim_verified_after_created_checks.sql` with insert/update triggers rejecting claims rows whose non-null positive last_verified_at is before positive created_at, while preserving NULL and guarding to avoid masking timestamp-specific triggers.","anti_overfit_note":"This is a general durable claim audit chronology invariant and does not use benchmark expected outputs or labels."}}
{"run":504,"commit":"bc3f16f","metric":593,"metrics":{"tests_green":593,"tests_total":593,"milestone_index":9,"loc_core":5006,"commit_count_total":530,"memory_error_rate":0,"unsupported_claim_rate":0,"mean_precision_at_k":1,"mean_recall_at_k":1,"beam_questions":0,"beam_rubric_checks":0,"beam_abstention_pct":0,"beam_contradiction_resolution_pct":0,"beam_event_ordering_pct":0,"beam_information_extraction_pct":0,"beam_instruction_following_pct":0,"beam_knowledge_update_pct":0,"beam_multi_session_reasoning_pct":0,"beam_preference_following_pct":0,"beam_summarization_pct":0,"beam_temporal_reasoning_pct":0},"status":"keep","description":"Reject blank durable claim predicates","timestamp":1778426855207,"segment":28,"confidence":3.4310344827586206,"asi":{"hypothesis":"Durable claim predicates should reject blank strings at the schema layer with a precise validation error because predicates are ontology vocabulary identifiers and runtime claim validation already rejects blank fields.","red_evidence":"`cargo test -q -p aver-core --test migrations claims_predicate_must_not_be_blank` failed before migration because blank predicates were rejected only by the generic ontology membership trigger (`claims.predicate not in ontology (update)`).","green_evidence":"Targeted predicate nonblank test passed; full migrations test passed with 79 tests; `./autoresearch.sh` passed with checks green and metrics tests_green=593 tests_total=593.","implementation_notes":"Added migration `0081_claim_predicate_nonblank_checks.sql` with insert/update triggers rejecting trimmed-empty claims.predicate before ontology membership checks, mirroring subject/object schema hardening.","anti_overfit_note":"This is a general durable claim schema invariant and does not use benchmark expected outputs or labels."}}
{"run":505,"commit":"d345ccc","metric":594,"metrics":{"tests_green":594,"tests_total":594,"milestone_index":9,"loc_core":5006,"commit_count_total":531,"memory_error_rate":0,"unsupported_claim_rate":0,"mean_precision_at_k":1,"mean_recall_at_k":1,"beam_questions":0,"beam_rubric_checks":0,"beam_abstention_pct":0,"beam_contradiction_resolution_pct":0,"beam_event_ordering_pct":0,"beam_information_extraction_pct":0,"beam_instruction_following_pct":0,"beam_knowledge_update_pct":0,"beam_multi_session_reasoning_pct":0,"beam_preference_following_pct":0,"beam_summarization_pct":0,"beam_temporal_reasoning_pct":0},"status":"keep","description":"Reject claim creation before write timestamp","timestamp":1778426953967,"segment":28,"confidence":3.4482758620689653,"asi":{"hypothesis":"Durable claim created_at should not predate write_ts because Aver appends the audit log entry before creating the SQLite projection.","red_evidence":"`cargo test -q -p aver-core --test migrations claims_created_at_must_not_precede_write_ts` failed because direct SQL accepted `created_at < write_ts`.","green_evidence":"Targeted write/creation chronology test passed; full migrations test passed with 80 tests after updating related chronology fixtures to keep write_ts aligned; `./autoresearch.sh` passed with checks green and metrics tests_green=594 tests_total=594.","implementation_notes":"Added migration `0082_claim_created_after_write_checks.sql` with insert/update triggers rejecting claims rows whose positive created_at is before positive write_ts. Updated claim last_seen/last_verified chronology fixtures to set write_ts=10 so this newer invariant does not mask their intended assertions.","anti_overfit_note":"This is a general log-first durable claim chronology invariant and does not use benchmark expected outputs or labels."}}
{"run":506,"commit":"3850e70","metric":779,"metrics":{"tests_green":779,"tests_total":779,"milestone_index":9,"loc_core":6951,"commit_count_total":572,"memory_error_rate":0,"unsupported_claim_rate":0,"mean_precision_at_k":1,"mean_recall_at_k":1,"beam_questions":0,"beam_rubric_checks":0,"beam_abstention_pct":0,"beam_contradiction_resolution_pct":0,"beam_event_ordering_pct":0,"beam_information_extraction_pct":0,"beam_instruction_following_pct":0,"beam_knowledge_update_pct":0,"beam_multi_session_reasoning_pct":0,"beam_preference_following_pct":0,"beam_summarization_pct":0,"beam_temporal_reasoning_pct":0},"status":"keep","description":"Reject empty hyperedge source refs","timestamp":1779049950096,"segment":28,"confidence":6.637931034482759,"asi":{"hypothesis":"Hyperedges should require at least one source reference at the schema layer because provenance without concrete source refs is not auditable.","red_evidence":"`cargo test -q -p aver-core --test migrations hyperedge_source_refs_must_not_be_empty` failed because direct SQL accepted `source_refs = '[]'`.","green_evidence":"Targeted hyperedge test passed; full migrations test passed with 82 tests; `./autoresearch.sh` passed with checks green and metrics tests_green=779 tests_total=779.","implementation_notes":"Added migration `0087_hyperedge_source_refs_nonempty_checks.sql` with insert/update triggers rejecting valid JSON array source_refs when json_array_length is zero.","anti_overfit_note":"This is a general hyperedge audit provenance invariant and does not use benchmark expected outputs or labels."}}
{"run":507,"commit":"d2b9d52","metric":780,"metrics":{"tests_green":780,"tests_total":780,"milestone_index":9,"loc_core":6951,"commit_count_total":573,"memory_error_rate":0,"unsupported_claim_rate":0,"mean_precision_at_k":1,"mean_recall_at_k":1,"beam_questions":0,"beam_rubric_checks":0,"beam_abstention_pct":0,"beam_contradiction_resolution_pct":0,"beam_event_ordering_pct":0,"beam_information_extraction_pct":0,"beam_instruction_following_pct":0,"beam_knowledge_update_pct":0,"beam_multi_session_reasoning_pct":0,"beam_preference_following_pct":0,"beam_summarization_pct":0,"beam_temporal_reasoning_pct":0},"status":"keep","description":"Reject blank hyperedge predicates","timestamp":1779050024916,"segment":28,"confidence":6.598290598290598,"asi":{"hypothesis":"Hyperedge predicates should reject blank strings at the schema layer because predicate identifiers drive hyperedge semantics and indexing.","red_evidence":"`cargo test -q -p aver-core --test migrations hyperedge_predicate_must_not_be_blank` failed because direct SQL accepted a whitespace-only predicate.","green_evidence":"Targeted hyperedge predicate test passed; full migrations test passed with 83 tests; `./autoresearch.sh` passed with checks green and metrics tests_green=780 tests_total=780.","implementation_notes":"Added migration `0088_hyperedge_predicate_nonblank_checks.sql` with insert/update triggers rejecting trimmed-empty hyperedges.predicate values.","anti_overfit_note":"This is a general hyperedge schema consistency invariant and does not use benchmark expected outputs or labels."}}
{"run":508,"commit":"cc62a23","metric":781,"metrics":{"tests_green":781,"tests_total":781,"milestone_index":9,"loc_core":6951,"commit_count_total":574,"memory_error_rate":0,"unsupported_claim_rate":0,"mean_precision_at_k":1,"mean_recall_at_k":1,"beam_questions":0,"beam_rubric_checks":0,"beam_abstention_pct":0,"beam_contradiction_resolution_pct":0,"beam_event_ordering_pct":0,"beam_information_extraction_pct":0,"beam_instruction_following_pct":0,"beam_knowledge_update_pct":0,"beam_multi_session_reasoning_pct":0,"beam_preference_following_pct":0,"beam_summarization_pct":0,"beam_temporal_reasoning_pct":0},"status":"keep","description":"Reject hyperedge updates before creation","timestamp":1779050097148,"segment":28,"confidence":6.559322033898305,"asi":{"hypothesis":"Hyperedge updated_at should not predate created_at because hyperedge audit chronology must be monotonic.","red_evidence":"`cargo test -q -p aver-core --test migrations hyperedge_updated_at_must_not_precede_created_at` failed because direct SQL accepted updated_at < created_at.","green_evidence":"Targeted hyperedge chronology test passed; full migrations test passed with 84 tests; `./autoresearch.sh` passed with checks green and metrics tests_green=781 tests_total=781.","implementation_notes":"Added migration `0089_hyperedge_updated_after_created_checks.sql` with insert/update triggers rejecting hyperedges whose updated_at is less than created_at.","anti_overfit_note":"This is a general hyperedge audit chronology invariant and does not use benchmark expected outputs or labels."}}
{"run":509,"commit":"2a1db75","metric":782,"metrics":{"tests_green":782,"tests_total":782,"milestone_index":9,"loc_core":6951,"commit_count_total":575,"memory_error_rate":0,"unsupported_claim_rate":0,"mean_precision_at_k":1,"mean_recall_at_k":1,"beam_questions":0,"beam_rubric_checks":0,"beam_abstention_pct":0,"beam_contradiction_resolution_pct":0,"beam_event_ordering_pct":0,"beam_information_extraction_pct":0,"beam_instruction_following_pct":0,"beam_knowledge_update_pct":0,"beam_multi_session_reasoning_pct":0,"beam_preference_following_pct":0,"beam_summarization_pct":0,"beam_temporal_reasoning_pct":0},"status":"keep","description":"Reject non-positive hyperedge participant links","timestamp":1779050181409,"segment":28,"confidence":6.576271186440678,"asi":{"hypothesis":"Hyperedge participant links should reject non-positive hyperedge_id values before foreign-key handling so malformed graph edges get precise schema diagnostics.","red_evidence":"`cargo test -q -p aver-core --test migrations hyperedge_participant_hyperedge_id_must_be_positive` failed because inserting hyperedge_id=0 produced only a generic foreign-key failure instead of the intended invariant error.","green_evidence":"Targeted participant link test passed; full migrations test passed with 85 tests; `./autoresearch.sh` passed with checks green and metrics tests_green=782 tests_total=782.","implementation_notes":"Added migration `0090_hyperedge_participant_hyperedge_id_positive_checks.sql` with insert/update triggers rejecting hyperedge_participants.hyperedge_id <= 0.","anti_overfit_note":"This is a general hyperedge graph-link schema invariant and does not use benchmark expected outputs or labels."}}
{"run":510,"commit":"63dfa02","metric":783,"metrics":{"tests_green":783,"tests_total":783,"milestone_index":9,"loc_core":6951,"commit_count_total":576,"memory_error_rate":0,"unsupported_claim_rate":0,"mean_precision_at_k":1,"mean_recall_at_k":1,"beam_questions":0,"beam_rubric_checks":0,"beam_abstention_pct":0,"beam_contradiction_resolution_pct":0,"beam_event_ordering_pct":0,"beam_information_extraction_pct":0,"beam_instruction_following_pct":0,"beam_knowledge_update_pct":0,"beam_multi_session_reasoning_pct":0,"beam_preference_following_pct":0,"beam_summarization_pct":0,"beam_temporal_reasoning_pct":0},"status":"keep","description":"Reject non-positive prune marker timestamps","timestamp":1779050254650,"segment":28,"confidence":6.593220338983051,"asi":{"hypothesis":"Observation prune marker timestamps should be positive at the schema layer because prune-marker audit ordering should not contain sentinel zero values.","red_evidence":"`cargo test -q -p aver-core --test migrations observation_prune_marker_ts_must_be_positive` failed because direct SQL accepted ts=0.","green_evidence":"Targeted prune marker timestamp test passed; full migrations test passed with 86 tests; `./autoresearch.sh` passed with checks green and metrics tests_green=783 tests_total=783.","implementation_notes":"Added migration `0091_observation_prune_marker_ts_positive_checks.sql` with insert/update triggers rejecting observation_prune_markers.ts <= 0.","anti_overfit_note":"This is a general observation pruning audit chronology invariant and does not use benchmark expected outputs or labels."}}
{"run":511,"commit":"63dfa02","metric":784,"metrics":{"tests_green":784,"tests_total":784,"milestone_index":9,"loc_core":6951,"commit_count_total":577,"memory_error_rate":0,"unsupported_claim_rate":0,"mean_precision_at_k":1,"mean_recall_at_k":1,"beam_questions":0,"beam_rubric_checks":0,"beam_abstention_pct":0,"beam_contradiction_resolution_pct":0,"beam_event_ordering_pct":0,"beam_information_extraction_pct":0,"beam_instruction_following_pct":0,"beam_knowledge_update_pct":0,"beam_multi_session_reasoning_pct":0,"beam_preference_following_pct":0,"beam_summarization_pct":0,"beam_temporal_reasoning_pct":0},"status":"checks_failed","description":"Prune marker JSON-array check failed formatting gate","timestamp":1779050333526,"segment":28,"confidence":6.53781512605042,"asi":{"hypothesis":"Observation prune marker pruned_observation_ids should require JSON arrays so pruning projections remain replayable and typed.","red_evidence":"`cargo test -q -p aver-core --test migrations observation_prune_marker_ids_must_be_json_array` failed because direct SQL accepted a JSON object.","rollback_reason":"`./autoresearch.sh` benchmark passed but `autoresearch.checks.sh` failed at cargo fmt for the assertion formatting in migrations.rs.","next_action_hint":"Reapply the same test and `0092_observation_prune_marker_ids_json_array_checks.sql`, run cargo fmt before rerunning autoresearch.","implementation_notes":"Migration trigger logic was correct; targeted test and full migrations test passed before the formatting gate.","anti_overfit_note":"This is a general observation pruning schema invariant and does not use benchmark expected outputs or labels."}}
{"run":512,"commit":"8747e5d","metric":784,"metrics":{"tests_green":784,"tests_total":784,"milestone_index":9,"loc_core":6951,"commit_count_total":577,"memory_error_rate":0,"unsupported_claim_rate":0,"mean_precision_at_k":1,"mean_recall_at_k":1,"beam_questions":0,"beam_rubric_checks":0,"beam_abstention_pct":0,"beam_contradiction_resolution_pct":0,"beam_event_ordering_pct":0,"beam_information_extraction_pct":0,"beam_instruction_following_pct":0,"beam_knowledge_update_pct":0,"beam_multi_session_reasoning_pct":0,"beam_preference_following_pct":0,"beam_summarization_pct":0,"beam_temporal_reasoning_pct":0},"status":"keep","description":"Reject non-array prune marker ids","timestamp":1779050406245,"segment":28,"confidence":6.5,"asi":{"hypothesis":"Observation prune marker pruned_observation_ids should require JSON arrays so pruning projections remain replayable and typed.","red_evidence":"`cargo test -q -p aver-core --test migrations observation_prune_marker_ids_must_be_json_array` failed because direct SQL accepted a JSON object.","green_evidence":"After reapplying with cargo fmt, targeted prune marker JSON-array test passed; full migrations test passed with 87 tests; `./autoresearch.sh` passed with checks green and metrics tests_green=784 tests_total=784.","implementation_notes":"Added migration `0092_observation_prune_marker_ids_json_array_checks.sql` with insert/update triggers requiring json_valid and json_type(...)=array for pruned_observation_ids.","anti_overfit_note":"This is a general observation pruning schema invariant and does not use benchmark expected outputs or labels."}}
