{"run":28,"commit":"cd70c0c","metric":28,"metrics":{"tests_total":28,"milestone_index":2,"loc_core":549,"commit_count_total":32},"status":"keep","description":"T28 lists vector chunks for a claim","timestamp":1778132120959,"segment":0,"confidence":3.6923076923076925,"asi":{"hypothesis":"Store-level HybridRAG assembly needs a stable way to retrieve all chunk metadata for a claim before vector rows are scored","red_evidence":"list_vector_chunks_for_claim_orders_by_chunk_id failed because Store had no list_vector_chunks_for_claim method","green_evidence":"cargo test --workspace -q passed; autoresearch.sh parsed tests_green=28 tests_total=28 and checks passed","implementation_notes":"Added query ordered by vector_chunks.id; maps rows into existing VectorChunk DTO"}}
{"run":29,"commit":"8239208","metric":29,"metrics":{"tests_total":29,"milestone_index":2,"loc_core":555,"commit_count_total":33},"status":"keep","description":"T29 renders claim text for embedding chunks","timestamp":1778132168145,"segment":0,"confidence":3.5714285714285716,"asi":{"hypothesis":"embedding/indexing should share a deterministic claim text rendering instead of callers hand-formatting subject/predicate/object triples","red_evidence":"claim_text_renders_subject_predicate_object_for_embedding failed because Claim had no text method","green_evidence":"cargo test --workspace -q passed; autoresearch.sh parsed tests_green=29 tests_total=29 and checks passed","implementation_notes":"Added Claim::text() returning \"subject predicate object\"; no storage or log behavior changed"}}
{"run":30,"commit":"23b1bfc","metric":30,"metrics":{"tests_total":30,"milestone_index":2,"loc_core":565,"commit_count_total":34},"status":"keep","description":"T30 creates vector chunks from canonical claim text","timestamp":1778132208186,"segment":0,"confidence":3.7142857142857144,"asi":{"hypothesis":"chunk creation should have a one-call path from claim id to canonical claim text so embedding/indexing callers cannot drift in text formatting","red_evidence":"add_vector_chunk_for_claim_uses_canonical_claim_text failed because Store had no add_vector_chunk_for_claim method","green_evidence":"cargo test --workspace -q passed; autoresearch.sh parsed tests_green=30 tests_total=30 and checks passed","implementation_notes":"add_vector_chunk_for_claim reuses get_claim + Claim::text + add_vector_chunk; no new log writes because chunk metadata remains derived index data"}}
{"run":31,"commit":"23b1bfc","metric":25,"metrics":{"tests_total":26,"milestone_index":2,"loc_core":569,"commit_count_total":35},"status":"crash","description":"T31 tie-breaker change exposed flaky Ollama loopback test failure","timestamp":1778132271911,"segment":0,"confidence":3.7142857142857144,"asi":{"hypothesis":"make HybridRAG candidate ranking deterministic by breaking equal score ties by claim_id","rollback_reason":"autoresearch.sh failed because previously kept ollama_embedding_client_posts_to_local_embeddings_endpoint intermittently returned ConnectionReset before completing response read","next_action_hint":"first stabilize the Ollama loopback test by reading the full HTTP request body before responding or adding Connection: close; then reapply the ranking tie-breaker test/change","red_evidence":"rank_candidates_breaks_score_ties_by_claim_id failed with order [2,1] vs expected [1,2] before implementation","implementation_notes":"Implementation used total_cmp(desc).then_with(claim_id asc) and cargo test --workspace passed once before autoresearch exposed the flaky vector HTTP test"}}
{"run":32,"commit":"ee91997","metric":31,"metrics":{"tests_total":31,"milestone_index":2,"loc_core":569,"commit_count_total":35},"status":"keep","description":"T31 breaks HybridRAG ranking ties by claim id","timestamp":1778132323070,"segment":0,"confidence":3.857142857142857,"asi":{"hypothesis":"HybridRAG ranking should be deterministic even when candidates have identical scores, using claim_id as a stable tiebreaker","red_evidence":"rank_candidates_breaks_score_ties_by_claim_id failed with order [2,1] vs expected [1,2] before implementation","green_evidence":"cargo test --workspace -q passed; autoresearch.sh parsed tests_green=31 tests_total=31 and checks passed","implementation_notes":"Changed rank_candidates to score descending then claim_id ascending; also stabilized the prior Ollama loopback test response with Connection: close + flush after a crash exposed intermittent ConnectionReset"}}
{"run":33,"commit":"296f250","metric":32,"metrics":{"tests_total":32,"milestone_index":2,"loc_core":577,"commit_count_total":36},"status":"keep","description":"T32 validates HybridRAG alpha bounds","timestamp":1778132359568,"segment":0,"confidence":4,"asi":{"hypothesis":"caller-supplied HybridRAG alpha overrides should be validated to the unit interval before retrieval scoring uses them","red_evidence":"hybrid_weights_reject_alpha_outside_unit_interval failed because HybridWeights had no try_new constructor","green_evidence":"cargo test --workspace -q passed; autoresearch.sh parsed tests_green=32 tests_total=32 and checks passed","implementation_notes":"Added HybridWeights::try_new(alpha) returning Err for alpha <0 or >1; public alpha field left unchanged for existing tests/API, stricter construction can be adopted later"}}
{"run":34,"commit":"5509ce9","metric":33,"metrics":{"tests_total":33,"milestone_index":2,"loc_core":596,"commit_count_total":37},"status":"keep","description":"T33 parses HybridRAG alpha override strings","timestamp":1778132420449,"segment":0,"confidence":3.8666666666666667,"asi":{"hypothesis":"CLI/config alpha overrides should parse into validated HybridWeights before retrieval scoring consumes them","red_evidence":"hybrid_weights_parse_alpha_override_from_string failed because HybridWeights did not implement FromStr","green_evidence":"cargo test --workspace -q passed; autoresearch.sh parsed tests_green=33 tests_total=33 and checks passed","implementation_notes":"Added HybridWeightsParseError with thiserror, changed try_new to return the typed error, and implemented FromStr via f64 parse plus unit-interval validation"}}
{"run":35,"commit":"c83a539","metric":34,"metrics":{"tests_total":34,"milestone_index":2,"loc_core":596,"commit_count_total":38},"status":"keep","description":"T34 trims HybridRAG alpha override strings","timestamp":1778132458189,"segment":0,"confidence":4.285714285714286,"asi":{"hypothesis":"alpha override parsing should tolerate harmless surrounding whitespace from CLI/config inputs like vector backend parsing does","red_evidence":"hybrid_weights_parser_trims_alpha_override_whitespace failed with ParseFloatError Invalid for \" 0.40 \"","green_evidence":"cargo test --workspace -q passed; autoresearch.sh parsed tests_green=34 tests_total=34 and checks passed","implementation_notes":"Changed HybridWeights FromStr to trim before f64 parsing; validation semantics unchanged"}}
{"run":36,"commit":"32751bb","metric":35,"metrics":{"tests_total":35,"milestone_index":2,"loc_core":613,"commit_count_total":39},"status":"keep","description":"T35 adds cosine similarity for vector scoring","timestamp":1778132500796,"segment":0,"confidence":4.133333333333334,"asi":{"hypothesis":"HybridRAG vector scoring needs a small deterministic cosine similarity primitive before retrieved embeddings can become RetrievalCandidates","red_evidence":"cosine_similarity_returns_one_for_identical_vectors failed because memory_core::vector::cosine_similarity did not exist","green_evidence":"cargo test --workspace -q passed; autoresearch.sh parsed tests_green=35 tests_total=35 and checks passed","implementation_notes":"Added cosine_similarity(&[f32], &[f32]) -> Option<f32> returning None for empty or mismatched lengths; zero-vector behavior not yet tested"}}
{"run":37,"commit":"32751bb","metric":30,"metrics":{"tests_total":31,"milestone_index":2,"loc_core":617,"commit_count_total":40},"status":"crash","description":"T36 zero-vector cosine handling exposed flaky Ollama loopback header reset","timestamp":1778132541712,"segment":0,"confidence":3.875,"asi":{"hypothesis":"cosine_similarity should return None for zero vectors rather than Some(NaN)","rollback_reason":"autoresearch.sh failed because ollama_embedding_client_posts_to_local_embeddings_endpoint intermittently hit Connection reset by peer while reading headers despite cargo test passing once","next_action_hint":"stabilize the HTTP loopback test by reading the full request using Content-Length before writing the response and possibly shutdown write; then reapply zero-vector cosine test/change","red_evidence":"cosine_similarity_returns_none_for_zero_vector failed with left Some(NaN) right None before implementation","implementation_notes":"Implementation added a left_norm/right_norm zero check; cargo test --workspace passed before autoresearch exposed existing flaky HTTP test"}}
{"run":38,"commit":"768b546","metric":36,"metrics":{"tests_total":36,"milestone_index":2,"loc_core":617,"commit_count_total":40},"status":"keep","description":"T36 handles zero vectors in cosine similarity","timestamp":1778132590171,"segment":0,"confidence":4,"asi":{"hypothesis":"cosine_similarity should return None for zero vectors rather than Some(NaN) so vector retrieval does not rank invalid embeddings","red_evidence":"cosine_similarity_returns_none_for_zero_vector failed with left Some(NaN) right None before implementation","green_evidence":"cargo test --workspace -q passed; autoresearch.sh parsed tests_green=36 tests_total=36 and checks passed","implementation_notes":"Added zero-norm guard; also stabilized the Ollama loopback test by reading headers/body via Content-Length before writing the response, addressing the prior ConnectionReset crash"}}
{"run":39,"commit":"4706e1a","metric":37,"metrics":{"tests_total":37,"milestone_index":2,"loc_core":621,"commit_count_total":42},"status":"keep","description":"T37 normalizes cosine similarity for vector scores","timestamp":1778132638902,"segment":0,"confidence":4.125,"asi":{"hypothesis":"HybridRAG vector scores should be normalized to the 0..1 range before blending with graph scores","red_evidence":"normalized_cosine_score_maps_opposite_vectors_to_zero failed because normalized_cosine_score did not exist","green_evidence":"cargo test --workspace -q passed; autoresearch.sh parsed tests_green=37 tests_total=37 and checks passed","implementation_notes":"Added normalized_cosine_score mapping cosine [-1,1] to [0,1] and preserving None for invalid/zero vectors"}}
{"run":40,"commit":"f8d8e54","metric":38,"metrics":{"tests_total":38,"milestone_index":2,"loc_core":636,"commit_count_total":43},"status":"keep","description":"T38 adds vector index default configuration","timestamp":1778132691269,"segment":0,"confidence":4,"asi":{"hypothesis":"v0.2 vector indexing should centralize default backend/model choices so callers do not hardcode sqlite-vss and the Ollama model independently","red_evidence":"vector_index_config_defaults_to_sqlite_vss_and_nomic_model failed because VectorIndexConfig did not exist","green_evidence":"cargo test --workspace -q passed; autoresearch.sh parsed tests_green=38 tests_total=38 and checks passed","implementation_notes":"Added VectorIndexConfig defaulting to VectorBackend::SqliteVss and nomic-embed-text; no environment/config file loading yet"}}
{"run":41,"commit":"efd84bb","metric":39,"metrics":{"tests_total":39,"milestone_index":2,"loc_core":663,"commit_count_total":44},"status":"keep","description":"T39 adds offline embedding client trait and mock","timestamp":1778132778283,"segment":0,"confidence":4.375,"asi":{"hypothesis":"embedding tests should depend on an EmbeddingClient trait with a deterministic mock so cargo test stays offline and does not hit flaky loopback/Ollama paths","red_evidence":"embedding_client_trait_allows_offline_vector_tests failed because EmbeddingClient and MockEmbeddingClient did not exist","green_evidence":"cargo test --workspace -q passed; autoresearch.sh parsed tests_green=39 tests_total=39 and checks passed","implementation_notes":"Added EmbeddingClient trait, MockEmbeddingClient returning a cloned fixture vector, and implemented the trait for OllamaEmbeddingClient; replaced the loopback HTTP test with offline mock-based trait coverage per supervisor steering"}}
{"run":42,"commit":"003fe85","metric":40,"metrics":{"tests_total":40,"milestone_index":2,"loc_core":680,"commit_count_total":45},"status":"keep","description":"T40 parses vector index optional configuration","timestamp":1778132820399,"segment":0,"confidence":4.235294117647059,"asi":{"hypothesis":"VectorIndexConfig should parse backend/model overrides together so callers do not duplicate defaulting and trimming logic","red_evidence":"vector_index_config_parses_optional_backend_and_model failed because VectorIndexConfig had no from_optional_config method","green_evidence":"cargo test --workspace -q passed; autoresearch.sh parsed tests_green=40 tests_total=40 and checks passed","implementation_notes":"Added from_optional_config(backend, embedding_model) combining VectorBackend parsing with trimmed non-empty model override and default fallback"}}
{"run":43,"commit":"b280d41","metric":41,"metrics":{"tests_total":41,"milestone_index":2,"loc_core":698,"commit_count_total":46},"status":"keep","description":"T41 builds retrieval candidates from embeddings","timestamp":1778132866573,"segment":0,"confidence":4.111111111111111,"asi":{"hypothesis":"HybridRAG retrieval candidates should be constructible directly from query/candidate embeddings using the normalized vector score primitive","red_evidence":"retrieval_candidate_from_embeddings_uses_normalized_vector_score failed because RetrievalCandidate had no from_embeddings constructor","green_evidence":"cargo test --workspace -q passed; autoresearch.sh parsed tests_green=41 tests_total=41 and checks passed","implementation_notes":"Added RetrievalCandidate::from_embeddings returning None when normalized cosine cannot score invalid vectors; blends normalized vector score with supplied graph score"}}
{"run":44,"commit":"9bf741b","metric":42,"metrics":{"tests_total":42,"milestone_index":2,"loc_core":701,"commit_count_total":47},"status":"keep","description":"T42 ranks NaN retrieval scores last","timestamp":1778132926746,"segment":0,"confidence":4.222222222222222,"asi":{"hypothesis":"HybridRAG ranking should degrade invalid NaN scores to the end rather than letting f64::total_cmp place NaN first","red_evidence":"rank_candidates_puts_nan_scores_last failed with order [1,2] vs expected [2,1] before implementation","green_evidence":"cargo test --workspace -q passed; autoresearch.sh parsed tests_green=42 tests_total=42 and checks passed","implementation_notes":"rank_candidates now branches on score.is_nan before score-desc/claim-id ordering; an initially proposed invalid-vector from_embeddings test passed immediately and was replaced before production code changes"}}
{"run":45,"commit":"a957392","metric":43,"metrics":{"tests_total":43,"milestone_index":2,"loc_core":701,"commit_count_total":48},"status":"keep","description":"T43 treats empty vector backend config as default","timestamp":1778132983348,"segment":0,"confidence":4.333333333333333,"asi":{"hypothesis":"an empty MEMORY_VECTOR_BACKEND-like value should behave like unset config rather than erroring, matching model override fallback semantics","red_evidence":"vector_backend_empty_optional_config_uses_default failed with Err(\"unknown vector backend\") for whitespace-only input","green_evidence":"cargo test --workspace -q passed; autoresearch.sh parsed tests_green=43 tests_total=43 and checks passed","implementation_notes":"VectorBackend::from_optional_config now trims and filters empty strings before parsing, returning SqliteVss default for None/empty"}}
{"run":46,"commit":"75bd0ef","metric":44,"metrics":{"tests_total":44,"milestone_index":2,"loc_core":736,"commit_count_total":49},"status":"keep","description":"T44 persists embedding vectors with vector chunks","timestamp":1778133117169,"segment":0,"confidence":4.2105263157894735,"asi":{"hypothesis":"v0.2 vector chunk rows need to persist the embedding vector alongside metadata so offline mock embeddings can feed later HybridRAG ranking without network calls","red_evidence":"add_vector_chunk_with_embedding_persists_embedding_vector failed because Store had no add_vector_chunk_with_embedding method and VectorChunk had no embedding field","green_evidence":"cargo test --workspace -q passed; autoresearch.sh parsed tests_green=44 tests_total=44 and checks passed","implementation_notes":"Added nullable embedding_json to vector_chunks migration, VectorChunk.embedding Option<Vec<f32>>, add_vector_chunk_with_embedding, and JSON parsing on get/list; no live Ollama calls added"}}
{"run":47,"commit":"aa119b6","metric":45,"metrics":{"tests_total":45,"milestone_index":2,"loc_core":751,"commit_count_total":50},"status":"keep","description":"T45 embeds claim text into vector chunks via client","timestamp":1778133182066,"segment":0,"confidence":4.1,"asi":{"hypothesis":"Store should provide an offline-testable path from claim id to embedded vector chunk using the EmbeddingClient trait, without calling Ollama in tests","red_evidence":"add_embedded_vector_chunk_for_claim_uses_embedding_client failed because Store had no add_embedded_vector_chunk_for_claim method","green_evidence":"cargo test --workspace -q passed; autoresearch.sh parsed tests_green=45 tests_total=45 and checks passed","implementation_notes":"Added add_embedded_vector_chunk_for_claim using get_claim + Claim::text + client.embed + add_vector_chunk_with_embedding; Store::Error now wraps vector::EmbeddingError"}}
{"run":48,"commit":"aa119b6","metric":46,"metrics":{"tests_total":46,"milestone_index":2,"loc_core":793,"commit_count_total":51},"status":"checks_failed","description":"T46 vector chunk embedding ranking passed tests but failed clippy collapsible_if","timestamp":1778133254844,"segment":0,"confidence":4.1,"asi":{"hypothesis":"Store should rank persisted vector chunks by normalized cosine similarity to a query embedding, returning top-k matches offline","rollback_reason":"cargo clippy -D warnings rejected nested if-let in rank_vector_chunks_by_embedding as collapsible_if","next_action_hint":"reapply rank_vector_chunks_by_embedding test/implementation and use combined if let Some(embedding) = ... && let Some(score) = ...","red_evidence":"rank_vector_chunks_by_embedding_returns_best_match_first failed because Store had no rank_vector_chunks_by_embedding method","implementation_notes":"Implementation queried vector_chunks with embedding_json, parsed VectorChunk embeddings, scored with normalized_cosine_score, sorted score descending then id ascending, and truncated top_k"}}
{"run":49,"commit":"0c5157f","metric":46,"metrics":{"tests_total":46,"milestone_index":2,"loc_core":793,"commit_count_total":51},"status":"keep","description":"T46 ranks vector chunks by embedding similarity","timestamp":1778133326574,"segment":0,"confidence":4.2,"asi":{"hypothesis":"Store should rank persisted vector chunks by normalized cosine similarity to a query embedding, returning top-k matches offline","red_evidence":"rank_vector_chunks_by_embedding_returns_best_match_first failed because Store had no rank_vector_chunks_by_embedding method","green_evidence":"cargo test --workspace -q passed; autoresearch.sh parsed tests_green=46 tests_total=46 and checks passed","implementation_notes":"Added rank_vector_chunks_by_embedding querying chunks with embedding_json, scoring with normalized_cosine_score, sorting score desc then id asc, and truncating top_k; fixed prior clippy collapsible_if by using combined if-let"}}
{"run":50,"commit":"3a7a053","metric":47,"metrics":{"tests_total":47,"milestone_index":2,"loc_core":806,"commit_count_total":52},"status":"keep","description":"T47 embeds vector recall queries before ranking chunks","timestamp":1778133402374,"segment":0,"confidence":4.095238095238095,"asi":{"hypothesis":"Store vector recall should embed the query through EmbeddingClient and reuse offline chunk ranking, keeping cargo test network-free via MockEmbeddingClient","red_evidence":"recall_vector_chunks_embeds_query_with_client_before_ranking failed because Store had no recall_vector_chunks method","green_evidence":"cargo test --workspace -q passed; autoresearch.sh parsed tests_green=47 tests_total=47 and checks passed","implementation_notes":"Added recall_vector_chunks(query, client, top_k) that calls client.embed(query) then rank_vector_chunks_by_embedding; no live Ollama calls in tests"}}
{"run":51,"commit":"2d1ffcb","metric":48,"metrics":{"tests_total":48,"milestone_index":2,"loc_core":822,"commit_count_total":53},"status":"keep","description":"T48 returns claims from vector recall","timestamp":1778133459659,"segment":0,"confidence":4,"asi":{"hypothesis":"agent-facing vector recall should return Claim rows rather than internal VectorChunk metadata while preserving vector rank order","red_evidence":"recall_vector_claims_returns_claims_for_ranked_chunks failed because Store had no recall_vector_claims method","green_evidence":"cargo test --workspace -q passed; autoresearch.sh parsed tests_green=48 tests_total=48 and checks passed","implementation_notes":"Added recall_vector_claims(query, client, top_k) that reuses recall_vector_chunks and maps chunk.claim_id through get_claim; still offline-testable with MockEmbeddingClient"}}
