{"run":271,"commit":"990a688","metric":285,"metrics":{"tests_total":285,"milestone_index":9,"loc_core":2369,"commit_count_total":294,"memory_error_rate":0,"unsupported_claim_rate":0,"mean_precision_at_k":1,"mean_recall_at_k":1},"status":"keep","description":"reject Azure token paths","timestamp":1778231031383,"segment":26,"confidence":3.8333333333333335,"asi":{"hypothesis":"The privacy path filter should reject Azure CLI access-token files because they may contain cloud credentials","red_evidence":"privacy_filter_path_rejects_azure_access_tokens failed because privacy_filter_path(\".azure/accessTokens.json\") returned Ok(())","green_evidence":"./autoresearch.sh passed with tests_green=285, tests_total=285, memory_error_rate=0, and autoresearch.checks.sh green","anti_overfit_note":"The change strengthens a generic privacy guardrail for local cloud credential files; it does not depend on benchmark data, BEAM labels, rubrics, reference answers, or fixture-specific scoring shortcuts"}}
{"run":272,"commit":"9cd7f4c","metric":286,"metrics":{"tests_total":286,"milestone_index":9,"loc_core":2373,"commit_count_total":295,"memory_error_rate":0,"unsupported_claim_rate":0,"mean_precision_at_k":1,"mean_recall_at_k":1},"status":"keep","description":"reject AWS config paths","timestamp":1778231136899,"segment":26,"confidence":3.875,"asi":{"hypothesis":"The privacy path filter should reject AWS config files as sensitive cloud credential context, alongside AWS credentials files","red_evidence":"privacy_filter_path_rejects_aws_config_file failed because privacy_filter_path(\".aws/config\") returned Ok(())","green_evidence":"./autoresearch.sh passed with tests_green=286, tests_total=286, memory_error_rate=0, and autoresearch.checks.sh green","anti_overfit_note":"The change strengthens a generic privacy guardrail for local cloud credential configuration; it does not depend on benchmark data, BEAM labels, rubrics, reference answers, or fixture-specific scoring shortcuts"}}
{"run":273,"commit":"810e53f","metric":287,"metrics":{"tests_total":287,"milestone_index":9,"loc_core":2375,"commit_count_total":296,"memory_error_rate":0,"unsupported_claim_rate":0,"mean_precision_at_k":1,"mean_recall_at_k":1},"status":"keep","description":"reject Terraform credential paths","timestamp":1778231207799,"segment":26,"confidence":3.836734693877551,"asi":{"hypothesis":"The privacy path filter should reject Terraform CLI credential files because they may contain infrastructure registry tokens","red_evidence":"privacy_filter_path_rejects_terraform_credentials failed because privacy_filter_path(\".terraform.d/credentials.tfrc.json\") returned Ok(())","green_evidence":"./autoresearch.sh passed with tests_green=287, tests_total=287, memory_error_rate=0, and autoresearch.checks.sh green","anti_overfit_note":"The change strengthens a generic privacy guardrail for local infrastructure credential files; it does not depend on benchmark data, BEAM labels, rubrics, reference answers, or fixture-specific scoring shortcuts"}}
{"run":274,"commit":"80792d8","metric":288,"metrics":{"tests_total":288,"milestone_index":9,"loc_core":2377,"commit_count_total":297,"memory_error_rate":0,"unsupported_claim_rate":0,"mean_precision_at_k":1,"mean_recall_at_k":1},"status":"keep","description":"reject Git credential paths","timestamp":1778231267739,"segment":26,"confidence":3.8,"asi":{"hypothesis":"The privacy path filter should reject Git credential-store files because they may contain repository credentials or tokens","red_evidence":"privacy_filter_path_rejects_git_credentials_file failed because privacy_filter_path(\".git-credentials\") returned Ok(())","green_evidence":"./autoresearch.sh passed with tests_green=288, tests_total=288, memory_error_rate=0, and autoresearch.checks.sh green","anti_overfit_note":"The change strengthens a generic privacy guardrail for local VCS credential files; it does not depend on benchmark data, BEAM labels, rubrics, reference answers, or fixture-specific scoring shortcuts"}}
{"run":275,"commit":"3e6748b","metric":289,"metrics":{"tests_total":289,"milestone_index":9,"loc_core":2379,"commit_count_total":298,"memory_error_rate":0,"unsupported_claim_rate":0,"mean_precision_at_k":1,"mean_recall_at_k":1},"status":"keep","description":"reject PyPI credential paths","timestamp":1778231347592,"segment":26,"confidence":3.84,"asi":{"hypothesis":"The privacy path filter should reject PyPI configuration files because they may contain package-registry credentials","red_evidence":"privacy_filter_path_rejects_pypirc_file failed because privacy_filter_path(\".pypirc\") returned Ok(())","green_evidence":"./autoresearch.sh passed with tests_green=289, tests_total=289, memory_error_rate=0, and autoresearch.checks.sh green","anti_overfit_note":"The change strengthens a generic privacy guardrail for local package-registry credential files; it does not introduce Python into build, runtime, or extraction paths and does not depend on benchmark data, BEAM labels, rubrics, reference answers, or fixture-specific scoring shortcuts"}}
{"run":276,"commit":"9658915","metric":290,"metrics":{"tests_total":290,"milestone_index":9,"loc_core":2381,"commit_count_total":299,"memory_error_rate":0,"unsupported_claim_rate":0,"mean_precision_at_k":1,"mean_recall_at_k":1},"status":"keep","description":"reject RubyGems credential paths","timestamp":1778231458966,"segment":26,"confidence":3.88,"asi":{"hypothesis":"The privacy path filter should reject RubyGems credential files because they may contain package-registry API keys","red_evidence":"privacy_filter_path_rejects_rubygems_credentials failed because privacy_filter_path(\".gem/credentials\") returned Ok(())","green_evidence":"./autoresearch.sh passed with tests_green=290, tests_total=290, memory_error_rate=0, and autoresearch.checks.sh green","anti_overfit_note":"The change strengthens a generic privacy guardrail for local package-registry credential files; it does not depend on benchmark data, BEAM labels, rubrics, reference answers, or fixture-specific scoring shortcuts"}}
{"run":277,"commit":"342a94a","metric":291,"metrics":{"tests_total":291,"milestone_index":9,"loc_core":2383,"commit_count_total":300,"memory_error_rate":0,"unsupported_claim_rate":0,"mean_precision_at_k":1,"mean_recall_at_k":1},"status":"keep","description":"reject OCI credential paths","timestamp":1778231573660,"segment":26,"confidence":3.843137254901961,"asi":{"hypothesis":"The privacy path filter should reject OCI CLI config files because they may contain cloud credential metadata and private-key references","red_evidence":"privacy_filter_path_rejects_oci_config_file failed because privacy_filter_path(\".oci/config\") returned Ok(())","green_evidence":"./autoresearch.sh passed with tests_green=291, tests_total=291, memory_error_rate=0, and autoresearch.checks.sh green","anti_overfit_note":"The change strengthens a generic privacy guardrail for local cloud credential configuration; it does not depend on benchmark data, BEAM labels, rubrics, reference answers, or fixture-specific scoring shortcuts"}}
{"run":278,"commit":"14f22fd","metric":292,"metrics":{"tests_total":292,"milestone_index":9,"loc_core":2385,"commit_count_total":301,"memory_error_rate":0,"unsupported_claim_rate":0,"mean_precision_at_k":1,"mean_recall_at_k":1},"status":"keep","description":"reject Vault token paths","timestamp":1778231621473,"segment":26,"confidence":3.8076923076923075,"asi":{"hypothesis":"The privacy path filter should reject Vault token files because they contain local secret-bearing authentication tokens","red_evidence":"privacy_filter_path_rejects_vault_token_file failed because privacy_filter_path(\".vault-token\") returned Ok(())","green_evidence":"./autoresearch.sh passed with tests_green=292, tests_total=292, memory_error_rate=0, and autoresearch.checks.sh green","anti_overfit_note":"The change strengthens a generic privacy guardrail for local secret-token files; it does not depend on benchmark data, BEAM labels, rubrics, reference answers, or fixture-specific scoring shortcuts"}}
{"run":279,"commit":"13b8052","metric":293,"metrics":{"tests_total":293,"milestone_index":9,"loc_core":2387,"commit_count_total":302,"memory_error_rate":0,"unsupported_claim_rate":0,"mean_precision_at_k":1,"mean_recall_at_k":1},"status":"keep","description":"reject Pulumi credential paths","timestamp":1778231868189,"segment":26,"confidence":3.8461538461538463,"asi":{"hypothesis":"The privacy path filter should reject Pulumi credentials files because they contain local infrastructure login tokens","red_evidence":"privacy_filter_path_rejects_pulumi_credentials failed because privacy_filter_path(\".pulumi/credentials.json\") returned Ok(())","green_evidence":"./autoresearch.sh passed with tests_green=293, tests_total=293, memory_error_rate=0, and autoresearch.checks.sh green","anti_overfit_note":"The change strengthens a generic privacy guardrail for local infrastructure credential files; it does not depend on benchmark data, BEAM labels, rubrics, reference answers, or fixture-specific scoring shortcuts"}}
{"run":280,"commit":"134b75b","metric":294,"metrics":{"tests_total":294,"milestone_index":9,"loc_core":2389,"commit_count_total":303,"memory_error_rate":0,"unsupported_claim_rate":0,"mean_precision_at_k":1,"mean_recall_at_k":1},"status":"keep","description":"reject Sentry credential paths","timestamp":1778231938983,"segment":26,"confidence":3.8846153846153846,"asi":{"hypothesis":"The privacy path filter should reject Sentry CLI config files because they commonly contain auth tokens","red_evidence":"privacy_filter_path_rejects_sentry_cli_config failed because privacy_filter_path(\".sentryclirc\") returned Ok(())","green_evidence":"./autoresearch.sh passed with tests_green=294, tests_total=294, memory_error_rate=0, and autoresearch.checks.sh green","anti_overfit_note":"The change strengthens a generic privacy guardrail for local service credential config files; it does not depend on benchmark data, BEAM labels, rubrics, reference answers, or fixture-specific scoring shortcuts"}}
{"run":281,"commit":"94a1812","metric":295,"metrics":{"tests_total":295,"milestone_index":9,"loc_core":2395,"commit_count_total":304,"memory_error_rate":0,"unsupported_claim_rate":0,"mean_precision_at_k":1,"mean_recall_at_k":1},"status":"keep","description":"reject Slack bot tokens","timestamp":1778232052372,"segment":26,"confidence":3.849056603773585,"asi":{"hypothesis":"The privacy content filter should reject Slack bot token prefixes even when synthetic low-entropy test tokens avoid the generic entropy guard","red_evidence":"privacy_filter_rejects_slack_bot_token failed because a split synthetic xoxb token returned Ok(())","green_evidence":"./autoresearch.sh passed with tests_green=295, tests_total=295, memory_error_rate=0, and autoresearch.checks.sh green","anti_overfit_note":"The change strengthens a generic service-token privacy guardrail; it does not depend on benchmark data, BEAM labels, rubrics, reference answers, or fixture-specific scoring shortcuts"}}
{"run":282,"commit":"0bd56a2","metric":296,"metrics":{"tests_total":296,"milestone_index":9,"loc_core":2397,"commit_count_total":305,"memory_error_rate":0,"unsupported_claim_rate":0,"mean_precision_at_k":1,"mean_recall_at_k":1},"status":"keep","description":"reject Slack user tokens","timestamp":1778232111776,"segment":26,"confidence":3.814814814814815,"asi":{"hypothesis":"The privacy content filter should reject Slack user token prefixes alongside bot token prefixes","red_evidence":"privacy_filter_rejects_slack_user_token failed because a split synthetic xoxp token returned Ok(())","green_evidence":"./autoresearch.sh passed with tests_green=296, tests_total=296, memory_error_rate=0, and autoresearch.checks.sh green","anti_overfit_note":"The change strengthens a generic service-token privacy guardrail; it does not depend on benchmark data, BEAM labels, rubrics, reference answers, or fixture-specific scoring shortcuts"}}
{"run":283,"commit":"c5c6dea","metric":297,"metrics":{"tests_total":297,"milestone_index":9,"loc_core":2398,"commit_count_total":306,"memory_error_rate":0,"unsupported_claim_rate":0,"mean_precision_at_k":1,"mean_recall_at_k":1},"status":"keep","description":"reject Slack app tokens","timestamp":1778232186634,"segment":26,"confidence":3.8518518518518516,"asi":{"hypothesis":"The privacy content filter should reject Slack app-level token prefixes alongside bot and user token prefixes","red_evidence":"privacy_filter_rejects_slack_app_token failed because a split synthetic xapp token returned Ok(())","green_evidence":"./autoresearch.sh passed with tests_green=297, tests_total=297, memory_error_rate=0, and autoresearch.checks.sh green","anti_overfit_note":"The change strengthens a generic service-token privacy guardrail; it does not depend on benchmark data, BEAM labels, rubrics, reference answers, or fixture-specific scoring shortcuts"}}
{"run":284,"commit":"bcf2d9b","metric":298,"metrics":{"tests_total":298,"milestone_index":9,"loc_core":2404,"commit_count_total":307,"memory_error_rate":0,"unsupported_claim_rate":0,"mean_precision_at_k":1,"mean_recall_at_k":1},"status":"keep","description":"reject GitLab personal access tokens","timestamp":1778232233501,"segment":26,"confidence":3.888888888888889,"asi":{"hypothesis":"The privacy content filter should reject GitLab personal access token prefixes even when synthetic low-entropy tokens avoid generic entropy detection","red_evidence":"privacy_filter_rejects_gitlab_pat failed because a split synthetic glpat token returned Ok(())","green_evidence":"./autoresearch.sh passed with tests_green=298, tests_total=298, memory_error_rate=0, and autoresearch.checks.sh green","anti_overfit_note":"The change strengthens a generic VCS service-token privacy guardrail; it does not depend on benchmark data, BEAM labels, rubrics, reference answers, or fixture-specific scoring shortcuts"}}
{"run":285,"commit":"0517555","metric":299,"metrics":{"tests_total":299,"milestone_index":9,"loc_core":2410,"commit_count_total":308,"memory_error_rate":0,"unsupported_claim_rate":0,"mean_precision_at_k":1,"mean_recall_at_k":1},"status":"keep","description":"reject Hugging Face tokens","timestamp":1778232290472,"segment":26,"confidence":3.8545454545454545,"asi":{"hypothesis":"The privacy content filter should reject Hugging Face token prefixes even when synthetic low-entropy tokens avoid generic entropy detection","red_evidence":"privacy_filter_rejects_huggingface_token failed because a split synthetic hf_ token returned Ok(())","green_evidence":"./autoresearch.sh passed with tests_green=299, tests_total=299, memory_error_rate=0, and autoresearch.checks.sh green","anti_overfit_note":"The change strengthens a generic ML service-token privacy guardrail; it does not depend on benchmark data, BEAM labels, rubrics, reference answers, or fixture-specific scoring shortcuts"}}
{"run":286,"commit":"2cba37d","metric":300,"metrics":{"tests_total":300,"milestone_index":9,"loc_core":2416,"commit_count_total":309,"memory_error_rate":0,"unsupported_claim_rate":0,"mean_precision_at_k":1,"mean_recall_at_k":1},"status":"keep","description":"reject Linear API keys","timestamp":1778232364376,"segment":26,"confidence":3.8214285714285716,"asi":{"hypothesis":"The privacy content filter should reject Linear API key prefixes even when synthetic low-entropy tokens avoid generic entropy detection","red_evidence":"privacy_filter_rejects_linear_api_key failed because a split synthetic lin_api_ token returned Ok(())","green_evidence":"./autoresearch.sh passed with tests_green=300, tests_total=300, memory_error_rate=0, and autoresearch.checks.sh green","anti_overfit_note":"The change strengthens a generic SaaS service-token privacy guardrail; it does not depend on benchmark data, BEAM labels, rubrics, reference answers, or fixture-specific scoring shortcuts"}}
{"run":287,"commit":"ec4480e","metric":301,"metrics":{"tests_total":301,"milestone_index":9,"loc_core":2422,"commit_count_total":310,"memory_error_rate":0,"unsupported_claim_rate":0,"mean_precision_at_k":1,"mean_recall_at_k":1},"status":"keep","description":"reject npm access tokens","timestamp":1778232415670,"segment":26,"confidence":3.857142857142857,"asi":{"hypothesis":"The privacy content filter should reject npm access token prefixes even when synthetic low-entropy tokens avoid generic entropy detection","red_evidence":"privacy_filter_rejects_npm_access_token failed because a split synthetic npm_ token returned Ok(())","green_evidence":"./autoresearch.sh passed with tests_green=301, tests_total=301, memory_error_rate=0, and autoresearch.checks.sh green","anti_overfit_note":"The change strengthens a generic package-registry service-token privacy guardrail; it does not depend on benchmark data, BEAM labels, rubrics, reference answers, or fixture-specific scoring shortcuts"}}
{"run":288,"commit":"055cfd6","metric":302,"metrics":{"tests_total":302,"milestone_index":9,"loc_core":2424,"commit_count_total":311,"memory_error_rate":0,"unsupported_claim_rate":0,"mean_precision_at_k":1,"mean_recall_at_k":1},"status":"keep","description":"reject pnpm credential paths","timestamp":1778232494027,"segment":26,"confidence":3.892857142857143,"asi":{"hypothesis":"The privacy path filter should reject pnpm rc files because they may contain package-registry authentication tokens","red_evidence":"privacy_filter_path_rejects_pnpmrc_file failed because privacy_filter_path(\".pnpmrc\") returned Ok(())","green_evidence":"./autoresearch.sh passed with tests_green=302, tests_total=302, memory_error_rate=0, and autoresearch.checks.sh green","anti_overfit_note":"The change strengthens a generic package-manager credential-file privacy guardrail; it does not depend on benchmark data, BEAM labels, rubrics, reference answers, or fixture-specific scoring shortcuts"}}
{"run":289,"commit":"602c5d5","metric":303,"metrics":{"tests_total":303,"milestone_index":9,"loc_core":2430,"commit_count_total":312,"memory_error_rate":0,"unsupported_claim_rate":0,"mean_precision_at_k":1,"mean_recall_at_k":1},"status":"keep","description":"reject Tailscale auth keys","timestamp":1778232556613,"segment":26,"confidence":3.8596491228070176,"asi":{"hypothesis":"The privacy content filter should reject Tailscale auth-key prefixes even when synthetic low-entropy tokens avoid generic entropy detection","red_evidence":"privacy_filter_rejects_tailscale_auth_key failed because a split synthetic tskey-auth token returned Ok(())","green_evidence":"./autoresearch.sh passed with tests_green=303, tests_total=303, memory_error_rate=0, and autoresearch.checks.sh green","anti_overfit_note":"The change strengthens a generic infrastructure service-token privacy guardrail; it does not depend on benchmark data, BEAM labels, rubrics, reference answers, or fixture-specific scoring shortcuts"}}
{"run":290,"commit":"c523be2","metric":304,"metrics":{"tests_total":304,"milestone_index":9,"loc_core":2436,"commit_count_total":313,"memory_error_rate":0,"unsupported_claim_rate":0,"mean_precision_at_k":1,"mean_recall_at_k":1},"status":"keep","description":"reject Tailscale API keys","timestamp":1778233184722,"segment":26,"confidence":3.8275862068965516,"asi":{"hypothesis":"The privacy content filter should reject Tailscale API key prefixes in addition to auth-key prefixes","red_evidence":"privacy_filter_rejects_tailscale_api_key failed because a split synthetic tskey-api token returned Ok(())","green_evidence":"./autoresearch.sh passed with tests_green=304, tests_total=304, memory_error_rate=0, and autoresearch.checks.sh green","anti_overfit_note":"The change strengthens a generic infrastructure service-token privacy guardrail; it does not depend on benchmark data, BEAM labels, rubrics, reference answers, or fixture-specific scoring shortcuts"}}
{"run":291,"commit":"0578a02","metric":305,"metrics":{"tests_total":305,"milestone_index":9,"loc_core":2438,"commit_count_total":314,"memory_error_rate":0,"unsupported_claim_rate":0,"mean_precision_at_k":1,"mean_recall_at_k":1},"status":"keep","description":"reject Composer auth paths","timestamp":1778233251030,"segment":26,"confidence":3.8620689655172415,"asi":{"hypothesis":"The privacy path filter should reject Composer auth.json files because they commonly contain package-registry credentials","red_evidence":"privacy_filter_path_rejects_composer_auth_file failed because privacy_filter_path(\"auth.json\") returned Ok(())","green_evidence":"./autoresearch.sh passed with tests_green=305, tests_total=305, memory_error_rate=0, and autoresearch.checks.sh green","anti_overfit_note":"The change strengthens a generic package-manager credential-file privacy guardrail; it does not depend on benchmark data, BEAM labels, rubrics, reference answers, or fixture-specific scoring shortcuts"}}
{"run":292,"commit":"cbb8875","metric":306,"metrics":{"tests_total":306,"milestone_index":9,"loc_core":2440,"commit_count_total":315,"memory_error_rate":0,"unsupported_claim_rate":0,"mean_precision_at_k":1,"mean_recall_at_k":1},"status":"keep","description":"reject NuGet credential paths","timestamp":1778233301780,"segment":26,"confidence":3.896551724137931,"asi":{"hypothesis":"The privacy path filter should reject NuGet.Config credential files because they can contain package-source credentials","red_evidence":"privacy_filter_path_rejects_nuget_config_file failed because privacy_filter_path(\".nuget/NuGet/NuGet.Config\") returned Ok(())","green_evidence":"./autoresearch.sh passed with tests_green=306, tests_total=306, memory_error_rate=0, and autoresearch.checks.sh green","anti_overfit_note":"The change strengthens a generic package-manager credential-file privacy guardrail; it does not depend on benchmark data, BEAM labels, rubrics, reference answers, or fixture-specific scoring shortcuts"}}
