{"run":328,"commit":"b86a100","metric":402,"metrics":{"tests_total":402,"milestone_index":9,"loc_core":3910,"commit_count_total":352,"memory_error_rate":0,"unsupported_claim_rate":0,"mean_precision_at_k":1,"mean_recall_at_k":1},"status":"keep","description":"Extract C struct and enum definitions","timestamp":1778352840350,"segment":28,"confidence":4,"asi":{"hypothesis":"C extraction should include named struct and enum specifiers as definition facts in addition to functions, because C APIs commonly expose data shapes and discriminants through those declarations.","red_evidence":"cargo test -q -p aver-extractor extract_c_struct_and_enum_symbols_emit_definition_facts failed because extract_c_structs and extract_c_enums were not exported.","green_evidence":"cargo test --workspace -q passed; ./autoresearch.sh passed with tests_green=402 tests_total=402 and checks green.","implementation_notes":"Added C collectors for struct_specifier and enum_specifier node names and extended extract_c_facts to emit Struct and Enum definition facts.","anti_overfit_note":"This is grammar-backed extraction of standard C declarations and does not depend on benchmark labels, scoring, or fixture-specific shortcuts."}}
{"run":329,"commit":"e9d45ac","metric":403,"metrics":{"tests_total":403,"milestone_index":9,"loc_core":3910,"commit_count_total":353,"memory_error_rate":0,"unsupported_claim_rate":0,"mean_precision_at_k":1,"mean_recall_at_k":1},"status":"keep","description":"Extract C typedef aliases","timestamp":1778352881255,"segment":28,"confidence":3.6,"asi":{"hypothesis":"C header/API extraction should capture typedef aliases because many C projects expose public types through typedef declarations rather than named structs/enums alone.","red_evidence":"cargo test -q -p aver-extractor extract_c_typedef_aliases_emit_definition_facts failed because extract_c_type_aliases was not exported.","green_evidence":"cargo test --workspace -q passed; ./autoresearch.sh passed with tests_green=403 tests_total=403 and checks green.","implementation_notes":"Added a type_definition declarator walker for C and extended extract_c_facts to emit TypeAlias facts for typedef names.","anti_overfit_note":"This is grammar-backed extraction of standard C typedef declarations and does not use benchmark labels, expected answers, or scoring-specific shortcuts."}}
{"run":330,"commit":"734a581","metric":404,"metrics":{"tests_total":404,"milestone_index":9,"loc_core":3910,"commit_count_total":354,"memory_error_rate":0,"unsupported_claim_rate":0,"mean_precision_at_k":1,"mean_recall_at_k":1},"status":"keep","description":"Extract C++ type aliases","timestamp":1778352958228,"segment":28,"confidence":3.3333333333333335,"asi":{"hypothesis":"C++ extraction should capture both `using` aliases and typedef aliases because modern C++ APIs expose many public symbols as type aliases.","red_evidence":"cargo test -q -p aver-extractor extract_cpp_type_aliases_emit_definition_facts failed because extract_cpp_type_aliases was not exported.","green_evidence":"cargo test --workspace -q passed; ./autoresearch.sh passed with tests_green=404 tests_total=404 and checks green.","implementation_notes":"Added C++ alias_declaration extraction plus reused the type_definition declarator walker for typedef aliases, extending extract_cpp_facts with TypeAlias facts.","anti_overfit_note":"This is grammar-backed extraction of standard C++ declaration forms and does not use benchmark labels, expected answers, or scoring-specific shortcuts."}}
{"run":331,"commit":"2d00ddd","metric":405,"metrics":{"tests_total":405,"milestone_index":9,"loc_core":3910,"commit_count_total":355,"memory_error_rate":0,"unsupported_claim_rate":0,"mean_precision_at_k":1,"mean_recall_at_k":1},"status":"keep","description":"Extract C# delegate definitions","timestamp":1778353016087,"segment":28,"confidence":3.6666666666666665,"asi":{"hypothesis":"C# extraction should include delegate declarations because delegates are named API surface symbols used for callbacks and events.","red_evidence":"cargo test -q -p aver-extractor extract_csharp_delegates_emit_definition_facts failed because extract_csharp_delegates was not exported.","green_evidence":"cargo test --workspace -q passed; ./autoresearch.sh passed with tests_green=405 tests_total=405 and checks green.","implementation_notes":"Added delegate_declaration name collection for C# and extended extract_csharp_facts with Delegate definition facts.","anti_overfit_note":"This is grammar-backed extraction of a standard C# declaration form and does not depend on benchmark labels, expected answers, or scoring-specific shortcuts."}}
{"run":332,"commit":"0018f16","metric":406,"metrics":{"tests_total":406,"milestone_index":9,"loc_core":3910,"commit_count_total":356,"memory_error_rate":0,"unsupported_claim_rate":0,"mean_precision_at_k":1,"mean_recall_at_k":1},"status":"keep","description":"Extract C# record definitions","timestamp":1778353057851,"segment":28,"confidence":4,"asi":{"hypothesis":"C# extraction should include record declarations because modern C# code commonly models immutable data/API shapes with records rather than classes or structs.","red_evidence":"cargo test -q -p aver-extractor extract_csharp_records_emit_definition_facts failed because extract_csharp_records was not exported.","green_evidence":"cargo test --workspace -q passed; ./autoresearch.sh passed with tests_green=406 tests_total=406 and checks green.","implementation_notes":"Added record_declaration name collection for C# and extended extract_csharp_facts with Record definition facts.","anti_overfit_note":"This is grammar-backed extraction of a standard C# declaration form and does not depend on benchmark labels, expected answers, or scoring-specific shortcuts."}}
{"run":333,"commit":"1b01ccb","metric":407,"metrics":{"tests_total":407,"milestone_index":9,"loc_core":3910,"commit_count_total":357,"memory_error_rate":0,"unsupported_claim_rate":0,"mean_precision_at_k":1,"mean_recall_at_k":1},"status":"keep","description":"Extract Java record definitions","timestamp":1778353112681,"segment":28,"confidence":3.7142857142857144,"asi":{"hypothesis":"Java extraction should include record declarations because modern Java APIs use records for immutable data shapes alongside classes and enums.","red_evidence":"cargo test -q -p aver-extractor extract_java_records_emit_definition_facts failed because extract_java_records was not exported.","green_evidence":"cargo test --workspace -q passed; ./autoresearch.sh passed with tests_green=407 tests_total=407 and checks green.","implementation_notes":"Added record_declaration name collection for Java and extended extract_java_facts with Record definition facts.","anti_overfit_note":"This is grammar-backed extraction of a standard Java declaration form and does not depend on benchmark labels, expected answers, or scoring-specific shortcuts."}}
{"run":334,"commit":"212de98","metric":408,"metrics":{"tests_total":408,"milestone_index":9,"loc_core":3910,"commit_count_total":358,"memory_error_rate":0,"unsupported_claim_rate":0,"mean_precision_at_k":1,"mean_recall_at_k":1},"status":"keep","description":"Extract Java annotation type definitions","timestamp":1778353160084,"segment":28,"confidence":3.5,"asi":{"hypothesis":"Java extraction should include annotation type declarations because Java libraries frequently expose custom annotations as named API surface symbols.","red_evidence":"cargo test -q -p aver-extractor extract_java_annotations_emit_definition_facts failed because extract_java_annotations was not exported.","green_evidence":"cargo test --workspace -q passed; ./autoresearch.sh passed with tests_green=408 tests_total=408 and checks green.","implementation_notes":"Added annotation_type_declaration name collection for Java and extended extract_java_facts with Annotation definition facts.","anti_overfit_note":"This is grammar-backed extraction of a standard Java declaration form and does not depend on benchmark labels, expected answers, or scoring-specific shortcuts."}}
{"run":335,"commit":"1a8ce36","metric":409,"metrics":{"tests_total":409,"milestone_index":9,"loc_core":3910,"commit_count_total":359,"memory_error_rate":0,"unsupported_claim_rate":0,"mean_precision_at_k":1,"mean_recall_at_k":1},"status":"keep","description":"Extract Swift actor definitions","timestamp":1778353207399,"segment":28,"confidence":3.75,"asi":{"hypothesis":"Swift extraction should include actor declarations because actors are named concurrency/type definitions in modern Swift, parallel to classes, structs, enums, and protocols.","red_evidence":"cargo test -q -p aver-extractor extract_swift_actors_emit_definition_facts failed because extract_swift_actors was not exported.","green_evidence":"cargo test --workspace -q passed; ./autoresearch.sh passed with tests_green=409 tests_total=409 and checks green.","implementation_notes":"Added declaration_kind == actor filtering for Swift class_declaration nodes and extended extract_swift_facts with Actor definition facts.","anti_overfit_note":"This is grammar-backed extraction of a standard Swift declaration form and does not depend on benchmark labels, expected answers, or scoring-specific shortcuts."}}
{"run":336,"commit":"bf1fc13","metric":410,"metrics":{"tests_total":410,"milestone_index":9,"loc_core":3910,"commit_count_total":360,"memory_error_rate":0,"unsupported_claim_rate":0,"mean_precision_at_k":1,"mean_recall_at_k":1},"status":"keep","description":"Extract C++ namespace definitions","timestamp":1778353277176,"segment":28,"confidence":4,"asi":{"hypothesis":"C++ extraction should include namespace declarations because namespaces are named API organization symbols and common ownership boundaries in C++ headers.","red_evidence":"cargo test -q -p aver-extractor extract_cpp_namespaces_emit_definition_facts failed because extract_cpp_namespaces was not exported.","green_evidence":"cargo test --workspace -q passed; ./autoresearch.sh passed with tests_green=410 tests_total=410 and checks green.","implementation_notes":"Added namespace_definition name collection for C++ and extended extract_cpp_facts with Namespace definition facts.","anti_overfit_note":"This is grammar-backed extraction of a standard C++ declaration form and does not depend on benchmark labels, expected answers, or scoring-specific shortcuts."}}
{"run":337,"commit":"f60cd7c","metric":411,"metrics":{"tests_total":411,"milestone_index":9,"loc_core":3910,"commit_count_total":361,"memory_error_rate":0,"unsupported_claim_rate":0,"mean_precision_at_k":1,"mean_recall_at_k":1},"status":"keep","description":"Extract C# namespace definitions","timestamp":1778353316478,"segment":28,"confidence":3.7777777777777777,"asi":{"hypothesis":"C# extraction should include namespace declarations because namespaces are named API organization and ownership boundaries in C# codebases.","red_evidence":"cargo test -q -p aver-extractor extract_csharp_namespaces_emit_definition_facts failed because extract_csharp_namespaces was not exported.","green_evidence":"cargo test --workspace -q passed; ./autoresearch.sh passed with tests_green=411 tests_total=411 and checks green.","implementation_notes":"Added namespace_declaration name collection for C# and extended extract_csharp_facts with Namespace definition facts.","anti_overfit_note":"This is grammar-backed extraction of a standard C# declaration form and does not depend on benchmark labels, expected answers, or scoring-specific shortcuts."}}
{"run":338,"commit":"ba54f28","metric":412,"metrics":{"tests_total":412,"milestone_index":9,"loc_core":3910,"commit_count_total":362,"memory_error_rate":0,"unsupported_claim_rate":0,"mean_precision_at_k":1,"mean_recall_at_k":1},"status":"keep","description":"Extract PHP namespace definitions","timestamp":1778353351541,"segment":28,"confidence":3.6,"asi":{"hypothesis":"PHP extraction should include namespace declarations because modern PHP packages use namespaces as named API organization and ownership boundaries.","red_evidence":"cargo test -q -p aver-extractor extract_php_namespaces_emit_definition_facts failed because extract_php_namespaces was not exported.","green_evidence":"cargo test --workspace -q passed; ./autoresearch.sh passed with tests_green=412 tests_total=412 and checks green.","implementation_notes":"Added namespace_definition name collection for PHP and extended extract_php_facts with Namespace definition facts.","anti_overfit_note":"This is grammar-backed extraction of a standard PHP declaration form and does not depend on benchmark labels, expected answers, or scoring-specific shortcuts."}}
{"run":339,"commit":"5ce70bd","metric":413,"metrics":{"tests_total":413,"milestone_index":9,"loc_core":3910,"commit_count_total":363,"memory_error_rate":0,"unsupported_claim_rate":0,"mean_precision_at_k":1,"mean_recall_at_k":1},"status":"keep","description":"Extract Java package definitions","timestamp":1778353407215,"segment":28,"confidence":3.8,"asi":{"hypothesis":"Java extraction should include package declarations because packages are named API organization and ownership boundaries for Java source files.","red_evidence":"cargo test -q -p aver-extractor extract_java_packages_emit_definition_facts failed because extract_java_packages was not exported.","green_evidence":"cargo test --workspace -q passed; ./autoresearch.sh passed with tests_green=413 tests_total=413 and checks green.","implementation_notes":"Added package_declaration scanning for scoped_identifier/identifier children and extended extract_java_facts with Package definition facts.","anti_overfit_note":"This is grammar-backed extraction of a standard Java declaration form and does not depend on benchmark labels, expected answers, or scoring-specific shortcuts."}}
{"run":340,"commit":"3345fd5","metric":414,"metrics":{"tests_total":414,"milestone_index":9,"loc_core":3910,"commit_count_total":364,"memory_error_rate":0,"unsupported_claim_rate":0,"mean_precision_at_k":1,"mean_recall_at_k":1},"status":"keep","description":"Extract Python class inheritance facts","timestamp":1778353466693,"segment":28,"confidence":4,"asi":{"hypothesis":"Python class extraction should emit inheritance facts because superclass relationships are a core deterministic AST relationship and align with the v0.3 class-extends roadmap beyond TypeScript.","red_evidence":"cargo test -q -p aver-extractor extract_python_facts_emit_class_extends_triple failed because extract_python_facts did not include a Class:Store extends Class:BaseStore triple.","green_evidence":"cargo test --workspace -q passed; ./autoresearch.sh passed with tests_green=414 tests_total=414 and checks green.","implementation_notes":"Added Python class_definition superclass scanning via the Tree-sitter superclasses field and extended extract_python_facts with extends triples.","anti_overfit_note":"This is grammar-backed extraction of a standard Python inheritance relationship and does not depend on benchmark labels, expected answers, or scoring-specific shortcuts."}}
{"run":341,"commit":"99c59af","metric":415,"metrics":{"tests_total":415,"milestone_index":9,"loc_core":3910,"commit_count_total":365,"memory_error_rate":0,"unsupported_claim_rate":0,"mean_precision_at_k":1,"mean_recall_at_k":1},"status":"keep","description":"Extract Java class inheritance facts","timestamp":1778353503363,"segment":28,"confidence":3.8181818181818183,"asi":{"hypothesis":"Java class extraction should emit inheritance facts because superclass relationships are a core deterministic AST relationship and align with the v0.3 class-extends roadmap across common languages.","red_evidence":"cargo test -q -p aver-extractor extract_java_facts_emit_class_extends_triple failed because extract_java_facts did not include a Class:Store extends Class:BaseStore triple.","green_evidence":"cargo test --workspace -q passed; ./autoresearch.sh passed with tests_green=415 tests_total=415 and checks green.","implementation_notes":"Added Java class_declaration superclass scanning via the Tree-sitter superclass field and extended extract_java_facts with extends triples.","anti_overfit_note":"This is grammar-backed extraction of a standard Java inheritance relationship and does not depend on benchmark labels, expected answers, or scoring-specific shortcuts."}}
{"run":342,"commit":"069d6cf","metric":416,"metrics":{"tests_total":416,"milestone_index":9,"loc_core":3910,"commit_count_total":366,"memory_error_rate":0,"unsupported_claim_rate":0,"mean_precision_at_k":1,"mean_recall_at_k":1},"status":"keep","description":"Extract C++ class inheritance facts","timestamp":1778353547689,"segment":28,"confidence":3.6666666666666665,"asi":{"hypothesis":"C++ class extraction should emit inheritance facts because base-class clauses are a core deterministic AST relationship and align with the v0.3 class-extends roadmap across common languages.","red_evidence":"cargo test -q -p aver-extractor extract_cpp_facts_emit_class_extends_triple failed because extract_cpp_facts did not include a Class:Store extends Class:BaseStore triple.","green_evidence":"cargo test --workspace -q passed; ./autoresearch.sh passed with tests_green=416 tests_total=416 and checks green.","implementation_notes":"Added C++ class_specifier/struct_specifier base_class_clause scanning and extended extract_cpp_facts with extends triples.","anti_overfit_note":"This is grammar-backed extraction of a standard C++ inheritance relationship and does not depend on benchmark labels, expected answers, or scoring-specific shortcuts."}}
{"run":343,"commit":"ab4b921","metric":417,"metrics":{"tests_total":417,"milestone_index":9,"loc_core":3910,"commit_count_total":367,"memory_error_rate":0,"unsupported_claim_rate":0,"mean_precision_at_k":1,"mean_recall_at_k":1},"status":"keep","description":"Extract C# class inheritance facts","timestamp":1778353602740,"segment":28,"confidence":3.8333333333333335,"asi":{"hypothesis":"C# class extraction should emit inheritance facts because base-list relationships are a core deterministic AST relationship and align with the v0.3 class-extends roadmap across common languages.","red_evidence":"cargo test -q -p aver-extractor extract_csharp_facts_emit_class_extends_triple failed because extract_csharp_facts did not include a Class:Store extends Class:BaseStore triple.","green_evidence":"cargo test --workspace -q passed; ./autoresearch.sh passed with tests_green=417 tests_total=417 and checks green.","implementation_notes":"Added C# class_declaration base_list scanning and extended extract_csharp_facts with extends triples.","anti_overfit_note":"This is grammar-backed extraction of a standard C# inheritance relationship and does not depend on benchmark labels, expected answers, or scoring-specific shortcuts."}}
{"run":344,"commit":"262d96f","metric":418,"metrics":{"tests_total":418,"milestone_index":9,"loc_core":3910,"commit_count_total":368,"memory_error_rate":0,"unsupported_claim_rate":0,"mean_precision_at_k":1,"mean_recall_at_k":1},"status":"keep","description":"Extract Swift class inheritance facts","timestamp":1778353655520,"segment":28,"confidence":4,"asi":{"hypothesis":"Swift class extraction should emit inheritance facts because inheritance_specifier relationships are a core deterministic AST relationship and align with the v0.3 class-extends roadmap across common languages.","red_evidence":"cargo test -q -p aver-extractor extract_swift_facts_emit_class_extends_triple failed because extract_swift_facts did not include a Class:Store extends Class:BaseStore triple.","green_evidence":"cargo test --workspace -q passed; ./autoresearch.sh passed with tests_green=418 tests_total=418 and checks green.","implementation_notes":"Added Swift class_declaration inheritance_specifier scanning for class/actor declarations and extended extract_swift_facts with extends triples.","anti_overfit_note":"This is grammar-backed extraction of a standard Swift inheritance relationship and does not depend on benchmark labels, expected answers, or scoring-specific shortcuts."}}
{"run":192,"commit":"e56cb9c","metric":59.75261655566128,"metrics":{"beam_questions":400,"beam_rubric_checks":1051,"beam_abstention_pct":72.5,"beam_contradiction_resolution_pct":54.6875,"beam_event_ordering_pct":71.83098591549296,"beam_information_extraction_pct":44.02173913043478,"beam_instruction_following_pct":51.69491525423729,"beam_knowledge_update_pct":64.28571428571429,"beam_multi_session_reasoning_pct":58.415841584158414,"beam_preference_following_pct":80.4054054054054,"beam_summarization_pct":47.94871794871795,"beam_temporal_reasoning_pct":64.66666666666666},"status":"checks_failed","description":"Explain BEAM context ordering in answer prompt, but checks failed and score was below best","timestamp":1778353656992,"segment":26,"confidence":127.70000000000105,"asi":{"hypothesis":"Explicitly telling the generator whether retrieved contexts are ordered newest-to-oldest or oldest-to-newest should help it use query-adaptive ordering correctly without exposing benchmark labels or references.","rollback_reason":"autoresearch.checks.sh failed on cargo fmt in crates/aver-extractor/src/lib.rs, and the primary score 59.7526 was below current best 60.7517 anyway.","result":"Knowledge_update improved sharply, but abstention, information extraction, summarization, and overall score regressed; prompt order notes appear too costly/noisy as written.","anti_overfit_note":"The change was generic prompt/context formatting based only on question text and context order; no BEAM labels, rubrics, reference answers, or expected outputs were used.","next_action_hint":"Do not retry this exact order-note wording. Before further experiments, fix or account for the extractor rustfmt drift so checks do not mask benchmark outcomes."}}
