{"run":450,"commit":"0b76b17","metric":544,"metrics":{"tests_green":544,"tests_total":544,"milestone_index":9,"loc_core":5133,"commit_count_total":481,"memory_error_rate":0,"unsupported_claim_rate":0,"mean_precision_at_k":1,"mean_recall_at_k":1,"beam_questions":0,"beam_rubric_checks":0,"beam_abstention_pct":0,"beam_contradiction_resolution_pct":0,"beam_event_ordering_pct":0,"beam_information_extraction_pct":0,"beam_instruction_following_pct":0,"beam_knowledge_update_pct":0,"beam_multi_session_reasoning_pct":0,"beam_preference_following_pct":0,"beam_summarization_pct":0,"beam_temporal_reasoning_pct":0},"status":"keep","description":"Reject blank observation agent ids","timestamp":1778421372474,"segment":28,"confidence":4.545454545454546,"asi":{"hypothesis":"Observation agent_id should reject blank strings at the schema layer because record_observation derives a validated producing agent identity from source events.","red_evidence":"`cargo test -q -p aver-core --test migrations observations_agent_id_must_not_be_blank` failed because direct SQL accepted `agent_id = '   '`.","green_evidence":"Targeted test passed; full migrations test passed; `./autoresearch.sh` passed with checks green and metrics tests_green=544 tests_total=544.","implementation_notes":"Added migration `0032_observation_agent_id_nonblank_checks.sql` with insert/update triggers rejecting observations rows whose trimmed agent_id is empty; registered it in embedded migrations.","anti_overfit_note":"This enforces a generic observation provenance invariant and does not depend on benchmark-specific expected answers."}}
{"run":451,"commit":"cd6212e","metric":545,"metrics":{"tests_green":545,"tests_total":545,"milestone_index":9,"loc_core":5137,"commit_count_total":482,"memory_error_rate":0,"unsupported_claim_rate":0,"mean_precision_at_k":1,"mean_recall_at_k":1,"beam_questions":0,"beam_rubric_checks":0,"beam_abstention_pct":0,"beam_contradiction_resolution_pct":0,"beam_event_ordering_pct":0,"beam_information_extraction_pct":0,"beam_instruction_following_pct":0,"beam_knowledge_update_pct":0,"beam_multi_session_reasoning_pct":0,"beam_preference_following_pct":0,"beam_summarization_pct":0,"beam_temporal_reasoning_pct":0},"status":"keep","description":"Reject invalid observation agent id characters","timestamp":1778421439491,"segment":28,"confidence":4.575757575757576,"asi":{"hypothesis":"Observation agent_id should enforce the same portable identifier character set as source events, preventing direct SQL rows from breaking observation provenance/audit assumptions.","red_evidence":"`cargo test -q -p aver-core --test migrations observations_agent_id_allows_only_portable_identifier_chars` failed because direct SQL accepted `agent_id = 'bad id!'`.","green_evidence":"Targeted test passed; full migrations test passed; `./autoresearch.sh` passed with checks green and metrics tests_green=545 tests_total=545.","implementation_notes":"Added migration `0033_observation_agent_id_charset_checks.sql` with insert/update triggers using SQLite GLOB to reject characters outside ASCII alphanumeric, underscore, and hyphen; registered it in embedded migrations.","anti_overfit_note":"This mirrors existing generic provenance identifier validation and is independent of benchmark fixtures or scoring."}}
{"run":452,"commit":"a1f2c0a","metric":546,"metrics":{"tests_green":546,"tests_total":546,"milestone_index":9,"loc_core":5141,"commit_count_total":483,"memory_error_rate":0,"unsupported_claim_rate":0,"mean_precision_at_k":1,"mean_recall_at_k":1,"beam_questions":0,"beam_rubric_checks":0,"beam_abstention_pct":0,"beam_contradiction_resolution_pct":0,"beam_event_ordering_pct":0,"beam_information_extraction_pct":0,"beam_instruction_following_pct":0,"beam_knowledge_update_pct":0,"beam_multi_session_reasoning_pct":0,"beam_preference_following_pct":0,"beam_summarization_pct":0,"beam_temporal_reasoning_pct":0},"status":"keep","description":"Reject blank observation session ids","timestamp":1778421536725,"segment":28,"confidence":4.606060606060606,"asi":{"hypothesis":"Observation session_id should reject blank strings at the schema layer because record_observation validates session scope before writing source-backed observations.","red_evidence":"`cargo test -q -p aver-core --test migrations observations_session_id_must_not_be_blank` failed because direct SQL accepted `session_id = '   '`.","green_evidence":"Targeted test passed; full migrations test passed; `./autoresearch.sh` passed with checks green and metrics tests_green=546 tests_total=546.","implementation_notes":"Added migration `0034_observation_session_nonblank_checks.sql` with insert/update triggers rejecting observations rows whose trimmed session_id is empty; registered it in embedded migrations.","anti_overfit_note":"This enforces a generic session provenance invariant used by replay and compaction, not benchmark-specific output shaping."}}
{"run":453,"commit":"003466a","metric":547,"metrics":{"tests_green":547,"tests_total":547,"milestone_index":9,"loc_core":5145,"commit_count_total":484,"memory_error_rate":0,"unsupported_claim_rate":0,"mean_precision_at_k":1,"mean_recall_at_k":1,"beam_questions":0,"beam_rubric_checks":0,"beam_abstention_pct":0,"beam_contradiction_resolution_pct":0,"beam_event_ordering_pct":0,"beam_information_extraction_pct":0,"beam_instruction_following_pct":0,"beam_knowledge_update_pct":0,"beam_multi_session_reasoning_pct":0,"beam_preference_following_pct":0,"beam_summarization_pct":0,"beam_temporal_reasoning_pct":0},"status":"keep","description":"Reject blank observation content","timestamp":1778421587581,"segment":28,"confidence":4.567164179104478,"asi":{"hypothesis":"Observation content should reject blank strings at the schema layer because record_observation validates semantic projection content before logging.","red_evidence":"`cargo test -q -p aver-core --test migrations observations_content_must_not_be_blank` failed because direct SQL accepted `content = '   '`.","green_evidence":"Targeted test passed; full migrations test passed; `./autoresearch.sh` passed with checks green and metrics tests_green=547 tests_total=547.","implementation_notes":"Added migration `0035_observation_content_nonblank_checks.sql` with insert/update triggers rejecting observations rows whose trimmed content is empty; registered it in embedded migrations.","anti_overfit_note":"This enforces a general observation semantic-content invariant and does not depend on benchmark expected answers."}}
{"run":454,"commit":"7dcd641","metric":548,"metrics":{"tests_green":548,"tests_total":548,"milestone_index":9,"loc_core":5149,"commit_count_total":485,"memory_error_rate":0,"unsupported_claim_rate":0,"mean_precision_at_k":1,"mean_recall_at_k":1,"beam_questions":0,"beam_rubric_checks":0,"beam_abstention_pct":0,"beam_contradiction_resolution_pct":0,"beam_event_ordering_pct":0,"beam_information_extraction_pct":0,"beam_instruction_following_pct":0,"beam_knowledge_update_pct":0,"beam_multi_session_reasoning_pct":0,"beam_preference_following_pct":0,"beam_summarization_pct":0,"beam_temporal_reasoning_pct":0},"status":"keep","description":"Reject blank observation derivations","timestamp":1778421628368,"segment":28,"confidence":4.529411764705882,"asi":{"hypothesis":"Observation derivation should reject blank strings at the schema layer because record_observation validates a derivation/audit rationale before logging.","red_evidence":"`cargo test -q -p aver-core --test migrations observations_derivation_must_not_be_blank` failed because direct SQL accepted `derivation = '   '`.","green_evidence":"Targeted test passed; full migrations test passed; `./autoresearch.sh` passed with checks green and metrics tests_green=548 tests_total=548.","implementation_notes":"Added migration `0036_observation_derivation_nonblank_checks.sql` with insert/update triggers rejecting observations rows whose trimmed derivation is empty; registered it in embedded migrations.","anti_overfit_note":"This enforces a general observation auditability invariant and does not depend on benchmark expected answers."}}
{"run":455,"commit":"00dbec1","metric":549,"metrics":{"tests_green":549,"tests_total":549,"milestone_index":9,"loc_core":5153,"commit_count_total":486,"memory_error_rate":0,"unsupported_claim_rate":0,"mean_precision_at_k":1,"mean_recall_at_k":1,"beam_questions":0,"beam_rubric_checks":0,"beam_abstention_pct":0,"beam_contradiction_resolution_pct":0,"beam_event_ordering_pct":0,"beam_information_extraction_pct":0,"beam_instruction_following_pct":0,"beam_knowledge_update_pct":0,"beam_multi_session_reasoning_pct":0,"beam_preference_following_pct":0,"beam_summarization_pct":0,"beam_temporal_reasoning_pct":0},"status":"keep","description":"Reject blank observation ids","timestamp":1778421681570,"segment":28,"confidence":4.5588235294117645,"asi":{"hypothesis":"Observation ids should reject blank strings at the schema layer because Store generates deterministic nonblank projection ids and retrieval/audit paths require meaningful ids.","red_evidence":"`cargo test -q -p aver-core --test migrations observations_id_must_not_be_blank` failed because direct SQL accepted a whitespace-only primary key.","green_evidence":"Targeted test passed; full migrations test passed; `./autoresearch.sh` passed with checks green and metrics tests_green=549 tests_total=549.","implementation_notes":"Added migration `0037_observation_id_nonblank_checks.sql` with insert/update triggers rejecting observations rows whose trimmed id is empty; registered it in embedded migrations.","anti_overfit_note":"This protects a general identifier/audit invariant and is not tied to benchmark scoring or expected answers."}}
{"run":456,"commit":"7f1b032","metric":550,"metrics":{"tests_green":550,"tests_total":550,"milestone_index":9,"loc_core":5157,"commit_count_total":487,"memory_error_rate":0,"unsupported_claim_rate":0,"mean_precision_at_k":1,"mean_recall_at_k":1,"beam_questions":0,"beam_rubric_checks":0,"beam_abstention_pct":0,"beam_contradiction_resolution_pct":0,"beam_event_ordering_pct":0,"beam_information_extraction_pct":0,"beam_instruction_following_pct":0,"beam_knowledge_update_pct":0,"beam_multi_session_reasoning_pct":0,"beam_preference_following_pct":0,"beam_summarization_pct":0,"beam_temporal_reasoning_pct":0},"status":"keep","description":"Reject blank candidate claim subjects","timestamp":1778421747179,"segment":28,"confidence":4.457142857142857,"asi":{"hypothesis":"Candidate claim subjects should reject blank strings at the schema layer because propose_candidate_claim validates staged triple fields before persistence.","red_evidence":"`cargo test -q -p aver-core --test migrations candidate_claim_subject_must_not_be_blank` failed because direct SQL accepted `subject = '   '`.","green_evidence":"Targeted test passed; full migrations test passed; `./autoresearch.sh` passed with checks green and metrics tests_green=550 tests_total=550.","implementation_notes":"Added migration `0038_candidate_claim_subject_nonblank_checks.sql` with insert/update triggers rejecting candidate_claims rows whose trimmed subject is empty; registered it in embedded migrations.","anti_overfit_note":"This enforces the generic staged-triple shape invariant and is independent of benchmark-specific answers."}}
{"run":457,"commit":"2fd82f7","metric":551,"metrics":{"tests_green":551,"tests_total":551,"milestone_index":9,"loc_core":5161,"commit_count_total":488,"memory_error_rate":0,"unsupported_claim_rate":0,"mean_precision_at_k":1,"mean_recall_at_k":1,"beam_questions":0,"beam_rubric_checks":0,"beam_abstention_pct":0,"beam_contradiction_resolution_pct":0,"beam_event_ordering_pct":0,"beam_information_extraction_pct":0,"beam_instruction_following_pct":0,"beam_knowledge_update_pct":0,"beam_multi_session_reasoning_pct":0,"beam_preference_following_pct":0,"beam_summarization_pct":0,"beam_temporal_reasoning_pct":0},"status":"keep","description":"Reject blank candidate claim predicates","timestamp":1778421799338,"segment":28,"confidence":4.422535211267606,"asi":{"hypothesis":"Candidate claim predicates should reject blank strings at the schema layer because propose_candidate_claim validates staged triple fields before persistence.","red_evidence":"`cargo test -q -p aver-core --test migrations candidate_claim_predicate_must_not_be_blank` failed because direct SQL accepted `predicate = '   '`.","green_evidence":"Targeted test passed; full migrations test passed; `./autoresearch.sh` passed with checks green and metrics tests_green=551 tests_total=551.","implementation_notes":"Added migration `0039_candidate_claim_predicate_nonblank_checks.sql` with insert/update triggers rejecting candidate_claims rows whose trimmed predicate is empty; registered it in embedded migrations.","anti_overfit_note":"This enforces the generic staged-triple shape invariant and is independent of benchmark-specific answers."}}
{"run":458,"commit":"ccea6e6","metric":552,"metrics":{"tests_green":552,"tests_total":552,"milestone_index":9,"loc_core":5165,"commit_count_total":489,"memory_error_rate":0,"unsupported_claim_rate":0,"mean_precision_at_k":1,"mean_recall_at_k":1,"beam_questions":0,"beam_rubric_checks":0,"beam_abstention_pct":0,"beam_contradiction_resolution_pct":0,"beam_event_ordering_pct":0,"beam_information_extraction_pct":0,"beam_instruction_following_pct":0,"beam_knowledge_update_pct":0,"beam_multi_session_reasoning_pct":0,"beam_preference_following_pct":0,"beam_summarization_pct":0,"beam_temporal_reasoning_pct":0},"status":"keep","description":"Reject blank candidate claim objects","timestamp":1778421843671,"segment":28,"confidence":4.388888888888889,"asi":{"hypothesis":"Candidate claim objects should reject blank strings at the schema layer because propose_candidate_claim validates staged triple fields before persistence.","red_evidence":"`cargo test -q -p aver-core --test migrations candidate_claim_object_must_not_be_blank` failed because direct SQL accepted `object = '   '`.","green_evidence":"Targeted test passed; full migrations test passed; `./autoresearch.sh` passed with checks green and metrics tests_green=552 tests_total=552.","implementation_notes":"Added migration `0040_candidate_claim_object_nonblank_checks.sql` with insert/update triggers rejecting candidate_claims rows whose trimmed object is empty; registered it in embedded migrations.","anti_overfit_note":"This enforces the generic staged-triple shape invariant and is independent of benchmark-specific answers."}}
{"run":459,"commit":"51ee9b7","metric":553,"metrics":{"tests_green":553,"tests_total":553,"milestone_index":9,"loc_core":5169,"commit_count_total":490,"memory_error_rate":0,"unsupported_claim_rate":0,"mean_precision_at_k":1,"mean_recall_at_k":1,"beam_questions":0,"beam_rubric_checks":0,"beam_abstention_pct":0,"beam_contradiction_resolution_pct":0,"beam_event_ordering_pct":0,"beam_information_extraction_pct":0,"beam_instruction_following_pct":0,"beam_knowledge_update_pct":0,"beam_multi_session_reasoning_pct":0,"beam_preference_following_pct":0,"beam_summarization_pct":0,"beam_temporal_reasoning_pct":0},"status":"keep","description":"Require reasons for rejected candidate claims","timestamp":1778421922033,"segment":28,"confidence":4.416666666666667,"asi":{"hypothesis":"Rejected candidate claims should require a nonblank rejection_reason at the schema layer because Store::reject_candidate_claim validates rejection rationale before updating staged memory.","red_evidence":"`cargo test -q -p aver-core --test migrations rejected_candidate_claims_must_have_nonblank_reason` failed because direct SQL accepted status REJECTED with `rejection_reason = '   '`.","green_evidence":"Targeted test passed; full migrations test passed; `./autoresearch.sh` passed with checks green and metrics tests_green=553 tests_total=553.","implementation_notes":"Added migration `0041_candidate_rejection_reason_checks.sql` with insert/update triggers requiring non-null/nonblank rejection_reason when candidate_claims.status is REJECTED; registered it in embedded migrations.","anti_overfit_note":"This enforces a generic staged-claim workflow/audit invariant and does not shape benchmark outputs."}}
{"run":460,"commit":"5b6d86c","metric":554,"metrics":{"tests_green":554,"tests_total":554,"milestone_index":9,"loc_core":5173,"commit_count_total":491,"memory_error_rate":0,"unsupported_claim_rate":0,"mean_precision_at_k":1,"mean_recall_at_k":1,"beam_questions":0,"beam_rubric_checks":0,"beam_abstention_pct":0,"beam_contradiction_resolution_pct":0,"beam_event_ordering_pct":0,"beam_information_extraction_pct":0,"beam_instruction_following_pct":0,"beam_knowledge_update_pct":0,"beam_multi_session_reasoning_pct":0,"beam_preference_following_pct":0,"beam_summarization_pct":0,"beam_temporal_reasoning_pct":0},"status":"keep","description":"Require claim ids for promoted candidates","timestamp":1778421980874,"segment":28,"confidence":4.444444444444445,"asi":{"hypothesis":"Promoted candidate claims should require promoted_claim_id at the schema layer because Store::promote_candidate_claim sets status and the durable claim reference together.","red_evidence":"`cargo test -q -p aver-core --test migrations promoted_candidate_claims_must_reference_claim` failed because direct SQL accepted status PROMOTED with `promoted_claim_id = NULL`.","green_evidence":"Targeted test passed; full migrations test passed; `./autoresearch.sh` passed with checks green and metrics tests_green=554 tests_total=554.","implementation_notes":"Added migration `0042_candidate_promotion_claim_id_checks.sql` with insert/update triggers requiring promoted_claim_id when candidate_claims.status is PROMOTED; registered it in embedded migrations.","anti_overfit_note":"This enforces a generic staged-to-durable workflow invariant and does not shape benchmark outputs."}}
{"run":461,"commit":"9f6967e","metric":555,"metrics":{"tests_green":555,"tests_total":555,"milestone_index":9,"loc_core":5177,"commit_count_total":492,"memory_error_rate":0,"unsupported_claim_rate":0,"mean_precision_at_k":1,"mean_recall_at_k":1,"beam_questions":0,"beam_rubric_checks":0,"beam_abstention_pct":0,"beam_contradiction_resolution_pct":0,"beam_event_ordering_pct":0,"beam_information_extraction_pct":0,"beam_instruction_following_pct":0,"beam_knowledge_update_pct":0,"beam_multi_session_reasoning_pct":0,"beam_preference_following_pct":0,"beam_summarization_pct":0,"beam_temporal_reasoning_pct":0},"status":"keep","description":"Reject non-positive candidate timestamps","timestamp":1778422122123,"segment":28,"confidence":4.410958904109589,"asi":{"hypothesis":"Candidate claim created_at values should be positive at the schema layer because Store stages candidates with real Unix timestamps and audit ordering should not contain sentinel zero values.","red_evidence":"`cargo test -q -p aver-core --test migrations candidate_claim_created_at_must_be_positive` failed because direct SQL accepted `created_at = 0`.","green_evidence":"Targeted test passed; full migrations test passed; `./autoresearch.sh` passed with checks green and metrics tests_green=555 tests_total=555.","implementation_notes":"Added migration `0043_candidate_created_at_positive_checks.sql` with insert/update triggers rejecting candidate_claims rows whose created_at is <= 0; registered it in embedded migrations. Updated direct-SQL candidate shape tests to use positive timestamps so they continue isolating their intended invariant.","anti_overfit_note":"This is a general audit/order invariant for staged memory and does not use benchmark expected outputs or labels."}}
{"run":462,"commit":"f270a24","metric":556,"metrics":{"tests_green":556,"tests_total":556,"milestone_index":9,"loc_core":5181,"commit_count_total":493,"memory_error_rate":0,"unsupported_claim_rate":0,"mean_precision_at_k":1,"mean_recall_at_k":1,"beam_questions":0,"beam_rubric_checks":0,"beam_abstention_pct":0,"beam_contradiction_resolution_pct":0,"beam_event_ordering_pct":0,"beam_information_extraction_pct":0,"beam_instruction_following_pct":0,"beam_knowledge_update_pct":0,"beam_multi_session_reasoning_pct":0,"beam_preference_following_pct":0,"beam_summarization_pct":0,"beam_temporal_reasoning_pct":0},"status":"keep","description":"Reject non-positive episodic event timestamps","timestamp":1778422220399,"segment":28,"confidence":4.378378378378378,"asi":{"hypothesis":"Episodic event timestamps should be positive at the schema layer because Store records real Unix timestamps and event ordering/extraction thresholds should not contain sentinel zero values.","red_evidence":"`cargo test -q -p aver-core --test migrations episodic_event_timestamp_must_be_positive` failed because direct SQL accepted `ts = 0`.","green_evidence":"Targeted test passed; full migrations test passed; `./autoresearch.sh` passed with checks green and metrics tests_green=556 tests_total=556.","implementation_notes":"Added migration `0044_episodic_event_ts_positive_checks.sql` with insert/update triggers rejecting episodic_events rows whose ts is <= 0; registered it in embedded migrations. Updated direct-SQL episodic event invariant tests to use positive timestamps so they keep isolating their intended validation.","anti_overfit_note":"This is a general event ordering/audit invariant and does not use benchmark expected outputs or labels."}}
