{"run":198,"commit":"12a49e2","metric":433,"metrics":{"beam_questions":0,"beam_rubric_checks":0,"beam_abstention_pct":0,"beam_contradiction_resolution_pct":0,"beam_event_ordering_pct":0,"beam_information_extraction_pct":0,"beam_instruction_following_pct":0,"beam_knowledge_update_pct":0,"beam_multi_session_reasoning_pct":0,"beam_preference_following_pct":0,"beam_summarization_pct":0,"beam_temporal_reasoning_pct":0,"tests_green":433,"tests_total":433,"milestone_index":9,"loc_core":3910,"commit_count_total":380,"memory_error_rate":0,"unsupported_claim_rate":0,"mean_precision_at_k":1,"mean_recall_at_k":1},"status":"keep","description":"Extract C++ struct inheritance facts with Struct prefixes","timestamp":1778354588749,"segment":26,"confidence":568.8537499999957,"asi":{"hypothesis":"C++ struct inheritance should emit Struct extends Struct triples because structs are first-class type definitions in the extractor and should not be coerced into Class facts.","red_evidence":"cargo test -q -p aver-extractor extract_cpp_facts_emit_struct_extends_triple failed because extract_cpp_facts did not include Struct:Store extends Struct:BaseStore.","green_evidence":"cargo test --workspace -q passed; ./autoresearch.sh passed with tests_green=433 tests_total=433 and checks green.","implementation_notes":"Generalized C++ base_class_clause extraction to choose Class or Struct fact prefixes based on class_specifier vs struct_specifier.","anti_overfit_note":"This is grammar-backed extraction of a standard C++ language relationship and does not depend on benchmark labels, expected answers, or scoring-specific shortcuts."}}
{"run":355,"commit":"9cb5be5","metric":434,"metrics":{"tests_total":434,"milestone_index":9,"loc_core":3910,"commit_count_total":382,"memory_error_rate":0,"unsupported_claim_rate":0,"mean_precision_at_k":1,"mean_recall_at_k":1},"status":"keep","description":"Extract TypeScript class implements facts","timestamp":1778354656544,"segment":28,"confidence":4.444444444444445,"asi":{"hypothesis":"TypeScript class declarations should emit Class implements Interface triples for implements_clause because implemented interfaces are a deterministic type relationship distinct from class inheritance.","red_evidence":"cargo test -q -p aver-extractor extract_typescript_facts_emit_class_implements_triple failed because extract_typescript_facts did not include Class:Store implements Interface:Recallable.","green_evidence":"cargo test -q -p aver-extractor extract_typescript_facts_emit_class_implements_triple passed; extract_typescript_facts_emits_class_extends_triple still passed; cargo test --workspace -q passed; ./autoresearch.sh passed with tests_green=434 tests_total=434 and checks green.","implementation_notes":"Split TypeScript class_heritage handling so extends facts are read only from extends_clause and implements facts are read from implements_clause, avoiding misclassifying implements-only classes as extends.","anti_overfit_note":"This is grammar-backed extraction of a standard TypeScript language relationship and does not depend on benchmark labels, expected answers, or scoring-specific shortcuts."}}
{"run":199,"commit":"322aa54","metric":436,"metrics":{"beam_questions":0,"beam_rubric_checks":0,"beam_abstention_pct":0,"beam_contradiction_resolution_pct":0,"beam_event_ordering_pct":0,"beam_information_extraction_pct":0,"beam_instruction_following_pct":0,"beam_knowledge_update_pct":0,"beam_multi_session_reasoning_pct":0,"beam_preference_following_pct":0,"beam_summarization_pct":0,"beam_temporal_reasoning_pct":0,"tests_green":436,"tests_total":436,"milestone_index":9,"loc_core":3910,"commit_count_total":383,"memory_error_rate":0,"unsupported_claim_rate":0,"mean_precision_at_k":1,"mean_recall_at_k":1},"status":"keep","description":"Extract PHP class implements facts","timestamp":1778354770223,"segment":26,"confidence":572.7949999999929,"asi":{"hypothesis":"PHP class declarations should emit Class implements Interface triples for implements clauses because implemented interfaces are deterministic type relationships distinct from inheritance.","red_evidence":"cargo test -q -p aver-extractor extract_php_facts_emit_class_implements_triple failed because extract_php_facts did not include Class:Store implements Interface:Recallable.","green_evidence":"cargo test --workspace -q passed; ./autoresearch.sh passed with tests_green=436 tests_total=436 and checks green.","implementation_notes":"Added PHP class_interface_clause scanning for class_declaration and extended extract_php_facts with implements triples, preserving class/interface extends extraction.","anti_overfit_note":"This is grammar-backed extraction of a standard PHP language relationship and does not depend on benchmark labels, expected answers, or scoring-specific shortcuts."}}
{"run":200,"commit":"815c0ee","metric":437,"metrics":{"beam_questions":0,"beam_rubric_checks":0,"beam_abstention_pct":0,"beam_contradiction_resolution_pct":0,"beam_event_ordering_pct":0,"beam_information_extraction_pct":0,"beam_instruction_following_pct":0,"beam_knowledge_update_pct":0,"beam_multi_session_reasoning_pct":0,"beam_preference_following_pct":0,"beam_summarization_pct":0,"beam_temporal_reasoning_pct":0,"tests_green":437,"tests_total":437,"milestone_index":9,"loc_core":3910,"commit_count_total":384,"memory_error_rate":0,"unsupported_claim_rate":0,"mean_precision_at_k":1,"mean_recall_at_k":1},"status":"keep","description":"Extract Kotlin class implements interface facts","timestamp":1778354834645,"segment":26,"confidence":459.2869999999986,"asi":{"hypothesis":"Kotlin class delegation to an interface declared in the same source should emit Class implements Interface triples because Kotlin uses delegation specifiers for interface implementation.","red_evidence":"cargo test -q -p aver-extractor extract_kotlin_facts_emit_class_implements_interface_triple failed because extract_kotlin_facts did not include Class:Store implements Interface:Recallable.","green_evidence":"cargo test --workspace -q passed; ./autoresearch.sh passed with tests_green=437 tests_total=437 and checks green.","implementation_notes":"Collected Kotlin interface definitions from the source, then classified class delegation_specifier targets matching those interfaces as implements facts while preserving existing extends facts.","anti_overfit_note":"This is grammar-backed extraction of a standard Kotlin language relationship and does not depend on benchmark labels, expected answers, or scoring-specific shortcuts."}}
{"run":201,"commit":"afbf2d2","metric":439,"metrics":{"beam_questions":0,"beam_rubric_checks":0,"beam_abstention_pct":0,"beam_contradiction_resolution_pct":0,"beam_event_ordering_pct":0,"beam_information_extraction_pct":0,"beam_instruction_following_pct":0,"beam_knowledge_update_pct":0,"beam_multi_session_reasoning_pct":0,"beam_preference_following_pct":0,"beam_summarization_pct":0,"beam_temporal_reasoning_pct":0,"tests_green":439,"tests_total":439,"milestone_index":9,"loc_core":3910,"commit_count_total":385,"memory_error_rate":0,"unsupported_claim_rate":0,"mean_precision_at_k":1,"mean_recall_at_k":1},"status":"keep","description":"Extract Swift class protocol conformance facts","timestamp":1778354890931,"segment":26,"confidence":384.4908333333346,"asi":{"hypothesis":"Swift class inheritance clauses targeting protocols declared in the same source should emit Class implements Protocol triples because Swift uses the same colon syntax for superclass inheritance and protocol conformance.","red_evidence":"cargo test -q -p aver-extractor extract_swift_facts_emit_class_implements_protocol_triple failed because extract_swift_facts did not include Class:Store implements Protocol:Recallable.","green_evidence":"cargo test --workspace -q passed; ./autoresearch.sh passed with tests_green=439 tests_total=439 and checks green.","implementation_notes":"Collected Swift protocol definitions from the source, then classified class/actor inheritance_specifier targets matching those protocols as implements facts while preserving existing extends facts.","anti_overfit_note":"This is grammar-backed extraction of a standard Swift language relationship and does not depend on benchmark labels, expected answers, or scoring-specific shortcuts."}}
{"run":356,"commit":"3b935bc","metric":439,"metrics":{"tests_total":439,"milestone_index":9,"loc_core":3910,"commit_count_total":385,"memory_error_rate":0,"unsupported_claim_rate":0,"mean_precision_at_k":1,"mean_recall_at_k":1},"status":"keep","description":"Extract multiple C++ bases and Swift protocol conformance facts","timestamp":1778354895387,"segment":28,"confidence":4.5,"asi":{"hypothesis":"Common type hierarchy extraction should handle multiple C++ base classes and Swift class protocol conformance because both are deterministic grammar relationships and common API surface signals.","red_evidence":"cargo test -q -p aver-extractor extract_cpp_facts_emit_multiple_class_extends_triples failed because the second C++ base Auditable was missing; workspace also exposed a pending Swift protocol conformance test expecting Class:Store implements Protocol:Recallable.","green_evidence":"cargo test -q -p aver-extractor extract_cpp_facts_emit_multiple_class_extends_triples passed; cargo test -q -p aver-extractor extract_swift_facts_emit_class_implements_protocol_triple passed; cargo test --workspace -q passed; ./autoresearch.sh passed with tests_green=439 tests_total=439 and checks green.","implementation_notes":"C++ base_class_clause collection now emits an extends fact for each type_identifier/qualified_identifier base. Swift conformance uses protocols declared in the same source to classify class inheritance_specifier targets as implements Protocol facts.","anti_overfit_note":"This is grammar-backed extraction of standard C++ and Swift language relationships and does not depend on benchmark labels, expected answers, or scoring-specific shortcuts."}}
{"run":202,"commit":"1b107e8","metric":440,"metrics":{"beam_questions":0,"beam_rubric_checks":0,"beam_abstention_pct":0,"beam_contradiction_resolution_pct":0,"beam_event_ordering_pct":0,"beam_information_extraction_pct":0,"beam_instruction_following_pct":0,"beam_knowledge_update_pct":0,"beam_multi_session_reasoning_pct":0,"beam_preference_following_pct":0,"beam_summarization_pct":0,"beam_temporal_reasoning_pct":0,"tests_green":440,"tests_total":440,"milestone_index":9,"loc_core":3910,"commit_count_total":387,"memory_error_rate":0,"unsupported_claim_rate":0,"mean_precision_at_k":1,"mean_recall_at_k":1},"status":"keep","description":"Extract C# class implements interface facts","timestamp":1778354942038,"segment":26,"confidence":289.02500000000117,"asi":{"hypothesis":"C# class base lists targeting interfaces declared in the same source should emit Class implements Interface triples because C# uses the same base-list syntax for superclass inheritance and interface implementation.","red_evidence":"cargo test -q -p aver-extractor extract_csharp_facts_emit_class_implements_interface_triple failed because extract_csharp_facts did not include Class:Store implements Interface:IRecallable.","green_evidence":"cargo test --workspace -q passed; ./autoresearch.sh passed with tests_green=440 tests_total=440 and checks green.","implementation_notes":"Collected C# interface definitions from the source, then classified class base_list targets matching those interfaces as implements facts while preserving existing extends facts.","anti_overfit_note":"This is grammar-backed extraction of a standard C# language relationship and does not depend on benchmark labels, expected answers, or scoring-specific shortcuts."}}
{"run":357,"commit":"a3c0ce2","metric":440,"metrics":{"tests_total":440,"milestone_index":9,"loc_core":3910,"commit_count_total":387,"memory_error_rate":0,"unsupported_claim_rate":0,"mean_precision_at_k":1,"mean_recall_at_k":1},"status":"keep","description":"Extract C# class implements interface facts","timestamp":1778354945641,"segment":28,"confidence":4.6,"asi":{"hypothesis":"C# class base lists should emit Class implements Interface triples when a base-list type matches an interface declared in the same source, because C# uses the same base_list for base class and interface implementation.","red_evidence":"cargo test -q -p aver-extractor extract_csharp_facts_emit_class_implements_interface_triple failed because extract_csharp_facts did not include Class:Store implements Interface:IRecallable.","green_evidence":"cargo test -q -p aver-extractor extract_csharp_facts_emit_class_implements_interface_triple passed; cargo test --workspace -q passed; ./autoresearch.sh passed with tests_green=440 tests_total=440 and checks green.","implementation_notes":"Collected C# interface declarations from the source and classified class_declaration base_list identifiers matching those interfaces as implements facts, while preserving existing extends facts.","anti_overfit_note":"This is grammar-backed extraction of a standard C# language relationship and does not depend on benchmark labels, expected answers, or scoring-specific shortcuts."}}
{"run":358,"commit":"e7f5b70","metric":441,"metrics":{"tests_total":441,"milestone_index":9,"loc_core":3910,"commit_count_total":389,"memory_error_rate":0,"unsupported_claim_rate":0,"mean_precision_at_k":1,"mean_recall_at_k":1},"status":"keep","description":"Extract C# record implements interface facts","timestamp":1778355003933,"segment":28,"confidence":4.476190476190476,"asi":{"hypothesis":"C# record declarations should emit Record implements Interface triples when their base list names a locally declared interface, because records can implement interfaces using the same syntax as classes.","red_evidence":"cargo test -q -p aver-extractor extract_csharp_facts_emit_record_implements_interface_triple failed because extract_csharp_facts did not include Record:User implements Interface:IRecallable.","green_evidence":"cargo test -q -p aver-extractor extract_csharp_facts_emit_record_implements_interface_triple passed; extract_csharp_facts_emit_class_implements_interface_triple still passed; cargo test --workspace -q passed; ./autoresearch.sh passed with tests_green=441 tests_total=441 and checks green.","implementation_notes":"Generalized C# implements extraction from class_declaration to class_declaration and record_declaration, selecting Class or Record subject prefixes while matching base_list identifiers against local interface definitions.","anti_overfit_note":"This is grammar-backed extraction of a standard C# language relationship and does not depend on benchmark labels, expected answers, or scoring-specific shortcuts."}}
{"run":359,"commit":"416a5d6","metric":442,"metrics":{"tests_total":442,"milestone_index":9,"loc_core":3910,"commit_count_total":390,"memory_error_rate":0,"unsupported_claim_rate":0,"mean_precision_at_k":1,"mean_recall_at_k":1},"status":"keep","description":"Extract PHP class trait use facts","timestamp":1778355059231,"segment":28,"confidence":4.363636363636363,"asi":{"hypothesis":"PHP classes should emit Class uses Trait triples for trait use declarations in class bodies because traits are a first-class reuse relationship in PHP code.","red_evidence":"cargo test -q -p aver-extractor extract_php_facts_emit_class_uses_trait_triple failed because extract_php_facts did not include Class:Store uses Trait:RecordsMemory.","green_evidence":"cargo test -q -p aver-extractor extract_php_facts_emit_class_uses_trait_triple passed; cargo test --workspace -q passed; ./autoresearch.sh passed with tests_green=442 tests_total=442 and checks green.","implementation_notes":"Added PHP class body use_declaration scanning and emitted uses facts for name/qualified_name trait references, while leaving namespace-level use declarations out of this relationship.","anti_overfit_note":"This is grammar-backed extraction of a standard PHP language relationship and does not depend on benchmark labels, expected answers, or scoring-specific shortcuts."}}
{"run":203,"commit":"7ff3ef5","metric":443,"metrics":{"beam_questions":0,"beam_rubric_checks":0,"beam_abstention_pct":0,"beam_contradiction_resolution_pct":0,"beam_event_ordering_pct":0,"beam_information_extraction_pct":0,"beam_instruction_following_pct":0,"beam_knowledge_update_pct":0,"beam_multi_session_reasoning_pct":0,"beam_preference_following_pct":0,"beam_summarization_pct":0,"beam_temporal_reasoning_pct":0,"tests_green":443,"tests_total":443,"milestone_index":9,"loc_core":3910,"commit_count_total":391,"memory_error_rate":0,"unsupported_claim_rate":0,"mean_precision_at_k":1,"mean_recall_at_k":1},"status":"keep","description":"Extract Ruby class include module facts","timestamp":1778355217753,"segment":26,"confidence":232.79650000000018,"asi":{"hypothesis":"Ruby class include calls targeting modules declared in the same source should emit Class implements Module triples because mixins are Ruby's standard module-conformance/reuse relationship.","red_evidence":"cargo test -q -p aver-extractor extract_ruby_facts_emit_class_includes_module_triple failed because extract_ruby_facts did not include Class:Store implements Module:Recallable.","green_evidence":"cargo test --workspace -q passed; ./autoresearch.sh passed with tests_green=443 tests_total=443 and checks green.","implementation_notes":"Collected Ruby modules from the source and scanned class call nodes beginning with include to emit implements facts for included local modules.","anti_overfit_note":"This is grammar-backed extraction of a standard Ruby language relationship and does not depend on benchmark labels, expected answers, or scoring-specific shortcuts."}}
{"run":204,"commit":"e35a09d","metric":444,"metrics":{"beam_questions":0,"beam_rubric_checks":0,"beam_abstention_pct":0,"beam_contradiction_resolution_pct":0,"beam_event_ordering_pct":0,"beam_information_extraction_pct":0,"beam_instruction_following_pct":0,"beam_knowledge_update_pct":0,"beam_multi_session_reasoning_pct":0,"beam_preference_following_pct":0,"beam_summarization_pct":0,"beam_temporal_reasoning_pct":0,"tests_green":444,"tests_total":444,"milestone_index":9,"loc_core":3910,"commit_count_total":392,"memory_error_rate":0,"unsupported_claim_rate":0,"mean_precision_at_k":1,"mean_recall_at_k":1},"status":"keep","description":"Extract Go struct embedding inheritance facts","timestamp":1778355288707,"segment":26,"confidence":194.43500000000003,"asi":{"hypothesis":"Go struct embedding should emit Struct extends Struct triples when the embedded type is a struct declared in the same source, because embedding is Go's deterministic composition/inheritance-like relationship.","red_evidence":"cargo test -q -p aver-extractor extract_go_facts_emit_struct_embedding_extends_triple failed because extract_go_facts did not include Struct:Store extends Struct:BaseStore.","green_evidence":"cargo test --workspace -q passed; ./autoresearch.sh passed with tests_green=444 tests_total=444 and checks green.","implementation_notes":"Collected Go struct definitions from the source, scanned struct_type descendants for embedded type identifiers matching local structs, and emitted Struct extends Struct facts.","anti_overfit_note":"This is grammar-backed extraction of a standard Go language relationship and does not depend on benchmark labels, expected answers, or scoring-specific shortcuts."}}
{"run":205,"commit":"c9c355a","metric":445,"metrics":{"beam_questions":0,"beam_rubric_checks":0,"beam_abstention_pct":0,"beam_contradiction_resolution_pct":0,"beam_event_ordering_pct":0,"beam_information_extraction_pct":0,"beam_instruction_following_pct":0,"beam_knowledge_update_pct":0,"beam_multi_session_reasoning_pct":0,"beam_preference_following_pct":0,"beam_summarization_pct":0,"beam_temporal_reasoning_pct":0,"tests_green":445,"tests_total":445,"milestone_index":9,"loc_core":3910,"commit_count_total":393,"memory_error_rate":0,"unsupported_claim_rate":0,"mean_precision_at_k":1,"mean_recall_at_k":1},"status":"keep","description":"Avoid Go struct inheritance facts for named fields","timestamp":1778355350295,"segment":26,"confidence":167.03392857142808,"asi":{"hypothesis":"Go struct embedding extraction should distinguish anonymous embedded fields from named fields so ordinary composition fields do not become false Struct extends Struct facts.","red_evidence":"cargo test -q -p aver-extractor extract_go_facts_do_not_treat_named_struct_fields_as_extends failed because a named field base BaseStore was incorrectly emitted as Struct:Store extends Struct:BaseStore.","green_evidence":"cargo test --workspace -q passed; ./autoresearch.sh passed with tests_green=445 tests_total=445 and checks green.","implementation_notes":"Replaced broad struct_type type_identifier collection with field_declaration scanning that only records embedded fields lacking field_identifier descendants.","anti_overfit_note":"This is grammar-backed precision improvement for standard Go struct syntax and does not depend on benchmark labels, expected answers, or scoring-specific shortcuts."}}
