{"run":539,"commit":"54da71f","metric":810,"metrics":{"tests_green":810,"tests_total":810,"milestone_index":9,"loc_core":6951,"commit_count_total":603,"memory_error_rate":0,"unsupported_claim_rate":0,"mean_precision_at_k":1,"mean_recall_at_k":1,"beam_questions":0,"beam_rubric_checks":0,"beam_abstention_pct":0,"beam_contradiction_resolution_pct":0,"beam_event_ordering_pct":0,"beam_information_extraction_pct":0,"beam_instruction_following_pct":0,"beam_knowledge_update_pct":0,"beam_multi_session_reasoning_pct":0,"beam_preference_following_pct":0,"beam_summarization_pct":0,"beam_temporal_reasoning_pct":0},"status":"keep","description":"Reject self-parent ontology extensions","timestamp":1779053189044,"segment":28,"confidence":6.351145038167939,"asi":{"hypothesis":"Ontology extension audit rows should reject self-parenting predicate relationships so the extension log cannot encode a cyclic immediate parent edge.","red_evidence":"`cargo test -q -p aver-core --test migrations ontology_extension_parent_must_not_self_reference` failed because direct SQL accepted predicate='uses' with parent='uses'.","green_evidence":"Targeted ontology extension self-parent test passed; full migrations test passed with 113 tests; `./autoresearch.sh` passed with checks green and metrics tests_green=810 tests_total=810.","implementation_notes":"Added migration `0118_ontology_extension_parent_not_self_checks.sql` with insert/update triggers rejecting ontology_extension_log rows where parent equals predicate.","anti_overfit_note":"This is a general ontology hierarchy audit invariant and does not use benchmark expected outputs or labels."}}
{"run":540,"commit":"54da71f","metric":471,"metrics":{"tests_green":471,"tests_total":472,"milestone_index":9,"loc_core":6951,"commit_count_total":604,"memory_error_rate":0,"unsupported_claim_rate":0,"mean_precision_at_k":0,"mean_recall_at_k":0,"beam_questions":0,"beam_rubric_checks":0,"beam_abstention_pct":0,"beam_contradiction_resolution_pct":0,"beam_event_ordering_pct":0,"beam_information_extraction_pct":0,"beam_instruction_following_pct":0,"beam_knowledge_update_pct":0,"beam_multi_session_reasoning_pct":0,"beam_preference_following_pct":0,"beam_summarization_pct":0,"beam_temporal_reasoning_pct":0},"status":"crash","description":"Predicate type created_via trigger broke legacy migration replay","timestamp":1779053310404,"segment":28,"confidence":6.4,"asi":{"hypothesis":"Predicate type created_via should reject blank creation-source strings for auditability.","rollback_reason":"`./autoresearch.sh` failed because vector_index migration replay hit `error in trigger predicate_type_created_via_nonblank_insert after drop column: no such column: NEW.created_via`; older migration replay paths may temporarily lack the audit column, so this trigger placement is unsafe.","next_action_hint":"Do not retry a trigger that references predicate_types.created_via without first understanding the legacy vector_index replay/drop-column path; prefer a different invariant on stable columns or a migration-safe implementation.","error_details":"crates/aver-core/tests/vector_index.rs migration_backfills_existing_vector_chunks_rows failed after targeted migrations tests passed.","anti_overfit_note":"The attempted invariant was general auditability, not benchmark-specific, but implementation violated migration replay compatibility."}}
