{"run":183,"commit":"e56cb9c","metric":60.75166508087536,"metrics":{"beam_questions":400,"beam_rubric_checks":1051,"beam_abstention_pct":82.5,"beam_contradiction_resolution_pct":54.37499999999999,"beam_event_ordering_pct":71.12676056338029,"beam_information_extraction_pct":50.54347826086957,"beam_instruction_following_pct":57.6271186440678,"beam_knowledge_update_pct":52.38095238095239,"beam_multi_session_reasoning_pct":58.91089108910891,"beam_preference_following_pct":79.05405405405406,"beam_summarization_pct":50,"beam_temporal_reasoning_pct":65.33333333333333},"status":"keep","description":"Expand query-adaptive BEAM recent-first ordering to natural currentness phrases like now/as-of/today/present","timestamp":1778330675932,"segment":26,"confidence":106.41666666666701,"asi":{"hypothesis":"Current-state questions are often phrased with 'now', 'as of', 'today', or 'present' rather than explicit current/latest terms; treating those as recent-first should surface freshest supported claims without using benchmark labels.","result":"Improved BEAM score from 60.2284 to 60.7517 with checks passing.","tradeoffs":"Preference following and summarization dipped, but gains in abstention, event ordering, information extraction, instruction following, and knowledge update outweighed the losses.","next_action_hint":"Try a more precise word-boundary currentness detector to avoid false positives while retaining the useful natural phrases, or add date-sensitive ordering for explicit temporal questions."}}
{"run":184,"commit":"e56cb9c","metric":0,"metrics":{"beam_questions":0,"beam_rubric_checks":0,"beam_abstention_pct":0,"beam_contradiction_resolution_pct":0,"beam_event_ordering_pct":0,"beam_information_extraction_pct":0,"beam_instruction_following_pct":0,"beam_knowledge_update_pct":0,"beam_multi_session_reasoning_pct":0,"beam_preference_following_pct":0,"beam_summarization_pct":0,"beam_temporal_reasoning_pct":0},"status":"crash","description":"Try BEAM top_k 20 after query-adaptive ordering, but OpenAI embeddings returned 503 before completion","timestamp":1778333603685,"segment":26,"confidence":106.41666666666701,"asi":{"hypothesis":"Increasing retrieval breadth from 16 to 20 may improve BEAM because query-adaptive ordering can handle more candidate facts.","rollback_reason":"Experiment did not complete due to external OpenAI embeddings 503, so no reliable score was produced.","error_detail":"openai embeddings https://api.openai.com/v1/embeddings returned status code 503 at BEAM conversation 19.","next_action_hint":"Retry the same top_k=20 experiment once because failure was provider availability, not code behavior; if it completes, compare against 60.7517."}}
{"run":185,"commit":"e56cb9c","metric":0,"metrics":{"beam_questions":0,"beam_rubric_checks":0,"beam_abstention_pct":0,"beam_contradiction_resolution_pct":0,"beam_event_ordering_pct":0,"beam_information_extraction_pct":0,"beam_instruction_following_pct":0,"beam_knowledge_update_pct":0,"beam_multi_session_reasoning_pct":0,"beam_preference_following_pct":0,"beam_summarization_pct":0,"beam_temporal_reasoning_pct":0},"status":"crash","description":"Retry BEAM top_k 20, but OpenAI chat completions returned 502 before completion","timestamp":1778336709620,"segment":26,"confidence":106.41666666666701,"asi":{"hypothesis":"Increasing retrieval breadth from 16 to 20 may improve BEAM because query-adaptive ordering can handle more candidate facts.","rollback_reason":"Second attempt did not complete due to external OpenAI chat 502, so no reliable score was produced.","error_detail":"openai chat completions https://api.openai.com/v1/chat/completions returned status code 502 near BEAM conversation 19.","next_action_hint":"Pause top_k=20 live retries until provider stabilizes; either add retry/backoff around OpenAI calls or test a smaller local/offline improvement next."}}
{"run":186,"commit":"e56cb9c","metric":60.60894386298763,"metrics":{"beam_questions":400,"beam_rubric_checks":1051,"beam_abstention_pct":81.25,"beam_contradiction_resolution_pct":53.75,"beam_event_ordering_pct":71.59624413145539,"beam_information_extraction_pct":48.369565217391305,"beam_instruction_following_pct":52.54237288135594,"beam_knowledge_update_pct":47.61904761904761,"beam_multi_session_reasoning_pct":59.900990099009896,"beam_preference_following_pct":81.08108108108108,"beam_summarization_pct":51.02564102564102,"beam_temporal_reasoning_pct":67.33333333333333},"status":"discard","description":"Add bounded OpenAI 5xx/transport retries for BEAM provider robustness; score did not beat current best","timestamp":1778340039030,"segment":26,"confidence":98.2307692307688,"asi":{"hypothesis":"Bounded retries for transient OpenAI 5xx/transport failures should improve live BEAM run reliability without changing scoring behavior.","rollback_reason":"Run completed but primary BEAM score 60.6089 was below current best 60.7517, so autoresearch rules require discard despite robustness value.","result":"Offline retry tests passed and live run completed; primary score regressed mainly in knowledge_update and instruction_following while temporal/event ordering improved.","next_action_hint":"Revisit retry/backoff as a product-hardening change outside primary-score autoresearch, or combine with a scoring-improving retrieval change before keeping."}}
{"run":187,"commit":"e56cb9c","metric":59.229305423406274,"metrics":{"beam_questions":400,"beam_rubric_checks":1051,"beam_abstention_pct":70,"beam_contradiction_resolution_pct":53.43750000000001,"beam_event_ordering_pct":71.59624413145539,"beam_information_extraction_pct":50,"beam_instruction_following_pct":48.30508474576271,"beam_knowledge_update_pct":42.857142857142854,"beam_multi_session_reasoning_pct":59.900990099009896,"beam_preference_following_pct":83.1081081081081,"beam_summarization_pct":49.23076923076923,"beam_temporal_reasoning_pct":61.33333333333333},"status":"discard","description":"Increase BEAM default retrieval breadth from top_k 16 to 20 after query-adaptive ordering","timestamp":1778343351164,"segment":26,"confidence":106.41666666666701,"asi":{"hypothesis":"With query-adaptive ordering, retrieving 20 contexts instead of 16 might surface additional relevant facts without overwhelming current/latest questions.","rollback_reason":"Completed run scored 59.2293, well below current best 60.7517; broader context appears to add too much distractor/noise.","result":"top_k=20 improved preference_following and information_extraction slightly, but sharply hurt abstention, knowledge_update, instruction_following, summarization, and temporal reasoning.","next_action_hint":"Do not increase retrieval breadth globally. Try query-specific breadth or post-retrieval filtering/reranking instead."}}
{"run":188,"commit":"e56cb9c","metric":59.990485252140815,"metrics":{"beam_questions":400,"beam_rubric_checks":1051,"beam_abstention_pct":75,"beam_contradiction_resolution_pct":55.3125,"beam_event_ordering_pct":70.89201877934272,"beam_information_extraction_pct":49.45652173913043,"beam_instruction_following_pct":53.38983050847458,"beam_knowledge_update_pct":50,"beam_multi_session_reasoning_pct":60.89108910891089,"beam_preference_following_pct":78.37837837837837,"beam_summarization_pct":49.743589743589745,"beam_temporal_reasoning_pct":62},"status":"discard","description":"Treat end-up/settled/switched/final questions as recent-first BEAM context ordering","timestamp":1778346652115,"segment":26,"confidence":116.09090909091053,"asi":{"hypothesis":"Questions phrased as 'end up', 'settled on', 'switched to', or 'final' often ask for the latest chosen value and should use recent-first context ordering.","rollback_reason":"Completed run scored 59.9905, below current best 60.7517; the broader trigger set caused too many false recent-first orderings.","result":"Contradiction resolution and multi-session reasoning improved, but abstention, preference following, temporal reasoning, summarization, and event ordering declined enough to lose overall.","next_action_hint":"Avoid broad 'final'/'end up' currentness triggers. If revisiting, use narrower phrase handling or combine with answer prompt rather than changing context order."}}
{"run":189,"commit":"e56cb9c","metric":0,"metrics":{"beam_questions":0,"beam_rubric_checks":0,"beam_abstention_pct":0,"beam_contradiction_resolution_pct":0,"beam_event_ordering_pct":0,"beam_information_extraction_pct":0,"beam_instruction_following_pct":0,"beam_knowledge_update_pct":0,"beam_multi_session_reasoning_pct":0,"beam_preference_following_pct":0,"beam_summarization_pct":0,"beam_temporal_reasoning_pct":0},"status":"crash","description":"Word-boundary currentness detector BEAM run crashed on OpenAI embeddings 500","timestamp":1778347305551,"segment":26,"confidence":116.09090909091053,"asi":{"hypothesis":"Using word-boundary currentness matching should avoid false recent-first ordering for words like presentation while preserving current/latest/now semantics.","rollback_reason":"Experiment did not complete due to external OpenAI embeddings 500, so no reliable score was produced.","error_detail":"openai embeddings https://api.openai.com/v1/embeddings returned status code 500 early in the BEAM run.","next_action_hint":"Retry this word-boundary detector once, or defer until adding provider retry/backoff outside primary-score loop."}}
{"run":190,"commit":"e56cb9c","metric":0,"metrics":{"beam_questions":0,"beam_rubric_checks":0,"beam_abstention_pct":0,"beam_contradiction_resolution_pct":0,"beam_event_ordering_pct":0,"beam_information_extraction_pct":0,"beam_instruction_following_pct":0,"beam_knowledge_update_pct":0,"beam_multi_session_reasoning_pct":0,"beam_preference_following_pct":0,"beam_summarization_pct":0,"beam_temporal_reasoning_pct":0},"status":"crash","description":"Retry word-boundary currentness detector, but OpenAI embeddings returned immediate 500","timestamp":1778347335734,"segment":26,"confidence":116.09090909091053,"asi":{"hypothesis":"Using word-boundary currentness matching should avoid false recent-first ordering for words like presentation while preserving current/latest/now semantics.","rollback_reason":"Second attempt did not complete due to immediate external OpenAI embeddings 500, so no reliable score was produced.","error_detail":"openai embeddings https://api.openai.com/v1/embeddings returned status code 500 on BEAM conversation 1.","next_action_hint":"Provider appears unstable; switch next cycles to offline/deterministic improvements or product-hardening with local tests until live OpenAI stabilizes."}}
{"run":191,"commit":"e56cb9c","metric":59.895337773548995,"metrics":{"beam_questions":400,"beam_rubric_checks":1051,"beam_abstention_pct":76.25,"beam_contradiction_resolution_pct":54.0625,"beam_event_ordering_pct":71.36150234741784,"beam_information_extraction_pct":47.82608695652174,"beam_instruction_following_pct":53.38983050847458,"beam_knowledge_update_pct":52.38095238095239,"beam_multi_session_reasoning_pct":59.900990099009896,"beam_preference_following_pct":79.05405405405406,"beam_summarization_pct":48.46153846153846,"beam_temporal_reasoning_pct":66},"status":"discard","description":"Combine word-boundary currentness detection with bounded OpenAI transient retries","timestamp":1778350573590,"segment":26,"confidence":121.61904761904715,"asi":{"hypothesis":"Word-boundary currentness matching should avoid false recent-first ordering for words like presentation while bounded OpenAI retries should let transient 5xx runs complete without changing prompt or benchmark-specific behavior.","rollback_reason":"Completed BEAM score 59.8953 is below current best 60.7517, so the primary metric regressed despite robustness and the code must be discarded.","result":"Run completed with retries available, but abstention, information extraction, summarization, and instruction following fell enough to lose overall; word-boundary precision did not translate into score improvement.","anti_overfit_note":"The attempted changes used only generic language tokenization and generic HTTP 5xx retry handling; no BEAM labels, rubrics, reference answers, expected answers, or fixture-specific shortcuts were used.","next_action_hint":"Do not pursue word-boundary currentness under the BEAM primary metric. Try a targeted context formatting/reranking change that preserves the successful e56cb9c detector, or shift provider-retry hardening outside score-optimization."}}
{"type":"config","name":"Tree-sitter common language extractor tests","metricName":"tests_green","metricUnit":"","bestDirection":"higher"}
{"run":320,"commit":"4aeaa1c","metric":394,"metrics":{"tests_total":394,"milestone_index":9,"loc_core":3910,"commit_count_total":344,"memory_error_rate":0,"unsupported_claim_rate":0,"mean_precision_at_k":1,"mean_recall_at_k":1},"status":"keep","description":"Add basic Tree-sitter extraction for common languages","timestamp":1778352045132,"segment":28,"confidence":null,"asi":{"hypothesis":"A single TDD test can lock in basic deterministic symbol extraction for common languages using bundled Tree-sitter Rust grammar crates without Python or runtime network dependencies.","red_evidence":"cargo test -q -p aver-extractor extract_common_language_basic_symbols_emit_definition_facts failed with unresolved imports for the new language extractors before implementation.","green_evidence":"./autoresearch.sh passed with tests_green=394 tests_total=394 and backpressure checks green.","implementation_notes":"Added grammar crates and basic functions/classes/interfaces definition facts for JavaScript, Java, C, C++, C#, Ruby, PHP, Kotlin, and Swift; Rust remains deeper than other languages."}}
{"run":321,"commit":"b1385bd","metric":395,"metrics":{"tests_total":395,"milestone_index":9,"loc_core":3910,"commit_count_total":345,"memory_error_rate":0,"unsupported_claim_rate":0,"mean_precision_at_k":1,"mean_recall_at_k":1},"status":"keep","description":"Extract common language type definition symbols","timestamp":1778352305752,"segment":28,"confidence":null,"asi":{"hypothesis":"Basic common-language Tree-sitter support should include type symbols beyond classes, namely enums, structs, interfaces, and protocols where the grammar exposes them, while staying deterministic and offline.","red_evidence":"cargo test -q -p aver-extractor extract_common_language_type_symbols_emit_definition_facts failed with unresolved imports for extract_java_enums, extract_cpp_structs/enums, extract_csharp_interfaces/structs/enums, extract_php_interfaces/enums, and extract_swift_protocols/structs/enums.","green_evidence":"cargo test --workspace -q passed; ./autoresearch.sh passed with tests_green=395 tests_total=395 and checks green.","implementation_notes":"Added one TDD test covering Java enum, C++ struct/enum, C# interface/struct/enum, PHP interface/enum, and Swift protocol/struct/enum definition facts. Swift class_declaration is filtered by declaration_kind so class/struct/enum facts do not collapse together."}}
{"run":322,"commit":"e03e102","metric":396,"metrics":{"tests_total":396,"milestone_index":9,"loc_core":3910,"commit_count_total":346,"memory_error_rate":0,"unsupported_claim_rate":0,"mean_precision_at_k":1,"mean_recall_at_k":1},"status":"keep","description":"Dispatch extraction by common source file extension","timestamp":1778352388304,"segment":28,"confidence":2,"asi":{"hypothesis":"Common-language Tree-sitter support is more usable when callers can pass a source path and source text to a deterministic dispatcher instead of manually selecting each language-specific extractor.","red_evidence":"cargo test -q -p aver-extractor extract_facts_for_path_dispatches_common_language_extensions failed because extract_facts_for_path was not exported.","green_evidence":"cargo test --workspace -q passed; ./autoresearch.sh passed with tests_green=396 tests_total=396 and checks green.","implementation_notes":"Added extract_facts_for_path mapping common extensions for Rust, Python, TypeScript/TSX, JavaScript/JSX, Go, Java, C headers/sources, C++ sources/headers, C#, Ruby, PHP, Kotlin/KTS, and Swift; unknown extensions return an empty fact list."}}
{"run":323,"commit":"0057f65","metric":397,"metrics":{"tests_total":397,"milestone_index":9,"loc_core":3910,"commit_count_total":347,"memory_error_rate":0,"unsupported_claim_rate":0,"mean_precision_at_k":1,"mean_recall_at_k":1},"status":"keep","description":"Extract JavaScript and TypeScript arrow function variables","timestamp":1778352513344,"segment":28,"confidence":3,"asi":{"hypothesis":"Basic symbol extraction for common JavaScript/TypeScript should treat const/let variables initialized with arrow or function expressions as function definitions, because modern code often defines functions this way.","red_evidence":"cargo test -q -p aver-extractor extract_javascript_and_typescript_arrow_function_variables failed because extract_javascript_functions returned [] for `const remember = () => true;`.","green_evidence":"cargo test --workspace -q passed; ./autoresearch.sh passed with tests_green=397 tests_total=397 and checks green.","implementation_notes":"Added a recursive variable_declarator collector that records identifier names only when the value is an arrow_function, function, or function_expression, then reused it for JavaScript and TypeScript extraction."}}
{"run":324,"commit":"7eb378d","metric":398,"metrics":{"tests_total":398,"milestone_index":9,"loc_core":3910,"commit_count_total":348,"memory_error_rate":0,"unsupported_claim_rate":0,"mean_precision_at_k":1,"mean_recall_at_k":1},"status":"keep","description":"Extract Python classes and Go type definitions","timestamp":1778352581779,"segment":28,"confidence":4,"asi":{"hypothesis":"Basic common-language extraction should include Python class definitions and Go named type declarations for structs/interfaces, not just functions.","red_evidence":"cargo test -q -p aver-extractor extract_python_classes_and_go_type_symbols_emit_definition_facts failed because extract_python_classes, extract_go_structs, and extract_go_interfaces were not exported.","green_evidence":"cargo test --workspace -q passed; ./autoresearch.sh passed with tests_green=398 tests_total=398 and checks green.","implementation_notes":"Python facts now include class_definition names as Class facts. Go facts now inspect type_spec nodes and classify names by struct_type versus interface_type."}}
{"run":325,"commit":"1096492","metric":399,"metrics":{"tests_total":399,"milestone_index":9,"loc_core":3910,"commit_count_total":349,"memory_error_rate":0,"unsupported_claim_rate":0,"mean_precision_at_k":1,"mean_recall_at_k":1},"status":"keep","description":"Extract Kotlin interface and enum definitions","timestamp":1778352657350,"segment":28,"confidence":3.3333333333333335,"asi":{"hypothesis":"Kotlin basic Tree-sitter extraction should distinguish class, interface, and enum class definitions rather than collapsing every class_declaration into Class facts.","red_evidence":"cargo test -q -p aver-extractor extract_kotlin_interface_and_enum_symbols_emit_definition_facts failed because extract_kotlin_interfaces and extract_kotlin_enums were not exported.","green_evidence":"cargo test --workspace -q passed; ./autoresearch.sh passed with tests_green=399 tests_total=399 and checks green.","implementation_notes":"Added prefix-based Kotlin class_declaration classification for `class`, `interface`, and `enum class` because the Kotlin grammar version exposes these forms as class_declaration without name/declaration_kind fields."}}
{"run":326,"commit":"d2afe9f","metric":400,"metrics":{"tests_total":400,"milestone_index":9,"loc_core":3910,"commit_count_total":350,"memory_error_rate":0,"unsupported_claim_rate":0,"mean_precision_at_k":1,"mean_recall_at_k":1},"status":"keep","description":"Extract Ruby modules and PHP traits","timestamp":1778352725121,"segment":28,"confidence":3,"asi":{"hypothesis":"Common-language type extraction should include Ruby modules and PHP traits because they are primary code organization/type constructs in those languages.","red_evidence":"cargo test -q -p aver-extractor extract_ruby_modules_and_php_traits_emit_definition_facts failed because extract_ruby_modules and extract_php_traits were not exported.","green_evidence":"cargo test --workspace -q passed; ./autoresearch.sh passed with tests_green=400 tests_total=400 and checks green.","implementation_notes":"Ruby facts now include module node names as Module facts. PHP facts now include trait_declaration names as Trait facts."}}
{"run":327,"commit":"cbf44cc","metric":401,"metrics":{"tests_total":401,"milestone_index":9,"loc_core":3910,"commit_count_total":351,"memory_error_rate":0,"unsupported_claim_rate":0,"mean_precision_at_k":1,"mean_recall_at_k":1},"status":"keep","description":"Extract TypeScript interface enum and type alias definitions","timestamp":1778352799953,"segment":28,"confidence":3.5,"asi":{"hypothesis":"TypeScript symbol extraction should include interface, enum, and type alias declarations because they are first-class API surface definitions in common TypeScript code.","red_evidence":"cargo test -q -p aver-extractor extract_typescript_type_symbols_emit_definition_facts failed because extract_typescript_interfaces, extract_typescript_type_aliases, and extract_typescript_enums were not exported.","green_evidence":"cargo test --workspace -q passed; ./autoresearch.sh passed with tests_green=401 tests_total=401 and checks green.","implementation_notes":"Added TypeScript collectors for interface_declaration, type_alias_declaration, and enum_declaration and emitted Interface, TypeAlias, and Enum definition facts without changing benchmark logic.","anti_overfit_note":"This is grammar-backed extraction of standard TypeScript declarations; it does not depend on benchmark labels, scores, or fixture-specific shortcuts."}}
