{"run":219,"commit":"d9d6120","metric":458,"metrics":{"beam_questions":0,"beam_rubric_checks":0,"beam_abstention_pct":0,"beam_contradiction_resolution_pct":0,"beam_event_ordering_pct":0,"beam_information_extraction_pct":0,"beam_instruction_following_pct":0,"beam_knowledge_update_pct":0,"beam_multi_session_reasoning_pct":0,"beam_preference_following_pct":0,"beam_summarization_pct":0,"beam_temporal_reasoning_pct":0,"tests_green":458,"tests_total":458,"milestone_index":9,"loc_core":3910,"commit_count_total":406,"memory_error_rate":0,"unsupported_claim_rate":0,"mean_precision_at_k":1,"mean_recall_at_k":1},"status":"keep","description":"Avoid TypeScript implements facts for generic type arguments","timestamp":1778356321666,"segment":26,"confidence":30.533333333333335,"asi":{"hypothesis":"TypeScript class implements extraction should capture implemented interface names but should not emit implements facts for generic type arguments such as Memory in Recallable<Memory>.","red_evidence":"cargo test -q -p aver-extractor extract_typescript_facts_do_not_treat_generic_type_arguments_as_implemented_interfaces failed because the extractor emitted Class:Store implements Interface:Memory.","green_evidence":"cargo test --workspace -q passed; ./autoresearch.sh passed with tests_green=458 tests_total=458 and checks green.","implementation_notes":"Added TypeScript implements-clause name extraction that uses direct type identifiers and generic_type name fields, avoiding recursive collection of type_arguments as interfaces.","anti_overfit_note":"This is a grammar-backed precision guard for standard TypeScript generic implements syntax, not benchmark-specific behavior."}}
{"run":220,"commit":"19fa4d6","metric":459,"metrics":{"beam_questions":0,"beam_rubric_checks":0,"beam_abstention_pct":0,"beam_contradiction_resolution_pct":0,"beam_event_ordering_pct":0,"beam_information_extraction_pct":0,"beam_instruction_following_pct":0,"beam_knowledge_update_pct":0,"beam_multi_session_reasoning_pct":0,"beam_preference_following_pct":0,"beam_summarization_pct":0,"beam_temporal_reasoning_pct":0,"tests_green":459,"tests_total":459,"milestone_index":9,"loc_core":3910,"commit_count_total":407,"memory_error_rate":0,"unsupported_claim_rate":0,"mean_precision_at_k":1,"mean_recall_at_k":1},"status":"keep","description":"Avoid TypeScript interface extends facts for generic type arguments","timestamp":1778356372549,"segment":26,"confidence":31.655172413793103,"asi":{"hypothesis":"TypeScript interface extends extraction should capture extended interface names but should not emit extends facts for generic type arguments such as Memory in BaseRecallable<Memory>.","red_evidence":"cargo test -q -p aver-extractor extract_typescript_facts_do_not_treat_generic_type_arguments_as_interface_extends failed because the extractor emitted Interface:Recallable extends Interface:Memory.","green_evidence":"cargo test --workspace -q passed; ./autoresearch.sh passed with tests_green=459 tests_total=459 and checks green.","implementation_notes":"Reused the TypeScript heritage name collector for interface extends clauses so generic_type contributes only its name field, not recursive type_arguments.","anti_overfit_note":"This is a grammar-backed precision guard for standard TypeScript generic interface-extends syntax, not benchmark-specific behavior."}}
{"run":221,"commit":"1c4daa0","metric":460,"metrics":{"beam_questions":0,"beam_rubric_checks":0,"beam_abstention_pct":0,"beam_contradiction_resolution_pct":0,"beam_event_ordering_pct":0,"beam_information_extraction_pct":0,"beam_instruction_following_pct":0,"beam_knowledge_update_pct":0,"beam_multi_session_reasoning_pct":0,"beam_preference_following_pct":0,"beam_summarization_pct":0,"beam_temporal_reasoning_pct":0,"tests_green":460,"tests_total":460,"milestone_index":9,"loc_core":3910,"commit_count_total":408,"memory_error_rate":0,"unsupported_claim_rate":0,"mean_precision_at_k":1,"mean_recall_at_k":1},"status":"keep","description":"Avoid C# implements facts for generic type arguments","timestamp":1778356422166,"segment":26,"confidence":32.857142857142854,"asi":{"hypothesis":"C# class/record/struct implements extraction should capture implemented generic interface names but should not emit implements facts for generic type arguments such as IMemory in IRecallable<IMemory>.","red_evidence":"cargo test -q -p aver-extractor extract_csharp_facts_do_not_treat_generic_type_arguments_as_implemented_interfaces failed because the extractor emitted Class:Store implements Interface:IMemory.","green_evidence":"cargo test --workspace -q passed; ./autoresearch.sh passed with tests_green=460 tests_total=460 and checks green.","implementation_notes":"Added C# base-list type-name collection that takes generic_name identifier names but skips type_argument_list descendants before matching against local interfaces.","anti_overfit_note":"This is a grammar-backed precision guard for standard C# generic base-list syntax, not benchmark-specific behavior."}}
{"run":222,"commit":"2f26bfc","metric":461,"metrics":{"beam_questions":0,"beam_rubric_checks":0,"beam_abstention_pct":0,"beam_contradiction_resolution_pct":0,"beam_event_ordering_pct":0,"beam_information_extraction_pct":0,"beam_instruction_following_pct":0,"beam_knowledge_update_pct":0,"beam_multi_session_reasoning_pct":0,"beam_preference_following_pct":0,"beam_summarization_pct":0,"beam_temporal_reasoning_pct":0,"tests_green":461,"tests_total":461,"milestone_index":9,"loc_core":3910,"commit_count_total":409,"memory_error_rate":0,"unsupported_claim_rate":0,"mean_precision_at_k":1,"mean_recall_at_k":1},"status":"keep","description":"Extract multiple C# interface inheritance facts","timestamp":1778356473564,"segment":26,"confidence":32.92857142857143,"asi":{"hypothesis":"C# interface declarations can inherit from multiple interfaces in one base list, so extractor should emit one Interface extends Interface fact per base interface instead of only the first.","red_evidence":"cargo test -q -p aver-extractor extract_csharp_facts_emit_multiple_interface_extends_triples failed because the Auditable base interface fact was missing while BaseRecallable was present.","green_evidence":"cargo test --workspace -q passed; ./autoresearch.sh passed with tests_green=461 tests_total=461 and checks green.","implementation_notes":"For C# interface_declaration extends extraction, collect all base-list type names using the generic-safe C# base type-name collector; preserve first-base behavior for class/record extends facts.","anti_overfit_note":"This is grammar-backed extraction of standard C# multiple interface inheritance, not benchmark-specific behavior."}}
{"run":223,"commit":"83d6b71","metric":462,"metrics":{"beam_questions":0,"beam_rubric_checks":0,"beam_abstention_pct":0,"beam_contradiction_resolution_pct":0,"beam_event_ordering_pct":0,"beam_information_extraction_pct":0,"beam_instruction_following_pct":0,"beam_knowledge_update_pct":0,"beam_multi_session_reasoning_pct":0,"beam_preference_following_pct":0,"beam_summarization_pct":0,"beam_temporal_reasoning_pct":0,"tests_green":462,"tests_total":462,"milestone_index":9,"loc_core":3910,"commit_count_total":410,"memory_error_rate":0,"unsupported_claim_rate":0,"mean_precision_at_k":1,"mean_recall_at_k":1},"status":"keep","description":"Avoid Java implements facts for generic type arguments","timestamp":1778356525889,"segment":26,"confidence":33,"asi":{"hypothesis":"Java implements extraction should capture implemented generic interface names but should not emit implements facts for generic type arguments such as Memory in Recallable<Memory>.","red_evidence":"cargo test -q -p aver-extractor extract_java_facts_do_not_treat_generic_type_arguments_as_implemented_interfaces failed because the extractor emitted Class:Store implements Interface:Memory.","green_evidence":"cargo test --workspace -q passed; ./autoresearch.sh passed with tests_green=462 tests_total=462 and checks green.","implementation_notes":"Added Java implements name extraction that records generic_type names while skipping type_arguments descendants, replacing broad descendant type_identifier collection.","anti_overfit_note":"This is a grammar-backed precision guard for standard Java generic implements syntax, not benchmark-specific behavior."}}
{"run":224,"commit":"ce58899","metric":463,"metrics":{"beam_questions":0,"beam_rubric_checks":0,"beam_abstention_pct":0,"beam_contradiction_resolution_pct":0,"beam_event_ordering_pct":0,"beam_information_extraction_pct":0,"beam_instruction_following_pct":0,"beam_knowledge_update_pct":0,"beam_multi_session_reasoning_pct":0,"beam_preference_following_pct":0,"beam_summarization_pct":0,"beam_temporal_reasoning_pct":0,"tests_green":463,"tests_total":463,"milestone_index":9,"loc_core":3910,"commit_count_total":411,"memory_error_rate":0,"unsupported_claim_rate":0,"mean_precision_at_k":1,"mean_recall_at_k":1},"status":"keep","description":"Avoid Java interface extends facts for generic type arguments","timestamp":1778356573038,"segment":26,"confidence":34.2962962962963,"asi":{"hypothesis":"Java interface extends extraction should capture extended generic interface names but should not emit extends facts for generic type arguments such as Memory in BaseRecallable<Memory>.","red_evidence":"cargo test -q -p aver-extractor extract_java_facts_do_not_treat_generic_type_arguments_as_interface_extends failed because the extractor emitted Interface:Recallable extends Interface:Memory.","green_evidence":"cargo test --workspace -q passed; ./autoresearch.sh passed with tests_green=463 tests_total=463 and checks green.","implementation_notes":"Reused the Java generic-safe type-name collector for interface extends clauses, so generic_type contributes only its declared interface name and skips type_arguments.","anti_overfit_note":"This is a grammar-backed precision guard for standard Java generic interface inheritance syntax, not benchmark-specific behavior."}}
{"run":225,"commit":"7896ceb","metric":464,"metrics":{"beam_questions":0,"beam_rubric_checks":0,"beam_abstention_pct":0,"beam_contradiction_resolution_pct":0,"beam_event_ordering_pct":0,"beam_information_extraction_pct":0,"beam_instruction_following_pct":0,"beam_knowledge_update_pct":0,"beam_multi_session_reasoning_pct":0,"beam_preference_following_pct":0,"beam_summarization_pct":0,"beam_temporal_reasoning_pct":0,"tests_green":464,"tests_total":464,"milestone_index":9,"loc_core":3910,"commit_count_total":412,"memory_error_rate":0,"unsupported_claim_rate":0,"mean_precision_at_k":1,"mean_recall_at_k":1},"status":"keep","description":"Avoid C++ extends facts for template arguments","timestamp":1778356632824,"segment":26,"confidence":35.69230769230769,"asi":{"hypothesis":"C++ class/struct inheritance extraction should capture template base type names but should not emit extends facts for template arguments such as Memory in BaseStore<Memory>.","red_evidence":"cargo test -q -p aver-extractor extract_cpp_facts_do_not_treat_template_arguments_as_base_classes failed because the extractor emitted Class:Store extends Class:Memory.","green_evidence":"cargo test --workspace -q passed; ./autoresearch.sh passed with tests_green=464 tests_total=464 and checks green.","implementation_notes":"Added C++ base_class_clause type-name collection that records direct type_identifier/qualified_identifier bases and template_type name fields while avoiding template_argument_list descendants.","anti_overfit_note":"This is a grammar-backed precision guard for standard C++ template base-class syntax, not benchmark-specific behavior."}}
{"run":226,"commit":"e9f0c49","metric":465,"metrics":{"beam_questions":0,"beam_rubric_checks":0,"beam_abstention_pct":0,"beam_contradiction_resolution_pct":0,"beam_event_ordering_pct":0,"beam_information_extraction_pct":0,"beam_instruction_following_pct":0,"beam_knowledge_update_pct":0,"beam_multi_session_reasoning_pct":0,"beam_preference_following_pct":0,"beam_summarization_pct":0,"beam_temporal_reasoning_pct":0,"tests_green":465,"tests_total":465,"milestone_index":9,"loc_core":3910,"commit_count_total":413,"memory_error_rate":0,"unsupported_claim_rate":0,"mean_precision_at_k":1,"mean_recall_at_k":1},"status":"keep","description":"Avoid Swift protocol conformance facts for generic superclass arguments","timestamp":1778356693485,"segment":26,"confidence":34.44444444444444,"asi":{"hypothesis":"Swift inheritance extraction should capture generic superclass names while not treating generic type arguments as protocol conformances when those argument names are also protocols.","red_evidence":"cargo test -q -p aver-extractor extract_swift_facts_do_not_treat_generic_superclass_arguments_as_protocol_conformance failed because Class:Store did not extend Class:BaseStore from BaseStore<Memory>, and the previous broad user_type collection risked treating Memory as a protocol conformance.","green_evidence":"cargo test --workspace -q passed; ./autoresearch.sh passed with tests_green=465 tests_total=465 and checks green.","implementation_notes":"Changed Swift inheritance type-name extraction to use the inherits_from user_type's type_identifier name, and reused it for extends facts so BaseStore<Memory> yields BaseStore while skipping type argument user_type descendants.","anti_overfit_note":"This is a grammar-backed precision/recall guard for standard Swift generic inheritance syntax, not benchmark-specific behavior."}}
{"run":227,"commit":"6744798","metric":466,"metrics":{"beam_questions":0,"beam_rubric_checks":0,"beam_abstention_pct":0,"beam_contradiction_resolution_pct":0,"beam_event_ordering_pct":0,"beam_information_extraction_pct":0,"beam_instruction_following_pct":0,"beam_knowledge_update_pct":0,"beam_multi_session_reasoning_pct":0,"beam_preference_following_pct":0,"beam_summarization_pct":0,"beam_temporal_reasoning_pct":0,"tests_green":466,"tests_total":466,"milestone_index":9,"loc_core":3910,"commit_count_total":414,"memory_error_rate":0,"unsupported_claim_rate":0,"mean_precision_at_k":1,"mean_recall_at_k":1},"status":"keep","description":"Avoid Kotlin implements facts for generic type arguments","timestamp":1778356784346,"segment":26,"confidence":33.285714285714285,"asi":{"hypothesis":"Kotlin delegation-specifier extraction should capture generic interface/base names but should not emit implements facts for generic type arguments such as Memory in Recallable<Memory>.","red_evidence":"cargo test -q -p aver-extractor extract_kotlin_facts_do_not_treat_generic_type_arguments_as_implemented_interfaces failed because the extractor emitted Class:Store implements Interface:Memory.","green_evidence":"cargo test --workspace -q passed; ./autoresearch.sh passed with tests_green=466 tests_total=466 and checks green.","implementation_notes":"Changed Kotlin delegation type-name collection to use each delegation_specifier's user_type type_identifier name and skip nested type_arguments, preserving existing delegation extends/implements tests.","anti_overfit_note":"This is a grammar-backed precision guard for standard Kotlin generic delegation syntax, not benchmark-specific behavior."}}
{"run":228,"commit":"e26d594","metric":467,"metrics":{"beam_questions":0,"beam_rubric_checks":0,"beam_abstention_pct":0,"beam_contradiction_resolution_pct":0,"beam_event_ordering_pct":0,"beam_information_extraction_pct":0,"beam_instruction_following_pct":0,"beam_knowledge_update_pct":0,"beam_multi_session_reasoning_pct":0,"beam_preference_following_pct":0,"beam_summarization_pct":0,"beam_temporal_reasoning_pct":0,"tests_green":467,"tests_total":467,"milestone_index":9,"loc_core":3910,"commit_count_total":415,"memory_error_rate":0,"unsupported_claim_rate":0,"mean_precision_at_k":1,"mean_recall_at_k":1},"status":"keep","description":"Extract multiple Kotlin interface inheritance facts","timestamp":1778356882200,"segment":26,"confidence":33.357142857142854,"asi":{"hypothesis":"Kotlin interface declarations can inherit from multiple interfaces in one delegation list, so extractor should emit one Interface extends Interface fact per base interface instead of only the first.","red_evidence":"cargo test -q -p aver-extractor extract_kotlin_facts_emit_multiple_interface_extends_triples failed because the Auditable base interface fact was missing while BaseRecallable was present.","green_evidence":"cargo test --workspace -q passed; ./autoresearch.sh passed with tests_green=467 tests_total=467 and checks green.","implementation_notes":"For Kotlin interface extends extraction, collect all delegation_specifier user_type names using the generic-safe Kotlin delegation collector; preserve class extends behavior for class declarations.","anti_overfit_note":"This is grammar-backed extraction of standard Kotlin multiple interface inheritance, not benchmark-specific behavior."}}
{"run":229,"commit":"264f922","metric":468,"metrics":{"beam_questions":0,"beam_rubric_checks":0,"beam_abstention_pct":0,"beam_contradiction_resolution_pct":0,"beam_event_ordering_pct":0,"beam_information_extraction_pct":0,"beam_instruction_following_pct":0,"beam_knowledge_update_pct":0,"beam_multi_session_reasoning_pct":0,"beam_preference_following_pct":0,"beam_summarization_pct":0,"beam_temporal_reasoning_pct":0,"tests_green":468,"tests_total":468,"milestone_index":9,"loc_core":3910,"commit_count_total":416,"memory_error_rate":0,"unsupported_claim_rate":0,"mean_precision_at_k":1,"mean_recall_at_k":1},"status":"keep","description":"Extract multiple PHP interface inheritance facts","timestamp":1778356960265,"segment":26,"confidence":33.42857142857143,"asi":{"hypothesis":"PHP interface declarations can inherit from multiple interfaces in one extends clause, so extractor should emit one Interface extends Interface fact per base interface instead of only the first.","red_evidence":"cargo test -q -p aver-extractor extract_php_facts_emit_multiple_interface_extends_triples failed because the Auditable base interface fact was missing while BaseRecallable was present.","green_evidence":"cargo test --workspace -q passed; ./autoresearch.sh passed with tests_green=468 tests_total=468 and checks green.","implementation_notes":"For PHP interface_declaration extends extraction, collect all name/qualified_name descendants from the base_clause and emit one extends fact per base interface; class extends behavior remains first-base only.","anti_overfit_note":"This is grammar-backed extraction of standard PHP multiple interface inheritance, not benchmark-specific behavior."}}
{"run":230,"commit":"10c5997","metric":469,"metrics":{"beam_questions":0,"beam_rubric_checks":0,"beam_abstention_pct":0,"beam_contradiction_resolution_pct":0,"beam_event_ordering_pct":0,"beam_information_extraction_pct":0,"beam_instruction_following_pct":0,"beam_knowledge_update_pct":0,"beam_multi_session_reasoning_pct":0,"beam_preference_following_pct":0,"beam_summarization_pct":0,"beam_temporal_reasoning_pct":0,"tests_green":469,"tests_total":469,"milestone_index":9,"loc_core":3910,"commit_count_total":417,"memory_error_rate":0,"unsupported_claim_rate":0,"mean_precision_at_k":1,"mean_recall_at_k":1},"status":"keep","description":"Extract multiple Swift protocol inheritance facts","timestamp":1778357059690,"segment":26,"confidence":32.3448275862069,"asi":{"hypothesis":"Swift protocol declarations can inherit from multiple protocols in one inheritance clause, so extractor should emit one Protocol extends Protocol fact per inherited protocol instead of only the first.","red_evidence":"cargo test -q -p aver-extractor extract_swift_facts_emit_multiple_protocol_extends_triples failed because the Auditable base protocol fact was missing while BaseRecallable was present.","green_evidence":"cargo test --workspace -q passed; ./autoresearch.sh passed with tests_green=469 tests_total=469 and checks green.","implementation_notes":"Changed Swift extends extraction to collect inheritance names from the declaration node; protocol declarations emit all collected bases while class/actor declarations still emit the first superclass-style base.","anti_overfit_note":"This is grammar-backed extraction of standard Swift multiple protocol inheritance, not benchmark-specific behavior."}}
{"run":231,"commit":"9501942","metric":470,"metrics":{"beam_questions":0,"beam_rubric_checks":0,"beam_abstention_pct":0,"beam_contradiction_resolution_pct":0,"beam_event_ordering_pct":0,"beam_information_extraction_pct":0,"beam_instruction_following_pct":0,"beam_knowledge_update_pct":0,"beam_multi_session_reasoning_pct":0,"beam_preference_following_pct":0,"beam_summarization_pct":0,"beam_temporal_reasoning_pct":0,"tests_green":470,"tests_total":470,"milestone_index":9,"loc_core":3910,"commit_count_total":418,"memory_error_rate":0,"unsupported_claim_rate":0,"mean_precision_at_k":1,"mean_recall_at_k":1},"status":"keep","description":"Avoid Python extends facts for generic base arguments","timestamp":1778357176712,"segment":26,"confidence":31.333333333333332,"asi":{"hypothesis":"Python class inheritance extraction should capture generic base class names but should not emit extends facts for subscript type arguments such as Memory in BaseStore[Memory].","red_evidence":"cargo test -q -p aver-extractor extract_python_facts_do_not_treat_generic_base_arguments_as_superclasses failed because the extractor emitted Class:Store extends Class:Memory from a generic base argument.","green_evidence":"cargo test --workspace -q passed; ./autoresearch.sh passed with tests_green=470 tests_total=470 and checks green.","implementation_notes":"Replaced broad Python superclass identifier collection with superclass argument traversal that records direct identifiers/attributes and subscript value names while skipping subscript arguments.","anti_overfit_note":"This is a grammar-backed precision guard for standard Python generic base class syntax, not benchmark-specific behavior."}}
