{"type":"config","name":"agent memory layer TDD roadmap","metricName":"tests_green","metricUnit":"","bestDirection":"higher"}
{"run":1,"commit":"b1d9054","metric":4,"metrics":{"tests_total":4,"milestone_index":1,"loc_core":259,"commit_count_total":8},"status":"keep","description":"baseline: T1-T4 green before adding next TDD step","timestamp":1778130944734,"segment":0,"confidence":null,"asi":{"hypothesis":"establish current v0.1 baseline before adding T5 recall_text keyword behavior","current_next_test":"T5 recall_text_returns_claim_by_keyword","notes":"autoresearch.jsonl was empty despite existing T1-T4 commits, so initialized experiment and recorded clean baseline"}}
{"run":2,"commit":"b1d9054","metric":5,"metrics":{"tests_total":5,"milestone_index":1,"loc_core":302,"commit_count_total":9},"status":"checks_failed","description":"T5 recall_text passed benchmark but failed fmt check","timestamp":1778131018454,"segment":0,"confidence":null,"asi":{"hypothesis":"add minimal Store::recall_text keyword search over active claim triple fields","rollback_reason":"cargo fmt --check required wrapping tuple destructuring in recall_text loop","next_action_hint":"reapply T5 test and implementation, run cargo fmt before autoresearch.sh","red_evidence":"cargo test -p memory-core recall_text_returns_claim_by_keyword failed with no method named recall_text","implementation_notes":"Used SQLite LIKE across subject/predicate/object ordered by id; no ADR changes"}}
{"run":3,"commit":"ed22290","metric":5,"metrics":{"tests_total":5,"milestone_index":1,"loc_core":303,"commit_count_total":9},"status":"keep","description":"T5 adds keyword recall over active claim text","timestamp":1778131066473,"segment":0,"confidence":null,"asi":{"hypothesis":"a minimal SQLite LIKE-based Store::recall_text satisfies the v0.1 keyword recall milestone without changing storage schema","red_evidence":"test recall_text_returns_claim_by_keyword failed before implementation because Store had no recall_text method","green_evidence":"cargo test --workspace -q passed; autoresearch.sh parsed tests_green=5 tests_total=5 and checks passed","adr_alignment":"ADR-0008 recall surface begins with text recall; ADR-0004 HybridRAG deferred to v0.2; ADRs left unchanged"}}
{"run":4,"commit":"a89e3ea","metric":6,"metrics":{"tests_total":6,"milestone_index":1,"loc_core":303,"commit_count_total":10},"status":"keep","description":"T6 adds memory status CLI command","timestamp":1778131108415,"segment":0,"confidence":4,"asi":{"hypothesis":"the smallest CLI skeleton step is a status command that opens/creates the configured store and reports readiness","red_evidence":"status_reports_store_ready_for_memory_dir initially failed because the binary printed empty stdout","green_evidence":"cargo test --workspace -q passed; autoresearch.sh parsed tests_green=6 tests_total=6 and checks passed","implementation_notes":"Added clap parser with --memory-dir and Status subcommand only; no ADR or schema changes"}}
{"run":5,"commit":"69f1c81","metric":7,"metrics":{"tests_total":7,"milestone_index":1,"loc_core":303,"commit_count_total":11},"status":"keep","description":"T7 adds memory remember CLI command","timestamp":1778131150406,"segment":0,"confidence":3,"asi":{"hypothesis":"memory remember can be a thin CLI wrapper over Store::add_claim with explicit subject/predicate/object/source","red_evidence":"after adding serde_json dev-dep for the integration test, remember_writes_claim_to_configured_store failed because remember subcommand was not implemented","green_evidence":"cargo test --workspace -q passed; autoresearch.sh parsed tests_green=7 tests_total=7 and checks passed","implementation_notes":"Added Remember subcommand and dev-dependency serde_json for log assertion; write still flows through Store::add_claim preserving log-first invariant"}}
{"run":6,"commit":"09325e4","metric":8,"metrics":{"tests_total":8,"milestone_index":1,"loc_core":303,"commit_count_total":12},"status":"keep","description":"T8 adds memory recall CLI command","timestamp":1778131184482,"segment":0,"confidence":4,"asi":{"hypothesis":"the CLI recall command can reuse Store::recall_text and print one stable subject-predicate-object line per match","red_evidence":"recall_prints_claim_matching_keyword failed because recall was not a recognized subcommand","green_evidence":"cargo test --workspace -q passed; autoresearch.sh parsed tests_green=8 tests_total=8 and checks passed","implementation_notes":"Added Recall subcommand only; output intentionally simple and deterministic for v0.1"}}
{"run":7,"commit":"e7e9523","metric":9,"metrics":{"tests_total":9,"milestone_index":2,"loc_core":323,"commit_count_total":13},"status":"keep","description":"T9 starts v0.2 Ollama embedding request shape","timestamp":1778131233823,"segment":0,"confidence":5,"asi":{"hypothesis":"v0.2 can begin safely with a deterministic serializable Ollama embedding request before adding network I/O or sqlite-vss integration","red_evidence":"ollama_embedding_request_serializes_model_and_prompt failed because memory_core::vector did not exist","green_evidence":"cargo test --workspace -q passed; autoresearch.sh parsed tests_green=9 tests_total=9 milestone_index=2 and checks passed","adr_alignment":"ADR-0013 requires Rust HTTP to local Ollama; ADR-0004 HybridRAG vector side; book retrieval emphasized HybridRAG/vector+graph context [ch.100] and storage choice by actual walls not checklists [ch.105]"}}
{"run":8,"commit":"e5cffbc","metric":10,"metrics":{"tests_total":10,"milestone_index":2,"loc_core":328,"commit_count_total":14},"status":"keep","description":"T10 adds Ollama embedding response parsing","timestamp":1778131273831,"segment":0,"confidence":4,"asi":{"hypothesis":"parsing the Ollama embedding response vector is the next smallest non-network v0.2 step","red_evidence":"ollama_embedding_response_deserializes_embedding_vector failed because OllamaEmbeddingResponse did not exist","green_evidence":"cargo test --workspace -q passed; autoresearch.sh parsed tests_green=10 tests_total=10 and checks passed","implementation_notes":"Added Deserialize response struct with Vec<f32>; no HTTP dependency or external calls yet"}}
{"run":9,"commit":"bd53014","metric":11,"metrics":{"tests_total":11,"milestone_index":2,"loc_core":351,"commit_count_total":15},"status":"keep","description":"T11 normalizes Ollama embeddings endpoint URL","timestamp":1778131335924,"segment":0,"confidence":3.5,"asi":{"hypothesis":"before live HTTP, the embedding client should deterministically normalize the Ollama base URL to /api/embeddings","red_evidence":"ollama_embedding_client_normalizes_embeddings_endpoint_url failed because OllamaEmbeddingClient did not exist","green_evidence":"cargo test --workspace -q passed; autoresearch.sh parsed tests_green=11 tests_total=11 and checks passed","implementation_notes":"Added client storing trimmed base URL and model; model accessor included to avoid hidden dead field while preserving future request construction"}}
{"run":10,"commit":"6bface3","metric":12,"metrics":{"tests_total":12,"milestone_index":2,"loc_core":355,"commit_count_total":16},"status":"keep","description":"T12 builds Ollama embedding requests from client model","timestamp":1778131370607,"segment":0,"confidence":3.2,"asi":{"hypothesis":"the embedding client should own model configuration and construct serializable request bodies for prompts","red_evidence":"ollama_embedding_client_builds_request_with_configured_model failed because OllamaEmbeddingClient had no request method","green_evidence":"cargo test --workspace -q passed; autoresearch.sh parsed tests_green=12 tests_total=12 and checks passed","implementation_notes":"Added request(&self, prompt) returning OllamaEmbeddingRequest borrowing the configured model; still no network I/O"}}
{"run":11,"commit":"bbaace9","metric":13,"metrics":{"tests_total":13,"milestone_index":2,"loc_core":361,"commit_count_total":17},"status":"keep","description":"T13 adds vector chunk metadata migration","timestamp":1778131406015,"segment":0,"confidence":3,"asi":{"hypothesis":"v0.2 vector storage should first persist chunk metadata in SQLite so a future sqlite-vss table can join by row/claim id","red_evidence":"fresh_database_has_vector_chunks_table failed because migrations did not create vector_chunks","green_evidence":"cargo test --workspace -q passed; autoresearch.sh parsed tests_green=13 tests_total=13 and checks passed","implementation_notes":"Added 0002_vector_chunks migration and registered it; no sqlite-vss virtual table yet because extension-loading behavior should be tested separately"}}
{"run":12,"commit":"46eea41","metric":14,"metrics":{"tests_total":14,"milestone_index":2,"loc_core":379,"commit_count_total":18},"status":"keep","description":"T14 adds vector chunk metadata inserts","timestamp":1778131434093,"segment":0,"confidence":3.3333333333333335,"asi":{"hypothesis":"Store should be able to persist chunk metadata for claims before embedding vector indexing is connected","red_evidence":"add_vector_chunk_returns_chunk_id_for_claim failed because Store had no add_vector_chunk method","green_evidence":"cargo test --workspace -q passed; autoresearch.sh parsed tests_green=14 tests_total=14 and checks passed","implementation_notes":"Added add_vector_chunk using SQLite FK to claims and last_insert_rowid; no audit log entry because this is derived index metadata rather than a user memory write"}}
{"run":13,"commit":"6582f0f","metric":15,"metrics":{"tests_total":15,"milestone_index":2,"loc_core":406,"commit_count_total":19},"status":"keep","description":"T15 reads vector chunk metadata by id","timestamp":1778131488068,"segment":0,"confidence":3.6666666666666665,"asi":{"hypothesis":"chunk metadata needs a typed read path before retrieval/indexing logic can depend on it","red_evidence":"get_vector_chunk_returns_claim_text_and_model failed because Store had no get_vector_chunk method","green_evidence":"cargo test --workspace -q passed; autoresearch.sh parsed tests_green=15 tests_total=15 and checks passed","implementation_notes":"Added VectorChunk DTO and get_vector_chunk query mapping id, claim_id, text, and embedding_model"}}
{"run":14,"commit":"039a5ad","metric":16,"metrics":{"tests_total":16,"milestone_index":2,"loc_core":429,"commit_count_total":20},"status":"keep","description":"T16 adds hardcoded HybridRAG weights","timestamp":1778131532020,"segment":0,"confidence":3.4285714285714284,"asi":{"hypothesis":"v0.2 HybridRAG can start with ADR-0004's hardcoded alpha before adaptive query classification","red_evidence":"default_hybrid_weights_use_hardcoded_v0_2_alpha failed because memory_core::retrieval did not exist","green_evidence":"cargo test --workspace -q passed; autoresearch.sh parsed tests_green=16 tests_total=16 and checks passed","implementation_notes":"Added HybridWeights default alpha=0.65 plus vector_weight/graph_weight helpers; no scoring implementation yet"}}
{"run":15,"commit":"9d0b7b6","metric":17,"metrics":{"tests_total":17,"milestone_index":2,"loc_core":433,"commit_count_total":21},"status":"keep","description":"T17 blends vector and graph retrieval scores","timestamp":1778131563500,"segment":0,"confidence":3.25,"asi":{"hypothesis":"HybridWeights should encode ADR-0004's score formula directly so later retrieval can use one tested primitive","red_evidence":"hybrid_weights_blend_vector_and_graph_scores failed because HybridWeights had no blend method","green_evidence":"cargo test --workspace -q passed; autoresearch.sh parsed tests_green=17 tests_total=17 and checks passed","implementation_notes":"blend computes alpha*vector_score + (1-alpha)*graph_score; no ranking or retrieval side effects yet"}}
{"run":16,"commit":"bfcd82d","metric":18,"metrics":{"tests_total":18,"milestone_index":2,"loc_core":448,"commit_count_total":22},"status":"keep","description":"T18 adds HybridRAG retrieval candidate scoring","timestamp":1778131599340,"segment":0,"confidence":3.5,"asi":{"hypothesis":"a typed RetrievalCandidate with precomputed hybrid score is the smallest bridge from score formula to ranked recall results","red_evidence":"retrieval_candidate_uses_hybrid_score_for_ordering_signal failed because RetrievalCandidate did not exist","green_evidence":"cargo test --workspace -q passed; autoresearch.sh parsed tests_green=18 tests_total=18 and checks passed","implementation_notes":"Candidate stores claim_id and blended score only; ordering/top-k deferred to a later TDD step"}}
{"run":17,"commit":"418243e","metric":19,"metrics":{"tests_total":19,"milestone_index":2,"loc_core":453,"commit_count_total":23},"status":"keep","description":"T19 ranks HybridRAG candidates by score","timestamp":1778131626654,"segment":0,"confidence":3.75,"asi":{"hypothesis":"ranked recall needs a deterministic descending score order primitive before Store-level HybridRAG can assemble results","red_evidence":"rank_candidates_orders_by_descending_hybrid_score failed because rank_candidates did not exist","green_evidence":"cargo test --workspace -q passed; autoresearch.sh parsed tests_green=19 tests_total=19 and checks passed","implementation_notes":"rank_candidates uses f64::total_cmp descending to avoid partial_cmp unwrap/NaN pitfalls"}}
{"run":18,"commit":"f7f9241","metric":20,"metrics":{"tests_total":20,"milestone_index":2,"loc_core":462,"commit_count_total":24},"status":"keep","description":"T20 limits HybridRAG candidates to top-k","timestamp":1778131657572,"segment":0,"confidence":3.5555555555555554,"asi":{"hypothesis":"top-k truncation should be a tested pure primitive before wiring retrieval results into Store::recall","red_evidence":"top_k_candidates_returns_highest_scoring_limit failed because top_k_candidates did not exist","green_evidence":"cargo test --workspace -q passed; autoresearch.sh parsed tests_green=20 tests_total=20 and checks passed","implementation_notes":"top_k_candidates composes rank_candidates then truncate; deterministic with f64::total_cmp inherited from ranking"}}
{"run":19,"commit":"f7f9241","metric":21,"metrics":{"tests_total":21,"milestone_index":2,"loc_core":474,"commit_count_total":25},"status":"checks_failed","description":"T21 vector backend default passed tests but failed clippy derivable_impls","timestamp":1778131684131,"segment":0,"confidence":3.2,"asi":{"hypothesis":"encode ADR-0006 default vector backend as sqlite-vss with Qdrant opt-in enum","rollback_reason":"clippy -D warnings rejected manual Default impl for VectorBackend as derivable_impls","next_action_hint":"reapply VectorBackend test and implementation using #[derive(Default)] plus #[default] on SqliteVss","red_evidence":"vector_backend_defaults_to_sqlite_vss failed because VectorBackend did not exist","implementation_notes":"No ADR/schema changes; only vector.rs enum and vector.rs test import/test were involved"}}
{"run":20,"commit":"4eacca0","metric":21,"metrics":{"tests_total":21,"milestone_index":2,"loc_core":469,"commit_count_total":25},"status":"keep","description":"T21 defaults vector backend to sqlite-vss","timestamp":1778131722883,"segment":0,"confidence":3.4,"asi":{"hypothesis":"ADR-0006's default sqlite-vss backend should be represented as a typed default with Qdrant only as opt-in","red_evidence":"vector_backend_defaults_to_sqlite_vss failed because VectorBackend did not exist","green_evidence":"cargo test --workspace -q passed; autoresearch.sh parsed tests_green=21 tests_total=21 and checks passed","implementation_notes":"Used #[derive(Default)] with #[default] SqliteVss after prior clippy derivable_impls failure; no schema or ADR changes"}}
{"run":21,"commit":"3040b90","metric":22,"metrics":{"tests_total":22,"milestone_index":2,"loc_core":483,"commit_count_total":26},"status":"keep","description":"T22 parses qdrant vector backend opt-in","timestamp":1778131752880,"segment":0,"confidence":3.6,"asi":{"hypothesis":"ADR-0006's Qdrant escape hatch should be parseable explicitly while sqlite-vss remains the default","red_evidence":"vector_backend_parses_qdrant_opt_in failed because VectorBackend did not implement FromStr","green_evidence":"cargo test --workspace -q passed; autoresearch.sh parsed tests_green=22 tests_total=22 and checks passed","implementation_notes":"Added FromStr for sqlite-vss and qdrant with &'static str error; config/env plumbing deferred"}}
{"run":22,"commit":"e2e92f1","metric":23,"metrics":{"tests_total":23,"milestone_index":2,"loc_core":493,"commit_count_total":27},"status":"keep","description":"T23 displays vector backend config values","timestamp":1778131813502,"segment":0,"confidence":3.4545454545454546,"asi":{"hypothesis":"typed vector backends should round-trip to stable config strings before CLI/config surfaces expose them","red_evidence":"vector_backend_displays_config_values failed because VectorBackend did not implement Display/ToString","green_evidence":"cargo test --workspace -q passed; autoresearch.sh parsed tests_green=23 tests_total=23 and checks passed","implementation_notes":"Implemented Display matching FromStr strings for sqlite-vss and qdrant; no changes to parsing semantics"}}
{"run":23,"commit":"fea13c6","metric":24,"metrics":{"tests_total":24,"milestone_index":2,"loc_core":502,"commit_count_total":28},"status":"keep","description":"T24 defaults vector backend when config is unset","timestamp":1778131842427,"segment":0,"confidence":3.3333333333333335,"asi":{"hypothesis":"config plumbing should treat an absent MEMORY_VECTOR_BACKEND-like value as sqlite-vss without requiring callers to duplicate default logic","red_evidence":"vector_backend_from_optional_config_defaults_when_unset failed because VectorBackend had no from_optional_config constructor","green_evidence":"cargo test --workspace -q passed; autoresearch.sh parsed tests_green=24 tests_total=24 and checks passed","implementation_notes":"Added pure Option<&str> parser to avoid mutating process environment in Rust 2024 tests"}}
{"run":24,"commit":"94d7fa5","metric":25,"metrics":{"tests_total":25,"milestone_index":2,"loc_core":502,"commit_count_total":29},"status":"keep","description":"T25 trims vector backend config values","timestamp":1778131878192,"segment":0,"confidence":3.5,"asi":{"hypothesis":"backend config parsing should tolerate harmless surrounding whitespace from env/config files without changing accepted values","red_evidence":"vector_backend_config_parser_trims_whitespace failed with Err(\"unknown vector backend\") for \" qdrant \"","green_evidence":"cargo test --workspace -q passed; autoresearch.sh parsed tests_green=25 tests_total=25 and checks passed","implementation_notes":"Trim only in from_optional_config; FromStr remains strict for canonical values"}}
{"run":25,"commit":"cd5b7e6","metric":26,"metrics":{"tests_total":26,"milestone_index":2,"loc_core":507,"commit_count_total":30},"status":"keep","description":"T26 parses Ollama response bodies via client","timestamp":1778131924223,"segment":0,"confidence":3.6666666666666665,"asi":{"hypothesis":"the Ollama embedding client should own response-body parsing before actual HTTP transport is added","red_evidence":"ollama_embedding_client_parses_response_body_to_vector first failed because OllamaEmbeddingClient had no parse_response_body method; after implementation a malformed escaped JSON test string was corrected","green_evidence":"cargo test --workspace -q passed; autoresearch.sh parsed tests_green=26 tests_total=26 and checks passed","implementation_notes":"parse_response_body deserializes OllamaEmbeddingResponse and returns Vec<f32>; no network I/O added"}}
{"run":26,"commit":"cd5b7e6","metric":27,"metrics":{"tests_total":27,"milestone_index":2,"loc_core":524,"commit_count_total":31},"status":"checks_failed","description":"T27 Ollama HTTP embed passed tests but failed clippy large error checks","timestamp":1778132008302,"segment":0,"confidence":3.6666666666666665,"asi":{"hypothesis":"add a real local HTTP POST path for Ollama embeddings using ureq and a loopback test server","rollback_reason":"clippy -D warnings rejected EmbeddingError because ureq::Error made a large enum variant and Result large Err","next_action_hint":"reapply the HTTP embed test and implementation with boxed ureq::Error or a smaller string-based Http variant; also keep the test asserting only POST path because ureq may send body after initial header read","red_evidence":"ollama_embedding_client_posts_to_local_embeddings_endpoint first failed because OllamaEmbeddingClient had no embed method","implementation_notes":"Added workspace ureq dependency, EmbeddingError, and embed() posting JSON to /api/embeddings; cargo test passed before clippy failure"}}
{"run":27,"commit":"368ccf7","metric":27,"metrics":{"tests_total":27,"milestone_index":2,"loc_core":525,"commit_count_total":31},"status":"keep","description":"T27 posts embeddings requests to local Ollama HTTP endpoint","timestamp":1778132070191,"segment":0,"confidence":3.8333333333333335,"asi":{"hypothesis":"v0.2 should include a real HTTP POST path to Ollama's /api/embeddings endpoint, verified against a local loopback server rather than external Ollama","red_evidence":"ollama_embedding_client_posts_to_local_embeddings_endpoint failed because OllamaEmbeddingClient had no embed method","green_evidence":"cargo test --workspace -q passed; autoresearch.sh parsed tests_green=27 tests_total=27 and checks passed","implementation_notes":"Added ureq dependency, EmbeddingError with string HTTP variant to avoid clippy large_enum_variant, and embed() that posts serialized request then parses response body; test only asserts POST path because body may arrive after initial header read"}}
