{"run":147,"commit":"e6639ae","metric":0,"metrics":{"tests_green":160,"tests_total":160,"milestone_index":9,"loc_core":1782,"commit_count_total":173,"unsupported_claim_rate":0,"mean_precision_at_k":1,"mean_recall_at_k":1},"status":"keep","description":"split compact multi-digit version identifiers","timestamp":1778184713133,"segment":19,"confidence":null,"asi":{"hypothesis":"compact version identifiers like OAuth21 should tokenize digit runs as both full runs and individual digits so spaced queries like 'OAuth 2 1 server' distinguish them from generic version facts","red_evidence":"recall_text_matches_multi_digit_version_identifier failed because OAuth21 only matched OAuth/server while server version 2 tied strongly","green_evidence":"multi_digit_version_identifier joins aggregate with memory_error_rate=0 and checks pass","anti_overfit_note":"digit-run splitting is a generic identifier rule for any compact numeric suffix, not OAuth-specific"}}
{"type":"config","name":"Optimize Aver aggregate memory error with v-prefixed version queries","metricName":"memory_error_rate","metricUnit":"","bestDirection":"lower"}
{"run":148,"commit":"e8a4fa0","metric":0,"metrics":{"tests_green":161,"tests_total":161,"milestone_index":9,"loc_core":1782,"commit_count_total":174,"unsupported_claim_rate":0,"mean_precision_at_k":1,"mean_recall_at_k":1},"status":"keep","description":"broaden aggregate with v-prefixed version query fixture","timestamp":1778184813334,"segment":20,"confidence":null,"asi":{"hypothesis":"queries often use v-prefixed versions like 'v2', so aggregate coverage should include compact identifier recall for 'supports OAuth v2'","red_evidence":"new test was expected to expose a v-prefix gap, but existing token scoring already ranked OAuth2 above generic version 2 because the supports predicate and OAuth token supplied enough signal","green_evidence":"v_prefixed_version_query joins aggregate with memory_error_rate=0 and checks pass","anti_overfit_note":"benchmark broadening only; no retrieval implementation changed because existing general scoring handled the case"}}
{"type":"config","name":"Optimize Aver aggregate memory error with irregular plural morphology","metricName":"memory_error_rate","metricUnit":"","bestDirection":"lower"}
{"run":149,"commit":"e8a4fa0","metric":0,"metrics":{"tests_green":32,"tests_total":33,"milestone_index":9,"loc_core":1784,"commit_count_total":175,"unsupported_claim_rate":0,"mean_precision_at_k":0,"mean_recall_at_k":0},"status":"crash","description":"irregular plural normalizer exposed overly broad name-anchor expansion","timestamp":1778184906324,"segment":21,"confidence":null,"asi":{"hypothesis":"normalize common irregular plurals such as children to child so natural queries beat same-object distractors","rollback_reason":"children normalized correctly, but existing name-anchor expansion kept a user/name/Alice distractor that did not share the child subject","next_action_hint":"reapply irregular plural fixture and constrain name-anchor expansion to max-score name subject cluster","failure_detail":"recall_text_normalizes_common_irregular_plural_query_tokens returned [child,user] instead of [child]"}}
{"run":150,"commit":"db7294f","metric":0,"metrics":{"tests_green":162,"tests_total":162,"milestone_index":9,"loc_core":1795,"commit_count_total":175,"unsupported_claim_rate":0,"mean_precision_at_k":1,"mean_recall_at_k":1},"status":"keep","description":"normalize irregular plural child queries","timestamp":1778184974045,"segment":21,"confidence":null,"asi":{"hypothesis":"common irregular plurals such as children should normalize to singular child, and name-anchor expansion should stay within the anchored subject cluster to avoid same-object distractors","red_evidence":"recall_text_normalizes_common_irregular_plural_query_tokens failed because children Alice returned both child/name/Alice and user/name/Alice","green_evidence":"irregular_plural_morphology joins aggregate with memory_error_rate=0 and checks pass","anti_overfit_note":"children->child is a common irregular morphology rule; subject-cluster filtering generalizes existing name-anchor expansion rather than targeting Alice"}}
{"type":"config","name":"Optimize Aver aggregate memory error with people/person morphology","metricName":"memory_error_rate","metricUnit":"","bestDirection":"lower"}
{"run":151,"commit":"76f1178","metric":0,"metrics":{"tests_green":163,"tests_total":163,"milestone_index":9,"loc_core":1797,"commit_count_total":176,"unsupported_claim_rate":0,"mean_precision_at_k":1,"mean_recall_at_k":1},"status":"keep","description":"normalize people/person irregular plural queries","timestamp":1778185047863,"segment":22,"confidence":null,"asi":{"hypothesis":"common irregular plural people should normalize to person so natural queries beat same-object distractors","red_evidence":"recall_text_normalizes_people_plural_query_tokens failed because people Alice returned both person/name/Alice and user/name/Alice before normalization","green_evidence":"people_plural_morphology joins aggregate with memory_error_rate=0 and checks pass","anti_overfit_note":"people->person is a common irregular morphology rule; no Alice or fixture-specific matching"}}
{"type":"config","name":"Advance Aver v0.3 extractor TDD tests","metricName":"tests_green","metricUnit":"","bestDirection":"higher"}
{"run":152,"commit":"c853c2a","metric":164,"metrics":{"tests_total":164,"milestone_index":9,"loc_core":1797,"commit_count_total":177,"memory_error_rate":0,"unsupported_claim_rate":0,"mean_precision_at_k":1,"mean_recall_at_k":1},"status":"keep","description":"extract qualified impl method call triples","timestamp":1778185181646,"segment":23,"confidence":null,"asi":{"hypothesis":"Tree-sitter extractor should preserve impl receiver type context when emitting method call facts so Store::add_claim calls are not conflated with free functions or methods on other types","red_evidence":"extract_rust_facts_emits_qualified_impl_method_call_triple failed because only unqualified Function:add_claim call facts existed","green_evidence":"autoresearch.sh passed with tests_green=164 and checks green","anti_overfit_note":"implementation walks impl_item nodes generically and qualifies every contained function_item call subject with the impl type, not a Store-specific rule"}}
{"run":153,"commit":"4c34fd0","metric":165,"metrics":{"tests_total":165,"milestone_index":9,"loc_core":1797,"commit_count_total":178,"memory_error_rate":0,"unsupported_claim_rate":0,"mean_precision_at_k":1,"mean_recall_at_k":1},"status":"keep","description":"extract Rust module definition triples","timestamp":1778185249119,"segment":23,"confidence":null,"asi":{"hypothesis":"Tree-sitter extractor should treat Rust modules as first-class code graph nodes by emitting file-defines-module triples","red_evidence":"extract_rust_facts_emits_file_defines_module_triple failed because mod_item names were not collected or emitted as facts","green_evidence":"autoresearch.sh passed with tests_green=165 and checks green","anti_overfit_note":"implementation generically collects all tree-sitter mod_item names and emits Module facts; it is not tied to the embedding fixture name"}}
{"run":154,"commit":"3114fed","metric":166,"metrics":{"tests_total":166,"milestone_index":9,"loc_core":1797,"commit_count_total":179,"memory_error_rate":0,"unsupported_claim_rate":0,"mean_precision_at_k":1,"mean_recall_at_k":1},"status":"keep","description":"extract module-qualified function definition triples","timestamp":1778185287755,"segment":23,"confidence":2,"asi":{"hypothesis":"Tree-sitter extractor should preserve module context for functions defined inside Rust modules so code graph facts can distinguish embedding::embed from other embed functions","red_evidence":"extract_rust_facts_emits_module_defines_function_triple failed because module function definitions were only emitted as unqualified file-level functions","green_evidence":"autoresearch.sh passed with tests_green=166 and checks green","anti_overfit_note":"implementation generically walks mod_item nodes and qualifies contained function_item definitions by nested module path; it is not tied to the embedding fixture name"}}
{"run":155,"commit":"b258337","metric":167,"metrics":{"tests_total":167,"milestone_index":9,"loc_core":1797,"commit_count_total":180,"memory_error_rate":0,"unsupported_claim_rate":0,"mean_precision_at_k":1,"mean_recall_at_k":1},"status":"keep","description":"extract module-qualified function call triples","timestamp":1778185331575,"segment":23,"confidence":3,"asi":{"hypothesis":"Tree-sitter extractor should preserve module context on call edges from functions inside modules so sibling calls are linked as embedding::embed -> embedding::normalize","red_evidence":"extract_rust_facts_emits_module_qualified_function_call_triple failed because nested module calls were only emitted through unqualified free-function call facts","green_evidence":"autoresearch.sh passed with tests_green=167 and checks green","anti_overfit_note":"implementation generically qualifies bare callee identifiers under any module path while preserving already-qualified or receiver calls"}}
{"run":156,"commit":"b258337","metric":168,"metrics":{"tests_total":168,"milestone_index":9,"loc_core":1797,"commit_count_total":181,"memory_error_rate":0,"unsupported_claim_rate":0,"mean_precision_at_k":1,"mean_recall_at_k":1},"status":"checks_failed","description":"nested module definition triples failed formatting check","timestamp":1778185369045,"segment":23,"confidence":3,"asi":{"hypothesis":"Tree-sitter extractor should emit nested module definition facts with qualified module paths such as Module:outer defines Module:outer::inner","rollback_reason":"cargo fmt --check required multiline formatting for the new nested module test","next_action_hint":"reapply nested module definition test and generic module definition fact collector, then run cargo fmt before autoresearch","red_evidence":"extract_rust_facts_emits_nested_module_definition_triple failed before implementation because nested mod_item facts were not qualified","green_evidence":"targeted test passed and autoresearch benchmark reported tests_green=168 before formatting gate failed"}}
{"run":157,"commit":"8ef8c7a","metric":168,"metrics":{"tests_total":168,"milestone_index":9,"loc_core":1797,"commit_count_total":181,"memory_error_rate":0,"unsupported_claim_rate":0,"mean_precision_at_k":1,"mean_recall_at_k":1},"status":"keep","description":"extract nested module definition triples","timestamp":1778185399492,"segment":23,"confidence":2.6666666666666665,"asi":{"hypothesis":"Tree-sitter extractor should emit nested module definition facts with qualified module paths such as Module:outer defines Module:outer::inner","red_evidence":"extract_rust_facts_emits_nested_module_definition_triple failed because nested mod_item facts were emitted only as unqualified file-level Module:inner facts","green_evidence":"autoresearch.sh passed with tests_green=168 and checks green","anti_overfit_note":"implementation generically walks nested mod_item nodes and emits parent-child module facts for any module path, not fixture-specific names"}}
{"run":158,"commit":"3cfbcbb","metric":169,"metrics":{"tests_total":169,"milestone_index":9,"loc_core":1797,"commit_count_total":182,"memory_error_rate":0,"unsupported_claim_rate":0,"mean_precision_at_k":1,"mean_recall_at_k":1},"status":"keep","description":"extract module-qualified impl method triples","timestamp":1778185448522,"segment":23,"confidence":5,"asi":{"hypothesis":"Tree-sitter extractor should preserve module context for impl method definitions so Type:storage::Store is not conflated with unqualified Type:Store","red_evidence":"extract_rust_facts_emits_module_qualified_impl_method_triple failed because impl methods inside modules were emitted only as Type:Store defines Function:Store::add_claim","green_evidence":"autoresearch.sh passed with tests_green=169 and checks green","anti_overfit_note":"implementation recursively tracks any mod_item path and qualifies contained impl_item type names generically unless already qualified"}}
{"run":159,"commit":"9d8280a","metric":170,"metrics":{"tests_total":170,"milestone_index":9,"loc_core":1797,"commit_count_total":183,"memory_error_rate":0,"unsupported_claim_rate":0,"mean_precision_at_k":1,"mean_recall_at_k":1},"status":"keep","description":"extract module-qualified impl method call triples","timestamp":1778185498373,"segment":23,"confidence":4,"asi":{"hypothesis":"Tree-sitter extractor should preserve module-qualified impl method subjects on call edges so Function:storage::Store::add_claim calls are aligned with module-qualified definition facts","red_evidence":"extract_rust_facts_emits_module_qualified_impl_method_call_triple failed because impl call facts inside modules used unqualified Function:Store::add_claim subjects","green_evidence":"autoresearch.sh passed with tests_green=170 and checks green","anti_overfit_note":"implementation reuses the generic module-path-qualified impl type walker and existing qualified method call collector for any module/type/method names"}}
{"run":160,"commit":"11365ac","metric":171,"metrics":{"tests_total":171,"milestone_index":9,"loc_core":1797,"commit_count_total":184,"memory_error_rate":0,"unsupported_claim_rate":0,"mean_precision_at_k":1,"mean_recall_at_k":1},"status":"keep","description":"extract module-qualified impl trait triples","timestamp":1778185551264,"segment":23,"confidence":3.5,"asi":{"hypothesis":"Tree-sitter extractor should preserve module context on trait implementation facts so local module traits and types are not conflated with similarly named symbols elsewhere","red_evidence":"extract_rust_facts_emits_module_qualified_impl_trait_triple failed because impl Trait for Type inside a module emitted only unqualified Type and Trait facts","green_evidence":"autoresearch.sh passed with tests_green=171 and checks green","anti_overfit_note":"implementation recursively tracks any mod_item path and qualifies bare trait/type names generically while preserving already qualified paths"}}
{"run":161,"commit":"fe02289","metric":172,"metrics":{"tests_total":172,"milestone_index":9,"loc_core":1797,"commit_count_total":185,"memory_error_rate":0,"unsupported_claim_rate":0,"mean_precision_at_k":1,"mean_recall_at_k":1},"status":"keep","description":"extract module-qualified trait definition triples","timestamp":1778185594979,"segment":23,"confidence":4,"asi":{"hypothesis":"Tree-sitter extractor should emit module-qualified trait definition facts so traits declared in modules align with module-qualified impl trait facts","red_evidence":"extract_rust_facts_emits_module_defines_trait_triple failed because module-local trait definitions were only emitted as file-level Trait:EmbeddingClient facts","green_evidence":"autoresearch.sh passed with tests_green=172 and checks green","anti_overfit_note":"implementation recursively tracks any mod_item path and qualifies contained trait_item definitions generically, not by fixture names"}}
{"run":162,"commit":"bae19f2","metric":173,"metrics":{"tests_total":173,"milestone_index":9,"loc_core":1797,"commit_count_total":186,"memory_error_rate":0,"unsupported_claim_rate":0,"mean_precision_at_k":1,"mean_recall_at_k":1},"status":"keep","description":"extract module-qualified struct definition triples","timestamp":1778185652747,"segment":23,"confidence":4.5,"asi":{"hypothesis":"Tree-sitter extractor should emit module-qualified struct definition facts so structs declared inside modules align with module-qualified impl type facts","red_evidence":"extract_rust_facts_emits_module_defines_struct_triple failed because module-local structs were only emitted as file-level Struct:Store facts","green_evidence":"autoresearch.sh passed with tests_green=173 and checks green","anti_overfit_note":"implementation recursively tracks any mod_item path and qualifies contained struct_item definitions generically, not by fixture names"}}
{"run":163,"commit":"0664da6","metric":174,"metrics":{"tests_total":174,"milestone_index":9,"loc_core":1797,"commit_count_total":187,"memory_error_rate":0,"unsupported_claim_rate":0,"mean_precision_at_k":1,"mean_recall_at_k":1},"status":"keep","description":"extract module-qualified enum definition triples","timestamp":1778185698500,"segment":23,"confidence":4,"asi":{"hypothesis":"Tree-sitter extractor should emit module-qualified enum definition facts so enums declared inside modules align with other module-qualified nominal type facts","red_evidence":"extract_rust_facts_emits_module_defines_enum_triple failed because module-local enums were only emitted as file-level Enum:MemoryError facts","green_evidence":"autoresearch.sh passed with tests_green=174 and checks green","anti_overfit_note":"implementation recursively tracks any mod_item path and qualifies contained enum_item definitions generically, not by fixture names"}}
{"run":164,"commit":"41d4e9f","metric":175,"metrics":{"tests_total":175,"milestone_index":9,"loc_core":1797,"commit_count_total":188,"memory_error_rate":0,"unsupported_claim_rate":0,"mean_precision_at_k":1,"mean_recall_at_k":1},"status":"keep","description":"extract module-qualified test coverage triples","timestamp":1778185753044,"segment":23,"confidence":3.6666666666666665,"asi":{"hypothesis":"Tree-sitter extractor should emit module-qualified test coverage facts so tests declared inside modules point at module-qualified function definitions","red_evidence":"extract_rust_facts_emits_module_qualified_test_covers_function_triple failed because module-local tests only produced unqualified test mapping facts","green_evidence":"autoresearch.sh passed with tests_green=175 and checks green","anti_overfit_note":"implementation recursively tracks any mod_item path and applies the existing prefix-based test-to-function mapping generically within module scope"}}
{"run":165,"commit":"5305c75","metric":176,"metrics":{"tests_total":176,"milestone_index":9,"loc_core":1797,"commit_count_total":189,"memory_error_rate":0,"unsupported_claim_rate":0,"mean_precision_at_k":1,"mean_recall_at_k":1},"status":"keep","description":"extract module-scoped import triples","timestamp":1778185810453,"segment":23,"confidence":4,"asi":{"hypothesis":"Tree-sitter extractor should emit imports from the containing module as Module:path imports Module:target instead of only file-level import facts","red_evidence":"extract_rust_facts_emits_module_imports_module_triple failed because use declarations inside modules only emitted src/lib.rs imports Module:std::fs","green_evidence":"autoresearch.sh passed with tests_green=176 and checks green","anti_overfit_note":"implementation recursively tracks any mod_item path and emits imports for use_declaration nodes under that module, with no fixture-specific module names"}}
{"run":166,"commit":"d39e068","metric":177,"metrics":{"tests_total":177,"milestone_index":9,"loc_core":1797,"commit_count_total":190,"memory_error_rate":0,"unsupported_claim_rate":0,"mean_precision_at_k":1,"mean_recall_at_k":1},"status":"keep","description":"extract Rust const definition triples","timestamp":1778185854901,"segment":23,"confidence":4.333333333333333,"asi":{"hypothesis":"Tree-sitter extractor should include Rust const_item symbols as deterministic code graph definition facts","red_evidence":"extract_rust_facts_emits_file_defines_const_triple failed because const_item names were not collected or emitted","green_evidence":"autoresearch.sh passed with tests_green=177 and checks green","anti_overfit_note":"implementation generically collects all tree-sitter const_item names and emits Const facts; it is not tied to DEFAULT_LIMIT"}}
{"run":167,"commit":"c468b24","metric":178,"metrics":{"tests_total":178,"milestone_index":9,"loc_core":1797,"commit_count_total":191,"memory_error_rate":0,"unsupported_claim_rate":0,"mean_precision_at_k":1,"mean_recall_at_k":1},"status":"keep","description":"extract module-qualified const definition triples","timestamp":1778185918793,"segment":23,"confidence":4,"asi":{"hypothesis":"Tree-sitter extractor should emit module-qualified const definition facts so constants declared inside modules align with other module-qualified symbol definitions","red_evidence":"extract_rust_facts_emits_module_defines_const_triple failed because module-local constants were only emitted as file-level Const:DEFAULT_LIMIT facts","green_evidence":"autoresearch.sh passed with tests_green=178 and checks green","anti_overfit_note":"implementation recursively tracks any mod_item path and qualifies contained const_item definitions generically, not by fixture names"}}
{"run":168,"commit":"160bfc6","metric":179,"metrics":{"tests_total":179,"milestone_index":9,"loc_core":1797,"commit_count_total":192,"memory_error_rate":0,"unsupported_claim_rate":0,"mean_precision_at_k":1,"mean_recall_at_k":1},"status":"keep","description":"add BEAM-style knowledge update MemoryBench fixture","timestamp":1778204178376,"segment":23,"confidence":3.75,"asi":{"hypothesis":"Recycle Karta BEAM100K knowledge_update failures into deterministic MemoryBench coverage where current/latest queries must rank updated facts over stale values","red_evidence":"beam_style_knowledge_update_fixture_scores_perfectly initially failed because the fixture did not exist; the test then locked the expected fixture metrics","green_evidence":"autoresearch.sh passed with tests_green=179, aggregate MemoryBench includes beam_knowledge_update, and checks are green","anti_overfit_note":"fixture is adapted from Karta's BEAM failure category using generic current/latest stale-value patterns, with no retrieval implementation changes or answer hard-coding"}}
