{"run":488,"commit":"898a922","metric":580,"metrics":{"tests_green":580,"tests_total":580,"milestone_index":9,"loc_core":5277,"commit_count_total":517,"memory_error_rate":0,"unsupported_claim_rate":0,"mean_precision_at_k":1,"mean_recall_at_k":1,"beam_questions":0,"beam_rubric_checks":0,"beam_abstention_pct":0,"beam_contradiction_resolution_pct":0,"beam_event_ordering_pct":0,"beam_information_extraction_pct":0,"beam_instruction_following_pct":0,"beam_knowledge_update_pct":0,"beam_multi_session_reasoning_pct":0,"beam_preference_following_pct":0,"beam_summarization_pct":0,"beam_temporal_reasoning_pct":0},"status":"keep","description":"Reject non-positive entity last-seen timestamps","timestamp":1778424263395,"segment":28,"confidence":3.381818181818182,"asi":{"hypothesis":"Projected entity last_seen_at values should be positive at the schema layer because Store/replay uses them for recency and decay logic and they should not contain sentinel zero values.","red_evidence":"`cargo test -q -p aver-core --test migrations entity_last_seen_at_must_be_positive` failed because direct SQL accepted `last_seen_at = 0`.","green_evidence":"Targeted test passed; full migrations test passed; `./autoresearch.sh` passed with checks green and metrics tests_green=580 tests_total=580.","implementation_notes":"Added migration `0068_entity_last_seen_at_positive_checks.sql` with insert/update triggers rejecting entities rows whose last_seen_at is <= 0; registered it in embedded migrations.","anti_overfit_note":"This is a general graph entity recency/audit invariant and does not use benchmark expected outputs or labels."}}
{"run":489,"commit":"50059c7","metric":581,"metrics":{"tests_green":581,"tests_total":581,"milestone_index":9,"loc_core":5281,"commit_count_total":518,"memory_error_rate":0,"unsupported_claim_rate":0,"mean_precision_at_k":1,"mean_recall_at_k":1,"beam_questions":0,"beam_rubric_checks":0,"beam_abstention_pct":0,"beam_contradiction_resolution_pct":0,"beam_event_ordering_pct":0,"beam_information_extraction_pct":0,"beam_instruction_following_pct":0,"beam_knowledge_update_pct":0,"beam_multi_session_reasoning_pct":0,"beam_preference_following_pct":0,"beam_summarization_pct":0,"beam_temporal_reasoning_pct":0},"status":"keep","description":"Reject entity last-seen before creation","timestamp":1778424359454,"segment":28,"confidence":3.369369369369369,"asi":{"hypothesis":"Projected entity last_seen_at should not precede created_at at the schema layer because graph recency/decay and audit chronology assume an entity cannot be seen before it exists.","red_evidence":"`cargo test -q -p aver-core --test migrations entity_last_seen_at_must_not_precede_created_at` failed because direct SQL accepted `created_at = 10, last_seen_at = 5`.","green_evidence":"Targeted ordering test passed; positive timestamp test still produces the clearer positive error after trigger guard; full migrations test passed; `./autoresearch.sh` passed with checks green and metrics tests_green=581 tests_total=581.","implementation_notes":"Added migration `0069_entity_seen_after_created_checks.sql` with insert/update triggers rejecting entities rows whose positive last_seen_at is less than positive created_at; registered it in embedded migrations.","anti_overfit_note":"This is a general graph entity chronology invariant and does not use benchmark expected outputs or labels."}}
{"run":490,"commit":"50059c7","metric":344,"metrics":{"tests_green":344,"tests_total":345,"milestone_index":9,"loc_core":5285,"commit_count_total":519,"memory_error_rate":0,"unsupported_claim_rate":0,"mean_precision_at_k":0,"mean_recall_at_k":0,"beam_questions":0,"beam_rubric_checks":0,"beam_abstention_pct":0,"beam_contradiction_resolution_pct":0,"beam_event_ordering_pct":0,"beam_information_extraction_pct":0,"beam_instruction_following_pct":0,"beam_knowledge_update_pct":0,"beam_multi_session_reasoning_pct":0,"beam_preference_following_pct":0,"beam_summarization_pct":0,"beam_temporal_reasoning_pct":0},"status":"crash","description":"Crash while enforcing entity requires_review boolean due legacy migration fixture","timestamp":1778424468859,"segment":28,"confidence":3.3392857142857144,"asi":{"hypothesis":"entities.requires_review should be constrained to SQLite boolean values 0 or 1.","rollback_reason":"Full workspace failed in `crates/aver-core/tests/vector_index.rs::migration_backfills_existing_vector_chunks_rows` because a legacy migration fixture schema hit the new trigger before `entities.requires_review` existed, producing `no such column: NEW.requires_review`.","next_action_hint":"Do not retry this invariant as a late trigger without first understanding old-schema migration paths; either rebuild entities table/check constraint at the migration that adds requires_review or skip this risky invariant.","red_evidence":"Targeted `entity_requires_review_must_be_boolean` failed because direct SQL accepted `requires_review = 2`; after adding trigger, `./autoresearch.sh` failed in vector_index migration fixture.","anti_overfit_note":"The failure is an old-schema migration compatibility issue, not benchmark-specific behavior."}}
{"run":491,"commit":"19cd922","metric":582,"metrics":{"tests_green":582,"tests_total":582,"milestone_index":9,"loc_core":5285,"commit_count_total":519,"memory_error_rate":0,"unsupported_claim_rate":0,"mean_precision_at_k":1,"mean_recall_at_k":1,"beam_questions":0,"beam_rubric_checks":0,"beam_abstention_pct":0,"beam_contradiction_resolution_pct":0,"beam_event_ordering_pct":0,"beam_information_extraction_pct":0,"beam_instruction_following_pct":0,"beam_knowledge_update_pct":0,"beam_multi_session_reasoning_pct":0,"beam_preference_following_pct":0,"beam_summarization_pct":0,"beam_temporal_reasoning_pct":0},"status":"keep","description":"Reject blank privacy rejection reasons","timestamp":1778424539746,"segment":28,"confidence":3.357142857142857,"asi":{"hypothesis":"Privacy rejection telemetry reason labels should reject blank strings at the schema layer because aggregate counters must remain actionable without storing secret content.","red_evidence":"`cargo test -q -p aver-core --test migrations privacy_rejection_reason_must_not_be_blank` failed because direct SQL accepted `reason = '   '`.","green_evidence":"Targeted test passed; full migrations test passed; `./autoresearch.sh` passed with checks green and metrics tests_green=582 tests_total=582.","implementation_notes":"Added migration `0070_privacy_rejection_reason_nonblank_checks.sql` with insert/update triggers rejecting privacy_rejections rows whose trimmed reason is empty; registered it in embedded migrations.","anti_overfit_note":"This is a general privacy telemetry quality invariant and does not use benchmark expected outputs or labels."}}
{"run":492,"commit":"327f8d3","metric":583,"metrics":{"tests_green":583,"tests_total":583,"milestone_index":9,"loc_core":5289,"commit_count_total":520,"memory_error_rate":0,"unsupported_claim_rate":0,"mean_precision_at_k":1,"mean_recall_at_k":1,"beam_questions":0,"beam_rubric_checks":0,"beam_abstention_pct":0,"beam_contradiction_resolution_pct":0,"beam_event_ordering_pct":0,"beam_information_extraction_pct":0,"beam_instruction_following_pct":0,"beam_knowledge_update_pct":0,"beam_multi_session_reasoning_pct":0,"beam_preference_following_pct":0,"beam_summarization_pct":0,"beam_temporal_reasoning_pct":0},"status":"keep","description":"Reject non-positive privacy rejection counts","timestamp":1778424612143,"segment":28,"confidence":3.375,"asi":{"hypothesis":"Privacy rejection telemetry counts should be positive at the schema layer because rows represent observed aggregate rejections and zero/negative counts are not meaningful telemetry.","red_evidence":"`cargo test -q -p aver-core --test migrations privacy_rejection_count_must_be_positive` failed because direct SQL accepted `count = 0`.","green_evidence":"Targeted test passed; full migrations test passed; `./autoresearch.sh` passed with checks green and metrics tests_green=583 tests_total=583.","implementation_notes":"Added migration `0071_privacy_rejection_count_positive_checks.sql` with insert/update triggers rejecting privacy_rejections rows whose count is <= 0; registered it in embedded migrations.","anti_overfit_note":"This is a general privacy telemetry quality invariant and does not use benchmark expected outputs or labels."}}
{"run":493,"commit":"ea2b012","metric":584,"metrics":{"tests_green":584,"tests_total":584,"milestone_index":9,"loc_core":5293,"commit_count_total":521,"memory_error_rate":0,"unsupported_claim_rate":0,"mean_precision_at_k":1,"mean_recall_at_k":1,"beam_questions":0,"beam_rubric_checks":0,"beam_abstention_pct":0,"beam_contradiction_resolution_pct":0,"beam_event_ordering_pct":0,"beam_information_extraction_pct":0,"beam_instruction_following_pct":0,"beam_knowledge_update_pct":0,"beam_multi_session_reasoning_pct":0,"beam_preference_following_pct":0,"beam_summarization_pct":0,"beam_temporal_reasoning_pct":0},"status":"keep","description":"Require existing predicates for ontology extensions","timestamp":1778424705859,"segment":28,"confidence":3.3628318584070795,"asi":{"hypothesis":"Ontology extension log predicate values should reference existing predicate_types so extension audit rows always identify the actual vocabulary row added by the extension path.","red_evidence":"`cargo test -q -p aver-core --test migrations ontology_extension_predicate_must_exist` failed because direct SQL accepted `predicate = 'missing_predicate'`.","green_evidence":"Targeted missing-predicate test passed; existing ontology extension validation tests were updated to use seeded predicates so they continue isolating their intended invariant; full migrations test passed; `./autoresearch.sh` passed with checks green and metrics tests_green=584 tests_total=584.","implementation_notes":"Added migration `0072_ontology_extension_predicate_exists_checks.sql` with insert/update triggers rejecting ontology_extension_log rows whose nonblank predicate is absent from predicate_types; registered it in embedded migrations.","anti_overfit_note":"This is a general ontology extension consistency invariant and does not use benchmark expected outputs or labels."}}
{"run":494,"commit":"adfaeae","metric":585,"metrics":{"tests_green":585,"tests_total":585,"milestone_index":9,"loc_core":5297,"commit_count_total":522,"memory_error_rate":0,"unsupported_claim_rate":0,"mean_precision_at_k":1,"mean_recall_at_k":1,"beam_questions":0,"beam_rubric_checks":0,"beam_abstention_pct":0,"beam_contradiction_resolution_pct":0,"beam_event_ordering_pct":0,"beam_information_extraction_pct":0,"beam_instruction_following_pct":0,"beam_knowledge_update_pct":0,"beam_multi_session_reasoning_pct":0,"beam_preference_following_pct":0,"beam_summarization_pct":0,"beam_temporal_reasoning_pct":0},"status":"keep","description":"Reject blank durable claim subjects","timestamp":1778424835818,"segment":28,"confidence":3.3508771929824563,"asi":{"hypothesis":"Durable claim subjects should reject blank strings at the schema layer because Store::add_claim validates triple fields before log-first persistence and direct SQL should preserve claim shape.","red_evidence":"`cargo test -q -p aver-core --test migrations claims_subject_must_not_be_blank` failed because direct SQL accepted `subject = '   '`.","green_evidence":"Targeted test passed; full migrations test passed; `./autoresearch.sh` passed with checks green and metrics tests_green=585 tests_total=585.","implementation_notes":"Added migration `0073_claim_subject_nonblank_checks.sql` with insert/update triggers rejecting claims rows whose trimmed subject is empty; registered it in embedded migrations.","anti_overfit_note":"This is a general durable triple shape invariant and does not use benchmark expected outputs or labels."}}
{"run":495,"commit":"7c9a3b0","metric":586,"metrics":{"tests_green":586,"tests_total":586,"milestone_index":9,"loc_core":5301,"commit_count_total":523,"memory_error_rate":0,"unsupported_claim_rate":0,"mean_precision_at_k":1,"mean_recall_at_k":1,"beam_questions":0,"beam_rubric_checks":0,"beam_abstention_pct":0,"beam_contradiction_resolution_pct":0,"beam_event_ordering_pct":0,"beam_information_extraction_pct":0,"beam_instruction_following_pct":0,"beam_knowledge_update_pct":0,"beam_multi_session_reasoning_pct":0,"beam_preference_following_pct":0,"beam_summarization_pct":0,"beam_temporal_reasoning_pct":0},"status":"keep","description":"Reject blank durable claim objects","timestamp":1778424903124,"segment":28,"confidence":3.398230088495575,"asi":{"hypothesis":"Durable claim objects should reject blank strings at the schema layer because Store::add_claim validates triple fields before log-first persistence and direct SQL should preserve claim shape.","red_evidence":"`cargo test -q -p aver-core --test migrations claims_object_must_not_be_blank` failed because direct SQL accepted `object = '   '`.","green_evidence":"Targeted test passed; full migrations test passed; `./autoresearch.sh` passed with checks green and metrics tests_green=586 tests_total=586.","implementation_notes":"Added migration `0074_claim_object_nonblank_checks.sql` with insert/update triggers rejecting claims rows whose trimmed object is empty; registered it in embedded migrations.","anti_overfit_note":"This is a general durable triple shape invariant and does not use benchmark expected outputs or labels."}}
{"run":496,"commit":"afa89c3","metric":587,"metrics":{"tests_green":587,"tests_total":587,"milestone_index":9,"loc_core":5305,"commit_count_total":524,"memory_error_rate":0,"unsupported_claim_rate":0,"mean_precision_at_k":1,"mean_recall_at_k":1,"beam_questions":0,"beam_rubric_checks":0,"beam_abstention_pct":0,"beam_contradiction_resolution_pct":0,"beam_event_ordering_pct":0,"beam_information_extraction_pct":0,"beam_instruction_following_pct":0,"beam_knowledge_update_pct":0,"beam_multi_session_reasoning_pct":0,"beam_preference_following_pct":0,"beam_summarization_pct":0,"beam_temporal_reasoning_pct":0},"status":"keep","description":"Reject non-positive durable claim creation timestamps","timestamp":1778425968345,"segment":28,"confidence":3.3859649122807016,"asi":{"hypothesis":"Durable claim created_at values should be positive at the schema layer because Store writes real Unix timestamps and claim chronology should not contain sentinel zero values.","red_evidence":"`cargo test -q -p aver-core --test migrations claims_created_at_must_be_positive` failed because direct SQL accepted `created_at = 0`. Full autoresearch initially exposed stale raw-SQL claim fixtures in claims, ontology_enforcement, and vector_index tests with zero timestamps, which were updated to valid positive values to avoid masking their intended assertions.","green_evidence":"Targeted claims timestamp test passed; stale fixture targeted tests passed; full migrations test passed; `./autoresearch.sh` passed with checks green and metrics tests_green=587 tests_total=587.","implementation_notes":"Added migration `0075_claim_created_at_positive_checks.sql` with insert/update triggers rejecting claims rows whose created_at is <= 0; registered it in embedded migrations. Updated direct-SQL claim fixtures to use positive timestamps except the new invalid timestamp test.","anti_overfit_note":"This is a general durable claim chronology/audit invariant and does not use benchmark expected outputs or labels."}}
{"run":497,"commit":"18f84c5","metric":588,"metrics":{"tests_green":588,"tests_total":588,"milestone_index":9,"loc_core":5309,"commit_count_total":525,"memory_error_rate":0,"unsupported_claim_rate":0,"mean_precision_at_k":1,"mean_recall_at_k":1,"beam_questions":0,"beam_rubric_checks":0,"beam_abstention_pct":0,"beam_contradiction_resolution_pct":0,"beam_event_ordering_pct":0,"beam_information_extraction_pct":0,"beam_instruction_following_pct":0,"beam_knowledge_update_pct":0,"beam_multi_session_reasoning_pct":0,"beam_preference_following_pct":0,"beam_summarization_pct":0,"beam_temporal_reasoning_pct":0},"status":"keep","description":"Reject non-positive durable claim last-seen timestamps","timestamp":1778426044316,"segment":28,"confidence":3.4035087719298245,"asi":{"hypothesis":"Durable claim last_seen_at values should be positive at the schema layer because Store writes real Unix timestamps and claim chronology should not contain sentinel zero values.","red_evidence":"`cargo test -q -p aver-core --test migrations claims_last_seen_at_must_be_positive` failed because direct SQL accepted `last_seen_at = 0`.","green_evidence":"Targeted claim last_seen_at timestamp test passed; full migrations test passed; `./autoresearch.sh` passed with checks green and metrics tests_green=588 tests_total=588.","implementation_notes":"Added migration `0076_claim_last_seen_at_positive_checks.sql` with insert/update triggers rejecting claims rows whose last_seen_at is <= 0; registered it in embedded migrations.","anti_overfit_note":"This is a general durable claim chronology/audit invariant and does not use benchmark expected outputs or labels."}}
{"run":498,"commit":"18f84c5","metric":589,"metrics":{"tests_green":589,"tests_total":589,"milestone_index":9,"loc_core":5004,"commit_count_total":526,"memory_error_rate":0,"unsupported_claim_rate":0,"mean_precision_at_k":1,"mean_recall_at_k":1,"beam_questions":0,"beam_rubric_checks":0,"beam_abstention_pct":0,"beam_contradiction_resolution_pct":0,"beam_event_ordering_pct":0,"beam_information_extraction_pct":0,"beam_instruction_following_pct":0,"beam_knowledge_update_pct":0,"beam_multi_session_reasoning_pct":0,"beam_preference_following_pct":0,"beam_summarization_pct":0,"beam_temporal_reasoning_pct":0},"status":"checks_failed","description":"Claim last-seen chronology trigger failed clippy checks","timestamp":1778426176114,"segment":28,"confidence":3.4035087719298245,"asi":{"hypothesis":"Durable claim last_seen_at should not precede created_at at the schema layer, guarded by positive timestamps to avoid masking earlier timestamp triggers.","red_evidence":"`cargo test -q -p aver-core --test migrations claims_last_seen_at_must_not_precede_created_at` failed because direct SQL accepted last_seen_at < created_at.","green_evidence":"Targeted test and full migrations test passed; `./autoresearch.sh` benchmark passed with tests_green=589 tests_total=589.","rollback_reason":"Backpressure checks failed under clippy with `unused doc comment` at crates/aver-core/src/lib.rs:39, likely because cargo fmt/clippy interpreted the existing migration doc comment as documenting a macro invocation after file changes; changes must be reapplied with that comment converted to normal comments or otherwise resolved.","next_action_hint":"After rollback, reapply the claim chronology test and migration, register it, convert the MIGRATIONS doc comment to non-doc `//` comments if needed, then rerun targeted tests and ./autoresearch.sh.","anti_overfit_note":"This is a general durable claim chronology invariant and does not use benchmark expected outputs or labels."}}
{"run":499,"commit":"e2b1d73","metric":589,"metrics":{"tests_green":589,"tests_total":589,"milestone_index":9,"loc_core":5006,"commit_count_total":526,"memory_error_rate":0,"unsupported_claim_rate":0,"mean_precision_at_k":1,"mean_recall_at_k":1,"beam_questions":0,"beam_rubric_checks":0,"beam_abstention_pct":0,"beam_contradiction_resolution_pct":0,"beam_event_ordering_pct":0,"beam_information_extraction_pct":0,"beam_instruction_following_pct":0,"beam_knowledge_update_pct":0,"beam_multi_session_reasoning_pct":0,"beam_preference_following_pct":0,"beam_summarization_pct":0,"beam_temporal_reasoning_pct":0},"status":"keep","description":"Reject claim last-seen before creation","timestamp":1778426454247,"segment":28,"confidence":3.4210526315789473,"asi":{"hypothesis":"Durable claim last_seen_at should not precede created_at at the schema layer because claim chronology should never move backwards.","red_evidence":"`cargo test -q -p aver-core --test migrations claims_last_seen_at_must_not_precede_created_at` failed before migration because direct SQL accepted `last_seen_at < created_at`.","green_evidence":"Targeted chronology test passed; full migrations test passed with 75 tests; `./autoresearch.sh` passed with checks green and metrics tests_green=589 tests_total=589.","implementation_notes":"Added migration `0077_claim_seen_after_created_checks.sql` with insert/update triggers guarded by positive timestamps to avoid masking earlier timestamp triggers. Preserved another agent's concurrent `lib.rs` change that generates MIGRATIONS from `build.rs`, so adding the migration file required no manual registration edit.","anti_overfit_note":"This is a general durable claim chronology invariant and does not use benchmark expected outputs or labels."}}
