{"run":424,"commit":"26f2bc5","metric":499,"metrics":{"beam_questions":0,"beam_rubric_checks":0,"beam_abstention_pct":0,"beam_contradiction_resolution_pct":0,"beam_event_ordering_pct":0,"beam_information_extraction_pct":0,"beam_instruction_following_pct":0,"beam_knowledge_update_pct":0,"beam_multi_session_reasoning_pct":0,"beam_preference_following_pct":0,"beam_summarization_pct":0,"beam_temporal_reasoning_pct":0,"tests_green":499,"tests_total":499,"milestone_index":9,"loc_core":3910,"commit_count_total":449,"memory_error_rate":0,"unsupported_claim_rate":0,"mean_precision_at_k":1,"mean_recall_at_k":1},"status":"keep","description":"Normalize Rust raw identifier struct names","timestamp":1778366939982,"segment":28,"confidence":4.038461538461538,"asi":{"hypothesis":"Rust raw identifier struct names such as struct r#type should normalize to their canonical identifier text so type definition facts match ordinary type references.","red_evidence":"cargo test -q -p aver-extractor extract_rust_structs_normalizes_raw_identifier_names failed because extract_rust_structs returned r#type instead of type.","green_evidence":"cargo fmt --all passed; targeted raw-identifier struct and function tests passed; cargo test --workspace -q passed; ./autoresearch.sh passed with tests_green=499 tests_total=499 and checks green.","implementation_notes":"Reused Rust identifier normalization for struct_item name extraction by stripping a leading r# before emitting the struct name.","anti_overfit_note":"This is a grammar-backed canonicalization for standard Rust raw identifiers in struct definitions and does not depend on benchmark labels, expected answers, or scoring-specific shortcuts."}}
{"run":425,"commit":"d12e43b","metric":500,"metrics":{"beam_questions":0,"beam_rubric_checks":0,"beam_abstention_pct":0,"beam_contradiction_resolution_pct":0,"beam_event_ordering_pct":0,"beam_information_extraction_pct":0,"beam_instruction_following_pct":0,"beam_knowledge_update_pct":0,"beam_multi_session_reasoning_pct":0,"beam_preference_following_pct":0,"beam_summarization_pct":0,"beam_temporal_reasoning_pct":0,"tests_green":500,"tests_total":500,"milestone_index":9,"loc_core":3910,"commit_count_total":450,"memory_error_rate":0,"unsupported_claim_rate":0,"mean_precision_at_k":1,"mean_recall_at_k":1},"status":"keep","description":"Normalize Rust raw identifier enum names","timestamp":1778366988845,"segment":28,"confidence":4.076923076923077,"asi":{"hypothesis":"Rust raw identifier enum names such as enum r#type should normalize to their canonical identifier text so enum definition facts match ordinary type references.","red_evidence":"cargo test -q -p aver-extractor extract_rust_enums_normalizes_raw_identifier_names failed because extract_rust_enums returned r#type instead of type.","green_evidence":"cargo fmt --all passed; targeted raw-identifier enum and struct tests passed; cargo test --workspace -q passed; ./autoresearch.sh passed with tests_green=500 tests_total=500 and checks green.","implementation_notes":"Reused Rust identifier normalization for enum_item name extraction by stripping a leading r# before emitting the enum name.","anti_overfit_note":"This is a grammar-backed canonicalization for standard Rust raw identifiers in enum definitions and does not depend on benchmark labels, expected answers, or scoring-specific shortcuts."}}
{"run":426,"commit":"b41954d","metric":501,"metrics":{"beam_questions":0,"beam_rubric_checks":0,"beam_abstention_pct":0,"beam_contradiction_resolution_pct":0,"beam_event_ordering_pct":0,"beam_information_extraction_pct":0,"beam_instruction_following_pct":0,"beam_knowledge_update_pct":0,"beam_multi_session_reasoning_pct":0,"beam_preference_following_pct":0,"beam_summarization_pct":0,"beam_temporal_reasoning_pct":0,"tests_green":501,"tests_total":501,"milestone_index":9,"loc_core":3910,"commit_count_total":451,"memory_error_rate":0,"unsupported_claim_rate":0,"mean_precision_at_k":1,"mean_recall_at_k":1},"status":"keep","description":"Normalize Rust raw identifier trait names","timestamp":1778367039927,"segment":28,"confidence":4.115384615384615,"asi":{"hypothesis":"Rust raw identifier trait names such as trait r#type should normalize to their canonical identifier text so trait definition facts match ordinary trait references.","red_evidence":"cargo test -q -p aver-extractor extract_rust_traits_normalizes_raw_identifier_names failed because extract_rust_traits returned r#type instead of type.","green_evidence":"cargo fmt --all passed; targeted raw-identifier trait and enum tests passed; cargo test --workspace -q passed; ./autoresearch.sh passed with tests_green=501 tests_total=501 and checks green.","implementation_notes":"Reused Rust identifier normalization for trait_item name extraction by stripping a leading r# before emitting the trait name.","anti_overfit_note":"This is a grammar-backed canonicalization for standard Rust raw identifiers in trait definitions and does not depend on benchmark labels, expected answers, or scoring-specific shortcuts."}}
{"run":427,"commit":"8794450","metric":524,"metrics":{"tests_green":524,"tests_total":524,"milestone_index":9,"loc_core":5053,"commit_count_total":461,"memory_error_rate":0,"unsupported_claim_rate":0,"mean_precision_at_k":1,"mean_recall_at_k":1,"beam_questions":0,"beam_rubric_checks":0,"beam_abstention_pct":0,"beam_contradiction_resolution_pct":0,"beam_event_ordering_pct":0,"beam_information_extraction_pct":0,"beam_instruction_following_pct":0,"beam_knowledge_update_pct":0,"beam_multi_session_reasoning_pct":0,"beam_preference_following_pct":0,"beam_summarization_pct":0,"beam_temporal_reasoning_pct":0},"status":"keep","description":"Add schema smoke tests and source_refs JSON trigger enforcement","timestamp":1778419875181,"segment":28,"confidence":5,"asi":{"hypothesis":"The pragmatic additive audit route should reconcile live schema guarantees by asserting vector/ontology migration artifacts and enforcing source_refs JSON shape with triggers, avoiding risky table rebuilds.","red_evidence":"The new `claims_source_refs_must_be_valid_json_array` test initially failed because direct SQL could insert `source_refs = 'not-json'` into `claims`.","green_evidence":"`./autoresearch.sh` passed with checks green and metrics tests_green=524 tests_total=524.","implementation_notes":"Added migration `0012_source_refs_json_checks.sql` with insert/update triggers, registered it in embedded migrations, and added fresh-schema smoke tests for vec0 virtual table and ontology trigger presence."}}
{"run":428,"commit":"5b2c9f5","metric":525,"metrics":{"tests_green":525,"tests_total":525,"milestone_index":9,"loc_core":5057,"commit_count_total":462,"memory_error_rate":0,"unsupported_claim_rate":0,"mean_precision_at_k":1,"mean_recall_at_k":1,"beam_questions":0,"beam_rubric_checks":0,"beam_abstention_pct":0,"beam_contradiction_resolution_pct":0,"beam_event_ordering_pct":0,"beam_information_extraction_pct":0,"beam_instruction_following_pct":0,"beam_knowledge_update_pct":0,"beam_multi_session_reasoning_pct":0,"beam_preference_following_pct":0,"beam_summarization_pct":0,"beam_temporal_reasoning_pct":0},"status":"keep","description":"Enforce observation source_event_ids JSON array shape","timestamp":1778419993224,"segment":28,"confidence":5.038461538461538,"asi":{"hypothesis":"JSON-text schema hardening should cover observations.source_event_ids as well as claims.source_refs so direct SQL cannot create rows that replay/recall parsing later rejects.","red_evidence":"`cargo test -q -p aver-core --test migrations observations_source_event_ids_must_be_valid_json_array` failed because direct SQL could insert `source_event_ids = 'not-json'`.","green_evidence":"Targeted migration test passed; full migrations test passed; `./autoresearch.sh` passed with checks green and metrics tests_green=525 tests_total=525.","implementation_notes":"Added additive migration `0013_observation_source_event_ids_json_checks.sql` with insert/update triggers requiring `observations.source_event_ids` to be a JSON array, then registered it in embedded migrations.","anti_overfit_note":"This enforces a general schema invariant for persisted JSON text consumed by observation recall/replay, not a benchmark-specific behavior."}}
{"run":429,"commit":"6570db6","metric":526,"metrics":{"tests_green":526,"tests_total":526,"milestone_index":9,"loc_core":5061,"commit_count_total":463,"memory_error_rate":0,"unsupported_claim_rate":0,"mean_precision_at_k":1,"mean_recall_at_k":1,"beam_questions":0,"beam_rubric_checks":0,"beam_abstention_pct":0,"beam_contradiction_resolution_pct":0,"beam_event_ordering_pct":0,"beam_information_extraction_pct":0,"beam_instruction_following_pct":0,"beam_knowledge_update_pct":0,"beam_multi_session_reasoning_pct":0,"beam_preference_following_pct":0,"beam_summarization_pct":0,"beam_temporal_reasoning_pct":0},"status":"keep","description":"Enforce vector embedding_json JSON array shape","timestamp":1778420067565,"segment":28,"confidence":4.981132075471698,"asi":{"hypothesis":"JSON-text schema hardening should also cover vector_chunks.embedding_json so direct SQL cannot persist malformed vectors that later break vector parsing or recall.","red_evidence":"After fixing the test signature, `cargo test -q -p aver-core --test migrations vector_chunk_embedding_json_must_be_null_or_json_array` failed because direct SQL could insert `embedding_json = 'not-json'`.","green_evidence":"Targeted migration test passed; full migrations test passed; `./autoresearch.sh` passed with checks green and metrics tests_green=526 tests_total=526.","implementation_notes":"Added additive migration `0014_vector_embedding_json_checks.sql` with insert/update triggers requiring `vector_chunks.embedding_json` to be NULL or a JSON array, and registered it in embedded migrations.","anti_overfit_note":"This protects a general persisted vector-storage invariant used by parse/rebuild paths, not a benchmark-specific shortcut."}}
{"run":430,"commit":"9a985c4","metric":527,"metrics":{"tests_green":527,"tests_total":527,"milestone_index":9,"loc_core":5065,"commit_count_total":464,"memory_error_rate":0,"unsupported_claim_rate":0,"mean_precision_at_k":1,"mean_recall_at_k":1,"beam_questions":0,"beam_rubric_checks":0,"beam_abstention_pct":0,"beam_contradiction_resolution_pct":0,"beam_event_ordering_pct":0,"beam_information_extraction_pct":0,"beam_instruction_following_pct":0,"beam_knowledge_update_pct":0,"beam_multi_session_reasoning_pct":0,"beam_preference_following_pct":0,"beam_summarization_pct":0,"beam_temporal_reasoning_pct":0},"status":"keep","description":"Enforce numeric vector embedding_json elements","timestamp":1778420150413,"segment":28,"confidence":4.925925925925926,"asi":{"hypothesis":"Vector embedding JSON arrays should reject non-numeric elements at write time so parse/rebuild paths only see arrays compatible with Vec<f32>.","red_evidence":"`cargo test -q -p aver-core --test migrations vector_chunk_embedding_json_array_elements_must_be_numeric` failed because direct SQL accepted `[0.1, \"not-a-number\"]`.","green_evidence":"Targeted test passed; full migrations test passed; `./autoresearch.sh` passed with checks green and metrics tests_green=527 tests_total=527.","implementation_notes":"Added migration `0015_vector_embedding_numeric_checks.sql` with insert/update triggers using json_each over valid arrays to reject elements whose JSON type is not integer or real. Guarded malformed JSON so the earlier array-shape trigger handles it cleanly.","anti_overfit_note":"This enforces a storage invariant required by generic vector parsing, independent of benchmark fixtures or scoring."}}
{"run":431,"commit":"3ca8bb9","metric":528,"metrics":{"tests_green":528,"tests_total":528,"milestone_index":9,"loc_core":5069,"commit_count_total":465,"memory_error_rate":0,"unsupported_claim_rate":0,"mean_precision_at_k":1,"mean_recall_at_k":1,"beam_questions":0,"beam_rubric_checks":0,"beam_abstention_pct":0,"beam_contradiction_resolution_pct":0,"beam_event_ordering_pct":0,"beam_information_extraction_pct":0,"beam_instruction_following_pct":0,"beam_knowledge_update_pct":0,"beam_multi_session_reasoning_pct":0,"beam_preference_following_pct":0,"beam_summarization_pct":0,"beam_temporal_reasoning_pct":0},"status":"keep","description":"Enforce integer observation source_event_ids elements","timestamp":1778420213739,"segment":28,"confidence":4.962962962962963,"asi":{"hypothesis":"Observation source_event_ids arrays should reject non-integer elements at write time because observation recall parses them as Vec<i64>.","red_evidence":"`cargo test -q -p aver-core --test migrations observations_source_event_ids_array_elements_must_be_integers` failed because direct SQL accepted `[1, \"not-an-id\"]`.","green_evidence":"Targeted test passed; full migrations test passed; `./autoresearch.sh` passed with checks green and metrics tests_green=528 tests_total=528.","implementation_notes":"Added migration `0016_observation_source_event_ids_integer_checks.sql` with insert/update triggers using json_each over valid arrays to reject non-integer JSON element types.","anti_overfit_note":"This protects a typed persistence invariant for observation replay/recall and is independent of benchmark-specific fixtures."}}
{"run":432,"commit":"a63a2ab","metric":529,"metrics":{"tests_green":529,"tests_total":529,"milestone_index":9,"loc_core":5073,"commit_count_total":466,"memory_error_rate":0,"unsupported_claim_rate":0,"mean_precision_at_k":1,"mean_recall_at_k":1,"beam_questions":0,"beam_rubric_checks":0,"beam_abstention_pct":0,"beam_contradiction_resolution_pct":0,"beam_event_ordering_pct":0,"beam_information_extraction_pct":0,"beam_instruction_following_pct":0,"beam_knowledge_update_pct":0,"beam_multi_session_reasoning_pct":0,"beam_preference_following_pct":0,"beam_summarization_pct":0,"beam_temporal_reasoning_pct":0},"status":"keep","description":"Enforce text claim source_refs elements","timestamp":1778420287015,"segment":28,"confidence":5,"asi":{"hypothesis":"Claim source_refs arrays should reject non-text elements because claim loading parses source_refs as Vec<String> and direct SQL should not create rows that later fail typed reads.","red_evidence":"`cargo test -q -p aver-core --test migrations claims_source_refs_array_elements_must_be_text` failed because direct SQL accepted `[\"manual\", 42]`.","green_evidence":"Targeted test passed; full migrations test passed; `./autoresearch.sh` passed with checks green and metrics tests_green=529 tests_total=529.","implementation_notes":"Added migration `0017_claim_source_refs_text_checks.sql` with insert/update triggers using json_each over valid arrays to reject non-text JSON element types; registered it in embedded migrations.","anti_overfit_note":"This protects a typed persisted schema invariant for claim provenance loading, independent of benchmark scoring or fixtures."}}
{"run":433,"commit":"c2aae57","metric":530,"metrics":{"tests_green":530,"tests_total":530,"milestone_index":9,"loc_core":5077,"commit_count_total":467,"memory_error_rate":0,"unsupported_claim_rate":0,"mean_precision_at_k":1,"mean_recall_at_k":1,"beam_questions":0,"beam_rubric_checks":0,"beam_abstention_pct":0,"beam_contradiction_resolution_pct":0,"beam_event_ordering_pct":0,"beam_information_extraction_pct":0,"beam_instruction_following_pct":0,"beam_knowledge_update_pct":0,"beam_multi_session_reasoning_pct":0,"beam_preference_following_pct":0,"beam_summarization_pct":0,"beam_temporal_reasoning_pct":0},"status":"keep","description":"Reject unsupported observations with empty source events","timestamp":1778420337126,"segment":28,"confidence":4.945454545454545,"asi":{"hypothesis":"Observation rows should require at least one source event at the schema layer because Store::record_observation already enforces provenance and recall/audit expects supporting events.","red_evidence":"`cargo test -q -p aver-core --test migrations observations_source_event_ids_must_not_be_empty` failed because direct SQL accepted `source_event_ids = []`.","green_evidence":"Targeted test passed; full migrations test passed; `./autoresearch.sh` passed with checks green and metrics tests_green=530 tests_total=530.","implementation_notes":"Added migration `0018_observation_source_event_ids_nonempty_checks.sql` with insert/update triggers rejecting empty JSON arrays for observations.source_event_ids; registered it in embedded migrations.","anti_overfit_note":"This strengthens the auditability invariant for all observations and does not use benchmark labels, outputs, or scoring shortcuts."}}
{"run":434,"commit":"c2aae57","metric":64,"metrics":{"tests_green":64,"tests_total":65,"milestone_index":9,"loc_core":5081,"commit_count_total":468,"memory_error_rate":0,"unsupported_claim_rate":0,"mean_precision_at_k":0,"mean_recall_at_k":0,"beam_questions":0,"beam_rubric_checks":0,"beam_abstention_pct":0,"beam_contradiction_resolution_pct":0,"beam_event_ordering_pct":0,"beam_information_extraction_pct":0,"beam_instruction_following_pct":0,"beam_knowledge_update_pct":0,"beam_multi_session_reasoning_pct":0,"beam_preference_following_pct":0,"beam_summarization_pct":0,"beam_temporal_reasoning_pct":0},"status":"crash","description":"Crash while enforcing nonempty claim source_refs due stale confidence trigger test fixture","timestamp":1778420384369,"segment":28,"confidence":4.857142857142857,"asi":{"hypothesis":"Claim source_refs arrays should reject empty arrays to preserve claim auditability.","rollback_reason":"Full workspace failed because existing `migration_0009_rejects_out_of_range_confidence_and_invalid_status` inserted `source_refs = '[]'`; the new nonempty trigger correctly fired before the confidence trigger, invalidating that fixture's expected error.","next_action_hint":"Redo the same invariant, but update the confidence-trigger regression fixture to use a valid nonempty source_refs array such as `[\"test_session\"]` so it still isolates confidence validation.","red_evidence":"Targeted new test initially failed because direct SQL accepted `source_refs = []`; after adding trigger, `./autoresearch.sh` failed in `crates/aver-core/tests/claims.rs:1026` because stale fixture expected confidence error while using now-invalid source_refs.","anti_overfit_note":"The failure is an interaction between two schema invariants, not a benchmark-specific issue."}}
{"run":435,"commit":"c2aae57","metric":144,"metrics":{"tests_green":144,"tests_total":145,"milestone_index":9,"loc_core":5081,"commit_count_total":468,"memory_error_rate":0,"unsupported_claim_rate":0,"mean_precision_at_k":0,"mean_recall_at_k":0,"beam_questions":0,"beam_rubric_checks":0,"beam_abstention_pct":0,"beam_contradiction_resolution_pct":0,"beam_event_ordering_pct":0,"beam_information_extraction_pct":0,"beam_instruction_following_pct":0,"beam_knowledge_update_pct":0,"beam_multi_session_reasoning_pct":0,"beam_preference_following_pct":0,"beam_summarization_pct":0,"beam_temporal_reasoning_pct":0},"status":"crash","description":"Crash while retrying nonempty claim source_refs due ontology test fixture","timestamp":1778420447027,"segment":28,"confidence":4.771929824561403,"asi":{"hypothesis":"Claim source_refs arrays should reject empty arrays while existing trigger tests should use valid provenance fixtures to isolate their target invariant.","rollback_reason":"Full workspace still had another stale raw-SQL fixture: ontology enforcement test inserted empty source_refs and therefore hit the new provenance trigger before the unknown-predicate trigger.","next_action_hint":"Redo the invariant and update all raw-SQL claim trigger tests that use `source_refs = '[]'` only as filler to use a valid nonempty text array.","red_evidence":"`./autoresearch.sh` failed in `crates/aver-core/tests/ontology_enforcement.rs:144`: expected ontology trigger message, got `claims.source_refs must not be empty`.","anti_overfit_note":"This is trigger-order isolation in tests, not a benchmark behavior change."}}
{"run":436,"commit":"c2aae57","metric":531,"metrics":{"tests_green":531,"tests_total":531,"milestone_index":9,"loc_core":5081,"commit_count_total":468,"memory_error_rate":0,"unsupported_claim_rate":0,"mean_precision_at_k":1,"mean_recall_at_k":1,"beam_questions":0,"beam_rubric_checks":0,"beam_abstention_pct":0,"beam_contradiction_resolution_pct":0,"beam_event_ordering_pct":0,"beam_information_extraction_pct":0,"beam_instruction_following_pct":0,"beam_knowledge_update_pct":0,"beam_multi_session_reasoning_pct":0,"beam_preference_following_pct":0,"beam_summarization_pct":0,"beam_temporal_reasoning_pct":0},"status":"checks_failed","description":"Checks failed for nonempty claim source_refs due formatting","timestamp":1778420553093,"segment":28,"confidence":4.689655172413793,"asi":{"hypothesis":"Claim source_refs arrays should reject empty arrays and raw-SQL trigger tests should use valid nonempty provenance when testing other invariants.","rollback_reason":"Benchmark passed but backpressure checks failed because `cargo fmt --check` wanted to wrap the new `execute` call in `crates/aver-core/tests/migrations.rs`.","next_action_hint":"Redo the same invariant, apply `cargo fmt --all` before `./autoresearch.sh`, then log keep if checks pass.","green_evidence":"Before checks, workspace benchmark passed with tests_green=531 tests_total=531 and all prior fixture conflicts resolved.","anti_overfit_note":"Failure was formatting only; invariant remains general schema auditability hardening."}}
