{"run":249,"commit":"7bd0f82","metric":263,"metrics":{"tests_total":263,"milestone_index":9,"loc_core":2336,"commit_count_total":272,"memory_error_rate":0,"unsupported_claim_rate":0,"mean_precision_at_k":1,"mean_recall_at_k":1},"status":"keep","description":"reject EC private keys","timestamp":1778228905798,"segment":26,"confidence":3.7837837837837838,"asi":{"hypothesis":"The privacy content filter should reject EC private-key headers in addition to generic, OpenSSH, and RSA private-key headers","red_evidence":"privacy_filter_rejects_ec_private_key_header failed because a split synthetic EC private-key header returned Ok(())","green_evidence":"./autoresearch.sh passed with tests_green=263, tests_total=263, memory_error_rate=0, and autoresearch.checks.sh green","anti_overfit_note":"The change strengthens a generic privacy guardrail for secret material detection; it does not depend on benchmark data, BEAM labels, rubrics, reference answers, or fixture-specific scoring shortcuts"}}
{"run":250,"commit":"b3fba29","metric":264,"metrics":{"tests_total":264,"milestone_index":9,"loc_core":2337,"commit_count_total":273,"memory_error_rate":0,"unsupported_claim_rate":0,"mean_precision_at_k":1,"mean_recall_at_k":1},"status":"keep","description":"reject DSA private keys","timestamp":1778229612139,"segment":26,"confidence":3.736842105263158,"asi":{"hypothesis":"The privacy content filter should reject DSA private-key headers in addition to generic, OpenSSH, RSA, and EC private-key headers","red_evidence":"privacy_filter_rejects_dsa_private_key_header failed because a split synthetic DSA private-key header returned Ok(())","green_evidence":"./autoresearch.sh passed with tests_green=264, tests_total=264, memory_error_rate=0, and autoresearch.checks.sh green","anti_overfit_note":"The change strengthens a generic privacy guardrail for secret material detection; it does not depend on benchmark data, BEAM labels, rubrics, reference answers, or fixture-specific scoring shortcuts"}}
{"run":251,"commit":"44405b0","metric":265,"metrics":{"tests_total":265,"milestone_index":9,"loc_core":2338,"commit_count_total":274,"memory_error_rate":0,"unsupported_claim_rate":0,"mean_precision_at_k":1,"mean_recall_at_k":1},"status":"keep","description":"reject encrypted private keys","timestamp":1778229672805,"segment":26,"confidence":3.789473684210526,"asi":{"hypothesis":"The privacy content filter should reject encrypted PKCS8 private-key headers in addition to algorithm-specific private-key headers","red_evidence":"privacy_filter_rejects_encrypted_private_key_header failed because a split synthetic ENCRYPTED PRIVATE KEY header returned Ok(())","green_evidence":"./autoresearch.sh passed with tests_green=265, tests_total=265, memory_error_rate=0, and autoresearch.checks.sh green","anti_overfit_note":"The change strengthens a generic privacy guardrail for secret key material detection; it does not depend on benchmark data, BEAM labels, rubrics, reference answers, or fixture-specific scoring shortcuts"}}
{"run":252,"commit":"7fa113c","metric":266,"metrics":{"tests_total":266,"milestone_index":9,"loc_core":2339,"commit_count_total":275,"memory_error_rate":0,"unsupported_claim_rate":0,"mean_precision_at_k":1,"mean_recall_at_k":1},"status":"keep","description":"reject PGP private keys","timestamp":1778229721149,"segment":26,"confidence":3.8421052631578947,"asi":{"hypothesis":"The privacy content filter should reject PGP private-key block headers as private key material","red_evidence":"privacy_filter_rejects_pgp_private_key_block_header failed because a split synthetic PGP PRIVATE KEY BLOCK header returned Ok(())","green_evidence":"./autoresearch.sh passed with tests_green=266, tests_total=266, memory_error_rate=0, and autoresearch.checks.sh green","anti_overfit_note":"The change strengthens a generic privacy guardrail for secret key material detection; it does not depend on benchmark data, BEAM labels, rubrics, reference answers, or fixture-specific scoring shortcuts"}}
{"run":253,"commit":"5fb5736","metric":267,"metrics":{"tests_total":267,"milestone_index":9,"loc_core":2339,"commit_count_total":276,"memory_error_rate":0,"unsupported_claim_rate":0,"mean_precision_at_k":1,"mean_recall_at_k":1},"status":"keep","description":"reject PKCS12 key paths","timestamp":1778229773504,"segment":26,"confidence":3.7948717948717947,"asi":{"hypothesis":"The privacy path filter should reject PKCS12 .p12 identity/key bundle files alongside .pem and .key files","red_evidence":"privacy_filter_path_rejects_pkcs12_file failed because privacy_filter_path(\"certs/client-identity.p12\") returned Ok(())","green_evidence":"./autoresearch.sh passed with tests_green=267, tests_total=267, memory_error_rate=0, and autoresearch.checks.sh green","anti_overfit_note":"The change strengthens a generic privacy guardrail for local key material paths; it does not depend on benchmark data, BEAM labels, rubrics, reference answers, or fixture-specific scoring shortcuts"}}
{"run":254,"commit":"65bacf6","metric":268,"metrics":{"tests_total":268,"milestone_index":9,"loc_core":2343,"commit_count_total":277,"memory_error_rate":0,"unsupported_claim_rate":0,"mean_precision_at_k":1,"mean_recall_at_k":1},"status":"keep","description":"reject PFX key paths","timestamp":1778229821129,"segment":26,"confidence":3.75,"asi":{"hypothesis":"The privacy path filter should reject PKCS12 .pfx identity/key bundle files alongside .p12, .pem, and .key files","red_evidence":"privacy_filter_path_rejects_pfx_file failed because privacy_filter_path(\"certs/client-identity.pfx\") returned Ok(())","green_evidence":"./autoresearch.sh passed with tests_green=268, tests_total=268, memory_error_rate=0, and autoresearch.checks.sh green","anti_overfit_note":"The change strengthens a generic privacy guardrail for local key material paths; it does not depend on benchmark data, BEAM labels, rubrics, reference answers, or fixture-specific scoring shortcuts"}}
{"run":255,"commit":"4134fb9","metric":269,"metrics":{"tests_total":269,"milestone_index":9,"loc_core":2344,"commit_count_total":278,"memory_error_rate":0,"unsupported_claim_rate":0,"mean_precision_at_k":1,"mean_recall_at_k":1},"status":"keep","description":"reject Java keystore paths","timestamp":1778229877367,"segment":26,"confidence":3.8,"asi":{"hypothesis":"The privacy path filter should reject Java keystore .jks files because they commonly contain private keys or credentials","red_evidence":"privacy_filter_path_rejects_java_keystore_file failed because privacy_filter_path(\"certs/production-keystore.jks\") returned Ok(())","green_evidence":"./autoresearch.sh passed with tests_green=269, tests_total=269, memory_error_rate=0, and autoresearch.checks.sh green","anti_overfit_note":"The change strengthens a generic privacy guardrail for local key material paths; it does not depend on benchmark data, BEAM labels, rubrics, reference answers, or fixture-specific scoring shortcuts"}}
{"run":256,"commit":"4a15be7","metric":270,"metrics":{"tests_total":270,"milestone_index":9,"loc_core":2345,"commit_count_total":279,"memory_error_rate":0,"unsupported_claim_rate":0,"mean_precision_at_k":1,"mean_recall_at_k":1},"status":"keep","description":"reject keystore key paths","timestamp":1778229955361,"segment":26,"confidence":3.85,"asi":{"hypothesis":"The privacy path filter should reject .keystore files because they commonly contain signing keys or credentials","red_evidence":"privacy_filter_path_rejects_keystore_file failed because privacy_filter_path(\"android/release.keystore\") returned Ok(())","green_evidence":"./autoresearch.sh passed with tests_green=270, tests_total=270, memory_error_rate=0, and autoresearch.checks.sh green","anti_overfit_note":"The change strengthens a generic privacy guardrail for local key material paths; it does not depend on benchmark data, BEAM labels, rubrics, reference answers, or fixture-specific scoring shortcuts"}}
{"run":257,"commit":"3ea9cb2","metric":271,"metrics":{"tests_total":271,"milestone_index":9,"loc_core":2346,"commit_count_total":280,"memory_error_rate":0,"unsupported_claim_rate":0,"mean_precision_at_k":1,"mean_recall_at_k":1},"status":"keep","description":"reject password database paths","timestamp":1778230029321,"segment":26,"confidence":3.8048780487804876,"asi":{"hypothesis":"The privacy path filter should reject KeePass .kdbx password database files as secret-bearing paths","red_evidence":"privacy_filter_path_rejects_password_database_file failed because privacy_filter_path(\"vault/team-passwords.kdbx\") returned Ok(())","green_evidence":"./autoresearch.sh passed with tests_green=271, tests_total=271, memory_error_rate=0, and autoresearch.checks.sh green","anti_overfit_note":"The change strengthens a generic privacy guardrail for local password database paths; it does not depend on benchmark data, BEAM labels, rubrics, reference answers, or fixture-specific scoring shortcuts"}}
{"run":258,"commit":"66178a0","metric":272,"metrics":{"tests_total":272,"milestone_index":9,"loc_core":2347,"commit_count_total":281,"memory_error_rate":0,"unsupported_claim_rate":0,"mean_precision_at_k":1,"mean_recall_at_k":1},"status":"keep","description":"reject legacy password database paths","timestamp":1778230073446,"segment":26,"confidence":3.761904761904762,"asi":{"hypothesis":"The privacy path filter should reject legacy KeePass .kdb password database files as secret-bearing paths","red_evidence":"privacy_filter_path_rejects_legacy_password_database_file failed because privacy_filter_path(\"vault/team-passwords.kdb\") returned Ok(())","green_evidence":"./autoresearch.sh passed with tests_green=272, tests_total=272, memory_error_rate=0, and autoresearch.checks.sh green","anti_overfit_note":"The change strengthens a generic privacy guardrail for local password database paths; it does not depend on benchmark data, BEAM labels, rubrics, reference answers, or fixture-specific scoring shortcuts"}}
{"run":259,"commit":"52d58b7","metric":273,"metrics":{"tests_total":273,"milestone_index":9,"loc_core":2348,"commit_count_total":282,"memory_error_rate":0,"unsupported_claim_rate":0,"mean_precision_at_k":1,"mean_recall_at_k":1},"status":"keep","description":"reject PuTTY private keys","timestamp":1778230127907,"segment":26,"confidence":3.8095238095238093,"asi":{"hypothesis":"The privacy content filter should reject PuTTY private-key headers as private key material","red_evidence":"privacy_filter_rejects_putty_private_key_header failed because a split synthetic PuTTY-User-Key-File header returned Ok(())","green_evidence":"./autoresearch.sh passed with tests_green=273, tests_total=273, memory_error_rate=0, and autoresearch.checks.sh green","anti_overfit_note":"The change strengthens a generic privacy guardrail for secret key material detection; it does not depend on benchmark data, BEAM labels, rubrics, reference answers, or fixture-specific scoring shortcuts"}}
{"run":260,"commit":"62862db","metric":274,"metrics":{"tests_total":274,"milestone_index":9,"loc_core":2349,"commit_count_total":283,"memory_error_rate":0,"unsupported_claim_rate":0,"mean_precision_at_k":1,"mean_recall_at_k":1},"status":"keep","description":"reject SSH2 encrypted private keys","timestamp":1778230177896,"segment":26,"confidence":3.857142857142857,"asi":{"hypothesis":"The privacy content filter should reject SSH2 encrypted private-key headers as private key material","red_evidence":"privacy_filter_rejects_ssh2_private_key_header failed because a split synthetic SSH2 encrypted private-key header returned Ok(())","green_evidence":"./autoresearch.sh passed with tests_green=274, tests_total=274, memory_error_rate=0, and autoresearch.checks.sh green","anti_overfit_note":"The change strengthens a generic privacy guardrail for secret key material detection; it does not depend on benchmark data, BEAM labels, rubrics, reference answers, or fixture-specific scoring shortcuts"}}
{"run":261,"commit":"388b05f","metric":275,"metrics":{"tests_total":275,"milestone_index":9,"loc_core":2350,"commit_count_total":284,"memory_error_rate":0,"unsupported_claim_rate":0,"mean_precision_at_k":1,"mean_recall_at_k":1},"status":"keep","description":"reject PuTTY key paths","timestamp":1778230216944,"segment":26,"confidence":3.813953488372093,"asi":{"hypothesis":"The privacy path filter should reject PuTTY .ppk key files as local key material","red_evidence":"privacy_filter_path_rejects_putty_key_file failed because privacy_filter_path(\"keys/deploy.ppk\") returned Ok(())","green_evidence":"./autoresearch.sh passed with tests_green=275, tests_total=275, memory_error_rate=0, and autoresearch.checks.sh green","anti_overfit_note":"The change strengthens a generic privacy guardrail for local private key paths; it does not depend on benchmark data, BEAM labels, rubrics, reference answers, or fixture-specific scoring shortcuts"}}
{"run":262,"commit":"766f838","metric":276,"metrics":{"tests_total":276,"milestone_index":9,"loc_core":2351,"commit_count_total":285,"memory_error_rate":0,"unsupported_claim_rate":0,"mean_precision_at_k":1,"mean_recall_at_k":1},"status":"keep","description":"reject age secret keys","timestamp":1778230316283,"segment":26,"confidence":3.772727272727273,"asi":{"hypothesis":"The privacy content filter should reject age secret-key material as private key material","red_evidence":"privacy_filter_rejects_age_secret_key failed because a split synthetic AGE-SECRET-KEY token returned Ok(())","green_evidence":"./autoresearch.sh passed with tests_green=276, tests_total=276, memory_error_rate=0, and autoresearch.checks.sh green","anti_overfit_note":"The change strengthens a generic privacy guardrail for secret key material detection; it does not depend on benchmark data, BEAM labels, rubrics, reference answers, or fixture-specific scoring shortcuts"}}
{"run":263,"commit":"83e923f","metric":277,"metrics":{"tests_total":277,"milestone_index":9,"loc_core":2353,"commit_count_total":286,"memory_error_rate":0,"unsupported_claim_rate":0,"mean_precision_at_k":1,"mean_recall_at_k":1},"status":"keep","description":"reject age identity paths","timestamp":1778230402379,"segment":26,"confidence":3.8181818181818183,"asi":{"hypothesis":"The privacy path filter should reject local age identity directories as secret-bearing paths","red_evidence":"privacy_filter_path_rejects_age_identity_dir failed because privacy_filter_path(\".age/keys.txt\") returned Ok(())","green_evidence":"./autoresearch.sh passed with tests_green=277, tests_total=277, memory_error_rate=0, and autoresearch.checks.sh green","anti_overfit_note":"The change strengthens a generic privacy guardrail for local age identity paths; it does not depend on benchmark data, BEAM labels, rubrics, reference answers, or fixture-specific scoring shortcuts"}}
{"run":264,"commit":"26d144f","metric":278,"metrics":{"tests_total":278,"milestone_index":9,"loc_core":2355,"commit_count_total":287,"memory_error_rate":0,"unsupported_claim_rate":0,"mean_precision_at_k":1,"mean_recall_at_k":1},"status":"keep","description":"reject GnuPG secret paths","timestamp":1778230486878,"segment":26,"confidence":3.8636363636363638,"asi":{"hypothesis":"The privacy path filter should reject local GnuPG private-key directories as secret-bearing paths","red_evidence":"After avoiding an already-rejected .key extension, privacy_filter_path_rejects_gnupg_private_keys_dir failed because privacy_filter_path(\".gnupg/private-keys-v1.d/keygrip\") returned Ok(())","green_evidence":"./autoresearch.sh passed with tests_green=278, tests_total=278, memory_error_rate=0, and autoresearch.checks.sh green","anti_overfit_note":"The change strengthens a generic privacy guardrail for local GnuPG secret paths; it does not depend on benchmark data, BEAM labels, rubrics, reference answers, or fixture-specific scoring shortcuts"}}
{"run":265,"commit":"74e03a2","metric":279,"metrics":{"tests_total":279,"milestone_index":9,"loc_core":2357,"commit_count_total":288,"memory_error_rate":0,"unsupported_claim_rate":0,"mean_precision_at_k":1,"mean_recall_at_k":1},"status":"keep","description":"reject netrc credential paths","timestamp":1778230547202,"segment":26,"confidence":3.8222222222222224,"asi":{"hypothesis":"The privacy path filter should reject .netrc files because they commonly contain machine credentials","red_evidence":"privacy_filter_path_rejects_netrc_file failed because privacy_filter_path(\".netrc\") returned Ok(())","green_evidence":"./autoresearch.sh passed with tests_green=279, tests_total=279, memory_error_rate=0, and autoresearch.checks.sh green","anti_overfit_note":"The change strengthens a generic privacy guardrail for local credential files; it does not depend on benchmark data, BEAM labels, rubrics, reference answers, or fixture-specific scoring shortcuts"}}
{"run":266,"commit":"a285016","metric":280,"metrics":{"tests_total":280,"milestone_index":9,"loc_core":2359,"commit_count_total":289,"memory_error_rate":0,"unsupported_claim_rate":0,"mean_precision_at_k":1,"mean_recall_at_k":1},"status":"keep","description":"reject npm credential paths","timestamp":1778230602519,"segment":26,"confidence":3.782608695652174,"asi":{"hypothesis":"The privacy path filter should reject .npmrc files because they commonly contain registry authentication tokens","red_evidence":"privacy_filter_path_rejects_npmrc_file failed because privacy_filter_path(\".npmrc\") returned Ok(())","green_evidence":"./autoresearch.sh passed with tests_green=280, tests_total=280, memory_error_rate=0, and autoresearch.checks.sh green","anti_overfit_note":"The change strengthens a generic privacy guardrail for local package-manager credential files; it does not depend on benchmark data, BEAM labels, rubrics, reference answers, or fixture-specific scoring shortcuts"}}
{"run":267,"commit":"a260b22","metric":281,"metrics":{"tests_total":281,"milestone_index":9,"loc_core":2361,"commit_count_total":290,"memory_error_rate":0,"unsupported_claim_rate":0,"mean_precision_at_k":1,"mean_recall_at_k":1},"status":"keep","description":"reject Cargo credential paths","timestamp":1778230707441,"segment":26,"confidence":3.8260869565217392,"asi":{"hypothesis":"The privacy path filter should reject Cargo credentials files because they may contain registry tokens","red_evidence":"privacy_filter_path_rejects_cargo_credentials_file failed because privacy_filter_path(\".cargo/credentials.toml\") returned Ok(())","green_evidence":"./autoresearch.sh passed with tests_green=281, tests_total=281, memory_error_rate=0, and autoresearch.checks.sh green","anti_overfit_note":"The change strengthens a generic privacy guardrail for local package-registry credential files; it does not depend on benchmark data, BEAM labels, rubrics, reference answers, or fixture-specific scoring shortcuts"}}
{"run":268,"commit":"6e1f01b","metric":282,"metrics":{"tests_total":282,"milestone_index":9,"loc_core":2363,"commit_count_total":291,"memory_error_rate":0,"unsupported_claim_rate":0,"mean_precision_at_k":1,"mean_recall_at_k":1},"status":"keep","description":"reject Yarn credential paths","timestamp":1778230771677,"segment":26,"confidence":3.869565217391304,"asi":{"hypothesis":"The privacy path filter should reject Yarn configuration files because they may contain npm registry tokens","red_evidence":"privacy_filter_path_rejects_yarnrc_file failed because privacy_filter_path(\".yarnrc.yml\") returned Ok(())","green_evidence":"./autoresearch.sh passed with tests_green=282, tests_total=282, memory_error_rate=0, and autoresearch.checks.sh green","anti_overfit_note":"The change strengthens a generic privacy guardrail for local package-manager credential files; it does not depend on benchmark data, BEAM labels, rubrics, reference answers, or fixture-specific scoring shortcuts"}}
{"run":269,"commit":"214f501","metric":283,"metrics":{"tests_total":283,"milestone_index":9,"loc_core":2365,"commit_count_total":292,"memory_error_rate":0,"unsupported_claim_rate":0,"mean_precision_at_k":1,"mean_recall_at_k":1},"status":"keep","description":"reject Docker credential paths","timestamp":1778230852300,"segment":26,"confidence":3.8297872340425534,"asi":{"hypothesis":"The privacy path filter should reject Docker config credentials because they may contain registry auth material","red_evidence":"privacy_filter_path_rejects_docker_config_credentials failed because privacy_filter_path(\".docker/config.json\") returned Ok(())","green_evidence":"./autoresearch.sh passed with tests_green=283, tests_total=283, memory_error_rate=0, and autoresearch.checks.sh green","anti_overfit_note":"The change strengthens a generic privacy guardrail for local container-registry credential files; it does not depend on benchmark data, BEAM labels, rubrics, reference answers, or fixture-specific scoring shortcuts"}}
{"run":270,"commit":"8d39404","metric":284,"metrics":{"tests_total":284,"milestone_index":9,"loc_core":2367,"commit_count_total":293,"memory_error_rate":0,"unsupported_claim_rate":0,"mean_precision_at_k":1,"mean_recall_at_k":1},"status":"keep","description":"reject Kubernetes credential paths","timestamp":1778230918214,"segment":26,"confidence":3.7916666666666665,"asi":{"hypothesis":"The privacy path filter should reject Kubernetes kubeconfig files because they may contain cluster credentials and tokens","red_evidence":"privacy_filter_path_rejects_kube_config_credentials failed because privacy_filter_path(\".kube/config\") returned Ok(())","green_evidence":"./autoresearch.sh passed with tests_green=284, tests_total=284, memory_error_rate=0, and autoresearch.checks.sh green","anti_overfit_note":"The change strengthens a generic privacy guardrail for local infrastructure credential files; it does not depend on benchmark data, BEAM labels, rubrics, reference answers, or fixture-specific scoring shortcuts"}}
